,0,1,2,3,4,5,6,7,8
0,Sr No,Description,self,spouse,huf,dependent1,dependent2,dependent3,
1,i,Agricultural Land,"Jhum Cultivation at Niausa Longding AP  Total Area 12 Acres Built Up Area Whether Inherited Y Purchase Date 0000-00-00 Purchase Cost 0.00 Development Cost 0.00  2,00,000 2 Lacs+ Jhum Cultivation at Niaunu, Orgoshon Area, Longding, AP  Total Area 5 Hect Built Up Area Whether Inherited N Purchase Date 2020-02-15 Purchase Cost 500000.00 Development Cost 0.00  9,00,000 9 Lacs+ Jhum Cultivation at Senua Area, Longding, AP  Total Area 3 Acres Built Up Area Whether Inherited N Purchase Date 2020-06-24 Purchase Cost 200000.00 Development Cost 0.00  5,00,000 5 Lacs+ Jhum Cultivation at Tissa Town, Longding, AP  Total Area 1 Hect Built Up Area Whether Inherited N Purchase Date 2020-12-17 Purchase Cost 300000.00 Development Cost 0.00  7,00,000 7 Lacs+",Nil,Nil,"Jhum Cultivation at Senua Village, Longding, AP  Total Area 2130 sq.mtr. Built Up Area Whether Inherited N Purchase Date 1995-02-11 Purchase Cost 25000.00 Development Cost 500000.00  35,00,000 35 Lacs+ Jhum Cultivation at Niaunu Village, Longding, AP  Total Area 5400 sq.mtr. Built Up Area Whether Inherited N Purchase Date 1995-06-17 Purchase Cost 70000.00 Development Cost 1000000.00  40,00,000 40 Lacs+",Nil,Nil,"Rs 98,00,000 98 Lacs+"
2,ii,Non Agricultural Land,"(1) Commercial Plot of Land at Longding Township, 63 sq.mtr., Allotment No. LR-37/84/Vol-IV of File No. Rev-124/73, Dated 05.04.1999, Plot No. 223 (2) Commercial Plot of Land at Longding Township, 225 sq.mtr., Allotment No. LR-37/84/Vol-IV of File No. Rev-124/73, Dated 06.11.2000, Plot No. 183/1 (3) Residential Plot of Land at Longding Township, 600 sq.mtr., Allotment No. LR-37/84/Vol-IV of File No. Rev-124/73, Dated 06.11.2000, Plot No. 234 (4) Commercial Plot of Land at Gohpur Itanagar, 380 sq.mtr., Allotment No. LM-131/2015 (VOL-III)/1087, Dated 05.11.2019, Date of Purchase 23.04.2018, Cost of Purchase 5000000/-  Total Area 13700 sqft Built Up Area Whether Inherited N Purchase Date 0000-00-00 Purchase Cost 0.00 Development Cost 0.00  0*(Value Not Given)","Commercial Plot of Land at Pappu Nallah Naharlagun, 8362.50 sq.mtr., Plot No. 44, Allotment No. DC/ICC/LRB-1688/15, Dated 17.03.2016  Total Area Built Up Area Whether Inherited N Purchase Date 2015-03-20 Purchase Cost 8000000.00 Development Cost 1000000.00  1,00,00,000 1 Crore+ Commercial Plot of Land at Energy Park, Itanagar, 750 sq.mtr., Plot No. 196, Allotment No. DC/ICC-12014/144/2017, Dated 06.02.2018  Total Area Built Up Area Whether Inherited N Purchase Date 2017-05-03 Purchase Cost 17000000.00 Development Cost 10000000.00  3,00,00,000 3 Crore+",Nil,Nil,Nil,Nil,"Rs 4,00,00,000 4 Crore+"
3,iii,Commercial Buildings,Nil,"Under Construction building at Energy Park, Itanagar, 750 sq.mtr., Plot No. 196, Allotment No. DC/ICC-12014/144/2017, Dated 06.02.2018  Total Area 8072.9 sqft Built Up Area 8072.9 sqft Whether Inherited N Purchase Date 2017-05-03 Purchase Cost 8000000.00 Development Cost 0.00  7,00,00,000 7 Crore+",Nil,Nil,Nil,Nil,"Rs 7,00,00,000 7 Crore+"
4,iv,Residential Buildings,"Residential Building (G+2) at Longding District Longding, Arunachal Pradesh  Total Area 6458.3 sqft Built Up Area 2582.4 sqft Whether Inherited N Purchase Date 0000-00-00 Purchase Cost 0.00 Development Cost 10500000.00  2,50,00,000 2 Crore+",Nil,Nil,Nil,Nil,Nil,"Rs 2,50,00,000 2 Crore+"
5,v,Others,Nil,Nil,Nil,Nil,Nil,Nil,Nil
6,Total Current Market Value of (i) to (v) (as per Affidavit),Total Current Market Value of (i) to (v) (as per Affidavit),"3,43,00,000 3 Crore+","13,00,00,000 13 Crore+",Nil,"75,00,000 75 Lacs+",Nil,Nil,"Rs 17,18,00,000 17 Crore+"
7,Totals Calculated,Totals Calculated,"Rs 2,73,00,000 2 Crore+","Rs 11,00,00,000 11 Crore+",Nil,"Rs 75,00,000 75 Lacs+",Nil,Nil,"Rs 14,48,00,000 14 Crore+"
