,0,1,2,3,4,5,6,7,8
0,Sr No,Description,self,spouse,huf,dependent1,dependent2,dependent3,
1,i,Agricultural Land,"Mauje Boraon Nandora Wardha Survey No 133  Total Area 3.12 Acre Built Up Area Whether Inherited N Purchase Date 2013-12-10 Purchase Cost 2380200.00 Development Cost 0.00  25,00,000 25 Lacs+",Nil,Nil,Nil,Nil,Nil,"Rs 25,00,000 25 Lacs+"
2,ii,Non Agricultural Land,"Mauje Chene, Thane Survey No 97, 98  Total Area 934315 Sq Ft Built Up Area Whether Inherited N Purchase Date 2015-06-14 Purchase Cost 466138500.00 Development Cost 0.00  45,00,00,000 45 Crore+ Mauje Ghodbunder Thane Survey No 193/5  Total Area 24972 Sq Ft Built Up Area Whether Inherited N Purchase Date 2019-08-09 Purchase Cost 73258600.00 Development Cost 0.00  7,20,00,000 7 Crore+ Mauje Ghodbunder Thane Survey No 193/6  Total Area 3337 Sq Ft Built Up Area Whether Inherited N Purchase Date 2019-08-09 Purchase Cost 5000000.00 Development Cost 0.00  85,87,000 85 Lacs+ Mauje Ghodbunder Thane Survey No 191  Total Area 2691 Sq Ft Built Up Area Whether Inherited N Purchase Date 2019-08-09 Purchase Cost 4000000.00 Development Cost 0.00  69,25,000 69 Lacs+ Mauje Chene Thane Survey No 91  Total Area 207713 Sq Ft Built Up Area Whether Inherited N Purchase Date 2023-12-05 Purchase Cost 104621000.00 Development Cost 0.00  9,77,48,000 9 Crore+ Mauje Chene Thane Survey No 115, 117/2  Total Area Built Up Area Whether Inherited N Purchase Date 2023-08-29 Purchase Cost 51274000.00 Development Cost 0.00  5,64,37,500 5 Crore+ Mauje Chene Thane Survey No 120/2, 147/4  Total Area Built Up Area Whether Inherited N Purchase Date 2023-08-29 Purchase Cost 15650500.00 Development Cost 0.00  1,65,60,800 1 Crore+ Chene, Survey No 114/1 & 124  Total Area Built Up Area Whether Inherited N Purchase Date 2023-12-29 Purchase Cost 43900000.00 Development Cost 0.00  4,21,18,500 4 Crore+ Mauje Chene Thane Survey No 121/1  Total Area 15500 Sq Ft Built Up Area Whether Inherited N Purchase Date 2023-11-24 Purchase Cost 6450000.00 Development Cost 0.00  60,00,000 60 Lacs+ Ghodbunder, Thane Survey No 193/3, 193/4, 193/8, 193/10  Total Area Built Up Area Whether Inherited N Purchase Date 2019-12-24 Purchase Cost 43576000.00 Development Cost 0.00  10,35,98,000 10 Crore+ Ghodbunder, Thane Survey No 193/46  Total Area 16361 Sq Ft Built Up Area Whether Inherited N Purchase Date 2021-02-05 Purchase Cost 24563600.00 Development Cost 0.00  4,21,04,000 4 Crore+ Ghodbunder Thane Survey No 193/9  Total Area 32615 Sq Ft Built Up Area Whether Inherited N Purchase Date 2021-02-05 Purchase Cost 72425000.00 Development Cost 0.00  8,39,31,000 8 Crore+ Mauje Ghodbunder, Thane Survey No 193/1A  Total Area 14004 Sq Ft Built Up Area Whether Inherited N Purchase Date 2024-03-06 Purchase Cost 39683400.00 Development Cost 0.00  4,50,47,500 4 Crore+ Mauje Ghodbunder, Thane Survey No 193/1B, 193/7, 193/2  Total Area 3294 Sq Ft Built Up Area Whether Inherited N Purchase Date 2024-03-05 Purchase Cost 64230000.00 Development Cost 0.00  6,00,00,000 6 Crore+ Mauje Chene, Thane Survey No 119/2, 122/2, 116/1  Total Area 11840 Sq Ft Built Up Area Whether Inherited N Purchase Date 2023-09-08 Purchase Cost 23379100.00 Development Cost 0.00  2,18,21,500 2 Crore+","Gala No 1 Clasic Plazza Naupada, Thane  Total Area 157 Sq Ft Built Up Area 157 Sq Ft Whether Inherited N Purchase Date 2001-11-07 Purchase Cost 325000.00 Development Cost 0.00  46,00,000 46 Lacs+ Gat No 32 Part No 2/3 Chitalsar  Total Area 2224 Sq Ft Built Up Area 2224 Sq Ft Whether Inherited N Purchase Date 2000-10-12 Purchase Cost 1385714.00 Development Cost 0.00  5,00,00,000 5 Crore+",Nil,Nil,Nil,Nil,"Rs 1,16,74,78,800 116 Crore+"
3,iii,Commercial Buildings,"Gala No 14, Gagangiri PAchpakhadi Ward 43  Total Area 310 Sq Ft Built Up Area 310 Sq Ft Whether Inherited N Purchase Date 1992-04-19 Purchase Cost 250000.00 Development Cost 0.00  64,82,813 64 Lacs+ Gala No 15, Gagangiri PAchpakhadi Ward 43  Total Area 310 Sq Ft Built Up Area 310 Sq Ft Whether Inherited N Purchase Date 2001-07-24 Purchase Cost 702400.00 Development Cost 0.00  64,82,813 64 Lacs+ Gala No 16, Gagangiri PAchpakhadi Ward 43  Total Area 310 Sq Ft Built Up Area 310 Sq Ft Whether Inherited N Purchase Date 2003-07-16 Purchase Cost 2500000.00 Development Cost 0.00  64,82,813 64 Lacs+ Gala No 5,6,7, Vihang Viahr Pachpakhadi Ward 43  Total Area 1880 Sq Ft Built Up Area 1880 Sq Ft Whether Inherited N Purchase Date 2001-05-10 Purchase Cost 1211000.00 Development Cost 0.00  3,93,15,124 3 Crore+ Gat No 32, Hissa No 2/3, Total Area 2247 Sq Ft Built Up Area Whether Inherited N Purchase Date 2000-10-12 Purchase Cost 1385714.00 Development Cost 0.00  5,00,00,000 5 Crore+ Gala No 6, 7 Mira Apt, Varsova  Total Area 1563 Sq Ft Built Up Area Whether Inherited N Purchase Date 2019-01-16 Purchase Cost 50000000.00 Development Cost 0.00  5,00,00,000 5 Crore+ Shop No 8, Sukhmani, Juhu, Himalaya Co Op Hsg Soc  Total Area 552 Sq Ft Built Up Area Whether Inherited N Purchase Date 2021-01-25 Purchase Cost 22980000.00 Development Cost 0.00  2,25,00,000 2 Crore+ Shop No 21, Vihang Plaza, Bhayandarpada, Thane  Total Area 13132 Sq Ft Built Up Area Whether Inherited N Purchase Date 2022-04-25 Purchase Cost 160530000.00 Development Cost 0.00  15,00,00,000 15 Crore+ Shop No 10, Vihang Valley, Owale, Thane  Total Area 7590 Sq Ft Built Up Area Whether Inherited N Purchase Date 2022-06-17 Purchase Cost 72255000.00 Development Cost 0.00  6,75,00,000 6 Crore+ Shop No 7, Sentram IT Park, Wagle Estate, Thane  Total Area 3230 Sq Ft Built Up Area Whether Inherited N Purchase Date 2023-09-26 Purchase Cost 49238948.00 Development Cost 0.00  4,61,00,000 4 Crore+ Groundfloor, Om Palace Co Op Hsg, Khar, Mumbai  Total Area 1615 Sq Ft Built Up Area Whether Inherited N Purchase Date 2023-04-06 Purchase Cost 90130000.00 Development Cost 0.00  8,50,00,000 8 Crore+ Navi Mumbai Sector 19C, Vashi LAnd No 13, Total Area 5812 Sq Ft Built Up Area Whether Inherited N Purchase Date 2024-09-04 Purchase Cost 127230000.00 Development Cost 0.00  12,00,00,000 12 Crore+",Nil,Nil,Nil,Nil,Nil,"Rs 64,98,63,563 64 Crore+"
4,iv,Residential Buildings,"Bunglow No 65, Dela Enclave, Phase 4, Kunenama Pune  Total Area 2443 Sq Ft Built Up Area Whether Inherited N Purchase Date 2018-08-06 Purchase Cost 42430000.00 Development Cost 0.00  6,05,00,000 6 Crore+ 203, Gulmohar, Sundarban PArk, Samta Nagar Thane  Total Area 704 Sq Ft Built Up Area Whether Inherited N Purchase Date 1997-02-26 Purchase Cost 672000.00 Development Cost 0.00  1,20,00,000 1 Crore+ Quantam Park, 302 Gulab Nagar, Khardanda, Union PArk Road, Khar West  Total Area 895 Sq Ft Built Up Area Whether Inherited N Purchase Date 2014-03-26 Purchase Cost 29700000.00 Development Cost 0.00  3,50,00,000 3 Crore+ 1002, Link Road, Andheri Windser Goregaon West 400102  Total Area 1745 Sq Ft Built Up Area Whether Inherited N Purchase Date 2018-10-30 Purchase Cost 72305750.00 Development Cost 0.00  8,00,00,000 8 Crore+ 2901, Basils, Hiranandani Estate, Thane West  Total Area 3668 Sq Ft Built Up Area Whether Inherited N Purchase Date 2017-03-25 Purchase Cost 55000000.00 Development Cost 0.00  9,00,00,000 9 Crore+ 3001 Basils, Hiranandani Estate, THane  Total Area 3668 Sq Ft Built Up Area Whether Inherited N Purchase Date 2017-03-25 Purchase Cost 55000000.00 Development Cost 0.00  9,00,00,000 9 Crore+ 105, Uniq Shanti, Unique Estate, Mira Road THane  Total Area 440 Sq Ft Built Up Area Whether Inherited N Purchase Date 2018-09-07 Purchase Cost 5974356.00 Development Cost 0.00  80,00,000 80 Lacs+ 106 Uniq Shanti, Unique Estate, Mira Road THane  Total Area 440 Sq Ft Built Up Area Whether Inherited N Purchase Date 2018-09-07 Purchase Cost 6263628.00 Development Cost 0.00  90,00,000 90 Lacs+","803, Vasant Londge, Steps, Majiwada, THane  Total Area 1490 Sq Ft Built Up Area Whether Inherited N Purchase Date 2010-10-26 Purchase Cost 8340000.00 Development Cost 0.00  3,00,00,000 3 Crore+ 804, Vasant Londge, Steps, Majiwada, THane  Total Area 1490 Sq Ft Built Up Area Whether Inherited N Purchase Date 2010-10-26 Purchase Cost 8340000.00 Development Cost 0.00  3,00,00,000 3 Crore+ 204, Gulmohar, Sundarwan PArk, Samta Nagar, Thane  Total Area 704 Sq Ft Built Up Area Whether Inherited N Purchase Date 2000-04-19 Purchase Cost 672000.00 Development Cost 0.00  1,20,00,000 1 Crore+ 1601 Viraj Tower, Pokhran Road no 2, Majiwada, Thane  Total Area 3066 Sq Ft Built Up Area Whether Inherited N Purchase Date 2024-07-24 Purchase Cost 53060000.00 Development Cost 0.00  5,00,00,000 5 Crore+",Nil,Nil,Nil,Nil,"Rs 50,65,00,000 50 Crore+"
5,v,Others,Nil,Nil,Nil,Nil,Nil,Nil,Nil
6,Total Current Market Value of (i) to (v) (as per Affidavit),Total Current Market Value of (i) to (v) (as per Affidavit),"2,14,97,42,364 214 Crore+","17,66,00,000 17 Crore+",Nil,Nil,Nil,Nil,"Rs 2,32,63,42,364 232 Crore+"
7,Totals Calculated,Totals Calculated,"Rs 2,14,97,42,363 214 Crore+","Rs 17,66,00,000 17 Crore+",Nil,Nil,Nil,Nil,"Rs 2,32,63,42,363 232 Crore+"
