,0,1,2,3,4,5,6,7,8
0,Sr No,Description,self,spouse,huf,dependent1,dependent2,dependent3,
1,i,Agricultural Land,"At Nivgunde Survey No 470/4  Total Area 2.29 Acres Built Up Area Whether Inherited N Purchase Date 2010-09-09 Purchase Cost 380500.00 Development Cost 0.00  6,27,840 6 Lacs+ At Nivgunde Survey No 506/2  Total Area 3.38 Acres Built Up Area Whether Inherited N Purchase Date 2010-09-09 Purchase Cost 380500.00 Development Cost 0.00  9,93,600 9 Lacs+ At Nivgunde Survey No 507/2  Total Area 1.38 acres Built Up Area Whether Inherited N Purchase Date 2011-02-07 Purchase Cost 62500.00 Development Cost 0.00  4,60,800 4 Lacs+ At Javkhede Tal Pathrdi Dist Ahamadnagar Survey No 54/2  Total Area 8.39 acres Built Up Area Whether Inherited Y Purchase Date 0000-00-00 Purchase Cost 0.00 Development Cost 0.00  30,65,860 30 Lacs+ At Javkhede Tal Pathrdi Dist Ahamadnagar Survey No 54/1  Total Area 2.31 Acres Built Up Area Whether Inherited Y Purchase Date 0000-00-00 Purchase Cost 0.00 Development Cost 0.00  9,47,940 9 Lacs+ At Javkhede Tal Pathrdi Dist Ahamadnagar Survey No 55/4  Total Area 5.22 Acres Built Up Area Whether Inherited Y Purchase Date 0000-00-00 Purchase Cost 0.00 Development Cost 0.00  18,95,880 18 Lacs+ At Kasar Pinpalgaon Tq Pathrdi Survey No 175/5  Total Area 0.06 Built Up Area Whether Inherited Y Purchase Date 0000-00-00 Purchase Cost 0.00 Development Cost 0.00  4,38,000 4 Lacs+ At Kasar Pinpalgaon Tq Pathrdi Survey No 165/2  Total Area 3.20 Acrs Built Up Area Whether Inherited Y Purchase Date 0000-00-00 Purchase Cost 0.00 Development Cost 0.00  13,59,000 13 Lacs+",Nil,Nil,Nil,Nil,Nil,"Rs 97,88,920 97 Lacs+"
2,ii,Non Agricultural Land,Nil,Nil,Nil,"At Nivgunde Tq Parthdi Survey No 147/2/2  Total Area 4050 sqft Built Up Area Whether Inherited N Purchase Date 2023-10-23 Purchase Cost 5000000.00 Development Cost 0.00  65,00,000 65 Lacs+",Nil,Nil,"Rs 65,00,000 65 Lacs+"
3,iii,Commercial Buildings,"Avadhut, Rajle Building, Rasnenagar, Savedi, Ahdamnagar Final Plot No. 116/Sub Plot No.1  Total Area 384.38 sqft Built Up Area 37968 sqft Whether Inherited N Purchase Date 2008-01-02 Purchase Cost 700000.00 Development Cost 8059095.00  4,24,63,080 4 Crore+",Nil,Nil,Nil,Nil,Nil,"Rs 4,24,63,080 4 Crore+"
4,iv,Residential Buildings,"Pune Flat, Flat No.D-302, 3rd Floor, Survey No.25+25.1, Part MP 1, Brahm Skycity, Dhanore Road, Kalavad, Pune-15  Total Area 945.18 sqft Built Up Area 945.18 sqft Whether Inherited N Purchase Date 2015-09-23 Purchase Cost 6175517.00 Development Cost 0.00  90,00,000 90 Lacs+ Flat Mhada Project Flat No.D9001 in Mumbai  Total Area 693.00 sqft Built Up Area 693.00 sqft Whether Inherited Y Purchase Date 2010-10-17 Purchase Cost 4246000.00 Development Cost 0.00  2,12,65,200 2 Crore+",Nil,Nil,Nil,Nil,Nil,"Rs 3,02,65,200 3 Crore+"
5,v,Others,Nil,Nil,Nil,Nil,Nil,Nil,Nil
6,Total Current Market Value of (i) to (v) (as per Affidavit),Total Current Market Value of (i) to (v) (as per Affidavit),"8,25,17,200 8 Crore+",Nil,Nil,"65,00,000 65 Lacs+",Nil,Nil,"Rs 8,90,17,200 8 Crore+"
7,Totals Calculated,Totals Calculated,"Rs 8,25,17,200 8 Crore+",Nil,Nil,"Rs 65,00,000 65 Lacs+",Nil,Nil,"Rs 8,90,17,200 8 Crore+"
