,0,1,2,3,4,5,6,7,8
0,Sr No,Description,self,spouse,huf,dependent1,dependent2,dependent3,
1,i,Agricultural Land,"Village Ugaahi Tehsil Shadabad Dist Hathras  Total Area 1.25 acre Built Up Area Whether Inherited Y Purchase Date 0000-00-00 Purchase Cost 0.00 Development Cost 0.00  25,00,000 25 Lacs+","Village Dhanakpur Tehsil Deoband, Village Sadoli Deepchand, Dt-2016.01.01  Total Area 2 acre Built Up Area Whether Inherited N Purchase Date 0000-00-00 Purchase Cost 0.00 Development Cost 8100000.00  90,00,000 90 Lacs+",Nil,Nil,Nil,Nil,"Rs 1,15,00,000 1 Crore+"
2,ii,Non Agricultural Land,Nil,Nil,Nil,Nil,Nil,Nil,Nil
3,iii,Commercial Buildings,"Vill Milk Vajiuddin Tehsil & Dist Saharanpur  Total Area 2900 sq.ft Built Up Area 1800 sq.ft Whether Inherited Y Purchase Date 0000-00-00 Purchase Cost 0.00 Development Cost 0.00  25,00,000 25 Lacs+",Nil,Nil,Nil,Nil,Nil,"Rs 25,00,000 25 Lacs+"
4,iv,Residential Buildings,"M. Chandranagar J.M.Aroma Sector Noida AJ Vatika Dream Velly Sector Noida, Area-1000 sq.ft, 1325 sq.ft, 1705 sq.ft, Date of purchase-2015 & 2020, Development-7000000/-, 4500000/-  Total Area Built Up Area Whether Inherited Y Purchase Date 0000-00-00 Purchase Cost 0.00 Development Cost 0.00  2,01,00,000 2 Crore+",Nil,Nil,Nil,Nil,Nil,"Rs 2,01,00,000 2 Crore+"
5,v,Others,"Name of Father New Vaishali Bihar  Total Area 1800 sq.ft Built Up Area Whether Inherited N Purchase Date 0000-00-00 Purchase Cost 0.00 Development Cost 0.00  22,00,000 22 Lacs+",Nil,Nil,Nil,Nil,Nil,"Rs 22,00,000 22 Lacs+"
6,Total Current Market Value of (i) to (v) (as per Affidavit),Total Current Market Value of (i) to (v) (as per Affidavit),"2,73,00,000 2 Crore+","90,00,000 90 Lacs+",Nil,Nil,Nil,Nil,"Rs 3,63,00,000 3 Crore+"
7,Totals Calculated,Totals Calculated,"Rs 2,73,00,000 2 Crore+","Rs 90,00,000 90 Lacs+",Nil,Nil,Nil,Nil,"Rs 3,63,00,000 3 Crore+"
