,0,1,2,3,4,5,6,7,8
0,Sr No,Description,self,spouse,huf,dependent1,dependent2,dependent3,
1,i,Agricultural Land,"Anakapalle district madugula mandal madugula village syno 758-2  Total Area Ac 01-33 cts Built Up Area Whether Inherited Y Purchase Date 0000-00-00 Purchase Cost 0.00 Development Cost 0.00  13,30,000 13 Lacs+ Anakapalle district anakapalle south 1 sy no 653/9  Total Area Ac 00-64.3 Cts Built Up Area Whether Inherited Y Purchase Date 0000-00-00 Purchase Cost 0.00 Development Cost 0.00  77,16,000 77 Lacs+ Anakapalle district anakapalle south 1  Total Area Ac 00-2.66 Cts Built Up Area Whether Inherited Y Purchase Date 0000-00-00 Purchase Cost 0.00 Development Cost 0.00  3,19,200 3 Lacs+ Anakappale district anakapalle sy.no 1482/5  Total Area Ac 00-23.6 Cts Built Up Area Whether Inherited Y Purchase Date 0000-00-00 Purchase Cost 0.00 Development Cost 0.00  28,39,000 28 Lacs+ Anakapalle district anakapalle soth 1 sy no 690-7B  Total Area AC 00-15 Cts Built Up Area Whether Inherited N Purchase Date 2020-12-16 Purchase Cost 3000000.00 Development Cost 0.00  18,00,000 18 Lacs+ Anakapalle district anakapalle TS No 66 (covered by court case in WP No 3722-2022)  Total Area Ac 01-98Cts Built Up Area Whether Inherited N Purchase Date 0000-00-00 Purchase Cost 59400.00 Development Cost 0.00  47,91,60,000 47 Crore+",Nil,Nil,Nil,Nil,Nil,"Rs 49,31,64,200 49 Crore+"
2,ii,Non Agricultural Land,"Anakapalle district anakapalle south 1  Total Area Ac 03-00Cts Built Up Area Whether Inherited Y Purchase Date 0000-00-00 Purchase Cost 0.00 Development Cost 0.00  3,60,00,000 3 Crore+",Nil,Nil,Nil,Nil,Nil,"Rs 3,60,00,000 3 Crore+"
3,iii,Commercial Buildings,"Visakhapatnam district kancharapalem sy no 10-7  Total Area 1347.76 sq ft Built Up Area 461.2 sq ft Whether Inherited Y Purchase Date 0000-00-00 Purchase Cost 0.00 Development Cost 0.00  89,85,000 89 Lacs+",Nil,Nil,"Visakhapatnam district kancharapalem sy no 10-7 Total Area 1347.76 sq ft Built Up Area 461.2 sq ft Whether Inherited Y Purchase Date 0000-00-00 Purchase Cost 0.00 Development Cost 0.00  89,85,000 89 Lacs+","Visakhapatnam district kancharapalem sy no 10-7 Total Area 1347.76 sq ft Built Up Area 461.2 sq ft Whether Inherited Y Purchase Date 0000-00-00 Purchase Cost 0.00 Development Cost 0.00  89,85,000 89 Lacs+",Nil,"Rs 2,69,55,000 2 Crore+"
4,iv,Residential Buildings,"Anakapalle district anakapalle RS ward sy no 1528-8 & 1528-9  Total Area 19166.4 sq ft Built Up Area 19170 sq ft Whether Inherited Y Purchase Date 0000-00-00 Purchase Cost 0.00 Development Cost 0.00  4,92,75,000 4 Crore+ Visakhapatnam kancharapalem sy no 41-1 D.No 35-15-12  Total Area 426.6 sq ft Built Up Area 360 sq ft Whether Inherited Y Purchase Date 0000-00-00 Purchase Cost 0.00 Development Cost 0.00  23,29,000 23 Lacs+",Nil,Nil,"visakhapatnam kancharapalem sy no 41-1 D no 35-15-12  Total Area 426.6 sq ft Built Up Area 360 sq ft Whether Inherited N Purchase Date 0000-00-00 Purchase Cost 0.00 Development Cost 0.00  23,29,000 23 Lacs+","visakhapatnam kancharapalem sy no 41-1 D no 35-15-12  Total Area 426.6 sq ft Built Up Area 360 sq ft Whether Inherited N Purchase Date 0000-00-00 Purchase Cost 0.00 Development Cost 0.00  23,29,000 23 Lacs+",Nil,"Rs 5,62,62,000 5 Crore+"
5,v,Others,Nil,Nil,Nil,Nil,Nil,Nil,Nil
6,Total Current Market Value of (i) to (v) (as per Affidavit),Total Current Market Value of (i) to (v) (as per Affidavit),"58,97,53,200 58 Crore+",Nil,Nil,"1,13,14,000 1 Crore+","1,13,14,000 1 Crore+",Nil,"Rs 61,23,81,200 61 Crore+"
7,Totals Calculated,Totals Calculated,"Rs 58,97,53,200 58 Crore+",Nil,Nil,"Rs 1,13,14,000 1 Crore+","Rs 1,13,14,000 1 Crore+",Nil,"Rs 61,23,81,200 61 Crore+"
