,0,1,2,3,4,5,6,7,8
0,Sr No,Description,self,spouse,huf,dependent1,dependent2,dependent3,
1,i,Agricultural Land,"WRC Land at Molom  Total Area 1.5 Acres Built Up Area Whether Inherited Y Purchase Date 0000-00-00 Purchase Cost 0.00 Development Cost 30000.00  20,00,000 20 Lacs+",Nil,Nil,Nil,Nil,Nil,"Rs 20,00,000 20 Lacs+"
2,ii,Non Agricultural Land,Jhum Land at Molom Village Sy No Nil  Total Area 3 Acre Built Up Area Whether Inherited Y Purchase Date 0000-00-00 Purchase Cost 0.00 Development Cost 0.00  0*(Value Not Given),Nil,Nil,Nil,Nil,Nil,Rs 0
3,iii,Commercial Buildings,Nil,"Hotel Mount Cave at Senki Park Division IV, Itanagar Vide Sy no 98/398 Allotment Oder No DC/LMITA(a)/416/05, Date 07.06.2006 Total Area 10763.91 Sq.ft. Built Up Area 2368.56 Sq.ft. Whether Inherited N Purchase Date 0000-00-00 Purchase Cost 0.00 Development Cost 3000000.00  80,00,000 80 Lacs+",Nil,Nil,Nil,Nil,"Rs 80,00,000 80 Lacs+"
4,iv,Residential Buildings,"Residential Building at Senkipark, Division-IV Itanagar Vide Govt. Land Oder No 9/98(Vol-IV)/740, Date 18.07.2004  Total Area 5381.96 Sq.ft. Built Up Area 1937.50 Sq.ft. Whether Inherited N Purchase Date 0000-00-00 Purchase Cost 0.00 Development Cost 4000000.00  50,00,000 50 Lacs+ Applied in from no 46 Si No 0507 at G-Extension Naharlagun Total Area 2970.85 Sq.ft. Built Up Area 1377.78 Sq.ft. Whether Inherited N Purchase Date 0000-00-00 Purchase Cost 0.00 Development Cost 4500000.00  60,00,000 60 Lacs+ Private Residential Plot Location New Market Aalo  Total Area 980 Sq.ft. Built Up Area 800 Sq.ft. Whether Inherited N Purchase Date 0000-00-00 Purchase Cost 0.00 Development Cost 3000000.00  40,00,000 40 Lacs+",Nil,Nil,Nil,Nil,Nil,"Rs 1,50,00,000 1 Crore+"
5,v,Others,Nil,Nil,Nil,Nil,Nil,Nil,Nil
6,Total Current Market Value of (i) to (v) (as per Affidavit),Total Current Market Value of (i) to (v) (as per Affidavit),"1,50,00,000 1 Crore+","80,00,000 80 Lacs+",Nil,Nil,Nil,Nil,"Rs 2,30,00,000 2 Crore+"
7,Totals Calculated,Totals Calculated,"Rs 1,70,00,000 1 Crore+","Rs 80,00,000 80 Lacs+",Nil,Nil,Nil,Nil,"Rs 2,50,00,000 2 Crore+"
