,0,1,2,3,4,5,6,7,8
0,Sr No,Description,self,spouse,huf,dependent1,dependent2,dependent3,
1,i,Agricultural Land,"WRC No. 3091/21/09/158 of 1991 Location Zote, Champhai  Total Area 9000 sq. ft. Built Up Area Whether Inherited N Purchase Date 2021-05-11 Purchase Cost 300000.00 Development Cost 500000.00  40,00,000 40 Lacs+ Periodic Patta No. 307006/10/147 Location Teikhang, Saitual District  Total Area 2.59 Acres Built Up Area Whether Inherited N Purchase Date 2020-01-21 Purchase Cost 25000.00 Development Cost 2000000.00  30,00,000 30 Lacs+ Plot of Land, VC Pass No. Nil Agriculture Land Location Tanhril Aizawl  Total Area 5 Acres Built Up Area Whether Inherited N Purchase Date 2021-06-01 Purchase Cost 1500000.00 Development Cost 0.00  30,00,000 30 Lacs+",Nil,Nil,Nil,Nil,Nil,"Rs 1,00,00,000 1 Crore+"
2,ii,Non Agricultural Land,Nil,"Garden LSC No. 13 of 1972 Location Durtlang Hermon Veng, Aizawl Mizoram  Total Area 2.3 Bighas Built Up Area Whether Inherited N Purchase Date 2022-07-04 Purchase Cost 1500000.00 Development Cost 0.00  30,00,000 30 Lacs+",Nil,Nil,Nil,Nil,"Rs 30,00,000 30 Lacs+"
3,iii,Commercial Buildings,"Commercial Building RCC Building (Aizawl Peack Resi=taurant) Location Zuangtui Industrial Area, Aizawl Mizoram Plot No. 7 Bolock No. II  Total Area 3228 sq. ft. Built Up Area 2600 sq. ft. Whether Inherited Y Purchase Date 2000-00-00 Purchase Cost 0.00 Development Cost 0.00  3,00,00,000 3 Crore+ Plot of Land Allotted at Industrial Growth Centre IGC at Luangmual, Aizawl By Commerce & Industries, Government of Mizoram Vide Order No. D.11028/3/2017  Total Area 2580 sq. m. Built Up Area Whether Inherited N Purchase Date 0000-00-00 Purchase Cost 0.00 Development Cost 500000.00  70,00,000 70 Lacs+ Teikhang Onion roots Washing Industires and Sialkal guest House, VC Pass  Total Area 40000 sq. ft. Built Up Area 15000 sq. ft. Whether Inherited N Purchase Date 0000-00-00 Purchase Cost 0.00 Development Cost 5000000.00  70,00,000 70 Lacs+",Nil,Nil,Nil,Nil,Nil,"Rs 4,40,00,000 4 Crore+"
4,iv,Residential Buildings,"RCC Building at Bawngkawn, LSC No. 103101/01/1081 of 2004  Total Area 2342.856 sq. ft. Built Up Area 1600 sq. ft. Whether Inherited Y Purchase Date 0000-00-00 Purchase Cost 0.00 Development Cost 0.00  4,00,00,000 4 Crore+ RCC Building at Hunthar Veng, Aizawl, lSC No. AZL-444 of 1974  Total Area 2853.665 sq. ft. Built Up Area 1800 sq. ft. Whether Inherited N Purchase Date 2014-04-11 Purchase Cost 6200000.00 Development Cost 23800000.00  3,80,00,000 3 Crore+ Assam Type Building at Hunthar, Aizawl LSC No. 01 of 1998  Total Area 2330 sq. ft. Built Up Area 300 sq. ft. Whether Inherited N Purchase Date 2023-08-01 Purchase Cost 1299480.00 Development Cost 0.00  1,20,00,000 1 Crore+ Plot of Land at Hunthar Aizawl Mizoram LSC No. 1057 of 1998  Total Area 2296.92 sq. ft. Built Up Area Whether Inherited N Purchase Date 2023-08-01 Purchase Cost 1281360.00 Development Cost 0.00  1,10,00,000 1 Crore+ Plot of Land at Zamabawk, Aizawl LSC No. CAD-2113 of 2016  Total Area 3957 sq. ft. Built Up Area Whether Inherited N Purchase Date 2019-01-28 Purchase Cost 2206860.00 Development Cost 0.00  1,00,00,000 1 Crore+ Plot of Land at Thingkah, Lawngtlai, LS No. 16/2016 of 10/06/2016  Total Area 68401.90 sq. ft. Built Up Area Whether Inherited N Purchase Date 2021-09-09 Purchase Cost 95370.00 Development Cost 0.00  20,00,000 20 Lacs+ Plot of Land at Luangmual, Aizawl Mizoram LSC No. 1751 of 2010  Total Area 12237.68 sq. ft. Built Up Area Whether Inherited N Purchase Date 2021-11-17 Purchase Cost 568750.00 Development Cost 3000000.00  1,00,00,000 1 Crore+ Plot of Land at Luangmual Aizawl, Mizoram LSC NO. 103701/01/826 of 2006  Total Area 11242.52 sq. ft. Built Up Area Whether Inherited N Purchase Date 2023-10-15 Purchase Cost 6270000.00 Development Cost 0.00  70,00,000 70 Lacs+ Plot of Land at Pukpui, Lunglei, VC Pass No. Nil  Total Area 4000 sq. ft. Built Up Area Whether Inherited N Purchase Date 2021-06-20 Purchase Cost 1000000.00 Development Cost 0.00  20,00,000 20 Lacs+",Nil,Nil,Nil,Nil,Nil,"Rs 13,20,00,000 13 Crore+"
5,v,Others,Nil,Nil,Nil,Nil,Nil,Nil,Nil
6,Total Current Market Value of (i) to (v) (as per Affidavit),Total Current Market Value of (i) to (v) (as per Affidavit),"18,60,00,000 18 Crore+","30,00,000 30 Lacs+",Nil,Nil,Nil,Nil,"Rs 18,90,00,000 18 Crore+"
7,Totals Calculated,Totals Calculated,"Rs 18,60,00,000 18 Crore+","Rs 30,00,000 30 Lacs+",Nil,Nil,Nil,Nil,"Rs 18,90,00,000 18 Crore+"
