,0,1,2,3,4,5,6,7,8
0,Sr No,Description,self,spouse,huf,dependent1,dependent2,dependent3,
1,i,Agricultural Land,"Dadam Village  Total Area 10 Acres Built Up Area Whether Inherited Y Purchase Date 0000-00-00 Purchase Cost 0.00 Development Cost 0.00  28,97,380 28 Lacs+",Nil,Nil,Nil,Nil,Nil,"Rs 28,97,380 28 Lacs+"
2,ii,Non Agricultural Land,"Khola Camp Complex Khonsa, LPC No. Rev/91-92  Total Area 26909.776 Sq ft Built Up Area Whether Inherited Y Purchase Date 2019-01-17 Purchase Cost 0.00 Development Cost 0.00  3,80,62,580 3 Crore+ Land & Building Dadam Village  Total Area 57600 sq ft Built Up Area Whether Inherited Y Purchase Date 0000-00-00 Purchase Cost 0.00 Development Cost 3846000.00  90,41,649 90 Lacs+",Nil,Nil,Nil,Nil,Nil,"Rs 4,71,04,229 4 Crore+"
3,iii,Commercial Buildings,"Land & Building at Club Colony, Khonsa, Plot/Dag No. 130  Total Area 538.196 sq ft Built Up Area 300 sq ft Whether Inherited N Purchase Date 0000-00-00 Purchase Cost 0.00 Development Cost 0.00  1,61,42,427 1 Crore+ Land and Along Complex Building, Khonsa, Plot/Dad No. 949  Total Area 3229.173 sq ft Built Up Area 3229.173 sq ft Whether Inherited N Purchase Date 0000-00-00 Purchase Cost 0.00 Development Cost 13088090.00  1,30,88,090 1 Crore+ Land & Hotel Building at Mancotta Khanikar, Dibrugarh, Assam, Dag No. 241(PT) Patta No. 47  Total Area 6367.176 sq ft Built Up Area 3100 sq ft Whether Inherited Y Purchase Date 0000-00-00 Purchase Cost 0.00 Development Cost 0.00  1,30,56,851 1 Crore+",Nil,Nil,Nil,Nil,Nil,"Rs 4,22,87,368 4 Crore+"
4,iv,Residential Buildings,"Pinewood Colony (Near DFO), Khonsa Plot No. 2034  Total Area 882.641 sq ft Built Up Area Whether Inherited N Purchase Date 0000-00-00 Purchase Cost 0.00 Development Cost 0.00  25,10,712 25 Lacs+ Land & Building- Aboh Niwas, type V Colony, Khonsa, Plot/DA G No. 55 (B)  Total Area 8293.916 Sq ft Built Up Area 8000 sq ft Whether Inherited Y Purchase Date 0000-00-00 Purchase Cost 0.00 Development Cost 0.00  2,49,75,936 2 Crore+",Nil,Nil,Nil,Nil,Nil,"Rs 2,74,86,648 2 Crore+"
5,v,Others,Nil,Nil,Nil,Nil,Nil,Nil,Nil
6,Total Current Market Value of (i) to (v) (as per Affidavit),Total Current Market Value of (i) to (v) (as per Affidavit),"11,97,75,625 11 Crore+",Nil,Nil,Nil,Nil,Nil,"Rs 11,97,75,625 11 Crore+"
7,Totals Calculated,Totals Calculated,"Rs 11,97,75,625 11 Crore+",Nil,Nil,Nil,Nil,Nil,"Rs 11,97,75,625 11 Crore+"
