,0,1,2,3,4,5,6,7,8
0,Sr No,Description,self,spouse,huf,dependent1,dependent2,dependent3,
1,i,Agricultural Land,"Farmhouse Dharwad  Total Area 148 hissa Built Up Area 8.22acer Whether Inherited N Purchase Date 0000-00-00 Purchase Cost 650000.00 Development Cost 0.00  1,20,00,000 1 Crore+",Nil,Nil,Nil,Nil,Nil,"Rs 1,20,00,000 1 Crore+"
2,ii,Non Agricultural Land,"Rayapura hubbali  Total Area 32/2 Built Up Area 1.20acer Whether Inherited N Purchase Date 0000-00-00 Purchase Cost 200000.00 Development Cost 0.00  6,76,27,000 6 Crore+ Rayapura hubbali  Total Area 25/1 A Built Up Area 1 acer Whether Inherited N Purchase Date 0000-00-00 Purchase Cost 300000.00 Development Cost 0.00  7,41,07,000 7 Crore+ Gokal road hubbali  Total Area 18.50gts Built Up Area Whether Inherited N Purchase Date 0000-00-00 Purchase Cost 3000000.00 Development Cost 0.00  22,98,69,000 22 Crore+ Ilavala hubbali  Total Area 32385sft Built Up Area Whether Inherited N Purchase Date 0000-00-00 Purchase Cost 26208000.00 Development Cost 0.00  6,47,70,000 6 Crore+","Saraswathipuram Hubbali  Total Area 1 gts Built Up Area Whether Inherited N Purchase Date 0000-00-00 Purchase Cost 3000000.00 Development Cost 0.00  5,65,000 5 Lacs+ Saraswathipuram Hubbali  Total Area 2gts Built Up Area Whether Inherited N Purchase Date 0000-00-00 Purchase Cost 3000000.00 Development Cost 0.00  10,80,000 10 Lacs+ Saraswathipuram Hubbali  Total Area 1gts Built Up Area Whether Inherited N Purchase Date 0000-00-00 Purchase Cost 3000000.00 Development Cost 0.00  6,15,000 6 Lacs+ Saraswathipuram Hubbali  Total Area 1gts Built Up Area Whether Inherited N Purchase Date 0000-00-00 Purchase Cost 3000000.00 Development Cost 0.00  6,29,000 6 Lacs+ Saraswathipuram Hubbali Total Area 2gts Built Up Area Whether Inherited N Purchase Date 0000-00-00 Purchase Cost 3000000.00 Development Cost 0.00  10,70,000 10 Lacs+",Nil,Nil,Nil,Nil,"Rs 44,03,32,000 44 Crore+"
3,iii,Commercial Buildings,"Building and open space blr  Total Area 4093sft Built Up Area 4093sft Whether Inherited Y Purchase Date 0000-00-00 Purchase Cost 0.00 Development Cost 0.00  5,45,18,000 5 Crore+ Building and open space blr  Total Area 9334sft Built Up Area 9334sft Whether Inherited Y Purchase Date 0000-00-00 Purchase Cost 0.00 Development Cost 0.00  4,07,00,000 4 Crore+","H.no.5 resdential rayanala hubbali  Total Area 12gts Built Up Area Whether Inherited N Purchase Date 0000-00-00 Purchase Cost 8530000.00 Development Cost 0.00  1,15,30,000 1 Crore+ H.no.5 resdential Unakal hubbali  Total Area 1200sft Built Up Area Whether Inherited N Purchase Date 0000-00-00 Purchase Cost 500000.00 Development Cost 0.00  5,00,000 5 Lacs+",Nil,Nil,Nil,Nil,"Rs 10,72,48,000 10 Crore+"
4,iv,Residential Buildings,"Living house gokal road hubbali  Total Area 38gts Built Up Area 19gts Whether Inherited N Purchase Date 0000-00-00 Purchase Cost 3024000.00 Development Cost 0.00  4,25,00,000 4 Crore+ H.no.5 vileka village gramada begur Blr  Total Area 1025sft Built Up Area 1025sft Whether Inherited N Purchase Date 0000-00-00 Purchase Cost 2000000.00 Development Cost 0.00  29,00,000 29 Lacs+ ALI Askara eoad blr  Total Area 2866sft Built Up Area Whether Inherited N Purchase Date 0000-00-00 Purchase Cost 23645000.00 Development Cost 0.00  2,75,75,000 2 Crore+","Living house gokal road hubbali Total Area 38gts Built Up Area Whether Inherited N Purchase Date 0000-00-00 Purchase Cost 3024000.00 Development Cost 0.00  4,25,00,000 4 Crore+ H.no.5 Residential lving house Unakalla  Total Area 1200sft Built Up Area 1200sft Whether Inherited N Purchase Date 0000-00-00 Purchase Cost 1200000.00 Development Cost 0.00  12,00,000 12 Lacs+ ALI askara road Blr  Total Area 2866sft Built Up Area 2866sft Whether Inherited N Purchase Date 0000-00-00 Purchase Cost 23645000.00 Development Cost 0.00  2,75,75,000 2 Crore+ Sonena village devanahalli Blr  Total Area 9719sft Built Up Area 9719sft Whether Inherited N Purchase Date 0000-00-00 Purchase Cost 116011000.00 Development Cost 0.00  12,18,01,000 12 Crore+",Nil,Nil,Nil,Nil,"Rs 26,60,51,000 26 Crore+"
5,v,Others,Nil,Nil,Nil,Nil,Nil,Nil,Nil
6,Total Current Market Value of (i) to (v) (as per Affidavit),Total Current Market Value of (i) to (v) (as per Affidavit),"60,17,86,000 60 Crore+","20,90,65,000 20 Crore+",Nil,Nil,Nil,Nil,"Rs 81,08,51,000 81 Crore+"
7,Totals Calculated,Totals Calculated,"Rs 61,65,66,000 61 Crore+","Rs 20,90,65,000 20 Crore+",Nil,Nil,Nil,Nil,"Rs 82,56,31,000 82 Crore+"
