,0,1,2,3,4,5,6,7,8
0,Sr No,Description,self,spouse,huf,dependent1,dependent2,dependent3,
1,i,Agricultural Land,"Mouza Kapileswar, JL No. 54  Total Area 0.185 acre Built Up Area Whether Inherited N Purchase Date 2014-10-29 Purchase Cost 220675.00 Development Cost 0.00  3,00,000 3 Lacs+","MOuza- Jaguli, JL No. 53  Total Area 0.235 Acre Built Up Area Whether Inherited N Purchase Date 2012-05-14 Purchase Cost 100000.00 Development Cost 0.00  1,80,000 1 Lacs+",Nil,Nil,Nil,Nil,"Rs 4,80,000 4 Lacs+"
2,ii,Non Agricultural Land,"Mouza Digha, JL No. 55  Total Area 1886 sq ft Built Up Area Whether Inherited N Purchase Date 2011-06-02 Purchase Cost 213030.00 Development Cost 0.00  3,20,000 3 Lacs+ Mouza Digha, JL No. 55  Total Area 3593 sq ft Built Up Area Whether Inherited N Purchase Date 1988-03-24 Purchase Cost 10000.00 Development Cost 0.00  1,00,000 1 Lacs+ Mouza Digha, JL No. 55  Total Area 381.82 sq ft Built Up Area Whether Inherited N Purchase Date 1990-06-04 Purchase Cost 1000.00 Development Cost 0.00  50,000 50 Thou+","Mouza Halisahar, JL No. 6  Total Area 630 sq ft Built Up Area Whether Inherited N Purchase Date 2005-08-24 Purchase Cost 112000.00 Development Cost 0.00  2,00,000 2 Lacs+ Mouza Halisahar, JL No. 6  Total Area 118.13 sq ft Built Up Area Whether Inherited N Purchase Date 0000-00-00 Purchase Cost 0.00 Development Cost 0.00  1,00,000 1 Lacs+",Nil,Nil,Nil,Nil,"Rs 7,70,000 7 Lacs+"
3,iii,Commercial Buildings,Nil,"Mouza Digha, JL No. 55  Total Area 77 sq ft Built Up Area 77 sq ft Whether Inherited N Purchase Date 2014-12-18 Purchase Cost 100000.00 Development Cost 0.00  3,00,000 3 Lacs+",Nil,Nil,Nil,Nil,"Rs 3,00,000 3 Lacs+"
4,iv,Residential Buildings,"Mouza Digha, JL no. 55  Total Area 1686 sq ft Built Up Area 1100 sq ft Whether Inherited N Purchase Date 1997-02-27 Purchase Cost 30000.00 Development Cost 6000000.00  15,00,000 15 Lacs+ Maniktala Housing  Total Area 697 sq ft Built Up Area 697 sq ft Whether Inherited N Purchase Date 2011-09-26 Purchase Cost 177457.00 Development Cost 0.00  10,00,000 10 Lacs+",Nil,Nil,Nil,Nil,Nil,"Rs 25,00,000 25 Lacs+"
5,v,Others,Nil,Nil,Nil,Nil,Nil,Nil,Nil
6,Total Current Market Value of (i) to (v) (as per Affidavit),Total Current Market Value of (i) to (v) (as per Affidavit),"22,70,000 22 Lacs+","7,80,000 7 Lacs+",Nil,Nil,Nil,Nil,"Rs 30,50,000 30 Lacs+"
7,Totals Calculated,Totals Calculated,"Rs 32,70,000 32 Lacs+","Rs 7,80,000 7 Lacs+",Nil,Nil,Nil,Nil,"Rs 40,50,000 40 Lacs+"
