,0,1,2,3,4,5,6,7,8
0,Sr No,Description,self,spouse,huf,dependent1,dependent2,dependent3,
1,i,Agricultural Land,"Poklok, Namchi, South Sikkim, K.No. 329, Plot No. 373, 380  Total Area 0.8340 Hectare Built Up Area Whether Inherited N Purchase Date 2006-07-01 Purchase Cost 120000.00 Development Cost 0.00  1,49,01,988 1 Crore+ Daramdin, Soreng, West Sikkim, K.No. 6, Plot No. 582, 583, 584, 594, 598 & 608  Total Area 1.2500 Hectare Built Up Area Whether Inherited Y Purchase Date 0000-00-00 Purchase Cost 0.00 Development Cost 0.00  2,63,71,580 2 Crore+ Paleytam, Namthang, Namchi, South Sikkim, K.No. 10, Plot No. 22  Total Area 0.1460 Hectare Built Up Area Whether Inherited Y Purchase Date 0000-00-00 Purchase Cost 0.00 Development Cost 0.00  27,97,325 27 Lacs+ Rumbuk Daramdin, Soreng, West Sikkim, K.No. 21, Plot No. 789, 802, 803, 754  Total Area 0.8437 Sq ft Built Up Area Whether Inherited Y Purchase Date 0000-00-00 Purchase Cost 0.00 Development Cost 0.00  50,85,646 50 Lacs+",Nil,Nil,Nil,Nil,Nil,"Rs 4,91,56,539 4 Crore+"
2,ii,Non Agricultural Land,"Gifted - Panchanai, Champasari, bagdogra, Darjeeling, West Bengal, K.No. LR-205(P), Plot No. RS 430(P), LR-428, LR-430(P)  Total Area 9582.30 Sq ft Built Up Area Whether Inherited N Purchase Date 0000-00-00 Purchase Cost 0.00 Development Cost 1425000.00  57,49,379 57 Lacs+","Gifted- Tadong, Gangtok East Sikkim, K.No. 177, Plot No. 825/1067  Total Area 840 Sq ft Built Up Area Whether Inherited N Purchase Date 2023-05-03 Purchase Cost 0.00 Development Cost 0.00  26,18,280 26 Lacs+",Nil,Nil,Nil,Nil,"Rs 83,67,659 83 Lacs+"
3,iii,Commercial Buildings,Nil,"Gifted- Tadong, Gangtok East Sikkim, K.No. 177, Plot No. 825/1067  Total Area 840 Sq ft Built Up Area 3670 Sq ft Whether Inherited N Purchase Date 2023-05-03 Purchase Cost 0.00 Development Cost 0.00  91,75,000 91 Lacs+",Nil,Nil,Nil,Nil,"Rs 91,75,000 91 Lacs+"
4,iv,Residential Buildings,"Gift- Panchanai, Champasari, bagdogra, darjeeling, West Bengal, K.No. LR-250(P), Plot No. RS 430(P), LR- 428, LR-430(P)  Total Area 1030.00 Sq ft Built Up Area 4120 sq ft Whether Inherited N Purchase Date 0000-00-00 Purchase Cost 0.00 Development Cost 1425000.00  90,64,000 90 Lacs+",Nil,Nil,Nil,Nil,Nil,"Rs 90,64,000 90 Lacs+"
5,v,Others,Nil,Nil,Nil,Nil,Nil,Nil,Nil
6,Total Current Market Value of (i) to (v) (as per Affidavit),Total Current Market Value of (i) to (v) (as per Affidavit),"6,39,69,918 6 Crore+","1,17,93,280 1 Crore+",Nil,Nil,Nil,Nil,"Rs 7,57,63,198 7 Crore+"
7,Totals Calculated,Totals Calculated,"Rs 6,39,69,918 6 Crore+","Rs 1,17,93,280 1 Crore+",Nil,Nil,Nil,Nil,"Rs 7,57,63,198 7 Crore+"
