,0,1,2,3,4,5,6,7,8
0,Sr No,Description,self,spouse,huf,dependent1,dependent2,dependent3,
1,i,Agricultural Land,"(1) Joint Property- Vill. Sarenkho, T. Sironj, P.H.Sarenkho, Khasra No. 31(s)32(s),40(s),43(s), 104(s),110(s),111(s), 113(s), 115(s), 204/1(s),208(s),209(s), Area- 6.235 Hectare. (2) Joint Property- Vill. Sarenkho, Khasra No. 226(s),229(s),231/2(s),225/2, Area- 3.966 Acre. (3) Joint Property- Vill. Sarenkho, Th. Sironj, P.H. Sarenkho, Khasra No. 225/1(s), Area- 10.855 Acre. (4) Vill. Sanrekho t. Sironj, P.H. sarenkho, Khasra No. 96/1(s)- 2.073 Hectare, Khasra No. 96/2(s)- 1.00 Hectare, Khasra No. 212(s)- 1.252 Hectare(3 Kita)- Area- 10.687 Acre. (5) Vill. Kalyanpur, Tah. Siroj, Patwari, Halka Kanji Khedi, Khasra No. 53(s), 54(s), 55(s), 56(s), 61/1(S), 62/1/9s/0- 8.035 Acre. DOP- 2013/01/02, COP- Rs. 441703. (6) Joint Property Vill. Sarekho , Patwari Halka Srekho, Mugalrai, Tah. Sironj, Dist. Vidisha, Khasra No. 55/2(S)- 1.753 Hectare, 1/4 Share- 1.082 Acre. (7) Joint Property, Vill. Sarekho Patwari Halka Sarekho, Mugalsarai, Tah. Sironj, Dist. Vidisha, Khasra No. 37/1(s)- 2.035 Hectare, Khasra No. 235(s)-0.784, Khasra No. 236/1(s)- 1.739- 1/4 Share- 2.814 Acre Total Area 52.846 Acre Built Up Area Whether Inherited N Purchase Date 0000-00-00 Purchase Cost 0.00 Development Cost 0.00  1,04,00,000 1 Crore+","(1) Vill. Bamhouri Patwari Halka No. 4, T.Hujur, Dist. Bhopal, Khata No.92/1(s)- 1.00 Acre, DOP- 2012/07/26, COP- Rs. 651345. (2) Joint Property, Vill. Sarekho Ptwari, Hlka Sarekho, Mugalsarai Tah. Sironj, Dist. Vidish, Khasra No. 55/2(s)- 3/4 Share- 2.804 Acre. (3) Joint Property, Vill. Sarekho Patwari Halka Sarekho, Mugalsarai, Tah Sironj, Dist. Vidisha, Khasra No. 37/1(S)-2.035 Hectare, Khasra No. 235(s)-0.784, Khasra No. 236/1(s) - 1.739- 3/4 Share - 8.446 Acre. (4) Joint Property, Vill. Klyanpur Patwari Halka NO. 38 (Kajikheda), Th. Sironj, Dist. Vidisha, Khasra No. 40(S). 3.748 Acre, DOP-2021/06/28, COP- Rs. 1346872. Total Area 15.998 Acre Built Up Area Whether Inherited N Purchase Date 0000-00-00 Purchase Cost 0.00 Development Cost 0.00  79,38,000 79 Lacs+",Nil,Nil,Nil,Nil,"Rs 1,83,38,000 1 Crore+"
2,ii,Non Agricultural Land,"Vill. Klyanpur, Th. Sironj, Patwari Halka Kanji, Khedi, Khasra No. 62/2(S)  Total Area 53820 Sq ft Built Up Area Whether Inherited N Purchase Date 2013-01-02 Purchase Cost 0.00 Development Cost 0.00  3,18,000 3 Lacs+",Nil,Nil,Nil,Nil,Nil,"Rs 3,18,000 3 Lacs+"
3,iii,Commercial Buildings,Nil,"Kisan Wear House No. 1, Joint (1) Property Vill. Khoriya Patwari, Halka No. 38 (Borkhedi), R.NiM. 04, tahsil Hujur Dist. Bhopal, Khasra No. 254/1/1/1/1 (S) & 254/1/1/1/1/2 (s), Area- 23305 Sq ft, DOP- 2021/07/19 (2) Joint Property. Vill. Khokriya Tapwari , Hlka NO. 38 (Borkhedi), R.Ni.M. 04, Tahsil hujur, Dist. Bhopal, Khasra No. 254/1/2/1(S), Area- 4360 Sq ft, DOP- 2021/07/19. Total Purchase Amount- RS. 951000 Total Area Built Up Area 64936 Sq ft Whether Inherited N Purchase Date 0000-00-00 Purchase Cost 951000.00 Development Cost 14594994.00  1,60,00,000 1 Crore+ Kisan Wear House No. 2. JOint Property- Vill. Mundla Patwari Hlka NO. 43, Th, Hujur, Dist. Bhopal, KHasra No. 217/2/2(S)  Total Area 21780 sqft Built Up Area Whether Inherited N Purchase Date 2022-08-12 Purchase Cost 574867.00 Development Cost 15894480.00  1,70,00,000 1 Crore+",Nil,Nil,Nil,Nil,"Rs 3,30,00,000 3 Crore+"
4,iv,Residential Buildings,Nil,"House No. 65, Patrakar Colony Link Road No.3, Th. Hujur Dist. Bhopal, Khasra No. 144, Vill. Kotra Sultanabad  Total Area 1500 sq ft Built Up Area 241.63 Sq mtr Whether Inherited N Purchase Date 2005-09-15 Purchase Cost 1146088.00 Development Cost 898786.00  65,00,000 65 Lacs+",Nil,Nil,Nil,Nil,"Rs 65,00,000 65 Lacs+"
5,v,Others,Nil,Nil,Nil,Nil,Nil,Nil,Nil
6,Total Current Market Value of (i) to (v) (as per Affidavit),Total Current Market Value of (i) to (v) (as per Affidavit),"1,07,18,000 1 Crore+","4,74,38,000 4 Crore+",Nil,Nil,Nil,Nil,"Rs 5,81,56,000 5 Crore+"
7,Totals Calculated,Totals Calculated,"Rs 1,07,18,000 1 Crore+","Rs 4,74,38,000 4 Crore+",Nil,Nil,Nil,Nil,"Rs 5,81,56,000 5 Crore+"
