,0,1,2,3,4,5,6,7,8
0,Sr No,Description,self,spouse,huf,dependent1,dependent2,dependent3,
1,i,Agricultural Land,"Land at Mel, S.F. No. 285/6, 285/6B, 285/8, 286,285/7, 285/7B, 285/4, 285/5A, 285/5A & 285/5B  Total Area 6.625 Acres Built Up Area Whether Inherited N Purchase Date 2012-08-22 Purchase Cost 2160100.00 Development Cost 0.00  35,00,000 35 Lacs+ Land at Sholinghur, S.F.No. 715, 759, 760, 714, 729, 730, 731, 760, 713. Share- 1/4  Total Area 11.80 Acres Built Up Area Whether Inherited Y Purchase Date 0000-00-00 Purchase Cost 2384600.00 Development Cost 0.00  50,00,000 50 Lacs+ Land at Sholinghur, S.F. No. 435/2A, 435/6, 435/7, Situated at Narikulam Mettu street Sholinghur  Total Area 1.82 Acres Built Up Area Whether Inherited N Purchase Date 2021-02-02 Purchase Cost 37740000.00 Development Cost 0.00  4,00,00,000 4 Crore+","Land at Sholinghur, S.F> No. 793/2, 815/1  Total Area 10 Cent Built Up Area Whether Inherited N Purchase Date 1982-05-12 Purchase Cost 422802.00 Development Cost 0.00  4,22,802 4 Lacs+",Nil,Nil,Nil,Nil,"Rs 4,89,22,802 4 Crore+"
2,ii,Non Agricultural Land,"Vacant Site at No. 5 Singasandra Village, Bgur Hobli, Banglore, S.Y.No. 5/1  Total Area 3250 sq ft Built Up Area Whether Inherited N Purchase Date 2012-03-14 Purchase Cost 9745777.00 Development Cost 17120585.00  3,00,00,000 3 Crore+","Singsandra Village, Begur Hobli. S.Y.No. 5/1  Total Area 3250 sq ft Built Up Area Whether Inherited N Purchase Date 2011-04-12 Purchase Cost 2362500.00 Development Cost 0.00  23,62,500 23 Lacs+",Nil,Nil,Nil,Nil,"Rs 3,23,62,500 3 Crore+"
3,iii,Commercial Buildings,"Rosy Tpwer II Floor No.7, Nungambakkam High Road, Chennai  Total Area 2593.5 sq ft Built Up Area 2593.5 sq ft Whether Inherited N Purchase Date 1986-08-29 Purchase Cost 887022.00 Development Cost 10461100.00  2,00,00,000 2 Crore+ 5, Walaja Road, Sholingur (Genset & Air-conditioner) S.F. No. 675/1  Total Area 30492 sq ft Built Up Area 6200 sq ft Whether Inherited N Purchase Date 1985-02-12 Purchase Cost 15000.00 Development Cost 662500.00  50,00,000 50 Lacs+ No.5, Arakkonam road, Sholingur, S.F. No. 675/1  Total Area 30520 sq ft Built Up Area 900 sq ft Whether Inherited N Purchase Date 1985-05-22 Purchase Cost 11925.00 Development Cost 563925.00  50,00,000 50 Lacs+ No. 32,33, Ganapathy Mudali Street, Sholinghur  Total Area 2663.75 sq ft Built Up Area 2400 sq ft Whether Inherited Y Purchase Date 0000-00-00 Purchase Cost 0.00 Development Cost 0.00  7,00,000 7 Lacs+ No. 32/1, Subbarao Street, Sholingur  Total Area 3600 sq ft Built Up Area 3160 sq ft Whether Inherited Y Purchase Date 0000-00-00 Purchase Cost 150000.00 Development Cost 6158400.00  90,00,000 90 Lacs+ Plot No. 2, Singasandra Village, Banglore. S.Y. 5/1  Total Area 4800 sq ft Built Up Area 1100 sq ft Whether Inherited N Purchase Date 2007-03-14 Purchase Cost 2191164.00 Development Cost 0.00  50,00,000 50 Lacs+","Rosy Tpwer II Floor No.7, Nungambakkam High Road, Chenna  Total Area 2593.5 Sq ft Built Up Area 2593.50 sq ft Whether Inherited N Purchase Date 1986-08-29 Purchase Cost 886980.00 Development Cost 0.00  25,00,000 25 Lacs+ NO.3, Dr. Nayar Road Chennai  Total Area 1000 sq ft Built Up Area 600 sq ft Whether Inherited N Purchase Date 1990-05-09 Purchase Cost 268017.00 Development Cost 0.00  20,00,000 20 Lacs+ Flat S-11, FF SW Heritages Sankara, New No.64 & 66, OLd No. 62 & 63, Mayer Ramanathan Street, Chetpat, Chennai  Total Area 1450 sq ft Built Up Area 1350 sq ft Whether Inherited N Purchase Date 2005-03-11 Purchase Cost 5381441.00 Development Cost 0.00  1,00,00,000 1 Crore+ Flat No.G3, North Ushman Road, Chennai  Total Area 957 sq ft Built Up Area 900 sq ft Whether Inherited N Purchase Date 1996-12-13 Purchase Cost 1120000.00 Development Cost 0.00  75,00,000 75 Lacs+",Nil,Nil,Nil,Nil,"Rs 6,67,00,000 6 Crore+"
4,iv,Residential Buildings,"No. 90, Boardinpet Street, Sholimgur  Total Area 2835 sq ft Built Up Area 4202 sq ft Whether Inherited Y Purchase Date 0000-00-00 Purchase Cost 19000.00 Development Cost 0.00  26,19,000 26 Lacs+ House at New No. 74, Pose Garden Chennai- 863  Total Area 5294 sq ft Built Up Area 6100 sq ft Whether Inherited Y Purchase Date 0000-00-00 Purchase Cost 195000.00 Development Cost 0.00  2,00,00,000 2 Crore+ Plot No. 3, Singasandra Village, Bangalore  Total Area 2320 sq ft Built Up Area 600 sq ft Whether Inherited N Purchase Date 2017-03-17 Purchase Cost 2675095.00 Development Cost 0.00  50,00,000 50 Lacs+","No. 229/230, Arakere Onkara Nagar, Bangalore  Total Area 3074 sq ft Built Up Area 1160 sq ft Whether Inherited N Purchase Date 2008-02-06 Purchase Cost 10943198.00 Development Cost 2349397.00  1,70,00,000 1 Crore+",Nil,Nil,Nil,Nil,"Rs 4,46,19,000 4 Crore+"
5,v,Others,Nil,Nil,Nil,Nil,Nil,Nil,Nil
6,Total Current Market Value of (i) to (v) (as per Affidavit),Total Current Market Value of (i) to (v) (as per Affidavit),"15,08,19,000 15 Crore+","4,17,85,302 4 Crore+",Nil,Nil,Nil,Nil,"Rs 19,26,04,302 19 Crore+"
7,Totals Calculated,Totals Calculated,"Rs 15,08,19,000 15 Crore+","Rs 4,17,85,302 4 Crore+",Nil,Nil,Nil,Nil,"Rs 19,26,04,302 19 Crore+"
