,0,1,2,3,4,5,6,7,8
0,Sr No,Description,self,spouse,huf,dependent1,dependent2,dependent3,
1,i,Agricultural Land,"(1)Mauja-Rampur, Anchal-Katihar, Thana No.75, Tauji No.1175, Khata No.57, Khasra No.492, 499, Purchase Date-3/10/1997, Puchase Cost-38000/- (2)Khasra No.492, Purchase Date-13/07/2013, Purchase Cost-125000/-  Total Area 0.86.5 Acre Built Up Area Whether Inherited N Purchase Date 0000-00-00 Purchase Cost 163000.00 Development Cost 500000.00  55,00,000 55 Lacs+",Nil,Nil,Nil,Nil,Nil,"Rs 55,00,000 55 Lacs+"
2,ii,Non Agricultural Land,"Mauja-Kheriya, Thana No.144, Tauji No.1/1309, Khata No.123, Khasra No.1961  Total Area 5400 Sq.Ft. Built Up Area Whether Inherited Y Purchase Date 2006-08-24 Purchase Cost 150000.00 Development Cost 300000.00  25,00,000 25 Lacs+",Nil,Nil,Nil,Nil,Nil,"Rs 25,00,000 25 Lacs+"
3,iii,Commercial Buildings,Nil,Nil,Nil,Nil,Nil,Nil,Nil
4,iv,Residential Buildings,"Mauja-Dalan, Thana NO.77, Khata NO.1140, Purchase Date-9/4/2001, 16/7/2001, 23/2/2002, Purchase Cost-38000/-,30000/-,30000/-  Total Area 4500 Sq.Ft. Built Up Area 3900 Sq.Ft. Whether Inherited N Purchase Date 0000-00-00 Purchase Cost 0.00 Development Cost 2500000.00  75,00,000 75 Lacs+",Nil,Nil,Nil,Nil,Nil,"Rs 75,00,000 75 Lacs+"
5,v,Others,"Land Value by National Highway Authority  Total Area Built Up Area Whether Inherited N Purchase Date 0000-00-00 Purchase Cost 0.00 Development Cost 0.00  1,00,000 1 Lacs+",Nil,Nil,Nil,Nil,Nil,"Rs 1,00,000 1 Lacs+"
6,Total Current Market Value of (i) to (v) (as per Affidavit),Total Current Market Value of (i) to (v) (as per Affidavit),"1,56,00,000 1 Crore+",Nil,Nil,Nil,Nil,Nil,"Rs 1,56,00,000 1 Crore+"
7,Totals Calculated,Totals Calculated,"Rs 1,56,00,000 1 Crore+",Nil,Nil,Nil,Nil,Nil,"Rs 1,56,00,000 1 Crore+"
