,0,1,2,3,4,5,6,7,8
0,Sr No,Description,self,spouse,huf,dependent1,dependent2,dependent3,
1,i,Agricultural Land,"dharmapuri distric,dharmapuri thaluk,ungaraanahalli grama ,sarve no-300/1  Total Area N, NO - 1.70 cent Built Up Area Whether Inherited N Purchase Date 2015-09-02 Purchase Cost 1300000.00 Development Cost 0.00  17,00,000 17 Lacs+",Nil,Nil,Nil,Nil,Nil,"Rs 17,00,000 17 Lacs+"
2,ii,Non Agricultural Land,"ITAM-1 - Dharmapuri distric,dharmapuri thaluk,virupatchipuram village,serve no-343/50 SQ,FT-2835, ITAM--2 - virupatchipuram village,serve no-326/2. 4700 SQ,FT. ITAM--3 - virupatchipuram village,serve no-326/2. 1175 SQ,FT. ITAM--4 - virupatchipuram village natham ,serve no-636/10. 786 sq,ft. ITAM -5 sq,ft 1440 (perchasing) Date of Purchase : 2015-4-20 Cost of Purchase : 50000, virupatchipuram village,serve no-326/2 Total Area Built Up Area Whether Inherited N Purchase Date 0000-00-00 Purchase Cost 0.00 Development Cost 0.00  1,15,00,000 1 Crore+","Itam 1 - Dharmapuri distric,dharmapuri thaluk,paapinayakanahalli,village sarve no-430/1(RD Nagar plot np.65) sq,ft 1200. Date of Purchase 16 -4-2010 Cost of Purchase-18000 ITAM 2 paapanayakkanahalli village,sarve no.430/1 (RD Nagar plot np.66) sq,ft 1105. Date of Purchase -16-4-2010 Cost of Purchase-16500 Total Area Built Up Area Whether Inherited N Purchase Date 0000-00-00 Purchase Cost 0.00 Development Cost 0.00  80,000 80 Thou+",Nil,Nil,Nil,Nil,"Rs 1,15,80,000 1 Crore+"
3,iii,Commercial Buildings,"Virupatchipuram village,sarve no-326/2  Total Area 1175 sq,ft Built Up Area Whether Inherited N Purchase Date 0000-00-00 Purchase Cost 0.00 Development Cost 2818000.00  31,00,000 31 Lacs+",Nil,Nil,Nil,Nil,Nil,"Rs 31,00,000 31 Lacs+"
4,iv,Residential Buildings,"dharmapuri distric,dharmapuri thaluk,verupatchipuram village,sarve no343/50  Total Area 2835 sq ft. Built Up Area 2000 sq,ft. Whether Inherited N Purchase Date 0000-00-00 Purchase Cost 0.00 Development Cost 0.00  26,00,000 26 Lacs+",Nil,Nil,Nil,Nil,Nil,"Rs 26,00,000 26 Lacs+"
5,v,Others,Nil,Nil,Nil,Nil,Nil,Nil,Nil
6,Total Current Market Value of (i) to (v) (as per Affidavit),Total Current Market Value of (i) to (v) (as per Affidavit),"1,89,00,000 1 Crore+","80,000 80 Thou+",Nil,Nil,Nil,Nil,"Rs 1,89,80,000 1 Crore+"
7,Totals Calculated,Totals Calculated,"Rs 1,89,00,000 1 Crore+","Rs 80,000 80 Thou+",Nil,Nil,Nil,Nil,"Rs 1,89,80,000 1 Crore+"
