,0,1,2,3,4,5,6,7,8
0,Sr No,Description,self,spouse,huf,dependent1,dependent2,dependent3,
1,i,Agricultural Land,"Vill-Bais Teh Vidisha Patwari Halka No-57 Sy No-34 & 172  Total Area 2.78 acre Built Up Area Whether Inherited N Purchase Date 0000-00-00 Purchase Cost 1500000.00 Development Cost 0.00  48,64,064 48 Lacs+ Vill Dholkhedi, Teh Vidisha Patwari Halka No-39 sy no-159  Total Area 1.47 acre Built Up Area Whether Inherited N Purchase Date 2013-03-20 Purchase Cost 452250.00 Development Cost 0.00  9,32,860 9 Lacs+ Ward no-11 Vidisha Sy no-383/2 & 384/2  Total Area 1.13 acre Built Up Area Whether Inherited N Purchase Date 2001-06-14 Purchase Cost 487480.00 Development Cost 0.00  92,98,472 92 Lacs+ Ward no-11 Vidisha Sy no-380/2  Total Area 0.098 acre Built Up Area Whether Inherited N Purchase Date 2017-03-31 Purchase Cost 2360480.00 Development Cost 0.00  56,00,000 56 Lacs+ Vill Samera Teh Vidisha Patwari Halka No-12 Sy no-220/1/1/1  Total Area 2.95 acre Built Up Area Whether Inherited N Purchase Date 2020-12-09 Purchase Cost 250377.00 Development Cost 0.00  27,76,224 27 Lacs+ Ward no-11 Nana Sahab Peshawa Ward Vidisha Sy no-380/2  Total Area 0.029 acre Built Up Area Whether Inherited N Purchase Date 2020-03-09 Purchase Cost 2160000.00 Development Cost 0.00  21,60,000 21 Lacs+","Vill Dholkhe D Teh Vidisha Patwari Halka No-39 Sy no-239/2/3  Total Area 3.358 acre Built Up Area Whether Inherited N Purchase Date 2015-09-08 Purchase Cost 2349683.00 Development Cost 0.00  21,27,107 21 Lacs+ Vill Dholkhe D Teh Vidisha Patwari Halka No-39 sy no-243/2/1/1 Farm house Total Area 8.26 acre Built Up Area Whether Inherited N Purchase Date 2012-08-27 Purchase Cost 2927885.00 Development Cost 500000.00  71,41,387 71 Lacs+ Vill Dholkhe D Teh Vidisha Patwari Halka No-39 sy no-244/1/2  Total Area 5.43 acre Built Up Area Whether Inherited N Purchase Date 2017-06-30 Purchase Cost 3761194.00 Development Cost 0.00  34,43,441 34 Lacs+ Vill Semra Teh Vidisha Patwari halka No-12 Sy no-220/1/1/2  Total Area 2.95 acre Built Up Area Whether Inherited N Purchase Date 2020-12-09 Purchase Cost 2503744.00 Development Cost 0.00  27,76,224 27 Lacs+",Nil,"Vill Samera Teh Vidisha Patwar halka no-12 Sy no-220/1/1/3, 220/1/2/3  Total Area 2.95 acre Built Up Area Whether Inherited N Purchase Date 2020-12-09 Purchase Cost 2503744.00 Development Cost 0.00  27,76,224 27 Lacs+",Nil,Nil,"Rs 4,38,96,003 4 Crore+"
2,ii,Non Agricultural Land,"Ward no-10 Raipur Vidisha  Total Area 6000 sq.ft Built Up Area Whether Inherited N Purchase Date 2023-04-17 Purchase Cost 138005.00 Development Cost 0.00  17,28,622 17 Lacs+ Ward no-11 nana Saheb Peshawa Ward Vidisha  Total Area 1355 sq.ft Built Up Area Whether Inherited N Purchase Date 2022-03-30 Purchase Cost 2265860.00 Development Cost 500000.00  30,00,000 30 Lacs+","Vill Dholkhe D Teh Vidisha Patwari Halka No-39 sy no-243/4  Total Area 1.05 acre Built Up Area Whether Inherited N Purchase Date 2012-08-27 Purchase Cost 367525.00 Development Cost 0.00  12,11,760 12 Lacs+",Nil,Nil,Nil,Nil,"Rs 59,40,382 59 Lacs+"
3,iii,Commercial Buildings,"Shop Mukherji Nagar Sy no-376/1  Total Area 735 sq.ft Built Up Area 735 sq.ft Whether Inherited N Purchase Date 2013-03-30 Purchase Cost 1500000.00 Development Cost 0.00  25,05,876 25 Lacs+ Shop Mukherji Nagar Sy no-376/2  Total Area 2600 sq/ft Built Up Area 1100 sq.ft Whether Inherited N Purchase Date 2004-12-13 Purchase Cost 1200000.00 Development Cost 0.00  71,00,000 71 Lacs+",Nil,Nil,Nil,Nil,Nil,"Rs 96,05,876 96 Lacs+"
4,iv,Residential Buildings,"Ward no- sy no-376,2162,383,384  Total Area 26913 sq.ft Built Up Area 1600 sq.ft Whether Inherited N Purchase Date 2001-06-14 Purchase Cost 152000.00 Development Cost 400000.00  1,11,69,360 1 Crore+",Nil,Nil,Nil,Nil,Nil,"Rs 1,11,69,360 1 Crore+"
5,v,Others,Nil,Nil,Nil,Nil,Nil,Nil,Nil
6,Total Current Market Value of (i) to (v) (as per Affidavit),Total Current Market Value of (i) to (v) (as per Affidavit),"5,11,35,478 5 Crore+","1,66,99,919 1 Crore+",Nil,"27,76,224 27 Lacs+",Nil,Nil,"Rs 7,06,11,621 7 Crore+"
7,Totals Calculated,Totals Calculated,"Rs 5,11,35,478 5 Crore+","Rs 1,66,99,919 1 Crore+",Nil,"Rs 27,76,224 27 Lacs+",Nil,Nil,"Rs 7,06,11,621 7 Crore+"
