,0,1,2,3,4,5,6,7,8
0,Sr No,Description,self,spouse,huf,dependent1,dependent2,dependent3,
1,i,Agricultural Land,"Village-Belsor Mouza-Dharampur Dist-Nalbari,Dag No-2953 Patta No-449  Total Area 1 Katha 4 Lecha Built Up Area Whether Inherited N Purchase Date 0000-00-00 Purchase Cost 600.00 Development Cost 25000.00  85,000 85 Thou+ Village-Dahudi , Mouza-Khetri,Dharampur Dag No-1182 1183 1184 Patta No-300 301 302  Total Area 1 Bigha 3 Katha 16 Lechs Built Up Area Whether Inherited N Purchase Date 0000-00-00 Purchase Cost 3000.00 Development Cost 38000.00  5,50,000 5 Lacs+ Village-Belsor Mouza-Dharampur Dist-Nalbari,Dag No-2974 Patta No-350  Total Area 10 Lecha Built Up Area Whether Inherited N Purchase Date 0000-00-00 Purchase Cost 6000.00 Development Cost 5000.00  75,000 75 Thou+ Vill-Bamibari,Mouza-Uttar Barkhetri, Dist-Nalbari Dag No-124 Patta No-605  Total Area 2 Katha 5 Lecha Built Up Area Whether Inherited N Purchase Date 2006-09-05 Purchase Cost 25000.00 Development Cost 38000.00  4,25,000 4 Lacs+ Vill-Bardhantoli Mouza-Batahghilla Dist-Nalbari, Dag No-75 85 88 Patta No-29  Total Area 2 Bigha Built Up Area Whether Inherited N Purchase Date 0000-00-00 Purchase Cost 237420.00 Development Cost 0.00  6,00,000 6 Lacs+ Vill-Barnibari Mouza-Uttar Barkhetri Dist-Nalbari Dag No-124 Patta No-605  Total Area 1 Katha 2 Lecha Built Up Area Whether Inherited N Purchase Date 2008-07-01 Purchase Cost 6000.00 Development Cost 95000.00  2,50,000 2 Lacs+ Vill-Paikam Dirua, Mouza Uttar Barkhetri Dist,Nalbari,Dag No-367 Patta No-163  Total Area 1 Bigha 16 Lecha Built Up Area Whether Inherited N Purchase Date 2008-10-11 Purchase Cost 24000.00 Development Cost 0.00  80,000 80 Thou+ Vill-Paikam Dirua, Mouza-Uttar Barkhetri,Dist Nalbari Dag No-367 Patta No-163  Total Area 3 Katha 2 Lecha Built Up Area Whether Inherited N Purchase Date 0000-00-00 Purchase Cost 13000.00 Development Cost 0.00  42,000 42 Thou+ Vill-Paikam Dirua Mouza-Uttar Barkhetri,Dist Nalbari, Dag No-197 544 Patta No-170 542  Total Area 3 Bigha 3 Katha 14 Lecha Built Up Area Whether Inherited N Purchase Date 0000-00-00 Purchase Cost 82500.00 Development Cost 0.00  4,10,000 4 Lacs+ Vill-Bardhntoli,Mouza-Batahghilla Dist-Nalbari Dag No-75 85 87 Patta No-23  Total Area 1 Bigha Built Up Area Whether Inherited N Purchase Date 0000-00-00 Purchase Cost 300000.00 Development Cost 0.00  8,00,000 8 Lacs+",Nil,Nil,Nil,Nil,Nil,"Rs 33,17,000 33 Lacs+"
2,ii,Non Agricultural Land,"Village-Maidamgaon, Mouza-Beltola,Dist Kamrup M, Dag No-1457 Patta No-1136  Total Area 1 Katha 5 Lecha Built Up Area Whether Inherited N Purchase Date 2017-10-11 Purchase Cost 2040000.00 Development Cost 0.00  25,00,000 25 Lacs+","Village-Maidamgaon, Mouza-Beltola,Dist Kamrup M, Dag No-4866 Patta No-1406  Total Area 1 Katha 5 Lecha Built Up Area Whether Inherited N Purchase Date 0000-00-00 Purchase Cost 297257.00 Development Cost 0.00  25,00,000 25 Lacs+",Nil,Nil,Nil,Nil,"Rs 50,00,000 50 Lacs+"
3,iii,Commercial Buildings,"Vill-Belsor Mouza-Dharampur Dist Nalbari Dag No-2819 2973 Patta No-220  Total Area 1200 Sq Ft Built Up Area 1350 Sq Ft Whether Inherited N Purchase Date 1985-03-01 Purchase Cost 3000.00 Development Cost 90000.00  7,25,000 7 Lacs+","Lotus Apartment Hatigaon,Mouza Beltola Dist Kamrup M,Dag No-120 Patta No-17  Total Area 1265 Sq Ft Built Up Area Whether Inherited N Purchase Date 0000-00-00 Purchase Cost 2000000.00 Development Cost 0.00  29,00,000 29 Lacs+",Nil,Nil,Nil,Nil,"Rs 36,25,000 36 Lacs+"
4,iv,Residential Buildings,"Vill-Maidamgaon, Mouza-Beltola Dist Kamrup M, Dag No-1261 1262 Patta No-28/818 New  Total Area 5904 Sq Ft Built Up Area Whether Inherited N Purchase Date 2004-04-05 Purchase Cost 426800.00 Development Cost 6000000.00  1,20,00,000 1 Crore+ Vill-Belsor Mouza-Dharampur Dist-Nalbari, Dag No-2819 2973 Patta No-220  Total Area 1 Bigha 16 Lecha Built Up Area 750 Sq Ft Whether Inherited N Purchase Date 1985-01-03 Purchase Cost 3000.00 Development Cost 225000.00  8,50,000 8 Lacs+ Vill-Kaplabari, Mouza Uttar Barkhetri Dist-Nalbari. Dag No-864 Patta No-170  Total Area 1 Katha 15 Lecha Built Up Area 890 Sq Ft Whether Inherited N Purchase Date 2009-09-18 Purchase Cost 25000.00 Development Cost 255000.00  3,50,000 3 Lacs+ Vill-Belsor Mouza-Dharampur Dist-Nalbari, Dag No-2819 Patta No-220  Total Area 16704 Sq Ft Built Up Area 750 Sq Ft Whether Inherited N Purchase Date 2010-03-26 Purchase Cost 116000.00 Development Cost 75000.00  8,60,000 8 Lacs+","Vill-Guwahati Part No-II, Mouza Ulubari Dist-Kamrup M, Dag No-1794 Patta No-903  Total Area 1 Katha 2 Lecha Built Up Area 5066.67 Sq Ft Whether Inherited N Purchase Date 1984-08-05 Purchase Cost 20000.00 Development Cost 2300000.00  70,00,000 70 Lacs+",Nil,"Vill-Maidomgaon, Mouza-Beltola,Dist-Kamrup, Dag No-87 Patta No-153  Total Area 1 Kath 5 Lecha Built Up Area 700 Sq Ft Whether Inherited N Purchase Date 2004-04-05 Purchase Cost 343505.00 Development Cost 200000.00  27,00,000 27 Lacs+",Nil,Nil,"Rs 2,37,60,000 2 Crore+"
5,v,Others,Nil,Nil,Nil,Nil,Nil,Nil,Nil
6,Total Current Market Value of (i) to (v) (as per Affidavit),Total Current Market Value of (i) to (v) (as per Affidavit),"2,06,77,000 2 Crore+","1,24,00,000 1 Crore+",Nil,"27,00,000 27 Lacs+",Nil,Nil,"Rs 3,57,77,000 3 Crore+"
7,Totals Calculated,Totals Calculated,"Rs 2,06,02,000 2 Crore+","Rs 1,24,00,000 1 Crore+",Nil,"Rs 27,00,000 27 Lacs+",Nil,Nil,"Rs 3,57,02,000 3 Crore+"
