,0,1,2,3,4,5,6,7,8
0,Sr No,Description,self,spouse,huf,dependent1,dependent2,dependent3,
1,i,Agricultural Land,Nil,Nil,Nil,Nil,Nil,Nil,Nil
2,ii,Non Agricultural Land,"(1) Kisam Town Nartam Mouza Town Nagaon Assam PP No 136, Dag No 30, Area- 1 Katha 16 Lessas, Date of Purchase 05.06.1995, Cost of Purchase-90000/-, (2) Kisam Town Nartam Mouza Town Nagaon Assam PP No 136, Dag No 30, Area- 10 Lessas, Date of Purchase 01.09.2009, Cost of Purchase-65000/-(3) Kisam Ghahi Mouza-Jagial Nagaon PP No 325, Dag NO 75/76, Area-2 Bighas Date of Purchase- 2207.2011, (4) Kisam Ghahi Mouza-Jagial Nagaon PP No 325, Dag NO 75/81, Area- 2 kATHAS 15 Lessam, Date of Purchase- 16.02.2010, Cost of Purchase-35000/-, (5) Kisam Ghahi Mouza-Jagial Nagaon PP No 9, Dag No82,Area-1 Bigha 1 Katha, Date of Purchase-11.06.2008, Cost of Purchase-40000/-, (6) Kisam Ghahi Mouza-Jagial Nagaon PP No 8, Dag NO 88, Area-3 Kathas, Date of Purchase-28.01.2011, Cost of Purchase-30000/- (7) Kisam Ghahi Mouza-Jagial Nagaon PP No 197, Dag NO 194, 141, Area-2 Katha 10 Leaasa, Date of Purchase-07.02.2007, Cost of Purchase-20000/-, (8) Kisam Ghahi Mouza-Jagial Nagaon PP No 15, Dag NO 79, Area-1 Bigha 3 Katha , Date of Purchase-11.04.2013, (9) Kisam Ghahi Mouza-Jagial Nagaon PP No 102, Dag NO 92, 90, 93, 94, 96, Area- 1 Bigha 4 Katha, 9 Lech, Date of Purchase-13.01.2014, Cost of Purchase-152000/- (10) Kisan Senchowa Mouza-Kachamari PP NO 243, Dag No 5, Area- 1 Bigha, 1 Katha 16 Leassas, Date of Purchase- 15.10.2007, Cost of Purchase-285000/-, (11) Kisan Senchowa Mouza-Kachamari PP NO 102, Dag No 92, 93, 94, 96, Area- 1 Bigha, 1 Katha 5 Leassas, Date of Purchase- 17.11.2006, Cost of Purchase-340475/-, (12) Kisan Senchowa Mouza-Kachamari PP NO 8, Dag No 2, Area- 1 Katha 15 Lessas, Date of Purchase-02.03.2007, Cost of Purchase-105000/-, (13) Kisan Senchowa Mouza-Kachamari PP NO 8, Dag No 2, Ara-1 Katha 15 Lessas, Date of Purchase-02.03.2007, Cost of Purchase-105000 Total Area 195961 Sq.ft Built Up Area Whether Inherited N Purchase Date 0000-00-00 Purchase Cost 0.00 Development Cost 501093.00  1,30,00,000 1 Crore+","(1) Kisam Town Nagaon Mouza Town Nagaon Assam PP No 1893 Dage No 4153, Area 1/2 2424 Sq.ft. Share in Land Measuring 1 Katha-13.66 Lessas, Date of purchase-28.10.2020, Cost of Purchase-815000/-, (2) Kissam-Goggaon Mouza Town Revenue Circle Nagaon Assam PP No 71, Dag No 115 Area-3600 Sq.ft. Date of purchase- 23.04.2008, Cost of purchase- 82500/-  Total Area Built Up Area Whether Inherited N Purchase Date 0000-00-00 Purchase Cost 0.00 Development Cost 0.00  38,50,000 38 Lacs+",Nil,Nil,Nil,Nil,"Rs 1,68,50,000 1 Crore+"
3,iii,Commercial Buildings,"(1)Kisam Town Nartan Mouza Town Nagaon Assam PP No 748 Dag NO 1268 (2) Kisam Town Nartam Mouza Town Nagaon Assam PP No926,Dag NO 483 Area-(1) 2 Katha 14 Lechase-7776 Sq.ft., (2) 2 Katha 12 Lessas-7488 Sq.ft., Date of Purchase-(1) 17.06.2009, (2) 2003, Cost of Purchase- (1) 600000/-, (2) 369800/- Any Investment- (1) 10124332/-  Total Area 32000 Built Up Area Whether Inherited N Purchase Date 0000-00-00 Purchase Cost 0.00 Development Cost 0.00  2,40,00,000 2 Crore+","Land & Shops At A T Road Marwaripatty, Kisam Town Nagaon Mouza Town PP No 377, Dag No 491  Total Area 1080 Sq.ft. Built Up Area 1850 Sq.ft. Whether Inherited N Purchase Date 2018-05-29 Purchase Cost 730000.00 Development Cost 0.00  10,00,000 10 Lacs+",Nil,Nil,Nil,Nil,"Rs 2,50,00,000 2 Crore+"
4,iv,Residential Buildings,"Amolapatty Nagaon Kisam Town Nartam Mouza Town PP No 68, Dag No 880  Total Area 1 Katha 1.34 Lecha= 3073 Sq.ft. Built Up Area 7748 Sq.dft. Whether Inherited N Purchase Date 0000-00-00 Purchase Cost 0.00 Development Cost 532500.00  95,00,000 95 Lacs+","Flat No A2 32nd Synergy Paradise, Bhetapara, Guwahati Total Area 1150 Sq.ft. Built Up Area 1150 Sq.ft. Whether Inherited N Purchase Date 2009-02-04 Purchase Cost 2027429.00 Development Cost 150000.00  35,00,000 35 Lacs+",Nil,Nil,Nil,Nil,"Rs 1,30,00,000 1 Crore+"
5,v,Others,Nil,"Investment In Leasehold Property At Panigaon Nagaon Total Area Built Up Area Whether Inherited N Purchase Date 0000-00-00 Purchase Cost 0.00 Development Cost 0.00  92,18,280 92 Lacs+",Nil,Nil,Nil,Nil,"Rs 92,18,280 92 Lacs+"
6,Total Current Market Value of (i) to (v) (as per Affidavit),Total Current Market Value of (i) to (v) (as per Affidavit),"4,65,00,000 4 Crore+","1,75,68,280 1 Crore+",Nil,Nil,Nil,Nil,"Rs 6,40,68,280 6 Crore+"
7,Totals Calculated,Totals Calculated,"Rs 4,65,00,000 4 Crore+","Rs 1,75,68,280 1 Crore+",Nil,Nil,Nil,Nil,"Rs 6,40,68,280 6 Crore+"
