,0,1,2,3,4,5,6,7,8
0,Sr No,Description,self,spouse,huf,dependent1,dependent2,dependent3,
1,i,Agricultural Land,"Tambaram villahe tambaram TK s.no.191/2  Total Area 0.42 ac Built Up Area Whether Inherited N Purchase Date 1982-07-16 Purchase Cost 5040.00 Development Cost 0.00  72,00,000 72 Lacs+ Naduveerapattu sriperumbudur tk s.no.175,176/3 & 163/2  Total Area 2.47 ac Built Up Area Whether Inherited N Purchase Date 2001-09-07 Purchase Cost 123500.00 Development Cost 0.00  9,00,000 9 Lacs+","Kannluvakkam village chegalpattu tk s.no.156/2  Total Area 6 ac Built Up Area Whether Inherited N Purchase Date 2003-09-03 Purchase Cost 420000.00 Development Cost 0.00  58,50,000 58 Lacs+ Kannluvakkam village chegalpattu tk s.no.156/3  Total Area 9.30ac Built Up Area Whether Inherited N Purchase Date 2004-07-05 Purchase Cost 713100.00 Development Cost 0.00  91,80,000 91 Lacs+ Naduveerapattu sriperumbudur tk s.no.164/1,164/2,170 & 169/1C  Total Area 2.90 ac Built Up Area Whether Inherited N Purchase Date 2001-12-07 Purchase Cost 145000.00 Development Cost 0.00  9,90,000 9 Lacs+",Nil,Nil,Nil,Nil,"Rs 2,41,20,000 2 Crore+"
2,ii,Non Agricultural Land,"Vacant land at no.69 harlth enclave west thmbaram chennai-45 s.no.384/1A2 & 384/1A3  Total Area 3160 sq ft Built Up Area Whether Inherited N Purchase Date 2008-12-20 Purchase Cost 2482000.00 Development Cost 0.00  45,22,500 45 Lacs+ Vacant land at no.69 harlth enclave west thmbaram chennai-45 s.no.384/1A4 & 384/1A5  Total Area 3618 sq ft Built Up Area Whether Inherited N Purchase Date 2008-12-20 Purchase Cost 3090000.00 Development Cost 0.00  54,12,000 54 Lacs+ Vacant land at mudichur rd,tambaram 231/1B  Total Area 2400 sq ft Built Up Area Whether Inherited N Purchase Date 2982-07-16 Purchase Cost 6000.00 Development Cost 0.00  1,20,00,000 1 Crore+ Vacant land at mudichur rd,tambaram s.no.231/1B  Total Area 3600 sq ft Built Up Area Whether Inherited N Purchase Date 1994-03-24 Purchase Cost 150000.00 Development Cost 0.00  1,92,00,000 1 Crore+ Vacant land at mudichur rd,tambaram s.no.341/C  Total Area 3417 sq ft Built Up Area Whether Inherited N Purchase Date 1981-09-19 Purchase Cost 75000.00 Development Cost 0.00  1,69,12,500 1 Crore+ Vacanvakkam land site at manivakkam S. no.223/1  Total Area 4557 sq ft Built Up Area Whether Inherited N Purchase Date 2008-03-31 Purchase Cost 1140000.00 Development Cost 0.00  21,75,000 21 Lacs+","Vacant land at no84,harltha encave west tambaram chennai-45 s.no.384/2A1 2B1,2B2  Total Area 2085 sq ft Built Up Area Whether Inherited N Purchase Date 2008-12-20 Purchase Cost 1783000.00 Development Cost 0.00  33,00,000 33 Lacs+ Vacant slte at reddy street,tambaram chennai-45 s.no.230/2  Total Area 2130 sq ft Built Up Area Whether Inherited N Purchase Date 1987-07-15 Purchase Cost 48192.00 Development Cost 0.00  18,97,500 18 Lacs+ Vacant land site at brahmin st tambaram s.no.230/2  Total Area 1738 sq ft Built Up Area Whether Inherited N Purchase Date 1987-07-15 Purchase Cost 44551.00 Development Cost 0.00  15,08,250 15 Lacs+ Vacant land site.melandai 2nd cross street,tambaram village,tk kanchee dist plot no.124/3D,124/3E & 124/3F  Total Area 1738 sq ft Built Up Area Whether Inherited N Purchase Date 2020-08-24 Purchase Cost 3493380.00 Development Cost 0.00  52,40,070 52 Lacs+",Nil,Nil,Nil,Nil,"Rs 7,21,67,820 7 Crore+"
3,iii,Commercial Buildings,"D/no..13/2 block no 139 cresecent park sr,t.nagar chennai-17 old ts no.6348/1 new TS no.638/4(appartment)  Total Area 1445 sq ft Built Up Area 2100 sq ft Whether Inherited N Purchase Date 2006-03-27 Purchase Cost 1458400.00 Development Cost 0.00  98,49,000 98 Lacs+ No.21 mudichur road west tambaram chennai-45 s.no.341/1A & 1C  Total Area 1500 sq ft Built Up Area 1050 sq ft Whether Inherited N Purchase Date 2002-06-28 Purchase Cost 540000.00 Development Cost 0.00  75,00,000 75 Lacs+ No.8 arumuga chennai-87 s.no.t alwar thirunagar valsaravakkam s.no.10/2  Total Area 3600 sq ft Built Up Area 2200 sq ft Whether Inherited N Purchase Date 1983-01-29 Purchase Cost 24000.00 Development Cost 1000000.00  74,77,500 74 Lacs+ Property at velchery road selaiyur s.no.10/2  Total Area 519 qsq ft Built Up Area 400 sq ft Whether Inherited N Purchase Date 1998-03-27 Purchase Cost 250000.00 Development Cost 0.00  10,29,705 10 Lacs+ Property at no.34 ramakrishna st west tambatamchennai-45 s no.319  Total Area 3400 sq ft Built Up Area Whether Inherited N Purchase Date 1985-03-24 Purchase Cost 600000.00 Development Cost 850000.00  1,89,00,000 1 Crore+","Porpert at velacher road selyur east tambaram chennai-59 s no.11/7,,12/3 A3  Total Area 2400 sq ft Built Up Area 700 sq ft Whether Inherited N Purchase Date 2003-12-12 Purchase Cost 2369147.00 Development Cost 0.00  72,00,000 72 Lacs+ House at pilliyar kovil st west tambarm chennai-45 s.no.230/2  Total Area 2400 sq ft Built Up Area 2600 sq ft Whether Inherited N Purchase Date 1987-02-26 Purchase Cost 24840.00 Development Cost 1800000.00  45,60,000 45 Lacs+ Property no.50 venkatesa choudhry st west chennai-45 s no.328/1A 3A2  Total Area 1319 sq ft Built Up Area Whether Inherited N Purchase Date 1993-12-03 Purchase Cost 120000.00 Development Cost 0.00  63,85,500 63 Lacs+ Property at no.50 venkatesa choudhry chennai-45 s.no.318/1A,3A  Total Area 1690sq ft Built Up Area Whether Inherited N Purchase Date 1992-10-16 Purchase Cost 127933.00 Development Cost 0.00  79,05,000 79 Lacs+ Property no.50 venkatesa choundhry st west tambaram chennai-45 s.no.318/1A 3A2  Total Area 1933 sq ft Built Up Area Whether Inherited N Purchase Date 1993-12-03 Purchase Cost 190000.00 Development Cost 0.00  94,48,500 94 Lacs+",Nil,Nil,Nil,Nil,"Rs 8,02,55,205 8 Crore+"
4,iv,Residential Buildings,"House at no14,reddy st west tambaram chennai-45 s.no.230/2  Total Area 4518 sq ft Built Up Area 3000 sq ft Whether Inherited N Purchase Date 1987-11-29 Purchase Cost 197967.00 Development Cost 1000000.00  93,00,000 93 Lacs+ House at no r.s no.390/11 block no.0085 archbishop mathias avenue,boat cli=ub road ra puram chennai-600028  Total Area 1260sq ft Built Up Area 1260 sq ft Whether Inherited N Purchase Date 2020-10-28 Purchase Cost 5500000.00 Development Cost 0.00  2,55,00,000 2 Crore+",Nil,Nil,Nil,Nil,Nil,"Rs 3,48,00,000 3 Crore+"
5,v,Others,Nil,Nil,Nil,Nil,Nil,Nil,Nil
6,Total Current Market Value of (i) to (v) (as per Affidavit),Total Current Market Value of (i) to (v) (as per Affidavit),"14,78,78,205 14 Crore+","6,34,64,820 6 Crore+",Nil,Nil,Nil,Nil,"Rs 21,13,43,025 21 Crore+"
7,Totals Calculated,Totals Calculated,"Rs 14,78,78,205 14 Crore+","Rs 6,34,64,820 6 Crore+",Nil,Nil,Nil,Nil,"Rs 21,13,43,025 21 Crore+"
