,0,1,2,3,4,5,6,7,8
0,Sr No,Description,self,spouse,huf,dependent1,dependent2,dependent3,
1,i,Agricultural Land,"Village Karo Teh-Madiyahu S No-642 663 89  Total Area 1.37 Acre Built Up Area Whether Inherited Y Purchase Date 0000-00-00 Purchase Cost 0.00 Development Cost 0.00  19,48,500 19 Lacs+ Nigoh Jamunipur S No-1104 557 551 774  Total Area 0.563 Acre Built Up Area Whether Inherited Y Purchase Date 0000-00-00 Purchase Cost 0.00 Development Cost 0.00  53,27,000 53 Lacs+",Nil,Nil,Nil,Nil,Nil,"Rs 72,75,500 72 Lacs+"
2,ii,Non Agricultural Land,"Village Baderi Madiyahu Jaunpur S No-774  Total Area 0.203 Hec Built Up Area Whether Inherited Y Purchase Date 0000-00-00 Purchase Cost 0.00 Development Cost 0.00  25,57,800 25 Lacs+ Raibhanipur S No-41 Share 1/3  Total Area 0.116 Hec Built Up Area Whether Inherited Y Purchase Date 0000-00-00 Purchase Cost 0.00 Development Cost 0.00  19,72,000 19 Lacs+","Village Ramdaspur Newada A No-421 Teh Sadar Jaunpur  Total Area 1.0110 Hec Built Up Area Whether Inherited N Purchase Date 2012-09-21 Purchase Cost 6000000.00 Development Cost 0.00  11,62,65,000 11 Crore+",Nil,Nil,Nil,Nil,"Rs 12,07,94,800 12 Crore+"
3,iii,Commercial Buildings,"Cold Storage A No-133Min, 134Min , 131B, 135Min, 136Min,  Total Area 0.162 Hec Built Up Area Whether Inherited Y Purchase Date 0000-00-00 Purchase Cost 0.00 Development Cost 0.00  2,40,25,333 2 Crore+ Katbar Bazar A No-1131/1232  Total Area 100 Sq Ft Built Up Area 100 Sq Ft Whether Inherited Y Purchase Date 0000-00-00 Purchase Cost 0.00 Development Cost 0.00  3,20,000 3 Lacs+",Nil,Nil,Nil,Nil,Nil,"Rs 2,43,45,333 2 Crore+"
4,iv,Residential Buildings,"Gomti Nagar Vistarkhand Lucknow 4/366  Total Area 240 Sq Mtr Built Up Area Whether Inherited Y Purchase Date 0000-00-00 Purchase Cost 0.00 Development Cost 0.00  60,00,000 60 Lacs+ Vistarkhand-2 Gomti Nagar Lucknow C-2/309  Total Area 200 Sq Mt Built Up Area Whether Inherited N Purchase Date 2012-01-30 Purchase Cost 4400000.00 Development Cost 0.00  55,00,000 55 Lacs+ Nigoh Jaunpur Jaunpur  Total Area 3000 Sq Mt Built Up Area Whether Inherited Y Purchase Date 0000-00-00 Purchase Cost 0.00 Development Cost 0.00  4,00,000 4 Lacs+ Umarpur OW Jaunpur H No-621  Total Area 2600 Sq Mt Built Up Area Whether Inherited Y Purchase Date 0000-00-00 Purchase Cost 0.00 Development Cost 0.00  40,00,000 40 Lacs+ Village Gaherpur Karo  Total Area 240 Sq Mt Built Up Area Whether Inherited Y Purchase Date 0000-00-00 Purchase Cost 0.00 Development Cost 0.00  2,00,000 2 Lacs+",Nil,Nil,Nil,Nil,Nil,"Rs 1,61,00,000 1 Crore+"
5,v,Others,Nil,Nil,Nil,Nil,Nil,Nil,Nil
6,Total Current Market Value of (i) to (v) (as per Affidavit),Total Current Market Value of (i) to (v) (as per Affidavit),"5,22,50,633 5 Crore+","11,62,65,000 11 Crore+",Nil,Nil,Nil,Nil,"Rs 16,85,15,633 16 Crore+"
7,Totals Calculated,Totals Calculated,"Rs 5,22,50,633 5 Crore+","Rs 11,62,65,000 11 Crore+",Nil,Nil,Nil,Nil,"Rs 16,85,15,633 16 Crore+"
