,0,1,2,3,4,5,6,7,8
0,Sr No,Description,self,spouse,huf,dependent1,dependent2,dependent3,
1,i,Agricultural Land,"Himmatpura-192,297,300,328,329 (1/2 share0  Total Area 0.64 acre Built Up Area Whether Inherited Y Purchase Date 0000-00-00 Purchase Cost 0.00 Development Cost 0.00  3,30,000 3 Lacs+ 53 (1/10 share) Himmatpura  Total Area 0.021 acre Built Up Area Whether Inherited Y Purchase Date 0000-00-00 Purchase Cost 0.00 Development Cost 0.00  77,000 77 Thou+ 41 & 61 (1/10 share0 Himmatpur  Total Area 0.039 acre Built Up Area Whether Inherited Y Purchase Date 0000-00-00 Purchase Cost 0.00 Development Cost 0.00  77,000 77 Thou+ 44,59,772/2,105,106,141/1,204/1,295,333,259,78/2,204/2, Himmatpur  Total Area 2.78 acre Built Up Area Whether Inherited Y Purchase Date 0000-00-00 Purchase Cost 0.00 Development Cost 0.00  11,22,000 11 Lacs+ 133 & 134 (1/10 share)  Total Area 0.35 acre Built Up Area Whether Inherited Y Purchase Date 0000-00-00 Purchase Cost 0.00 Development Cost 0.00  1,42,000 1 Lacs+ 176 Himmatpur  Total Area 0.18 acre Built Up Area Whether Inherited Y Purchase Date 0000-00-00 Purchase Cost 0.00 Development Cost 0.00  1,21,000 1 Lacs+ 41,45,48 & 70(1/2 share) Himmatpur  Total Area 0.18 acre Built Up Area Whether Inherited Y Purchase Date 0000-00-00 Purchase Cost 0.00 Development Cost 0.00  3,20,000 3 Lacs+ 14 & 49 share of 1/10, Rajendra  Total Area 0.059 acre Built Up Area Whether Inherited Y Purchase Date 0000-00-00 Purchase Cost 0.00 Development Cost 0.00  66,000 66 Thou+ 221 (Kuwa) 222, share of 1/3, Himmatpur  Total Area 0.04 acre Built Up Area Whether Inherited Y Purchase Date 0000-00-00 Purchase Cost 0.00 Development Cost 0.00  1,65,000 1 Lacs+ 72 (1/2 share) Rajendra  Total Area 0.51 Built Up Area Whether Inherited Y Purchase Date 0000-00-00 Purchase Cost 0.00 Development Cost 0.00  1,98,000 1 Lacs+ 136 (1/10 share) Rajendra  Total Area 0.208 acre Built Up Area Whether Inherited Y Purchase Date 0000-00-00 Purchase Cost 0.00 Development Cost 0.00  1,21,000 1 Lacs+ 195 & 198 (9.05% share) Himmatpur  Total Area 1.3756 acre Built Up Area Whether Inherited Y Purchase Date 0000-00-00 Purchase Cost 0.00 Development Cost 0.00  7,10,000 7 Lacs+ 46 (Kuwa) 1/2 share Rajendra  Total Area 0.01 acre Built Up Area Whether Inherited Y Purchase Date 0000-00-00 Purchase Cost 0.00 Development Cost 0.00  1,98,000 1 Lacs+","132/1, 132/2 (1/2 share) Rampura Duda, 131/1 (1/4 share), Rampura Duda  Total Area 0.18 acre , 0.005 acre Built Up Area Whether Inherited N Purchase Date 2011-11-14 Purchase Cost 56800.00 Development Cost 0.00  1,65,000 1 Lacs+ 419 Amarpura Sendara (Sabalpura)  Total Area 0.34 acre Built Up Area Whether Inherited N Purchase Date 2004-10-20 Purchase Cost 10400.00 Development Cost 0.00  1,10,000 1 Lacs+ 2,3/1,3/2,4/1,4/2,5,7,8,910,11/1,11/3,12,13,15,19 (1/9 share) Gajipura, Dt-06.09.17, 05.07.17, 20.07.17, Cost of purchase-45710/-53100/-30500/-  Total Area 1.05 acre Built Up Area Whether Inherited N Purchase Date 0000-00-00 Purchase Cost 0.00 Development Cost 0.00  3,20,000 3 Lacs+ 118,123,2262,124, Nand Pushkar  Total Area 1.58 acre Built Up Area Whether Inherited N Purchase Date 2016-06-30 Purchase Cost 3614200.00 Development Cost 0.00  38,00,000 38 Lacs+",Nil,Nil,Nil,Nil,"Rs 80,42,000 80 Lacs+"
2,ii,Non Agricultural Land,"Residential Plot Dharmpark Shusilpura Ajmer Road Jaipur 1/2 share Total Area 1695 sqf.t Built Up Area Whether Inherited N Purchase Date 2015-06-12 Purchase Cost 1525000.00 Development Cost 0.00  40,00,000 40 Lacs+",Nil,Nil,Nil,Nil,Nil,"Rs 40,00,000 40 Lacs+"
3,iii,Commercial Buildings,Nil,"House 8/139 Pyarelal Bagichi marg Beawar H.No-33  Total Area 441 sq.ft Built Up Area 1323 sq.ft Whether Inherited N Purchase Date 2012-05-29 Purchase Cost 515000.00 Development Cost 275000.00  24,30,000 24 Lacs+ House 8/139 Pyarelal Bagichi marg Beawar H.No-34 (1) Beawar  Total Area 384 sq.ft Built Up Area 1152 sq.ft Whether Inherited N Purchase Date 2014-03-29 Purchase Cost 422260.00 Development Cost 250000.00  21,10,000 21 Lacs+",Nil,Nil,Nil,Nil,"Rs 45,40,000 45 Lacs+"
4,iv,Residential Buildings,"House Himmatpura Total Area 3600 sq.ft Built Up Area 1500 sq.ft Whether Inherited Y Purchase Date 0000-00-00 Purchase Cost 0.00 Development Cost 75000.00  9,00,000 9 Lacs+ H.No-20A, Bapunagar-II Fatehpuriya II beawar  Total Area 1090.35 sq.ft Built Up Area 1090.35 sq.ft Whether Inherited N Purchase Date 2003-03-22 Purchase Cost 61880.00 Development Cost 863620.00  22,40,000 22 Lacs+ Nohra Vill Himmatpura  Total Area 1800 sq.ft Built Up Area 200 sq.ft Whether Inherited Y Purchase Date 0000-00-00 Purchase Cost 0.00 Development Cost 0.00  6,25,000 6 Lacs+ Vill Bada Himmatpura  Total Area 36000 sq.ft Built Up Area Whether Inherited Y Purchase Date 0000-00-00 Purchase Cost 0.00 Development Cost 0.00  17,00,000 17 Lacs+","House No-6 K.M. Colony Sandera Road Beawar  Total Area 288 sq.ft Built Up Area 1250 sq.ft Whether Inherited N Purchase Date 2001-05-15 Purchase Cost 26100.00 Development Cost 348900.00  9,00,000 9 Lacs+",Nil,Nil,Nil,Nil,"Rs 63,65,000 63 Lacs+"
5,v,Others,"Mines No-156/5 vill Bhartawa Security Deposit  Total Area Built Up Area Whether Inherited N Purchase Date 0000-00-00 Purchase Cost 0.00 Development Cost 0.00  1,10,000 1 Lacs+",Nil,Nil,Nil,Nil,Nil,"Rs 1,10,000 1 Lacs+"
6,Total Current Market Value of (i) to (v) (as per Affidavit),Total Current Market Value of (i) to (v) (as per Affidavit),"1,32,22,000 1 Crore+","98,35,000 98 Lacs+",Nil,Nil,Nil,Nil,"Rs 2,30,57,000 2 Crore+"
7,Totals Calculated,Totals Calculated,"Rs 1,32,22,000 1 Crore+","Rs 98,35,000 98 Lacs+",Nil,Nil,Nil,Nil,"Rs 2,30,57,000 2 Crore+"
