,0,1,2,3,4,5,6,7,8
0,Sr No,Description,self,spouse,huf,dependent1,dependent2,dependent3,
1,i,Agricultural Land,Nil,"Dammapet Vil & Mdl, Bhadradri Kothagudem Dist. Sy. No. Acrs 1)1407 4.2700 2) 1377/A 2.2000 3) 1374 1.3900 (Total 1 to 3-9.0600 Acrs.  Total Area 9.0600 Acrs. Built Up Area Whether Inherited Y Purchase Date 0000-00-00 Purchase Cost 0.00 Development Cost 0.00  1,81,20,000 1 Crore+ I. Bethupalli(v) Sathupalli (M) Khammam District Sy.No. Acrs 1) 288 2.1900 2) 289 0.3100 3) 290/1 1.0000 4) 370/A/1 1.3000 5) 370/B/1 0.0800 6)370/C/2 3.1700 7) 370/D/1 100700 8) 370/E/2 1.0600 9) 370/F/1 0.2000 10) 370/G/2 0.2000 (Total 1 to 10-12.3800 Acrs) Total Area 12.3800 Acrs. Built Up Area Whether Inherited Y Purchase Date 0000-00-00 Purchase Cost 0.00 Development Cost 0.00  2,46,60,000 2 Crore+","1.Nagupalli(V) Dammapet (M) Bhadradri KothagudemDt. Sy.No.Acrs. 1) 913/2A3 2.3700 2) 825/B1.2050 3) 825 6.08650 4) 819C 5.2600 5) 813D 10.2600 6) 670E 1.0700 7) 667F 1.0600 8) 602/G/1 7.0000  Total Area 36.110 Acrs. Built Up Area Whether Inherited Y Purchase Date 0000-00-00 Purchase Cost 0.00 Development Cost 0.00  6,48,00,000 6 Crore+",Nil,Nil,Nil,"Rs 10,75,80,000 10 Crore+"
2,ii,Non Agricultural Land,Nil,"Madhapur (v)  Total Area 924 Sq Ft Built Up Area Whether Inherited N Purchase Date 2018-02-05 Purchase Cost 6930000.00 Development Cost 12500000.00  1,25,00,000 1 Crore+",Nil,Nil,Nil,Nil,"Rs 1,25,00,000 1 Crore+"
3,iii,Commercial Buildings,Nil,"Sathupalli (v) Total Area 7500 sq Ft Built Up Area Whether Inherited N Purchase Date 2010-05-01 Purchase Cost 2324000.00 Development Cost 5000000.00  1,50,00,000 1 Crore+",Nil,Nil,Nil,Nil,"Rs 1,50,00,000 1 Crore+"
4,iv,Residential Buildings,Nil,Nil,"Gandugulapalli Vil.  Total Area 87120 Sq Ft Built Up Area 3000 Sq Ft Whether Inherited Y Purchase Date 0000-00-00 Purchase Cost 0.00 Development Cost 1000000.00  40,00,000 40 Lacs+",Nil,Nil,Nil,"Rs 40,00,000 40 Lacs+"
5,v,Others,Nil,Nil,Nil,Nil,Nil,Nil,Nil
6,Total Current Market Value of (i) to (v) (as per Affidavit),Total Current Market Value of (i) to (v) (as per Affidavit),Nil,"7,02,80,000 7 Crore+","6,88,00,000 6 Crore+",Nil,Nil,Nil,"Rs 13,90,80,000 13 Crore+"
7,Totals Calculated,Totals Calculated,Nil,"Rs 7,02,80,000 7 Crore+","Rs 6,88,00,000 6 Crore+",Nil,Nil,Nil,"Rs 13,90,80,000 13 Crore+"
