,0,1,2,3,4,5,6,7,8
0,Sr No,Description,self,spouse,huf,dependent1,dependent2,dependent3,
1,i,Agricultural Land,"Moje Pingali Sangrampur Buldhana 24 & 25  Total Area 8H31R Built Up Area Whether Inherited N Purchase Date 2011-11-21 Purchase Cost 1617000.00 Development Cost 0.00  38,00,000 38 Lacs+ Moje Madakhed Jalgaon Jamod Buldhana 35  Total Area 0H89R Built Up Area Whether Inherited Y Purchase Date 0000-00-00 Purchase Cost 0.00 Development Cost 0.00  3,00,000 3 Lacs+","Moje Khelmali Jalgaon Jamod 74  Total Area 1H86R Built Up Area Whether Inherited N Purchase Date 2018-05-21 Purchase Cost 1866000.00 Development Cost 0.00  30,00,000 30 Lacs+",Nil,"Moje Pingali Sangrampur Buldhana 26  Total Area 1H95R Built Up Area Whether Inherited N Purchase Date 2024-06-25 Purchase Cost 1721000.00 Development Cost 0.00  18,00,000 18 Lacs+ Moje Pingali Sangrampur Buldhana 26  Total Area 0H39R Built Up Area Whether Inherited N Purchase Date 2024-07-01 Purchase Cost 351000.00 Development Cost 0.00  4,00,000 4 Lacs+",Nil,Nil,"Rs 93,00,000 93 Lacs+"
2,ii,Non Agricultural Land,"Moje Wadi Khurd Jalgaon Jamod 48/1 Plot No 1, 13, 16, 17, 18, 22 And 8  Total Area 3401.6Sq.Foot Built Up Area Whether Inherited Y Purchase Date 0000-00-00 Purchase Cost 0.00 Development Cost 0.00  37,00,000 37 Lacs+","Moje Khelkhasa Khurd Jalgaon Jamod Buldhana 9 And 10 NP-34/ 29/2010-11 Lay Out 26 Plot  Total Area 37275.00Sq.Meter Built Up Area Whether Inherited N Purchase Date 2005-12-05 Purchase Cost 695786.00 Development Cost 100000.00  3,00,00,000 3 Crore+ Moje Khelkhasa Khurd Jalgaon Jamod Buldhana 9 NP-34 5/2001-02 Lay Out O Plot No 45  Total Area 314.50Sq.Meter Built Up Area Whether Inherited N Purchase Date 2023-10-26 Purchase Cost 750000.00 Development Cost 0.00  8,50,000 8 Lacs+ Moje Khelbari Jalgaon Jamod 176 1.42H  Total Area 6930.24Sq.Meter Built Up Area Whether Inherited N Purchase Date 2023-01-27 Purchase Cost 20000000.00 Development Cost 166640.00  2,49,96,000 2 Crore+ Moje Wayal Jalgaon Jamod 134 8.96H.R  Total Area 75675Sq.Meter Built Up Area Whether Inherited N Purchase Date 2022-07-19 Purchase Cost 7705000.00 Development Cost 500000.00  1,25,00,000 1 Crore+",Nil,Nil,Nil,Nil,"Rs 7,20,46,000 7 Crore+"
3,iii,Commercial Buildings,Nil,Nil,Nil,Nil,Nil,Nil,Nil
4,iv,Residential Buildings,"Moje Khelkhasa Khurd Jalgaon Jamod Buldhana Plot No 16, 17 And 18  Total Area 6459.00Sq.Foot Built Up Area 3400.00Sq.Foot Whether Inherited N Purchase Date 2003-03-05 Purchase Cost 70000.00 Development Cost 2125656.00  70,00,000 70 Lacs+",Nil,Nil,Nil,Nil,Nil,"Rs 70,00,000 70 Lacs+"
5,v,Others,"Shri Datta Krupa Sahakari Sanstha Kharghar Navi Mumbai  Total Area Built Up Area Whether Inherited N Purchase Date 0000-00-00 Purchase Cost 0.00 Development Cost 0.00  5,00,000 5 Lacs+ Cidco Housing Scheme Plot No 20 Sector 15A Palm Beach Road Belapur Navi Mumbai  Total Area Built Up Area Whether Inherited N Purchase Date 0000-00-00 Purchase Cost 0.00 Development Cost 0.00  1,00,000 1 Lacs+","Moje Khelsonji Jalgaon Jamod Gat No 37  Total Area 9085.00Sq.Meter Built Up Area Whether Inherited N Purchase Date 2021-03-12 Purchase Cost 0.00 Development Cost 0.00  2,23,25,266 2 Crore+",Nil,Nil,Nil,Nil,"Rs 2,29,25,266 2 Crore+"
6,Total Current Market Value of (i) to (v) (as per Affidavit),Total Current Market Value of (i) to (v) (as per Affidavit),"1,75,25,756 1 Crore+","9,44,37,906 9 Crore+",Nil,"22,00,000 22 Lacs+",Nil,Nil,"Rs 11,41,63,662 11 Crore+"
7,Totals Calculated,Totals Calculated,"Rs 1,54,00,000 1 Crore+","Rs 9,36,71,266 9 Crore+",Nil,"Rs 22,00,000 22 Lacs+",Nil,Nil,"Rs 11,12,71,266 11 Crore+"
