,0,1,2,3,4,5,6,7,8
0,Sr No,Description,self,spouse,huf,dependent1,dependent2,dependent3,
1,i,Agricultural Land,"Undivided Share in The plot under sy.no-124/1, Corjuem, Bardez Taluka (50% with Spouse) (Certain Sub-Divided Plots Sold)  Total Area 379799.64 sq.ft Built Up Area Whether Inherited Y Purchase Date 0000-00-00 Purchase Cost 0.00 Development Cost 0.00  50,00,000 50 Lacs+",Nil,Nil,Nil,Nil,Nil,"Rs 50,00,000 50 Lacs+"
2,ii,Non Agricultural Land,"Undivided Share in the Plot under Sy.No-124/1 Corjuem Bardez Taluka (50% with Spouse) (Certain sub divided plots sold)  Total Area 379799.64 sq.ft Built Up Area Whether Inherited Y Purchase Date 0000-00-00 Purchase Cost 0.00 Development Cost 0.00  50,00,000 50 Lacs+",Nil,Nil,Nil,Nil,Nil,"Rs 50,00,000 50 Lacs+"
3,iii,Commercial Buildings,"Undivided Share in Building Plot bearing P.T. Sheet no-34 Chalta Nos-117, 118 Panaji (50% with Spouse)  Total Area 86244.88 sq.ft Built Up Area 5920.15 sq.ft Whether Inherited Y Purchase Date 0000-00-00 Purchase Cost 0.00 Development Cost 0.00  2,00,00,000 2 Crore+",Nil,Nil,Nil,Nil,Nil,"Rs 2,00,00,000 2 Crore+"
4,iv,Residential Buildings,"Sy.No-156/0 of Courjuem Village, Bardez Taluka (50% with Spouse) with Existing old House No-95  Total Area 62290.8 sq.ft Built Up Area 5349.58 sq.ft Whether Inherited N Purchase Date 2008-02-14 Purchase Cost 500000.00 Development Cost 8000000.00  3,00,00,000 3 Crore+ Undivided Share in House Property bearing P.T. Sheet No-150, Chalta No-172 (50% share with Spouse)  Total Area 20037.6 sq.ft Built Up Area 16145 sq.ft Whether Inherited Y Purchase Date 0000-00-00 Purchase Cost 0.00 Development Cost 0.00  10,50,00,000 10 Crore+",Nil,Nil,Nil,Nil,Nil,"Rs 13,50,00,000 13 Crore+"
5,v,Others,Nil,Nil,Nil,Nil,Nil,Nil,Nil
6,Total Current Market Value of (i) to (v) (as per Affidavit),Total Current Market Value of (i) to (v) (as per Affidavit),"16,00,00,000 16 Crore+",Nil,Nil,Nil,Nil,Nil,"Rs 16,00,00,000 16 Crore+"
7,Totals Calculated,Totals Calculated,"Rs 16,50,00,000 16 Crore+",Nil,Nil,Nil,Nil,Nil,"Rs 16,50,00,000 16 Crore+"
