,0,1,2,3,4,5,6,7,8
0,Sr No,Description,self,spouse,huf,dependent1,dependent2,dependent3,
1,i,Agricultural Land,"Village Karhiya, Huzur, Riva, No. 15/2, 16/2  Total Area 11.169 Acre Built Up Area Whether Inherited N Purchase Date 2010-05-18 Purchase Cost 1800000.00 Development Cost 0.00  25,00,000 25 Lacs+ Moja-Began, Patwari Halka No. 24, Ward No. 40, Adarsh Ward, Tehsil Singrauli, 243/15  Total Area 0.289 Hec. Built Up Area Whether Inherited N Purchase Date 2009-03-13 Purchase Cost 1200000.00 Development Cost 0.00  15,00,000 15 Lacs+","Village Karhiya/Agdal P.H. Padra, Tehsil Huzur, Riva, 25/1, 24/2  Total Area 0.40 Acre Built Up Area Whether Inherited N Purchase Date 2014-03-20 Purchase Cost 1500000.00 Development Cost 0.00  22,00,000 22 Lacs+ Village Niga,Panchayat Karhiya, Patwari Halka Padra, Thesil Huzur Riva 15/1/1  Total Area 2.00 Acre Built Up Area Whether Inherited N Purchase Date 2010-10-06 Purchase Cost 500000.00 Development Cost 0.00  7,50,000 7 Lacs+ Village Morcha, Patwari Halka Katori Gopad Banas, Sidhi 332,337,339,342,386,276,274,262,129,130,146,149,328,329,331,336,341,340,348,349,350,351,352,353,355,376,383,387,388/1  Total Area 36.794 acre Built Up Area Whether Inherited N Purchase Date 2012-03-06 Purchase Cost 5000000.00 Development Cost 0.00  60,00,000 60 Lacs+ Village Patulakhi, Tehsil Behri, 1/5 Part And Self Property 278,311,313,374,391,420,474,517,574,835,836,901,944,1416,1420,1423,1426,1449,1462,1628,16555,1681,1707,1740,1743 Self Property 1/5 parrt And Self property Kh No. 838, 485,487 and 494, 1/3 Part, 1/5 PART- 5.288 Acre, 1659 acre, Date of Purchase 20/01/2001 & 10/03/1999, Purchase Amt 45000 & 2266666  Total Area Built Up Area Whether Inherited N Purchase Date 0000-00-00 Purchase Cost 0.00 Development Cost 0.00  6,00,000 6 Lacs+ Village Jamuaar, Tehsil Behri, 1/5 part, 179,181,187,188,155,156,177,178,  Total Area 84 acre Built Up Area Whether Inherited Y Purchase Date 0000-00-00 Purchase Cost 0.00 Development Cost 0.00  50,000 50 Thou+ Gram Pakhada Tehs.Bhari Joint A/c in 1/5 79  Total Area 0.593 Acre ni 1/5 and 0.12 Acer Built Up Area Whether Inherited Y Purchase Date 0000-00-00 Purchase Cost 36000.00 Development Cost 0.00  36,000 36 Thou+ Gram Kukray Brahman Tola Tesl. Bahri Joint A/c 1/5  Total Area 637,639,3,640,642,651, Built Up Area 5.016 acer in 1/5 and 1.000 Whether Inherited Y Purchase Date 0000-00-00 Purchase Cost 0.00 Development Cost 0.00  3,00,000 3 Lacs+ Gram Umariya Tehl. bahari Joint A/c 1/5 Dated 06-06-2010 and 28-04-2010  Total Area 88,89,96, Joint A/c in 1/5 and A/c no 80,83,86 joint property Built Up Area joint A/c in 0.4332 acer in 1/5 and 0.28 acer and total 3.842 acer Whether Inherited Y Purchase Date 0000-00-00 Purchase Cost 0.00 Development Cost 155.00  12,00,000 12 Lacs+ Gram Putlakhi Tesl.Bahri in Joint A/c in 1/35 1094,1086,1073,1327,1080,1783,1889,1890,4285,1220,1221,365,371,377,378,379,1990  Total Area 8332 acer and 1/35 0.2238 acer Built Up Area Whether Inherited Y Purchase Date 0000-00-00 Purchase Cost 0.00 Development Cost 0.00  65,000 65 Thou+ Gram Badela Tesl.Bahri in Joint A/c in 2/15 904,912,959,1004,1005,1110  Total Area Joint A/c in 964 Acer in 2/15 and 0.129 Built Up Area Whether Inherited Y Purchase Date 0000-00-00 Purchase Cost 0.00 Development Cost 0.00  40,000 40 Thou+ Gram Jamgarh Tesl. Sarai 94/3  Total Area 0.95 Hec. and 2.35 Acer Built Up Area Whether Inherited N Purchase Date 2020-08-05 Purchase Cost 997550.00 Development Cost 0.00  10,00,000 10 Lacs+ Gram Matkhaniya Halka vastuo Tesl. Kusmi 182/2,183/2  Total Area 3.58 Acer Built Up Area Whether Inherited N Purchase Date 2021-06-18 Purchase Cost 550000.00 Development Cost 0.00  6,00,000 6 Lacs+ Gram Bhamra Halka Bhamra First Tesl. Byohari 632/3  Total Area 0.0466 Acer Built Up Area Whether Inherited N Purchase Date 2023-03-25 Purchase Cost 150000.00 Development Cost 0.00  1,50,000 1 Lacs+ Gram Madhuri Pavai Halka Kurwa Tehsl.Gopad Banas //6,7/5,  Total Area 1.53 Acer Built Up Area Whether Inherited N Purchase Date 2021-08-27 Purchase Cost 3300000.00 Development Cost 0.00  35,00,000 35 Lacs+ Ward no 40 Tehsl. Singroli 243/19/1/1,243/21/1/1  Total Area 0.11184 Built Up Area Whether Inherited N Purchase Date 2023-03-25 Purchase Cost 6100000.00 Development Cost 0.00  61,00,000 61 Lacs+ Gram Muher Halka Ward no 02 Tehsl. Singroli 1236/4  Total Area 0.0932 Built Up Area Whether Inherited N Purchase Date 2022-06-28 Purchase Cost 650000.00 Development Cost 0.00  7,00,000 7 Lacs+ Gram Deniha Halka 72 Tehsl.Gopad Banas 39,40,41,42,202/2  Total Area 0.56 Acer Built Up Area Whether Inherited N Purchase Date 2019-12-03 Purchase Cost 3366423.00 Development Cost 0.00  40,00,000 40 Lacs+",Nil,Nil,Nil,Nil,"Rs 3,12,91,000 3 Crore+"
2,ii,Non Agricultural Land,"Ward no 40 Bedan Tehsl.Singroli 242/2  Total Area 950 Sqrft. Built Up Area Whether Inherited N Purchase Date 2020-05-15 Purchase Cost 1200000.00 Development Cost 0.00  15,00,000 15 Lacs+ Ward No. 3, Vindhyabihar Colony Housing Board Nagar Nigam Halka Hujur Rewa, Sy. No. 789, 790, 791  Total Area 121.5 sq.mtr, 1307.8 sqft Built Up Area Whether Inherited N Purchase Date 2020-11-17 Purchase Cost 901125.00 Development Cost 500000.00  16,00,000 16 Lacs+","Village Kotar Kala Patwari Halka 71 Tehsil Gopad Banas Dist. Sidhi, Sy. No. 724/1  Total Area 2180 sqft Built Up Area Whether Inherited N Purchase Date 2021-02-18 Purchase Cost 2694606.00 Development Cost 0.00  30,00,000 30 Lacs+",Nil,Nil,Nil,Nil,"Rs 61,00,000 61 Lacs+"
3,iii,Commercial Buildings,"Gram karodiya Utar Tola Ward no 10 Municipal Corporation Sidhi 10/1/4  Total Area 0.136 Built Up Area Whether Inherited N Purchase Date 2012-01-20 Purchase Cost 2000000.00 Development Cost 3500000.00  60,00,000 60 Lacs+ Village Thekaha Ward No. 5, Nagar Nigam Rewa, Radhakrishan Tower, Shop No. 49  Total Area 200 sqft Built Up Area Whether Inherited N Purchase Date 2005-01-06 Purchase Cost 400000.00 Development Cost 0.00  10,00,000 10 Lacs+",Nil,Nil,Nil,Nil,Nil,"Rs 70,00,000 70 Lacs+"
4,iv,Residential Buildings,"Vindhya Bihar Colony Hujur Tehsl.Reva in H.I.G.J.R /36  Total Area 1560.34 Sqrft,. Built Up Area Whether Inherited N Purchase Date 2010-05-26 Purchase Cost 942625.00 Development Cost 0.00  15,00,000 15 Lacs+ Padamdhar Colony dekaha Tehsl. Hujur Reva H.I.G.-II/31  Total Area 1776.06 Sqrft. Built Up Area 1700 sqrft. Whether Inherited N Purchase Date 2001-10-23 Purchase Cost 540000.00 Development Cost 0.00  11,00,000 11 Lacs+ Ward no 40 Bedan Tehsl. Singroli Muncipal 243/15  Total Area 13080 Sqrft. Built Up Area 10500Sqrft. Whether Inherited N Purchase Date 2009-03-13 Purchase Cost 1200000.00 Development Cost 9200000.00  1,00,00,000 1 Crore+","Plot no 769 Society No 08 deepatoli Rachi Jharkhand 162  Total Area 1800 Sqrft. Built Up Area Whether Inherited N Purchase Date 2004-02-23 Purchase Cost 1200000.00 Development Cost 0.00  22,00,000 22 Lacs+ Gram bawadiya Kala Municipal Corporation Ward no 53 Patwari Halka tehsl.Hujur Dist.Bhopal 7/1/A 78/1/B  Total Area 1200 Sqrft. Built Up Area Whether Inherited N Purchase Date 2010-08-08 Purchase Cost 1491000.00 Development Cost 2000000.00  40,00,000 40 Lacs+",Nil,Nil,Nil,Nil,"Rs 1,88,00,000 1 Crore+"
5,v,Others,Nil,Nil,Nil,Nil,Nil,Nil,Nil
6,Total Current Market Value of (i) to (v) (as per Affidavit),Total Current Market Value of (i) to (v) (as per Affidavit),"2,67,00,000 2 Crore+","3,04,91,000 3 Crore+",Nil,Nil,Nil,Nil,"Rs 5,71,91,000 5 Crore+"
7,Totals Calculated,Totals Calculated,"Rs 2,67,00,000 2 Crore+","Rs 3,64,91,000 3 Crore+",Nil,Nil,Nil,Nil,"Rs 6,31,91,000 6 Crore+"
