,0,1,2,3,4,5,6,7,8
0,Sr No,Description,self,spouse,huf,dependent1,dependent2,dependent3,
1,i,Agricultural Land,"Deed no.2711,pargona-kushiarkul,mazuza-medol part-III dag no-555(new),khatian no-206 patta no-366.  Total Area Built Up Area Whether Inherited N Purchase Date 0000-00-00 Purchase Cost 60000.00 Development Cost 0.00  1,00,000 1 Lacs+ Deed no-2280/2367 pargona-egasoai,mauza -saidambar part=I khatian no-60(old),dag no-36,  Total Area Built Up Area Whether Inherited N Purchase Date 0000-00-00 Purchase Cost 100000.00 Development Cost 0.00  1,50,000 1 Lacs+ Deed no-2409/2134 pargona-kushiarkul, mauza-medol part-III khatian no-230 dag no (new),patta no-380  Total Area Built Up Area Whether Inherited N Purchase Date 0000-00-00 Purchase Cost 50000.00 Development Cost 0.00  90,000 90 Thou+ Deed no-3621/3483 pargona-kushiarkul,mauza medol part-III;khatian no-260,dag no-555(new),oatta np-336  Total Area Built Up Area Whether Inherited N Purchase Date 0000-00-00 Purchase Cost 150000.00 Development Cost 0.00  2,00,000 2 Lacs+","Deed no -2143/1889 pargona-egarasti mauza -sanidambar part-I khatiam no-163(o)01(new),dagno-173,174(new)  Total Area Built Up Area Whether Inherited N Purchase Date 0000-00-00 Purchase Cost 475000.00 Development Cost 0.00  6,00,000 6 Lacs+ (1) Deed no-4196/3724 pargona-kushiarkul, mauza-nagkapon,khatian no-39(o) dag no-14,15 (n),patta no-34 (2) Deed n-4196/3724 pargon-kushiarkul,mauza-nagkaponkhatian no-39,40(o) dag no-14,15(n),patta no-34 Total Area Built Up Area Whether Inherited N Purchase Date 0000-00-00 Purchase Cost 300000.00 Development Cost 0.00  5,00,000 5 Lacs+ Deed no-848/784 pargona pratagarh,mouza hatairbound,patta no-40,61 dag no 173,173  Total Area Built Up Area Whether Inherited N Purchase Date 0000-00-00 Purchase Cost 200000.00 Development Cost 0.00  3,00,000 3 Lacs+ Deed no-1397/1301 pargona-patapgarh mouza-hatairbound,patta no-61 dag no 174  Total Area Built Up Area Whether Inherited N Purchase Date 0000-00-00 Purchase Cost 300000.00 Development Cost 0.00  4,00,000 4 Lacs+",Nil,Nil,Nil,Nil,"Rs 23,40,000 23 Lacs+"
2,ii,Non Agricultural Land,"Deed no 1/3 old station road karinganj pargona-kushiarkul.mouza-karimganjtowen pt-v khatian no-3883(n) dag no- 968,969,971,972(n)  Total Area 10310 sq ft Built Up Area Whether Inherited N Purchase Date 2015-01-01 Purchase Cost 750000.00 Development Cost 0.00  15,00,000 15 Lacs+ Deed n0-189/172(n) pargoan-kushiarkul mouza-karimganj town patta-v,patta no-506,561 dag no-967,902,903,906,907,908,909,901  Total Area 6240 sq ft Built Up Area Whether Inherited N Purchase Date 2019-07-05 Purchase Cost 1000000.00 Development Cost 0.00  15,00,000 15 Lacs+","Deed no-1/3 olf station road,karimganj pargoona kushiarkul,mouza karimganj town pt-v khatian no-3883(n)dag no 968,969,971,972,(n)  Total Area 10310 sq ft Built Up Area 2015/01/01 Whether Inherited N Purchase Date 0000-00-00 Purchase Cost 2750000.00 Development Cost 0.00  15,00,000 15 Lacs+ Deed no pargoN barakpar mouza-ambikaour part-IX patta no-149 dag no-545 municipal ward no-10 holding no-137  Total Area 3307 sq ft Built Up Area Whether Inherited N Purchase Date 0000-00-00 Purchase Cost 300000.00 Development Cost 0.00  22,00,000 22 Lacs+ Total Area Built Up Area Whether Inherited N Purchase Date 0000-00-00 Purchase Cost 0.00 Development Cost 0.00  15,00,000 15 Lacs+",Nil,Nil,Nil,Nil,"Rs 82,00,000 82 Lacs+"
3,iii,Commercial Buildings,"Deed no-408/3642 pargona-kishiarkul,mauza-karimganj town part-v pattan no-561,506(n) dag no-967,908,909,910,906,907,903(n)  Total Area 22297 sq ft Built Up Area 18500 sq ft Whether Inherited N Purchase Date 0000-00-00 Purchase Cost 781250.00 Development Cost 0.00  25,00,000 25 Lacs+","Deed no-4080/3642 pargona-kushiarkul,mauza-karimgani town part-v,oarra no-561,560 (n) dag no,967,908,909,910,906,907,903(n).  Total Area 22297 sq ft Built Up Area 18500 sq ft Whether Inherited N Purchase Date 0000-00-00 Purchase Cost 781250.00 Development Cost 0.00  25,00,000 25 Lacs+",Nil,Nil,Nil,Nil,"Rs 50,00,000 50 Lacs+"
4,iv,Residential Buildings,"Flat no-6B VILL-KAHILIPARA DAG NO-395 Patta No-757 mouza-beltola dist-kamrup metro Total Area 2700 sq ft Built Up Area 2700 sq ft Whether Inherited N Purchase Date 2014-05-09 Purchase Cost 4650000.00 Development Cost 0.00  70,00,000 70 Lacs+",Nil,Nil,Nil,Nil,Nil,"Rs 70,00,000 70 Lacs+"
5,v,Others,Nil,Nil,Nil,Nil,Nil,Nil,Nil
6,Total Current Market Value of (i) to (v) (as per Affidavit),Total Current Market Value of (i) to (v) (as per Affidavit),"1,30,40,000 1 Crore+","1,10,00,000 1 Crore+",Nil,Nil,Nil,Nil,"Rs 2,40,40,000 2 Crore+"
7,Totals Calculated,Totals Calculated,"Rs 1,30,40,000 1 Crore+","Rs 95,00,000 95 Lacs+",Nil,Nil,Nil,Nil,"Rs 2,25,40,000 2 Crore+"
