,0,1,2,3,4,5,6,7,8
0,Sr No,Description,self,spouse,huf,dependent1,dependent2,dependent3,
1,i,Agricultural Land,"No,55 Manapakkam Vill,Sriperumbudur Taluk Kancheepuram Dist Survey No.171/1,192/1,192/3,193/1,193/2  Total Area 5.43Acre Of Land Built Up Area Whether Inherited N Purchase Date 2004-05-18 Purchase Cost 2715000.00 Development Cost 0.00  16,29,00,000 16 Crore+ No,55 Manapakkam Vill,Sriperumbudur Taluk Kancheepuram Dist Survey No.563/382/1,382/2,382/3  Total Area 5.57 Acre Of Land Built Up Area Whether Inherited N Purchase Date 2004-05-01 Purchase Cost 2800000.00 Development Cost 0.00  16,71,00,000 16 Crore+ Manapakkam Vill,Sriperumbudur Taluk Kancheepuram Dist Survey No.387,383,377/1,384/2,385,386  Total Area 1.53 Acre Of Land Built Up Area Whether Inherited N Purchase Date 1998-03-29 Purchase Cost 100000.00 Development Cost 0.00  4,59,00,000 4 Crore+ 101,Thandalam Vill,Sriperumbudur Kancheepuram Dist Total Area 38 Cent Built Up Area Whether Inherited N Purchase Date 1994-11-09 Purchase Cost 30400.00 Development Cost 0.00  36,48,000 36 Lacs+ No,55 Manapakkam Vill,Sriperumbudur Taluk Kancheepuram Dist Survey No.534/1  Total Area 1.38 Acre Of Land Built Up Area Whether Inherited N Purchase Date 1995-07-14 Purchase Cost 69000.00 Development Cost 0.00  4,14,00,000 4 Crore+ Manapakkam Vill,Sriperumbudur Taluk Kancheepuram Dist Survey No.401,402,403  Total Area 1.16 Acre Built Up Area Whether Inherited N Purchase Date 1998-03-29 Purchase Cost 116000.00 Development Cost 0.00  3,48,00,000 3 Crore+ Manapakkam Vill,Sriperumbudur Taluk Kancheepuram Dist Survey No.398/2  Total Area 2.34 Acre Built Up Area Whether Inherited N Purchase Date 1995-06-15 Purchase Cost 117000.00 Development Cost 0.00  7,02,00,000 7 Crore+ Manapakkam Vill,Sriperumbudur Taluk Kancheepuram Dist Survey No.289,286/4,286/1,Part 286/3,267,266/1&2,308 Part,307  Total Area 7.61 Acre Built Up Area Whether Inherited N Purchase Date 1981-03-31 Purchase Cost 50000.00 Development Cost 0.00  22,83,00,000 22 Crore+ Manapakkam Vill,Sriperumbudur Taluk Kancheepuram Dist Survey No.400/2  Total Area 7 Cents Built Up Area Whether Inherited N Purchase Date 2007-04-09 Purchase Cost 259000.00 Development Cost 0.00  21,00,000 21 Lacs+ Manapakkam Vill,Sriperumbudur Taluk Kancheepuram Dist Survey No.400/2  Total Area 1 Acre & 28 Cents Built Up Area Whether Inherited N Purchase Date 2007-04-09 Purchase Cost 4736000.00 Development Cost 0.00  3,84,00,000 3 Crore+ Kottur Vill,Sriperumbudur Taluk Kancheepuram Dist -18/3 E & 6/2  Total Area 2.94 And Hf Acres Built Up Area Whether Inherited N Purchase Date 2006-11-09 Purchase Cost 160329.00 Development Cost 0.00  52,92,000 52 Lacs+ No,55 Manapakkam Vill,Sriperumbudur Taluk Kancheepuram Dist Survey No.185/1,268/1,196/1,196/2,197,198/1,198/2,199,277/2,195,278,280,269  Total Area 14.65 Acres Of Land Built Up Area Whether Inherited N Purchase Date 1992-03-31 Purchase Cost 100000.00 Development Cost 0.00  21,97,50,000 21 Crore+ No.6 Kottur Vill,Sriperumbudur Taluk Kancheepuram Dist Survey No.8/2A,10/2,13/3B,& 18/3B  Total Area 1.58 Acres Built Up Area Whether Inherited N Purchase Date 2006-09-13 Purchase Cost 103430.00 Development Cost 0.00  28,44,000 28 Lacs+ Narasingapuram Vill,Thiruvallur Dist Survey No.2/1  Total Area 50 Cents Built Up Area Whether Inherited N Purchase Date 2006-09-13 Purchase Cost 62710.00 Development Cost 0.00  27,00,000 27 Lacs+ Narasingapuram Vill,Thiruvallur Dist Survey No.1/6,3/4  Total Area 75 Cents Built Up Area Whether Inherited N Purchase Date 2006-09-13 Purchase Cost 49050.00 Development Cost 0.00  40,50,000 40 Lacs+ Narasingapuram Vill,Thiruvallur Dist Survey No.2/1  Total Area 1.06 Acres Built Up Area Whether Inherited N Purchase Date 2006-09-13 Purchase Cost 63600.00 Development Cost 0.00  57,24,000 57 Lacs+ No.6 Kottur Vill,Sriperumbudur Taluk Kancheepuram Dist Survey No.22/7,31/1,31/2,34/4,14/1C,14/3,14/4,14/5D,14/5C,14/5E,14/6,22/4,22/5,22/6  Total Area 9.62 Acres Built Up Area Whether Inherited N Purchase Date 2008-06-30 Purchase Cost 1500000.00 Development Cost 0.00  1,73,16,000 1 Crore+ No.6 Kottur Vill,Sriperumbudur Taluk Kancheepuram Dist Survey No.9/4B,15/2  Total Area 1.98 Acres Built Up Area Whether Inherited N Purchase Date 2008-05-16 Purchase Cost 297000.00 Development Cost 0.00  35,64,000 35 Lacs+ No.6 Kottur Vill,Sriperumbudur Taluk Kancheepuram Dist Survey No.7/2,& 11/1C  Total Area 31 Cents Built Up Area Whether Inherited N Purchase Date 2008-05-03 Purchase Cost 46500.00 Development Cost 0.00  5,58,00,000 5 Crore+ Narasingapuram Vill,Thiruvallur Dist Survey No.6/2,7/2,8/2  Total Area 1.21 Acres Built Up Area Whether Inherited N Purchase Date 2009-02-16 Purchase Cost 181500.00 Development Cost 0.00  65,34,000 65 Lacs+ Kottur Vill,Sriperumbudur Taluk Kancheepuram Dist Survey No.6/1,7/4  Total Area 1.55 Acres Built Up Area Whether Inherited N Purchase Date 2007-10-03 Purchase Cost 116250.00 Development Cost 0.00  26,70,000 26 Lacs+ Narasingapuram Vill,Thiruvallur Dist Survey No.6/1,7/1,8/1,6/3,7/3,8/3,  Total Area 2.46 Acres Built Up Area Whether Inherited N Purchase Date 2007-03-12 Purchase Cost 249200.00 Development Cost 0.00  1,32,84,000 1 Crore+ Narasingapuram Vill,Thiruvallur Dist Survey No.8/5,9/1A,10/1A,11/1A  Total Area 1.57 Acres Built Up Area Whether Inherited N Purchase Date 2007-10-03 Purchase Cost 109000.00 Development Cost 0.00  84,78,000 84 Lacs+ Kottur Vill,Sriperumbudur Taluk Kancheepuram Dist Survey No.16/1,18/4  Total Area 0.86 Acres Built Up Area Whether Inherited N Purchase Date 2017-12-22 Purchase Cost 660802.00 Development Cost 0.00  7,50,000 7 Lacs+ Manapakkam Vill,Sriperumbudur Taluk Kancheepuram Dist Survey No.404/405/2,394/1  Total Area 0.44 Acres Built Up Area Whether Inherited N Purchase Date 2003-10-17 Purchase Cost 250000.00 Development Cost 0.00  1,32,00,000 1 Crore+ Kolapkkam Vill,Sriperumbudur Taluk Dist Survey No.348/2  Total Area 1. Acres Built Up Area Whether Inherited N Purchase Date 2006-05-31 Purchase Cost 174000.00 Development Cost 0.00  1,20,00,000 1 Crore+","Kottur Village,Sriperumbudur Talik S No-34/2 34/3 18/3F 10/1 13/3 71/1B 7/3  Total Area 10.58 Acre Built Up Area Whether Inherited N Purchase Date 2007-00-00 Purchase Cost 704250.00 Development Cost 0.00  19,13,92,200 19 Crore+ narasingapuram Village,Thiruvallur Dist S No-3/5 2/1 3/1  Total Area 2.92 Acre Built Up Area Whether Inherited N Purchase Date 2006-08-17 Purchase Cost 189900.00 Development Cost 0.00  4,60,42,560 4 Crore+ No-55 Manapakkam Village,Sriperumbudur Taluk S No-551 534/2 528  Total Area 2.57 Acre Built Up Area Whether Inherited N Purchase Date 2008-11-06 Purchase Cost 465800.00 Development Cost 0.00  7,71,00,000 7 Crore+ Manapakkam Village,Sriperumbudur Taluk S No-185/1 268/1 196/1 196/2 197 198/1 198/2 199 277/2 195 278 280 269  Total Area 14.65 Acre Built Up Area Whether Inherited N Purchase Date 1992-03-31 Purchase Cost 100000.00 Development Cost 0.00  21,97,50,000 21 Crore+ Manapakkam Village Sriperumbudur Taluk S No-293/2 293/3  Total Area 1.07 Acre Built Up Area Whether Inherited N Purchase Date 1983-12-15 Purchase Cost 12900.00 Development Cost 0.00  3,21,00,000 3 Crore+ Mannur Village S No-548/2 549/1B 549/2A Total Area 2 Acres 80 Cents Built Up Area Whether Inherited N Purchase Date 2018-03-31 Purchase Cost 8120000.00 Development Cost 0.00  1,62,40,000 1 Crore+ Mannur Village S No-659/3B  Total Area 1 Acre Built Up Area Whether Inherited N Purchase Date 2018-03-29 Purchase Cost 2900000.00 Development Cost 0.00  58,00,000 58 Lacs+ Mannur Village S No-658/1A1B 658/1A2 658/1B  Total Area 5 Acre 38 Cents Built Up Area Whether Inherited N Purchase Date 2018-03-29 Purchase Cost 15602000.00 Development Cost 0.00  3,12,04,000 3 Crore+ Mannur Village S No-656/1B5 656/2  Total Area 1 Acre 65 Cents Built Up Area Whether Inherited N Purchase Date 2018-12-03 Purchase Cost 6000000.00 Development Cost 0.00  1,20,00,000 1 Crore+",Nil,Nil,Nil,Nil,"Rs 1,80,03,32,760 180 Crore+"
2,ii,Non Agricultural Land,"Land and Tiled ConstructionNo-98,Porur Village, Saidpet 112/1A 112/2  Total Area 1825 Sq Ft Built Up Area Whether Inherited N Purchase Date 1986-07-04 Purchase Cost 42000.00 Development Cost 0.00  1,25,00,000 1 Crore+","No-98 Porur Village Saidapet,Taluk S No-112/1A 112/2  Total Area 2145 Sq Ft Built Up Area Whether Inherited N Purchase Date 1986-07-04 Purchase Cost 48390.00 Development Cost 0.00  1,25,00,000 1 Crore+ Plot No-15 Chellaperumal Nagar,Sriperumbudur Village, S No-1047/4A 4B  Total Area 2514 Sq Ft Built Up Area Whether Inherited N Purchase Date 2006-12-14 Purchase Cost 94275.00 Development Cost 0.00  10,54,800 10 Lacs+ Plot No-15 Chellaperumal Nagar,Sriperumbudur Village, S No-1047/4D  Total Area 3836 Sq Ft Built Up Area Whether Inherited N Purchase Date 2006-12-06 Purchase Cost 143850.00 Development Cost 0.00  16,11,120 16 Lacs+ Chitlapakkam Village,Tambaram Taluk,S No-1047/4A 4B/174/2A & 2B  Total Area 4753 Sq Ft Built Up Area Whether Inherited Y Purchase Date 2015-09-30 Purchase Cost 0.00 Development Cost 0.00  1,42,59,000 1 Crore+",Nil,Nil,Nil,Nil,"Rs 4,19,24,920 4 Crore+"
3,iii,Commercial Buildings,"3/36th Undivided Share in 5394 Sq Ft at D No-32/1 Mount Road,Guindy Chennai 600032 Balaji Towers TS No-13 Blk-3 Adayar Village  Total Area 840 Sq Ft Built Up Area Whether Inherited N Purchase Date 1995-03-31 Purchase Cost 430902.00 Development Cost 0.00  1,87,50,000 1 Crore+ 251 Poonamalee High Road,Aminjikarai Chennai-600029 S No-TS No-31,BLK-27 1/5th Share  Total Area 3872 Sq Ft Built Up Area Whether Inherited N Purchase Date 1981-03-30 Purchase Cost 250000.00 Development Cost 0.00  93,75,000 93 Lacs+ 255 Poonamalee High Road,Aminjikarai,Chennai 600029,TS No-31,Blk-27 1/3 Undivided 4410 Sq Ft  Total Area 1470 Sq Ft Built Up Area Whether Inherited Y Purchase Date 1981-03-30 Purchase Cost 54500.00 Development Cost 0.00  93,75,000 93 Lacs+ Plot No-7,B2 New Colony Koyambedu TS No-12 Blk-2  Total Area 2.50 Cents Built Up Area Whether Inherited N Purchase Date 2018-09-24 Purchase Cost 5100000.00 Development Cost 0.00  75,00,000 75 Lacs+ Plot No-7,B3 New Colony Koyambedu TS No-12 Blk-2 Total Area 2.50 Cents Built Up Area Whether Inherited N Purchase Date 2018-09-24 Purchase Cost 5100000.00 Development Cost 0.00  75,00,000 75 Lacs+ No-250 Poonamalee High Road,Aminjikarai, S No-70/5,1/3 Share in 3872 Sq Ft  Total Area 1291 Sq Ft Built Up Area Whether Inherited Y Purchase Date 1981-03-30 Purchase Cost 250000.00 Development Cost 0.00  1,61,37,500 1 Crore+","D No-74/1 Mount Road Guindy Chennai 600032 Balaji Towers, TS No-13 BLK 2(3) Adayar Village  Total Area 5394 Sq Ft Built Up Area Whether Inherited N Purchase Date 1995-03-20 Purchase Cost 430902.00 Development Cost 0.00  1,87,50,000 1 Crore+",Nil,Nil,Nil,Nil,"Rs 8,73,87,500 8 Crore+"
4,iv,Residential Buildings,"1/2 Undivided Share in 5000 Sq Ft and Building at Plot No-1202 Z Blk 6th Avenue Anna Nagar Chennai 600040 TS No-127 Part  Total Area 2500 Sq Ft Built Up Area Whether Inherited N Purchase Date 1992-11-11 Purchase Cost 1797200.00 Development Cost 0.00  5,00,00,000 5 Crore+ N-137 Velachery Main Road,Chennai 438/1 Part 1/30 Share  Total Area 581 Sq Ft Built Up Area Whether Inherited N Purchase Date 1995-10-19 Purchase Cost 62790.00 Development Cost 0.00  18,00,000 18 Lacs+","Plot No-1202 Z Block 6th Avenue Anna Nagar Chennai 600040 TS No-127 Part  Total Area 5000 Sq Ft Built Up Area Whether Inherited N Purchase Date 1992-03-30 Purchase Cost 1797200.00 Development Cost 0.00  5,00,00,000 5 Crore+ No-12 6th Cross Street Shenoy Nagar,Chennai 600030  Total Area 2640 Sq Ft Built Up Area Whether Inherited N Purchase Date 1989-09-08 Purchase Cost 360000.00 Development Cost 0.00  3,16,00,000 3 Crore+ Land and Building at Triplicane OS No-764 RS No-1111  Total Area 990 Sq Ft Built Up Area 990 Sq Ft Whether Inherited N Purchase Date 2015-09-27 Purchase Cost 0.00 Development Cost 0.00  71,28,000 71 Lacs+",Nil,Nil,Nil,Nil,"Rs 14,05,28,000 14 Crore+"
5,v,Others,Nil,Nil,Nil,Nil,Nil,Nil,Nil
6,Total Current Market Value of (i) to (v) (as per Affidavit),Total Current Market Value of (i) to (v) (as per Affidavit),"1,30,16,41,500 130 Crore+","76,86,11,680 76 Crore+",Nil,Nil,Nil,Nil,"Rs 2,07,02,53,180 207 Crore+"
7,Totals Calculated,Totals Calculated,"Rs 1,30,16,41,500 130 Crore+","Rs 76,85,31,680 76 Crore+",Nil,Nil,Nil,Nil,"Rs 2,07,01,73,180 207 Crore+"
