,0,1,2,3,4,5,6,7,8
0,Sr No,Description,self,spouse,huf,dependent1,dependent2,dependent3,
1,i,Agricultural Land,"Sora, Ahmedpur Latur Total Area 3 Acre Built Up Area Whether Inherited N Purchase Date 1997-05-16 Purchase Cost 62000.00 Development Cost 0.00  60,00,000 60 Lacs+ Kurwande , Taluka Mawal Jhila Pune Total Area 10 Acre Built Up Area Whether Inherited N Purchase Date 2021-04-06 Purchase Cost 29351000.00 Development Cost 0.00  5,36,00,000 5 Crore+","Chiveri Gat No. 301  Total Area 14.5 Acre Built Up Area Whether Inherited Y Purchase Date 0000-00-00 Purchase Cost 0.00 Development Cost 0.00  70,00,000 70 Lacs+",Nil,Nil,Nil,Nil,"Rs 6,66,00,000 6 Crore+"
2,ii,Non Agricultural Land,Nil,Nil,Nil,Nil,Nil,Nil,Nil
3,iii,Commercial Buildings,Nil,"Shivraj Height , CTS E/268, Khar Total Area 3100 Sq Ft Built Up Area 4650 Sq Ft Whether Inherited N Purchase Date 2013-09-23 Purchase Cost 60500000.00 Development Cost 0.00  32,05,00,000 32 Crore+",Nil,Nil,Nil,Nil,"Rs 32,05,00,000 32 Crore+"
4,iv,Residential Buildings,"Presidential tower CTS167 Ghatkopar Total Area 800Sq Ft +800 Sq Ft Built Up Area 1100 +1100 sq Ft Whether Inherited N Purchase Date 2005-04-01 Purchase Cost 1900000.00 Development Cost 0.00  1,76,00,000 1 Crore+ Krishna Height CTS E/473 Khar Total Area 1100 Sq Ft Built Up Area 1500 Sq Ft Whether Inherited N Purchase Date 2007-07-17 Purchase Cost 3500000.00 Development Cost 0.00  3,85,00,000 3 Crore+",Nil,Nil,Nil,Nil,Nil,"Rs 5,61,00,000 5 Crore+"
5,v,Others,"Revolver Total Area Built Up Area Whether Inherited N Purchase Date 0000-00-00 Purchase Cost 0.00 Development Cost 0.00  62,000 62 Thou+ Household  Total Area Built Up Area Whether Inherited N Purchase Date 0000-00-00 Purchase Cost 0.00 Development Cost 0.00  7,50,000 7 Lacs+","AC Total Area Built Up Area Whether Inherited N Purchase Date 0000-00-00 Purchase Cost 0.00 Development Cost 0.00  3,30,934 3 Lacs+ Household Total Area Built Up Area Whether Inherited N Purchase Date 0000-00-00 Purchase Cost 0.00 Development Cost 0.00  3,60,000 3 Lacs+",Nil,Nil,Nil,Nil,"Rs 15,02,934 15 Lacs+"
6,Total Current Market Value of (i) to (v) (as per Affidavit),Total Current Market Value of (i) to (v) (as per Affidavit),"11,65,12,000 11 Crore+","13,76,90,934 13 Crore+",Nil,Nil,Nil,Nil,"Rs 25,42,02,934 25 Crore+"
7,Totals Calculated,Totals Calculated,"Rs 11,65,12,000 11 Crore+","Rs 32,81,90,934 32 Crore+",Nil,Nil,Nil,Nil,"Rs 44,47,02,934 44 Crore+"
