,0,1,2,3,4,5,6,7,8
0,Sr No,Description,self,spouse,huf,dependent1,dependent2,dependent3,
1,i,Agricultural Land,"Bhurkunda P.S.-Goghat Dist, Hooghly State of West Bengal, Khatian No-75, JL- No-7 Mouza-Bhurkunda  Total Area 1 acre 3 Bigha Built Up Area Whether Inherited Y Purchase Date 0000-00-00 Purchase Cost 0.00 Development Cost 0.00  15,00,000 15 Lacs+",Nil,Nil,Nil,Nil,Nil,"Rs 15,00,000 15 Lacs+"
2,ii,Non Agricultural Land,"Kotalpur P.S. Kotalpur Dist Bankura State of W.B. Dag No-4059 Mouza-Kotalpur  Total Area 7200 sq.ft Built Up Area Whether Inherited Y Purchase Date 0000-00-00 Purchase Cost 0.00 Development Cost 0.00  20,00,000 20 Lacs+",Nil,Nil,Nil,Nil,Nil,"Rs 20,00,000 20 Lacs+"
3,iii,Commercial Buildings,"6, Taltala Bazar Street Kolkata-700016, P.S. Taltala State of West Bengal  Total Area 1206.6 sq.ft Built Up Area 1200 sq.ft Whether Inherited Y Purchase Date 0000-00-00 Purchase Cost 0.00 Development Cost 0.00  75,00,000 75 Lacs+",Nil,Nil,Nil,Nil,Nil,"Rs 75,00,000 75 Lacs+"
4,iv,Residential Buildings,"5, Ripon Lane Kolkata-700016, P.S. Park Street State of West Bengal  Total Area 1500 sq.ft Built Up Area 1500 sq.ft Whether Inherited Y Purchase Date 0000-00-00 Purchase Cost 0.00 Development Cost 0.00  70,00,000 70 Lacs+",Nil,Nil,Nil,Nil,Nil,"Rs 70,00,000 70 Lacs+"
5,v,Others,Nil,Nil,Nil,Nil,Nil,Nil,Nil
6,Total Current Market Value of (i) to (v) (as per Affidavit),Total Current Market Value of (i) to (v) (as per Affidavit),"1,80,00,000 1 Crore+",Nil,Nil,Nil,Nil,Nil,"Rs 1,80,00,000 1 Crore+"
7,Totals Calculated,Totals Calculated,"Rs 1,80,00,000 1 Crore+",Nil,Nil,Nil,Nil,Nil,"Rs 1,80,00,000 1 Crore+"
