,0,1,2,3,4,5,6,7,8
0,Sr No,Description,self,spouse,huf,dependent1,dependent2,dependent3,
1,i,Agricultural Land,"Vill. Molnapur, Pargana Katehar, Tehsil Sadar, Varanasi, Aa No. 519, Ancestral Property, 1/3 Share  Total Area 0.8056 Acre Built Up Area Whether Inherited N Purchase Date 2021-10-13 Purchase Cost 0.00 Development Cost 0.00  1,05,00,000 1 Crore+ Vill. Raghunathpur, Pargana Kaswar Raja, Dist. Varanasi, Aa No. 89, 300  Total Area 0.6000 Acre Built Up Area Whether Inherited Y Purchase Date 0000-00-00 Purchase Cost 0.00 Development Cost 0.00  45,00,000 45 Lacs+ Vill. Daurharan, Pargana Katehar, Dist. Varanasi, Aa. No. 605, 610, 296, 295  Total Area 0.1802 Acre Built Up Area Whether Inherited Y Purchase Date 0000-00-00 Purchase Cost 0.00 Development Cost 0.00  10,00,000 10 Lacs+ Vill. Molnapur, Pargana Katehar, Dist. Varanasi, Aa No. 293, 293/1, 85  Total Area 0.1045 Acre Built Up Area Whether Inherited Y Purchase Date 0000-00-00 Purchase Cost 0.00 Development Cost 0.00  6,00,000 6 Lacs+ Vill. Raghunathpur, Pargana Kasvar Raja, Dist. Varanasi  Total Area 0.2016 Acre Built Up Area Whether Inherited Y Purchase Date 0000-00-00 Purchase Cost 0.00 Development Cost 0.00  15,00,000 15 Lacs+","Vill. Kapsethi, Pargana Kaswar Raja, Tehsil Rajatalab Sadar, Varanasi  Total Area 0.2203 Acre Built Up Area Whether Inherited N Purchase Date 2021-05-29 Purchase Cost 0.00 Development Cost 0.00  30,00,000 30 Lacs+",Nil,Nil,Nil,Nil,"Rs 2,11,00,000 2 Crore+"
2,ii,Non Agricultural Land,"Vill. Parasi, Dist. Sonbhadra Mouza Aa. No. 270, 6 Biswa  Total Area 8160 sqft Built Up Area Whether Inherited N Purchase Date 1997-04-20 Purchase Cost 41100.00 Development Cost 0.00  10,00,000 10 Lacs+ Vill. Kapsethi Kaswar Raja Varanasi, Aa No. 816, 25 Dismil  Total Area 10880 sqft Built Up Area Whether Inherited N Purchase Date 2003-06-16 Purchase Cost 138570.00 Development Cost 0.00  25,00,000 25 Lacs+ Vill. Molnapur, Pargana Katehar, Tehsil Sadar, Varanasi, Aa No. 513  Total Area 7101.60 sqft Built Up Area Whether Inherited N Purchase Date 2021-12-03 Purchase Cost 3510610.00 Development Cost 0.00  36,00,000 36 Lacs+","Vill. Kapsethi, Kaswaraja, Varanasi, Aa No. 816, 817, 818, 39.5 Dismil  Total Area 1791 sqft Built Up Area Whether Inherited N Purchase Date 2004-08-09 Purchase Cost 410260.00 Development Cost 500000.00  25,00,000 25 Lacs+ Vill. Alinagar, Pargana Ghus, Tehsil PDDU Nagar, Sadar, Chandauli, Aa No. 135  Total Area 1574 sqft Built Up Area Whether Inherited N Purchase Date 2021-02-08 Purchase Cost 629030.00 Development Cost 0.00  7,50,000 7 Lacs+ Vill. Mugalchak, Pargana Ghus, Tehsil PDDU Nagar, Sadar, Chandauli, Aa No. 330/3, 331/1, 332/1, 332  Total Area 2541 sqft Built Up Area Whether Inherited N Purchase Date 2021-02-08 Purchase Cost 868480.00 Development Cost 0.00  10,00,000 10 Lacs+ Vill. Mugalchak, Pargana Ghus, Tehsil PDDU Nagar, Sadar, Chandauli, Aa No. 331/1, Mi. 332, 333/5, 342/11  Total Area 5114 sqft Built Up Area Whether Inherited N Purchase Date 2020-07-31 Purchase Cost 2708000.00 Development Cost 0.00  30,00,000 30 Lacs+ Vill. Mugalchak, Pargana Ghus, Tehsil PDDU Nagar, Sadar, Chandauli, Aa No. 330/3  Total Area 3013 sqft Built Up Area Whether Inherited N Purchase Date 2020-07-31 Purchase Cost 3150000.00 Development Cost 0.00  35,00,000 35 Lacs+ Vill. Alinagar, Pargana Ghus, Tehsil PDDU Nagar, Sadar, Chandauli, Aa No. 135  Total Area 1574 sqft Built Up Area Whether Inherited N Purchase Date 2021-02-08 Purchase Cost 629030.00 Development Cost 0.00  7,50,000 7 Lacs+ Vill. Mugalchak, Pargana Ghus, Tehsil PDDU Nagar, Sadar, Chandauli, Aa No. 330/3, 331/1, 332/1, 332  Total Area 2663 sqft Built Up Area Whether Inherited N Purchase Date 2021-02-08 Purchase Cost 921350.00 Development Cost 0.00  10,00,000 10 Lacs+ Vill. Mugalchak, Pargana Ghus, Tehsil PDDU Nagar, Sadar, Chandauli, Aa No. 330/3, 331/1, 332/1, 332  Total Area 2234 sqft Built Up Area Whether Inherited N Purchase Date 2021-05-31 Purchase Cost 868400.00 Development Cost 0.00  9,00,000 9 Lacs+",Nil,Nil,Nil,Nil,"Rs 2,05,00,000 2 Crore+"
3,iii,Commercial Buildings,"Vill. Bicchiyakala, Majhwar Chandauli Aa No. 285D, 285E, 30.67 Dismil  Total Area 13348 sqft Built Up Area 8225 sqft Whether Inherited N Purchase Date 1998-05-29 Purchase Cost 100220.00 Development Cost 301640.00  96,00,000 96 Lacs+",Nil,Nil,Nil,Nil,Nil,"Rs 96,00,000 96 Lacs+"
4,iv,Residential Buildings,"D-11, Basement Ground Floor, Saket, New Delhi, Total Area 374.8 sq.mtr., 1/2 Share 187.40 sq.mtr.  Total Area 2016 sqft Built Up Area 1687 sqft Whether Inherited N Purchase Date 2010-06-23 Purchase Cost 7888125.00 Development Cost 0.00  2,50,00,000 2 Crore+ Vill. Raghunathpur, Pargana Kaswaraja, Dist. Varanasi, Aa No. 816, 817, 818  Total Area 3620 sqft Built Up Area 3620 sqft Whether Inherited Y Purchase Date 0000-00-00 Purchase Cost 0.00 Development Cost 0.00  25,00,000 25 Lacs+ Vill. Dhaurhara, Pargana Katehar, Dist. Varanasi  Total Area 181 sqft Built Up Area 181 sqft Whether Inherited Y Purchase Date 0000-00-00 Purchase Cost 0.00 Development Cost 0.00  2,50,000 2 Lacs+ D 59/235A-K, Niralanagar Colony, Mahmurganj, Varanasi  Total Area 3200 sqft Built Up Area 1200 sqft Whether Inherited Y Purchase Date 0000-00-00 Purchase Cost 0.00 Development Cost 0.00  3,00,00,000 3 Crore+","B-1/144, V.Kh. Gomatinagar, Lucknow, 336 sq.mtr., 1/3 Share 112 sq.mtr.  Total Area 1205 sqft Built Up Area 1457 sqft Whether Inherited N Purchase Date 2005-05-09 Purchase Cost 1654840.00 Development Cost 0.00  70,00,000 70 Lacs+ D 11 Basement, Ground Floor, Saket, New Delhi, 374.8 sq.mtr., 1/2 Share, 187.4 sq.mtr.  Total Area 2016 sqft Built Up Area 1687 sqft Whether Inherited N Purchase Date 2010-06-23 Purchase Cost 7888125.00 Development Cost 0.00  2,50,00,000 2 Crore+",Nil,Nil,Nil,Nil,"Rs 8,97,50,000 8 Crore+"
5,v,Others,Nil,"Harsh Construction Varansi, Aa No. 205 Vara., 1820.40 sq.mtr., 1/4 Share, 455.1 sq.mtr.  Total Area Built Up Area Whether Inherited N Purchase Date 0000-00-00 Purchase Cost 0.00 Development Cost 0.00  17,80,000 17 Lacs+",Nil,Nil,Nil,Nil,"Rs 17,80,000 17 Lacs+"
6,Total Current Market Value of (i) to (v) (as per Affidavit),Total Current Market Value of (i) to (v) (as per Affidavit),"9,25,50,000 9 Crore+","5,01,80,000 5 Crore+",Nil,Nil,Nil,Nil,"Rs 14,27,30,000 14 Crore+"
7,Totals Calculated,Totals Calculated,"Rs 9,25,50,000 9 Crore+","Rs 5,01,80,000 5 Crore+",Nil,Nil,Nil,Nil,"Rs 14,27,30,000 14 Crore+"
