,0,1,2,3,4,5,6,7,8
0,Sr No,Description,self,spouse,huf,dependent1,dependent2,dependent3,
1,i,Agricultural Land,"Seithekiema-A Village, Dimapur  Total Area 380 Acres Built Up Area Whether Inherited Y Purchase Date 0000-00-00 Purchase Cost 0.00 Development Cost 2028980.00  38,00,000 38 Lacs+ Razhaphe- Basa Nagaland, Inherited- 36.7 Acres, Purchased- 62 Acres  Total Area 98.7 Acres Built Up Area Whether Inherited N Purchase Date 2001-01-01 Purchase Cost 1610000.00 Development Cost 7646550.00  1,25,00,000 1 Crore+ Razhaphe- Bawe Nagaland  Total Area 51.25 Acres Built Up Area Whether Inherited Y Purchase Date 0000-00-00 Purchase Cost 0.00 Development Cost 3257800.00  35,00,000 35 Lacs+ Sukhuvi Nagaland  Total Area 120 Acres Built Up Area Whether Inherited N Purchase Date 1996-01-01 Purchase Cost 1500000.00 Development Cost 350000.00  28,00,000 28 Lacs+ Sovima Village Nagaland, Inherited- 58 Acres, Purchased- 48 Acres  Total Area 106 Acre Built Up Area Whether Inherited N Purchase Date 1991-01-01 Purchase Cost 2458000.00 Development Cost 26576130.00  3,20,00,000 3 Crore+ Tuophema Village Nagaland  Total Area 18.5 Acres Built Up Area Whether Inherited Y Purchase Date 0000-00-00 Purchase Cost 0.00 Development Cost 993955.00  12,00,000 12 Lacs+ Nedziphema Nagaland  Total Area 15 Acres Built Up Area Whether Inherited N Purchase Date 1995-01-01 Purchase Cost 60000.00 Development Cost 598600.00  7,50,000 7 Lacs+ Terryiphe II Nagaland  Total Area 3 Acres Built Up Area Whether Inherited Y Purchase Date 0000-00-00 Purchase Cost 0.00 Development Cost 131885.00  3,50,000 3 Lacs+ Sovima Village Nagaland  Total Area 5.67 Acres Built Up Area Whether Inherited Y Purchase Date 0000-00-00 Purchase Cost 0.00 Development Cost 0.00  20,00,000 20 Lacs+","Molvon Village Nagaland  Total Area 30 Acres Built Up Area Whether Inherited Y Purchase Date 0000-00-00 Purchase Cost 0.00 Development Cost 0.00  60,00,000 60 Lacs+ Molvon Village Nagaland  Total Area 25 Acres Built Up Area Whether Inherited N Purchase Date 2010-11-01 Purchase Cost 980000.00 Development Cost 482800.00  50,00,000 50 Lacs+",Nil,Nil,Nil,Nil,"Rs 6,99,00,000 6 Crore+"
2,ii,Non Agricultural Land,"Tseikhouchatsa Kohima Nagaland  Total Area 46500 sq ft Built Up Area Whether Inherited N Purchase Date 2007-07-10 Purchase Cost 500000.00 Development Cost 1132700.00  22,00,000 22 Lacs+ Bypass Junction Below Govt. High School, Kohima  Total Area 30000 sq ft Built Up Area Whether Inherited N Purchase Date 2009-04-29 Purchase Cost 2500000.00 Development Cost 21884680.00  2,60,00,000 2 Crore+ Tenyiphe II Nagaland  Total Area 3 Acres Built Up Area Whether Inherited Y Purchase Date 0000-00-00 Purchase Cost 0.00 Development Cost 131885.00  20,00,000 20 Lacs+","Near Sanuoru Bridge Kohima Nagaland  Total Area 102387 sq ft Built Up Area Whether Inherited Y Purchase Date 0000-00-00 Purchase Cost 0.00 Development Cost 0.00  1,20,00,000 1 Crore+",Nil,Nil,Nil,Nil,"Rs 4,22,00,000 4 Crore+"
3,iii,Commercial Buildings,"Noune Resort Seithekiema A Village Nagaland  Total Area 7405200 sq ft Built Up Area 50000 sq ft Whether Inherited N Purchase Date 1999-01-01 Purchase Cost 1190000.00 Development Cost 54011560.00  6,00,00,000 6 Crore+ Elite Complex Building Circular Road Dimapur Nagaland  Total Area 14500 sq ft Built Up Area 12000 sq ft Whether Inherited N Purchase Date 1994-01-01 Purchase Cost 5405000.00 Development Cost 1616330.00  1,40,00,000 1 Crore+ Kenouzou Property Don Bosco Road Kohima Nagaland  Total Area 21000 sq ft Built Up Area 12700 sq ft Whether Inherited N Purchase Date 1977-01-01 Purchase Cost 8000.00 Development Cost 3801730.00  75,00,000 75 Lacs+ Niathu Resort Chumukedima Nagaland  Total Area 1524600 sq ft Built Up Area 120000 sq ft Whether Inherited N Purchase Date 2001-01-01 Purchase Cost 7725400.00 Development Cost 45438755.00  7,00,00,000 7 Crore+","Monkhola Kohima Nagaland  Total Area 6300 sq ft Built Up Area 4500 sq ft Whether Inherited Y Purchase Date 0000-00-00 Purchase Cost 0.00 Development Cost 6614241.00  1,25,00,000 1 Crore+ New Secretariat Kohima Nagaland  Total Area 20128 sq ft Built Up Area 400 sq ft Whether Inherited N Purchase Date 2014-01-01 Purchase Cost 750000.00 Development Cost 4749567.00  95,00,000 95 Lacs+",Nil,Nil,Nil,Nil,"Rs 17,35,00,000 17 Crore+"
4,iv,Residential Buildings,"Tuophema Village Kohima Nagaland  Total Area 46200 sq ft Built Up Area 8000 sq ft Whether Inherited Y Purchase Date 0000-00-00 Purchase Cost 0.00 Development Cost 3618500.00  50,00,000 50 Lacs+","Flat at Games Village Guwahati  Total Area 1070 sq ft Built Up Area 1070 sq ft Whether Inherited N Purchase Date 2007-05-22 Purchase Cost 3870500.00 Development Cost 0.00  60,00,000 60 Lacs+ Flat at National Media Centre Gurgaon, Haryana  Total Area 2250 sq ft Built Up Area 2000 sq ft Whether Inherited N Purchase Date 2009-05-13 Purchase Cost 5016000.00 Development Cost 0.00  1,30,00,000 1 Crore+",Nil,Nil,Nil,Nil,"Rs 2,40,00,000 2 Crore+"
5,v,Others,Nil,Nil,Nil,Nil,Nil,Nil,Nil
6,Total Current Market Value of (i) to (v) (as per Affidavit),Total Current Market Value of (i) to (v) (as per Affidavit),"24,56,00,000 24 Crore+","6,40,00,000 6 Crore+",Nil,Nil,Nil,Nil,"Rs 30,96,00,000 30 Crore+"
7,Totals Calculated,Totals Calculated,"Rs 24,56,00,000 24 Crore+","Rs 6,40,00,000 6 Crore+",Nil,Nil,Nil,Nil,"Rs 30,96,00,000 30 Crore+"
