,0,1,2,3,4,5,6,7,8
0,Sr No,Description,self,spouse,huf,dependent1,dependent2,dependent3,
1,i,Agricultural Land,"Newpur Sherpur Jitapur Jijoli Area-1,1,2,7 Acre  Total Area Built Up Area Whether Inherited N Purchase Date 2009-03-02 Purchase Cost 6000000.00 Development Cost 0.00  90,00,000 90 Lacs+","Jijoli  Total Area 7 Acre Built Up Area Whether Inherited N Purchase Date 2009-01-02 Purchase Cost 2450000.00 Development Cost 0.00  58,00,000 58 Lacs+",Nil,Nil,Nil,Nil,"Rs 1,48,00,000 1 Crore+"
2,ii,Non Agricultural Land,"Dayal Brick Field Jitamu  Total Area .450 Acre Built Up Area Whether Inherited Y Purchase Date 0000-00-00 Purchase Cost 0.00 Development Cost 0.00  40,00,000 40 Lacs+",Nil,Nil,Nil,Nil,Nil,"Rs 40,00,000 40 Lacs+"
3,iii,Commercial Buildings,"Nyamupur Kala Telephone Total Area 300 Sq Ft Built Up Area Whether Inherited Y Purchase Date 0000-00-00 Purchase Cost 0.00 Development Cost 0.00  15,00,000 15 Lacs+",Nil,Nil,Nil,Nil,Nil,"Rs 15,00,000 15 Lacs+"
4,iv,Residential Buildings,"Nayepur Kala Total Area 4000 Sq Ft Built Up Area Whether Inherited N Purchase Date 0000-00-00 Purchase Cost 0.00 Development Cost 0.00  45,00,000 45 Lacs+ Ghaziabad  Total Area 3230 Sq Ft Built Up Area Whether Inherited N Purchase Date 2010-08-05 Purchase Cost 3894000.00 Development Cost 0.00  1,04,00,000 1 Crore+","Residential House Lucknow  Total Area 2072 Sq Ft Built Up Area Whether Inherited N Purchase Date 2010-06-08 Purchase Cost 1900000.00 Development Cost 0.00  52,00,000 52 Lacs+",Nil,Nil,Nil,Nil,"Rs 2,01,00,000 2 Crore+"
5,v,Others,"Riffle Total Area Built Up Area Whether Inherited N Purchase Date 0000-00-00 Purchase Cost 0.00 Development Cost 0.00  40,000 40 Thou+ Revolver  Total Area Built Up Area Whether Inherited N Purchase Date 0000-00-00 Purchase Cost 0.00 Development Cost 0.00  62,000 62 Thou+ DBBL  Total Area Built Up Area Whether Inherited N Purchase Date 0000-00-00 Purchase Cost 0.00 Development Cost 0.00  10,000 10 Thou+","Riffle  Total Area Built Up Area Whether Inherited N Purchase Date 0000-00-00 Purchase Cost 0.00 Development Cost 0.00  60,000 60 Thou+",Nil,Nil,Nil,Nil,"Rs 1,72,000 1 Lacs+"
6,Total Current Market Value of (i) to (v) (as per Affidavit),Total Current Market Value of (i) to (v) (as per Affidavit),"2,95,12,000 2 Crore+","1,10,60,000 1 Crore+",Nil,Nil,Nil,Nil,"Rs 4,05,72,000 4 Crore+"
7,Totals Calculated,Totals Calculated,"Rs 2,95,12,000 2 Crore+","Rs 1,10,60,000 1 Crore+",Nil,Nil,Nil,Nil,"Rs 4,05,72,000 4 Crore+"
