,0,1,2,3,4,5,6,7,8
0,Sr No,Description,self,spouse,huf,dependent1,dependent2,dependent3,
1,i,Agricultural Land,Nil,Nil,Nil,Nil,Nil,Nil,Nil
2,ii,Non Agricultural Land,"Site No. 110 at Lingubudhi Village, Kasaha Hobli, Mysuru Taluk, maned as Indian Estate Crystal City  Total Area 1200 sq ft Built Up Area Whether Inherited N Purchase Date 2016-02-22 Purchase Cost 440000.00 Development Cost 0.00  15,00,000 15 Lacs+",Nil,Nil,Nil,Nil,Nil,"Rs 15,00,000 15 Lacs+"
3,iii,Commercial Buildings,"No. 33/5A, New No. L1/1, Gift Date- 31/07/2018  Total Area 12000 sq ft Built Up Area 3800 sq ft Whether Inherited Y Purchase Date 0000-00-00 Purchase Cost 0.00 Development Cost 0.00  7,25,00,000 7 Crore+",Nil,Nil,Nil,Nil,Nil,"Rs 7,25,00,000 7 Crore+"
4,iv,Residential Buildings,"G-2, Ground Floor, Sri Vadrevu, Benson A Cross Road, Bengaluru  Total Area 1765 sq ft Built Up Area 1765 sq ft Whether Inherited N Purchase Date 2015-11-06 Purchase Cost 10600000.00 Development Cost 0.00  1,75,00,000 1 Crore+ 21/2, Old No. 82, Spender Road, Frazer Town Bengaluru  Total Area 4260 sq ft Built Up Area 8500 sq ft Whether Inherited N Purchase Date 2016-03-21 Purchase Cost 37200000.00 Development Cost 46340595.00  10,00,00,000 10 Crore+",Nil,Nil,Nil,Nil,Nil,"Rs 11,75,00,000 11 Crore+"
5,v,Others,Nil,"21/2, Old No. 82, Spencer Road, Frazer Town, Brngaluru  Total Area 4260 sq ft Built Up Area Whether Inherited N Purchase Date 0000-00-00 Purchase Cost 0.00 Development Cost 0.00  64,12,000 64 Lacs+",Nil,Nil,Nil,Nil,"Rs 64,12,000 64 Lacs+"
6,Total Current Market Value of (i) to (v) (as per Affidavit),Total Current Market Value of (i) to (v) (as per Affidavit),"19,15,00,000 19 Crore+","64,12,000 64 Lacs+",Nil,Nil,Nil,Nil,"Rs 19,79,12,000 19 Crore+"
7,Totals Calculated,Totals Calculated,"Rs 19,15,00,000 19 Crore+","Rs 64,12,000 64 Lacs+",Nil,Nil,Nil,Nil,"Rs 19,79,12,000 19 Crore+"
