,0,1,2,3,4,5,6,7,8
0,Sr No,Description,self,spouse,huf,dependent1,dependent2,dependent3,
1,i,Agricultural Land,"Maddirevula Village, Lakkireddypalli Mandal, Annamaiah District, Andhra Pradesh, Survey No. 240  Total Area 5.84 Acres Built Up Area Whether Inherited N Purchase Date 2007-10-18 Purchase Cost 163520.00 Development Cost 0.00  1,16,80,000 1 Crore+ 2. Papireddyguda Village, Keshampeta Mandal, Ranga Reddy Dist., Telangana, Survey No. 20/A  Total Area 4.00 Acres Built Up Area Whether Inherited N Purchase Date 2021-09-20 Purchase Cost 10344190.00 Development Cost 0.00  4,00,00,000 4 Crore+ 3. Papireddyguda Village, Keshampeta Mandal, Ranga Reddy Dist.,, Telangana, Survey No. 57/A6, 19/A, 20/E, 49/A, 19/R  Total Area 19.14 Acres Built Up Area Whether Inherited N Purchase Date 2021-09-20 Purchase Cost 50045651.00 Development Cost 0.00  19,14,00,000 19 Crore+ 4. Papireddyguda Village, Keshampeta Mandal, Ranga Reddy Dist, Telangana Survey No. 19/A, 20/A  Total Area 18.27 Acres Built Up Area Whether Inherited N Purchase Date 2021-09-16 Purchase Cost 48300363.00 Development Cost 0.00  18,27,00,000 18 Crore+","1 Mamillapalli, C K Dinne Mandal, Kadapa, Dstrict, Andhra Pradesh, Survey Nos. 224/2, 224/3, 224/4, 224/5 225/1, 225/2, 225/3, 226, 227. 223/1, 223/2, 223/3?, 223/3B, 223/4A, 223/4C, 219/2  Total Area 10.985 Acres Built Up Area Whether Inherited N Purchase Date 2008-09-06 Purchase Cost 5789495.00 Development Cost 0.00  54,92,50,000 54 Crore+ 2 Mamillapalli, C K Dinne Mandal, Kadapa District, Andhra Pradesh, Survey Nos. 228, 229, 230/1, 230/2, 231,  Total Area 04.22 Acres Built Up Area Whether Inherited N Purchase Date 2013-03-28 Purchase Cost 2722300.00 Development Cost 0.00  21,10,00,000 21 Crore+ 3 Upparapalli Village, Chennur Mandal, Kadapa District, Andhra Pradesh, Survey No. 37-1, 37-2, 38-2, 283, 284, 285, 286, 287, 288  Total Area 11.39 Acres Built Up Area Whether Inherited N Purchase Date 1985-09-02 Purchase Cost 15000.00 Development Cost 0.00  2,84,75,000 2 Crore+ 4 Abbavaramvillge, Rayachoty Sub Divsion, Rayachoty, Annamaiah District, Andhra Pradesh, Survey Nos. 476-7  Total Area 1.00 Acres Built Up Area Whether Inherited N Purchase Date 2022-03-17 Purchase Cost 435000.00 Development Cost 0.00  96,25,000 96 Lacs+ 5 Abbavaramvillge, Rayachoty Sub Divsion, Rayachoty, Annamaiah District, Andhra Pradesh, Survey Nos. 476  Total Area 0.10 A cres Built Up Area Whether Inherited N Purchase Date 2022-03-17 Purchase Cost 64000.00 Development Cost 0.00  14,00,000 14 Lacs+ 6 Khapsa Gollapalli, Rayachoty Municipality, Rayachoty, Annamaiah District, Andhra Pradesh, Survey No. 24-3A  Total Area 0.25 Acres Built Up Area Whether Inherited N Purchase Date 2022-03-17 Purchase Cost 958000.00 Development Cost 0.00  29,75,000 29 Lacs+","1. Sivalpalli Village, Chennur Mandal, KAdapa District, Andhra Pradesh, Survey Nos. 35/1, 47/1, 143/1, 144, 192/4, 160/2  Total Area 5.11 Acres Built Up Area Whether Inherited N Purchase Date 2005-03-17 Purchase Cost 251390.00 Development Cost 0.00  2,20,00,000 2 Crore+ 2. LR Palli, vi & Mandal, Annamaiah District, Andhra Pradesh Survey No. 901,902, 905, 889, 890/1,890/2, 842, 797, 800, 798, 1073, 806, 807, 808/2  Total Area 13.19 Acres Built Up Area Whether Inherited Y Purchase Date 0000-00-00 Purchase Cost 0.00 Development Cost 0.00  1,85,00,000 1 Crore+",Nil,Nil,Nil,"Rs 1,26,90,05,000 126 Crore+"
2,ii,Non Agricultural Land,"1. Pabbapuram, CK Dinne Mandal, Ksadapa District, Andhra Pradesh, Sy. No. 92/1  Total Area 276.86 Sq.yds Built Up Area Whether Inherited N Purchase Date 2023-07-01 Purchase Cost 432650.00 Development Cost 0.00  11,07,440 11 Lacs+ 2. Pabbapuram, CK Dinne Mandal, Kadapa District, Andhra Pradesh, Sy. No. 92/1  Total Area 245.88 Sq yds Built Up Area Whether Inherited N Purchase Date 2023-07-01 Purchase Cost 384280.00 Development Cost 0.00  9,83,520 9 Lacs+ 3. Pabbapuram, CK Dinne Mandal, Kadapa District, Andhra Pradesh, Sy. No. 92/1  Total Area 269.11 Sq. yds Built Up Area Whether Inherited N Purchase Date 2023-07-01 Purchase Cost 420830.00 Development Cost 0.00  10,76,440 10 Lacs+ 4. Pabbapuram, CK Dinne Mandal, Kadapa District, Andhra Pradesh, Sy. No. 92/1  Total Area 261.37 Sq. yds Built Up Area Whether Inherited N Purchase Date 2023-07-01 Purchase Cost 407930.00 Development Cost 0.00  10,45,480 10 Lacs+ 5. Pabbapuram, CK Dinne Mandal, Kadapa District, Andhra Pradesh, Sy. No. 92/1  Total Area 253.63 Sq. yds Built Up Area Whether Inherited N Purchase Date 2023-07-01 Purchase Cost 396100.00 Development Cost 0.00  10,45,480 10 Lacs+ 6. Bramhanapalli, Ward 4 Pulivendula, Kadapa District, Andhra Pradesh, Sv, No. 291/2A1C, Gift From Spouse  Total Area 745.55 Sq. yds Built Up Area Whether Inherited N Purchase Date 2023-07-10 Purchase Cost 0.00 Development Cost 0.00  1,50,00,000 1 Crore+","1.17th Ward, Sanjeeva Nagar Colony, Rayachoty Annamaiah District, Andhra Pradesh, Sy. No. 789/2B  Total Area . 527.77 Sq. Yards Built Up Area Whether Inherited N Purchase Date 2022-01-07 Purchase Cost 3484000.00 Development Cost 0.00  4,00,00,000 4 Crore+ 2. Lakkireddypalli vi & Mandal, Annamaiah District, Andhra Pradesh, Sy No. 916  Total Area 1.30 acres Built Up Area Whether Inherited N Purchase Date 2022-07-08 Purchase Cost 260000.00 Development Cost 0.00  1,85,00,000 1 Crore+",Nil,Nil,Nil,Nil,"Rs 7,87,58,360 7 Crore+"
3,iii,Commercial Buildings,"1. 1/700, Nagarajupalli Village, Dwaraka Nagar, RS Road, Kadapa, District, Andhra Pradesh, Total Area 360.2 Sq. Yards Built Up Area 5585 Sq. fts. Whether Inherited N Purchase Date 2021-12-30 Purchase Cost 0.00 Development Cost 4695207.00  3,00,00,000 3 Crore+ 2. Ekta Pearl, Kothaguda Village, Seringampalli Mandal, Ranga Reddy District. Telangana, Survey No. 37  Total Area 522.76 Sq.Yards Built Up Area 10080 Sq.fts. Whether Inherited N Purchase Date 2012-05-26 Purchase Cost 13662500.00 Development Cost 0.00  9,00,00,000 9 Crore+ 3. ?. N o. 1-10-73/2/8, Lumbini Arcade, Begumpet Main Road, Secundrabad, Telangana, Survey No. 42 & 51  Total Area 857 Sq. fts. Built Up Area 857 Sq. fts. Whether Inherited N Purchase Date 1996-07-10 Purchase Cost 285000.00 Development Cost 0.00  70,00,000 70 Lacs+","1. 72/1, D. No. 1/700, Nagarajupalli Village, Dwaraka Nagar, RS Road, Kadapa District, Andhra Pradesh  Total Area 2543.8 Sq.yards Built Up Area 96000 Sq fts Whether Inherited N Purchase Date 2012-11-29 Purchase Cost 54120187.00 Development Cost 124698505.00  62,00,00,000 62 Crore+ 2. Ekta Pearl, Kothaguda, Village, Serilingampalli Mandal, RR Dist, Telangna, Sy. No. 37  Total Area 130.68 Sq. Yard Built Up Area 2520 Sq. fts. Whether Inherited N Purchase Date 2012-05-26 Purchase Cost 6372792.00 Development Cost 0.00  3,25,00,000 3 Crore+ 3. ?. ? 0. 6-3-665/207, Flat No. 207, Lumbini Enclave, Panjagutta, Hyderabad, Telangana  Total Area 64.87 Sq. Yards Built Up Area 1429 Sq. fts Whether Inherited N Purchase Date 1992-01-21 Purchase Cost 350000.00 Development Cost 0.00  1,00,00,000 1 Crore+ 4. Kurnoothala, Kastrurirajugaripalli, LRPalli, Annamaiah Distrcti, Andhra Pradesh, Sy. No. 36  Total Area 32 Cents Built Up Area 342 Sq. fts Whether Inherited N Purchase Date 2006-12-27 Purchase Cost 1127620.00 Development Cost 0.00  3,20,00,000 3 Crore+ 5. Kurnoothala, Kastrurirajugaripalli, LRPalli, Annamaiah Distrcti, Andhra Pradesh Sy. No. 876/5  Total Area 4 cents Built Up Area 200.25 Sq. fts. Whether Inherited N Purchase Date 2009-01-07 Purchase Cost 75660.00 Development Cost 0.00  40,00,000 40 Lacs+ 6. Bramhanapalli Ward 4, Pulivendulat, Kadpa Dist. Andhra Pradesh Sy No. 291/2A1C  Total Area 5 Cents Built Up Area 2615 Sq. fts Whether Inherited N Purchase Date 2023-02-09 Purchase Cost 4101000.00 Development Cost 6000000.00  1,64,60,000 1 Crore+","?. ? ?. 6-3-665/206 Flat No. 206, Lumbini Enclave, Panjagutta, Hyderabad.  Total Area 64.87 Sq. Yards Built Up Area 1494.22 Sq.Ft Whether Inherited N Purchase Date 2008-05-08 Purchase Cost 4312000.00 Development Cost 975900.00  1,00,00,000 1 Crore+",Nil,Nil,Nil,"Rs 85,19,60,000 85 Crore+"
4,iv,Residential Buildings,"1. Villa No. 27, Plot No. 27, Palm Ridge Villas, Kondapur Village, GHMC RR Dist., Telangana, Survey No. 195/1 and 196 (part) Hyderabad  Total Area 325 Sq. Yards Built Up Area 4240 Sq. fts. Whether Inherited N Purchase Date 2017-11-27 Purchase Cost 15972000.00 Development Cost 0.00  10,00,00,000 10 Crore+ 2. Villa No. B-22,, Nallagandla Village, GHMC RR Dist., Survey No. Survey No. 314 (Part) Hyderabad, Telangana  Total Area 222 Sq. Yards Built Up Area 3895 Sq. fts. Whether Inherited N Purchase Date 2018-05-22 Purchase Cost 11785100.00 Development Cost 0.00  5,00,00,000 5 Crore+ 3. Villa No. B-23,, Nallagandia Village, Survey No. Survey No. 314 (Part) Hyderabad, Telangana  Total Area 222 Sq. Yards Built Up Area 3895 Sq. fts. Whether Inherited N Purchase Date 2018-05-22 Purchase Cost 11785100.00 Development Cost 0.00  5,00,00,000 5 Crore+ 4. Municipal No 8-2- 293/82/A/624/A & A/ 1/C (PTIN NO.1100871442) forming Part of 120 SHAIKPET VILLAGE, Telangana and Survey No. 102/1 of HAKIMPET VILLAGE, admeasuring 414 Square Yards or 346.10 Square Meters  Total Area 414 Sq. Yards Built Up Area 8200 Sq. fts. Whether Inherited N Purchase Date 2023-05-05 Purchase Cost 86080523.00 Development Cost 0.00  12,00,00,000 12 Crore+ 5. Municipal No. 8-2- 293/82/A/624/A & A/ 1/B (PTIN NO.1100871442) forming Part of 120 (New) of SHAIKPET VILLAGE, Telangana and Survey No. 102/1 of HAKIMPET VILLAGE, admeasuring 414 Square Yards or 346.10 Square Meters  Total Area 414 Sq. Yards Built Up Area 8200 Sq. fts. Whether Inherited N Purchase Date 2023-09-22 Purchase Cost 67788561.80 Development Cost 0.00  12,00,00,000 12 Crore+ 6. Municipal No. 8-2- 293/82/A/624/A & A/ 1/A (PTIN NO.1100871442) forming Part of Plot No.624-A, in Survey Nos. 120 of SHAIKPET VILLAGE, Telangana and Survey No. 102/1 of HAKIMPET VILLAGE, admeasuring 414 Square Yards or 346.10 Square Meters  Total Area 414 Sq. Yards Built Up Area 8200 Sq. fts. Whether Inherited N Purchase Date 2023-05-17 Purchase Cost 74675073.00 Development Cost 0.00  12,00,00,000 12 Crore+ 7. Flat No.801, in Block:G, in 15th and 16thh Floor of ""THE WORLD AT JUBILEE HILLS"" forming part of survey NO.1,Block NO F, Ward No.9, Correlating to survey No.403 and 403/P, Shaikpet Village, Hyderabad, Telangana  Total Area 13410Sq.ft Built Up Area 13410 Sq. fts. Whether Inherited N Purchase Date 2023-01-23 Purchase Cost 119684250.00 Development Cost 0.00  20,00,00,000 20 Crore+","Municipal Corporation of Hyderabad bearing No. 8-2-293/82/J-III/110 Plot No. 110, Jubilee Hills, Road No. 72, on Hyderabad. Survey No. 403/1 (old) 120 (New) of Shaikpet Vi & 102/1 of Hakeempet Village, Telangana  Total Area 1027.69 Sq. Yards Built Up Area 6800 Sq.fts Whether Inherited N Purchase Date 2007-03-28 Purchase Cost 39435545.00 Development Cost 11431321.00  35,00,00,000 35 Crore+",Nil,Nil,Nil,Nil,"Rs 1,11,00,00,000 111 Crore+"
5,v,Others,Nil,Nil,Nil,Nil,Nil,Nil,Nil
6,Total Current Market Value of (i) to (v) (as per Affidavit),Total Current Market Value of (i) to (v) (as per Affidavit),"1,33,30,07,400 133 Crore+","1,92,61,85,000 192 Crore+","5,05,00,000 5 Crore+",Nil,Nil,Nil,"Rs 3,30,96,92,400 330 Crore+"
7,Totals Calculated,Totals Calculated,"Rs 1,33,30,38,360 133 Crore+","Rs 1,92,61,85,000 192 Crore+","Rs 5,05,00,000 5 Crore+",Nil,Nil,Nil,"Rs 3,30,97,23,360 330 Crore+"
