,0,1,2,3,4,5,6,7,8
0,Sr No,Description,self,spouse,huf,dependent1,dependent2,dependent3,
1,i,Agricultural Land,"Makhgohganj ward no.4/18, 1/6 share in 4.59 d TOTAL VALUE IS 4519000  Total Area 4.59 D Built Up Area Whether Inherited N Purchase Date 0000-00-00 Purchase Cost 0.00 Development Cost 0.00  7,53,166 7 Lacs+","Mocharim Bodh Gaya Khata 992, Plot 260  Total Area 2720 sqft Built Up Area Whether Inherited N Purchase Date 1999-09-11 Purchase Cost 18500.00 Development Cost 0.00  2,40,000 2 Lacs+ Mocharim Bodh Gaya Khata 249, Plot 645  Total Area 37 D Built Up Area Whether Inherited N Purchase Date 2015-06-04 Purchase Cost 240000.00 Development Cost 0.00  7,20,000 7 Lacs+ Mocharim Bodh Gaya Khata 249, Plot 645  Total Area 37 D Built Up Area Whether Inherited N Purchase Date 2015-06-04 Purchase Cost 240000.00 Development Cost 0.00  7,20,000 7 Lacs+",Nil,Nil,Nil,Nil,"Rs 24,33,166 24 Lacs+"
2,ii,Non Agricultural Land,"Gaya Nagar Nigam ward no.3, Gaya  Total Area 184 sq.ft. Built Up Area Whether Inherited N Purchase Date 2015-03-11 Purchase Cost 794850.00 Development Cost 0.00  9,54,000 9 Lacs+","Khata No. 202, Plot No. 643 Shekhwara Bodh Gaya  Total Area 12 D. Built Up Area Whether Inherited N Purchase Date 2020-06-26 Purchase Cost 795000.00 Development Cost 0.00  7,95,000 7 Lacs+ Khata No. 210, Plot No. 731 Shekhbara Bodh Gaya  Total Area 36 D. Built Up Area Whether Inherited N Purchase Date 2020-08-18 Purchase Cost 2375000.00 Development Cost 0.00  23,75,000 23 Lacs+",Nil,Nil,Nil,Nil,"Rs 41,24,000 41 Lacs+"
3,iii,Commercial Buildings,Nil,Nil,Nil,Nil,Nil,Nil,Nil
4,iv,Residential Buildings,"Khazpura Patna, Plot No. 5  Total Area 2409 sqft Built Up Area 2409 sqft Whether Inherited N Purchase Date 2001-09-04 Purchase Cost 37000.00 Development Cost 6468000.00  64,68,000 64 Lacs+ Gaya Ward No. 4/18, H. No. 20/22 Makhlotganj  Total Area 1/6 Part of 4.59 D Built Up Area 1/6 Part of 4.59 D Whether Inherited Y Purchase Date 0000-00-00 Purchase Cost 0.00 Development Cost 0.00  4,51,900 4 Lacs+",Nil,Nil,Nil,Nil,Nil,"Rs 69,19,900 69 Lacs+"
5,v,Others,Nil,"Office- Patna, Shop No. 624 Agricultural land Khata 983, Plot 4936 Araji 532 D., Annual Rent Rs. 79800/- Village Imampur Muzaffarpur  Total Area 532 D. Built Up Area Whether Inherited N Purchase Date 0000-00-00 Purchase Cost 0.00 Development Cost 0.00  0*(Value Not Given)",Nil,Nil,Nil,Nil,Rs 0
6,Total Current Market Value of (i) to (v) (as per Affidavit),Total Current Market Value of (i) to (v) (as per Affidavit),"74,97,316 74 Lacs+","48,50,000 48 Lacs+",Nil,Nil,Nil,Nil,"Rs 1,23,47,316 1 Crore+"
7,Totals Calculated,Totals Calculated,"Rs 86,27,066 86 Lacs+","Rs 48,50,000 48 Lacs+",Nil,Nil,Nil,Nil,"Rs 1,34,77,066 1 Crore+"
