,0,1,2,3,4,5,6,7,8
0,Sr No,Description,self,spouse,huf,dependent1,dependent2,dependent3,
1,i,Agricultural Land,"Located at Longjang Village, Mokokchung  Total Area 60 Acres Built Up Area Whether Inherited Y Purchase Date 0000-00-00 Purchase Cost 0.00 Development Cost 0.00  12,50,000 12 Lacs+ Seithekim-A Village, Nagaland  Total Area 105 Acres Built Up Area Whether Inherited N Purchase Date 1990-05-10 Purchase Cost 700000.00 Development Cost 600000.00  36,00,000 36 Lacs+",Nil,Nil,Nil,Nil,Nil,"Rs 48,50,000 48 Lacs+"
2,ii,Non Agricultural Land,"Located at Chekiye Village, Chumoukedima District, Bearing Reg. No. 09/B. No. 3  Total Area 67427.25 sqft Built Up Area Whether Inherited N Purchase Date 1983-04-07 Purchase Cost 100000.00 Development Cost 120000.00  2,02,28,175 2 Crore+",Nil,Nil,Nil,Nil,Nil,"Rs 2,02,28,175 2 Crore+"
3,iii,Commercial Buildings,"Located at Murgipati Dimapur, Patta No. 258, Dag No. 196, Block No. 6, Mouza No. 1  Total Area 4896 sqft Built Up Area 4200 sqft Whether Inherited N Purchase Date 2013-10-07 Purchase Cost 0.00 Development Cost 10050000.00  3,25,00,000 3 Crore+","Nongrims Hills, Shillong, Meghalaya  Total Area 20391 sqft Built Up Area 10000 sqft Whether Inherited Y Purchase Date 0000-00-00 Purchase Cost 0.00 Development Cost 0.00  2,90,00,000 2 Crore+",Nil,Nil,Nil,Nil,"Rs 6,15,00,000 6 Crore+"
4,iv,Residential Buildings,"Located at Kashiram Village, Dimapur, Patta No. 81, Dag No. 148, Mouza No. 2, Block No. 10  Total Area 99216 sqft Built Up Area 1500 sqft Whether Inherited N Purchase Date 1988-02-20 Purchase Cost 100000.00 Development Cost 6000000.00  1,35,00,000 1 Crore+ Located at Tsusapang, Mokokchung Village  Total Area 87120 sqft Built Up Area 2000 sqft Whether Inherited N Purchase Date 2002-04-05 Purchase Cost 500000.00 Development Cost 750000.00  60,00,000 60 Lacs+",Nil,Nil,Nil,Nil,Nil,"Rs 1,95,00,000 1 Crore+"
5,v,Others,Nil,Nil,Nil,Nil,Nil,Nil,Nil
6,Total Current Market Value of (i) to (v) (as per Affidavit),Total Current Market Value of (i) to (v) (as per Affidavit),"7,70,78,175 7 Crore+","2,90,00,000 2 Crore+",Nil,Nil,Nil,Nil,"Rs 10,60,78,175 10 Crore+"
7,Totals Calculated,Totals Calculated,"Rs 7,70,78,175 7 Crore+","Rs 2,90,00,000 2 Crore+",Nil,Nil,Nil,Nil,"Rs 10,60,78,175 10 Crore+"
