,0,1,2,3,4,5,6,7,8
0,Sr No,Description,self,spouse,huf,dependent1,dependent2,dependent3,
1,i,Agricultural Land,"Sasti Ta. Patur Dist. Akola Group No. 142/2 (Collective)  Total Area 3.59 acres Built Up Area Whether Inherited Y Purchase Date 0000-00-00 Purchase Cost 0.00 Development Cost 0.00  32,34,600 32 Lacs+ Rajanda Tal. Barshitakali She.S.No.215 Total Area 6.50 acres Built Up Area N/A Whether Inherited N Purchase Date 2023-08-14 Purchase Cost 8700000.00 Development Cost 0.00  41,08,000 41 Lacs+ Rajanda Ta. Barshitakali She.S.No. 216/3/A  Total Area 0.85 acres Built Up Area N/A Whether Inherited N Purchase Date 2023-08-14 Purchase Cost 8700000.00 Development Cost 0.00  43,19,300 43 Lacs+ Babhulgaon Ta. Patur S.S.No.67  Total Area 0.92 acres Built Up Area N/A Whether Inherited N Purchase Date 2023-03-24 Purchase Cost 8525920.00 Development Cost 0.00  50,64,880 50 Lacs+ Babhulgaon Ta. Patur S.S.No.68 Total Area 2.83 acres Built Up Area N/A Whether Inherited N Purchase Date 2023-03-24 Purchase Cost 8525920.00 Development Cost 0.00  60,84,280 60 Lacs+ Babhulgaon Ta. Patur S.S.No.49  Total Area 1.41 acres Built Up Area N/A Whether Inherited N Purchase Date 2023-03-24 Purchase Cost 8525920.00 Development Cost 0.00  55,07,485 55 Lacs+",Nil,Nil,Nil,Nil,Nil,"Rs 2,83,18,545 2 Crore+"
2,ii,Non Agricultural Land,"Sawarkhed, Tq. Patur, Sh. S. No. 68/2  Total Area 2.22 acres Built Up Area N/A Whether Inherited N Purchase Date 2021-07-03 Purchase Cost 1703000.00 Development Cost 0.00  2,77,72,200 2 Crore+",Nil,Nil,Nil,Nil,Nil,"Rs 2,77,72,200 2 Crore+"
3,iii,Commercial Buildings,"Akola Municipality, Nazul sheet, No. 66, Plot no. 7, Civil Line Chowk  Total Area 57.45 Sq. mt. Built Up Area 57.45 Sq. mt. Whether Inherited N Purchase Date 2021-02-01 Purchase Cost 3790000.00 Development Cost 0.00  25,68,015 25 Lacs+",Nil,Nil,Nil,Nil,Nil,"Rs 25,68,015 25 Lacs+"
4,iv,Residential Buildings,"Mauje Umri Pragane Akola Municipal Corporation M.C.A-7/444  Total Area 223 Sq. foot Built Up Area Whether Inherited N Purchase Date 2022-07-25 Purchase Cost 4500000.00 Development Cost 0.00  47,28,924 47 Lacs+ Sasti Ta. Patur M.M.No.128 (Community) Total Area Built Up Area Whether Inherited Y Purchase Date 0000-00-00 Purchase Cost 0.00 Development Cost 0.00  78,90,096 78 Lacs+ Affordable Ta. Patur M.M.No.539 (Community) Total Area Built Up Area Whether Inherited Y Purchase Date 0000-00-00 Purchase Cost 0.00 Development Cost 0.00  2,39,560 2 Lacs+ Affordable Ta. Patur M.M.No.123 (Community)  Total Area Built Up Area Whether Inherited Y Purchase Date 0000-00-00 Purchase Cost 0.00 Development Cost 0.00  3,37,708 3 Lacs+","Mauje Umari, Akola Municipality Sh. S. No. 14/1, Group no. 103  Total Area 211 Sq. mt. Built Up Area 2270 Sq. Ft. Whether Inherited N Purchase Date 2011-03-11 Purchase Cost 653000.00 Development Cost 0.00  22,53,250 22 Lacs+","Mrs. Umerkhed, Akola Municipality, Plot no. 24/62  Total Area 2400 Sq. Ft. Built Up Area Whether Inherited Y Purchase Date 0000-00-00 Purchase Cost 0.00 Development Cost 0.00  44,83,104 44 Lacs+",Nil,Nil,Nil,"Rs 1,99,32,642 1 Crore+"
5,v,Others,Nil,Nil,Nil,Nil,Nil,Nil,Nil
6,Total Current Market Value of (i) to (v) (as per Affidavit),Total Current Market Value of (i) to (v) (as per Affidavit),"7,18,55,048 7 Crore+","22,53,350 22 Lacs+","44,83,104 44 Lacs+",Nil,Nil,Nil,"Rs 7,85,91,502 7 Crore+"
7,Totals Calculated,Totals Calculated,"Rs 7,18,55,048 7 Crore+","Rs 22,53,250 22 Lacs+","Rs 44,83,104 44 Lacs+",Nil,Nil,Nil,"Rs 7,85,91,402 7 Crore+"
