,0,1,2,3,4,5,6,7,8
0,Sr No,Description,self,spouse,huf,dependent1,dependent2,dependent3,
1,i,Agricultural Land,"Punjulurupadu Village, Venkatachalam Mandal. SPSR Nellore Distinct, Andhra Pradesh. 179/1,180/1,180/2.180/3  Total Area 14.90 Built Up Area Whether Inherited N Purchase Date 2011-02-10 Purchase Cost 15000000.00 Development Cost 0.00  5,96,00,000 5 Crore+","Mummayapalem, Ozili Mandal, Tirupati District, A.P 288/1, 288/2  Total Area 11.93 cents Built Up Area Whether Inherited N Purchase Date 2006-03-24 Purchase Cost 1200000.00 Development Cost 0.00  75,00,000 75 Lacs+",Nil,Nil,Nil,Nil,"Rs 6,71,00,000 6 Crore+"
2,ii,Non Agricultural Land,"VUDA Site VIJAYAWAD A 07P Block, Krishna District, Andhra Pradesh.  Total Area 836 sq.ft Built Up Area Whether Inherited N Purchase Date 2004-03-17 Purchase Cost 1000000.00 Development Cost 0.00  50,00,000 50 Lacs+ Kondakari Mijuru, Ponneri thaluk, Tiruvallur District, Tamilnadu. 625/1A  Total Area 21780sq.ft Built Up Area Whether Inherited N Purchase Date 2005-05-10 Purchase Cost 1000000.00 Development Cost 0.00  70,00,000 70 Lacs+ Shortlum Village, Kanthoor reddy, Kuppam, Thirupor thaluku, Chengalpattu district. Chennai 722, and no. 103/48  Total Area 21780 sq.ft Built Up Area Whether Inherited N Purchase Date 2021-07-07 Purchase Cost 45000000.00 Development Cost 0.00  6,00,00,000 6 Crore+ Pantapalem Village, Muttukuru Mandal, SPSR Nellore District 199/1b1, 199/1c, 223/a  Total Area 79.279.2 sqft Built Up Area Whether Inherited N Purchase Date 2007-09-11 Purchase Cost 1000000.00 Development Cost 0.00  1,00,00,000 1 Crore+","Padarupalli village, Nellore rural, SPSR Nellore District, A.P  Total Area 21780 sq.ft Built Up Area Whether Inherited N Purchase Date 1998-06-19 Purchase Cost 400000.00 Development Cost 0.00  2,00,00,000 2 Crore+",Nil,Nil,Nil,Nil,"Rs 10,20,00,000 10 Crore+"
3,iii,Commercial Buildings,"Kondakari Minjuru, Ponneri Thaluk, Thiruvallur District, Tamilnadu. 625/1A, 626/2  Total Area 99317 sq.ft Built Up Area 28084 sq.ft Whether Inherited N Purchase Date 2005-02-15 Purchase Cost 1500000.00 Development Cost 17500000.00  4,00,00,000 4 Crore+ Nallur Village, Ponneri taluk, Tiruvallur District, Tamilnadu. 8/1,8/1A2  Total Area 125452.79 sq.ft Built Up Area 60000 sq.ft Whether Inherited N Purchase Date 2001-09-05 Purchase Cost 500000.00 Development Cost 40000000.00  7,00,00,000 7 Crore+ Shop No-94, Vijayawada, Krishna District, Andhra Pradesh.  Total Area 864 sqft Built Up Area 864 sq ft Whether Inherited N Purchase Date 2006-08-08 Purchase Cost 1100000.00 Development Cost 0.00  22,00,000 22 Lacs+ Punjulurupadu Village, Venkatachalam Mandal, SPSR Nellore District, A.P. 130/1,128/13  Total Area 564102 sq ft Built Up Area 156000 Sq.Ft. Whether Inherited N Purchase Date 2004-06-15 Purchase Cost 843000.00 Development Cost 120000000.00  20,00,00,000 20 Crore+ Punjulurupadu Village, Venkatachalam Mandal, SPSR Nellore District, NO. 123,127,134,133  Total Area 795841.2 sq.ft Built Up Area 1560000 sq ft Whether Inherited N Purchase Date 0000-00-00 Purchase Cost 0.00 Development Cost 0.00  22,00,00,000 22 Crore+","Kondakari Minjuru, Ponneri Thaluk, Thiruvallur District, Tamilnadu. 626/1,626/2,1155  Total Area 108900 sq ft Built Up Area 60000 sq ft Whether Inherited N Purchase Date 2005-09-15 Purchase Cost 1500000.00 Development Cost 24000000.00  8,00,00,000 8 Crore+",Nil,Nil,Nil,Nil,"Rs 61,22,00,000 61 Crore+"
4,iv,Residential Buildings,"98/164 Portuguese church street, broadway chennai-1, tamilanadu  Total Area 1115 sq ft Built Up Area 3500 sqft Whether Inherited N Purchase Date 1999-12-09 Purchase Cost 610000.00 Development Cost 4000000.00  4,00,00,000 4 Crore+ Flat No.302, Pavani Apartment, Nellore town  Total Area Built Up Area 1740 sq ft Whether Inherited N Purchase Date 2008-12-11 Purchase Cost 1132000.00 Development Cost 0.00  35,00,000 35 Lacs+","98/164 Portuguese church street, broadway chennai-1, tamilanadu  Total Area 1115 sq.ft Built Up Area 3500 sq.ft Whether Inherited N Purchase Date 1999-12-09 Purchase Cost 610000.00 Development Cost 3500000.00  1,70,00,000 1 Crore+ Chevireddypalli, Venkatagiri town, SPSR Nellore District, ?.?. 69/1,60/4,66/10  Total Area 14544 sq.ft Built Up Area 12000 sq.ft Whether Inherited N Purchase Date 2006-10-20 Purchase Cost 1200000.00 Development Cost 16800000.00  3,00,00,000 3 Crore+",Nil,Nil,Nil,Nil,"Rs 9,05,00,000 9 Crore+"
5,v,Others,Nil,Nil,Nil,Nil,Nil,Nil,Nil
6,Total Current Market Value of (i) to (v) (as per Affidavit),Total Current Market Value of (i) to (v) (as per Affidavit),"71,73,00,000 71 Crore+","15,45,00,000 15 Crore+",Nil,Nil,Nil,Nil,"Rs 87,18,00,000 87 Crore+"
7,Totals Calculated,Totals Calculated,"Rs 71,73,00,000 71 Crore+","Rs 15,45,00,000 15 Crore+",Nil,Nil,Nil,Nil,"Rs 87,18,00,000 87 Crore+"
