,0,1,2,3,4,5,6,7,8
0,Sr No,Description,self,spouse,huf,dependent1,dependent2,dependent3,
1,i,Agricultural Land,"(1)Rihalpura, Dist. Kangra, (2) Birta, Dist. Kangra, (3)Lalehar, Dist. Kangra, (4) Keer Chamba, Dist. Kangra, (5) Sevkara, Dist. Kangra, (6)Bodarballa, Dist. Kangra, (7) Kachhiari, Dist. Kangra, (8) Kurfi, Dist. Shimla, (9) Andrar (Narwana) Dist. Kangra, (10)Rounkhar, Dist. Kangra, (11) Patola (Jadrangal), Dist. Kangra,(11) Mc Leodganj, Dist. Kangra, (12) Gopalpur (Palampur), Dist. Kangra, (13) Manali, Dist. Kullu, (14) Yol, Dist. Kangra, (15) Juhal Dari Dist. Kangra, (16)Barai Dist. Kangra, Whether inherited property Yes (Partially) 4 acre inherited, rest self acquired Total Area 18 acres Built Up Area Whether Inherited N Purchase Date 0000-00-00 Purchase Cost 62486000.00 Development Cost 0.00  45,00,00,000 45 Crore+","Gopalpur (Palampur) Dist. Kangra  Total Area 2 acre Built Up Area Whether Inherited N Purchase Date 2012-09-28 Purchase Cost 2327901.00 Development Cost 0.00  1,00,00,000 1 Crore+",Nil,Nil,Nil,Nil,"Rs 46,00,00,000 46 Crore+"
2,ii,Non Agricultural Land,"(1) Lalehar, Dist. Kangra, (2) Kand-dari, Dist. Kangra, (3)Patola (Jadrangal) Dist. Kangra, (4) Mc Leodganj, Dharamshala, (5) Manali Dist. Kullu, (6) Bodarballa, Dist. Kangra, (Yes) Partially 0.20 Acre inherited, rest self acquired Total Area 37120 sq.ft Built Up Area Whether Inherited N Purchase Date 0000-00-00 Purchase Cost 5118125.00 Development Cost 0.00  1,30,00,000 1 Crore+","Lalehar Dist. Kangra  Total Area 800 sq.ft Built Up Area Whether Inherited N Purchase Date 2013-06-10 Purchase Cost 200000.00 Development Cost 0.00  16,00,000 16 Lacs+",Nil,Nil,Nil,Nil,"Rs 1,46,00,000 1 Crore+"
3,iii,Commercial Buildings,"(1) Rihalpura, Dist. Kangra, (2) Birta Dist. Kangra, (3)Tehsil Chowk, Kangra Dist. Kangra, (4) Kand-dari Dist. Kangra, (5)  Total Area Built Up Area Whether Inherited Y Purchase Date 0000-00-00 Purchase Cost 486000.00 Development Cost 40000000.00  24,00,00,000 24 Crore+","Shahpur, Dist. Kangra  Total Area 6000 sq.ft Built Up Area Whether Inherited Y Purchase Date 0000-00-00 Purchase Cost 0.00 Development Cost 0.00  1,00,00,000 1 Crore+",Nil,Nil,Nil,Nil,"Rs 25,00,00,000 25 Crore+"
4,iv,Residential Buildings,"(1)Rihalpura, Dist. Kangra, (2) House No.1199 (1 Floor) (Residential Apartment) Sector 8C, Chandigarh, (3)Building No.15 ( Third Floor), (Residential apartment), Link Road, Jangpura Ext. New Delhi, Area. 2500 sq.ft, 500 sq.ft, 2200 sq.ft, Buil up area. 3500 sq.ft, 500 sq.ft, 2200 sq.ft  Total Area Built Up Area Whether Inherited Y Purchase Date 0000-00-00 Purchase Cost 0.00 Development Cost 0.00  5,00,00,000 5 Crore+",Nil,Nil,Nil,Nil,Nil,"Rs 5,00,00,000 5 Crore+"
5,v,Others,Nil,Nil,Nil,Nil,Nil,Nil,Nil
6,Total Current Market Value of (i) to (v) (as per Affidavit),Total Current Market Value of (i) to (v) (as per Affidavit),"75,30,00,000 75 Crore+","2,16,00,000 2 Crore+",Nil,Nil,Nil,Nil,"Rs 77,46,00,000 77 Crore+"
7,Totals Calculated,Totals Calculated,"Rs 75,30,00,000 75 Crore+","Rs 2,16,00,000 2 Crore+",Nil,Nil,Nil,Nil,"Rs 77,46,00,000 77 Crore+"
