,0,1,2,3,4,5,6,7,8
0,Sr No,Description,self,spouse,huf,dependent1,dependent2,dependent3,
1,i,Agricultural Land,"Sy. No. 128/17 (Part) Mutchel, Vill. Agonda  Total Area 0.56 Acre (2275 sq.mtr.) Built Up Area Whether Inherited N Purchase Date 2006-07-21 Purchase Cost 250000.00 Development Cost 50000.00  7,50,000 7 Lacs+","Sy. No. 128/17 (Part) Mutchel, Vill. Agonda  Total Area 0.56 Acre (2275 sq.mtr.) Built Up Area Whether Inherited N Purchase Date 2006-07-21 Purchase Cost 250000.00 Development Cost 50000.00  7,50,000 7 Lacs+",Nil,Nil,Nil,Nil,"Rs 15,00,000 15 Lacs+"
2,ii,Non Agricultural Land,"Plot No. 28, 29, Coangale situated at Gogol Surveyed under Chalta No. 14/1 to 14/7 of P. T. Sheet 80 and Chalta No. 3 of P. T. Sheet No. 57 of City Survey, Margao  Total Area 4747 and 4047 sqgy (441 and 376 sq.mtr.) Built Up Area Whether Inherited N Purchase Date 1992-02-17 Purchase Cost 179740.00 Development Cost 0.00  81,70,000 81 Lacs+","Plot No. 28, 29, Coangale situated at Gogol Surveyed under Chalta No. 14/1 to 14/7 of P. T. Sheet 80 and Chalta No. 3 of P. T. Sheet No. 57 of City Survey, Margao  Total Area 4747 and 4047 sqgy (441 and 376 sq.mtr.) Built Up Area Whether Inherited N Purchase Date 1992-02-17 Purchase Cost 179740.00 Development Cost 0.00  81,70,000 81 Lacs+",Nil,Nil,Nil,Nil,"Rs 1,63,40,000 1 Crore+"
3,iii,Commercial Buildings,"Half Share in Office No. 1 at Kamat Commercial Building Station Road Margao 403601 Goa, Sy. No. Chalta No. 541 to 544 of P. T. Sheet No. 239 of Margao City Survey  Total Area 294.50 sqft (27.38 sq.mtr.) Built Up Area 294.50 sqft (27.38 sq.mtr.) Whether Inherited Y Purchase Date 0000-00-00 Purchase Cost 0.00 Development Cost 0.00  3,75,400 3 Lacs+ Half Share in Garage space in Elvira Building at Aquem, Margao-Goa 403601, Sy. No./Chalta No. 41 of P. T. Sheet No. 196 of Margao City Survey  Total Area 511.30 sqft (47.5 sq.mtr.) Built Up Area 511.30 sqft (47.5 sq.mtr.) Whether Inherited N Purchase Date 1984-08-10 Purchase Cost 20000.00 Development Cost 0.00  3,00,000 3 Lacs+","Half Share in Office No. 1 at Kamat Commercial Building Station Road Margao 403601 Goa, Sy. No. Chalta No. 541 to 544 of P. T. Sheet No. 239 of Margao City Survey  Total Area 294.50 sqft (27.38 sq.mtr.) Built Up Area 294.50 sqft (27.38 sq.mtr.) Whether Inherited Y Purchase Date 0000-00-00 Purchase Cost 0.00 Development Cost 0.00  3,75,400 3 Lacs+ Half Share in Garage space in Elvira Building at Aquem, Margao-Goa 403601, Sy. No./Chalta No. 41 of P. T. Sheet No. 196 of Margao City Survey  Total Area 511.30 sqft (47.5 sq.mtr.) Built Up Area 511.30 sqft (47.5 sq.mtr.) Whether Inherited N Purchase Date 1984-08-10 Purchase Cost 20000.00 Development Cost 0.00  3,00,000 3 Lacs+",Nil,Nil,Nil,Nil,"Rs 13,50,800 13 Lacs+"
4,iv,Residential Buildings,"Vill. Taleigao, Taluka Tiswadi, Matriz Ni. 1258, Sy. No. 235/1 of Taleigao Vill.  Total Area 270.26 sq.mtr. (2909 sqft) Built Up Area 283 sq.mtr. and 48 sq.mtr. Tearrce (3046 sqft and 517 sqft Terrace) Whether Inherited N Purchase Date 2009-02-10 Purchase Cost 5560050.00 Development Cost 0.00  75,27,600 75 Lacs+ Moroda, Aquem Margao, Goa 403601, Sy. No./Chalta No. 246 of P. T. Sheet 227 of Margao City Survey  Total Area 779 sq.mtr. (8385 sqft) Built Up Area 563.80 sq.mtr. (6069 sqft) Whether Inherited Y Purchase Date 0000-00-00 Purchase Cost 0.00 Development Cost 15500000.00  1,50,00,000 1 Crore+","Vill. Taleigao, Taluka Tiswadi, Matriz Ni. 1258, Sy. No. 235/1 of Taleigao Vill.  Total Area 270.26 sq.mtr. (2909 sqft) Built Up Area 283 sq.mtr. and 48 sq.mtr. Tearrce (3046 sqft and 517 sqft Terrace) Whether Inherited N Purchase Date 2009-02-10 Purchase Cost 5560050.00 Development Cost 0.00  75,27,600 75 Lacs+ Moroda, Aquem Margao, Goa 403601, Sy. No./Chalta No. 246 of P. T. Sheet 227 of Margao City Survey  Total Area 779 sq.mtr. (8385 sqft) Built Up Area 563.80 sq.mtr. (6069 sqft) Whether Inherited Y Purchase Date 0000-00-00 Purchase Cost 0.00 Development Cost 15500000.00  1,50,00,000 1 Crore+",Nil,Nil,Nil,Nil,"Rs 4,50,55,200 4 Crore+"
5,v,Others,Nil,Nil,Nil,Nil,Nil,Nil,Nil
6,Total Current Market Value of (i) to (v) (as per Affidavit),Total Current Market Value of (i) to (v) (as per Affidavit),"3,21,23,000 3 Crore+","3,21,23,000 3 Crore+",Nil,Nil,Nil,Nil,"Rs 6,42,46,000 6 Crore+"
7,Totals Calculated,Totals Calculated,"Rs 3,21,23,000 3 Crore+","Rs 3,21,23,000 3 Crore+",Nil,Nil,Nil,Nil,"Rs 6,42,46,000 6 Crore+"
