,0,1,2,3,4,5,6,7,8
0,Sr No,Description,self,spouse,huf,dependent1,dependent2,dependent3,
1,i,Agricultural Land,"Ernakulam District Movattupuzha Taluk Thirumady Village Sy No 353/9,Sy No 353/10,Sy No 353/4A Total Area 3.20 Acre Built Up Area Whether Inherited N Purchase Date 2010-03-03 Purchase Cost 900000.00 Development Cost 0.00  1,00,00,000 1 Crore+ Ernakulam Distrit Movattupuzha Taluk Thirumady Village sy No 344/8  Total Area 60 Cents Built Up Area Whether Inherited N Purchase Date 1996-05-13 Purchase Cost 17000.00 Development Cost 0.00  20,00,000 20 Lacs+ Ernakulam District movattupuzha taluk Thirumady Village Sy No 520/10B,Sy No.520/10A  Total Area 90 cents Built Up Area Whether Inherited N Purchase Date 2002-05-15 Purchase Cost 102700.00 Development Cost 0.00  30,00,000 30 Lacs+ Ernakulam District Movattupuzha Taluk Thirumarady Village Sy.No.341/5/4,Sy No. 341/5/2,Sy No 341/5/1  Total Area 1.70 Acres Built Up Area Whether Inherited N Purchase Date 2006-10-25 Purchase Cost 225000.00 Development Cost 0.00  50,00,000 50 Lacs+ Ernakulam District Movattupuzha Taluk Thirumady village Sy No 526/4A/6,Sy No 526/3B/1,Sy No 526/3A  Total Area 2.05 Acre Built Up Area Whether Inherited N Purchase Date 0000-00-00 Purchase Cost 2002.00 Development Cost 0.00  60,00,000 60 Lacs+ Ernakulam District Movattupuzha Taluk thirumady Village Sy No 133/4,Sy No 133/5,Sy No 134/4,Sy No 134/2  Total Area 30 cents Built Up Area Whether Inherited Y Purchase Date 0000-00-00 Purchase Cost 0.00 Development Cost 0.00  25,00,000 25 Lacs+ Ernakulam District Movattupuzha taluk thirumady Village Sy no.531/2,Sy No 531/1B,Sy No 531/1A  Total Area 81cent Built Up Area Whether Inherited N Purchase Date 2008-04-07 Purchase Cost 280000.00 Development Cost 0.00  28,00,000 28 Lacs+ Ernakulam District Movattupuzha taluk Thirumady Village Sy No 345/7,351/10/6,351/9A/1,351/10/2,351/9A6  Total Area 99.95 cent Built Up Area Whether Inherited N Purchase Date 2003-10-23 Purchase Cost 166750.00 Development Cost 0.00  30,00,000 30 Lacs+ Ernakulam District Movattupuzha Taluk Thirumarady village Sy.No. 344/9,338/2/2,338/2/3,338/2/4,338/1A,3338/1B  Total Area 2.41.9 Acres Built Up Area Whether Inherited Y Purchase Date 0000-00-00 Purchase Cost 0.00 Development Cost 0.00  60,00,000 60 Lacs+ Ernakulam District Movattupuzha Taluk Thirumarady Village Sy No 529/3B,sy No 548/1/1  Total Area 3.33 Acres Built Up Area Whether Inherited N Purchase Date 2002-12-21 Purchase Cost 370200.00 Development Cost 0.00  1,00,00,000 1 Crore+","Ernakulam district Movattupuzha Taluk Thirumarady Village Sy No.533/2,533/1B,533/1A  Total Area 4.23 Acres Built Up Area Whether Inherited N Purchase Date 2003-02-20 Purchase Cost 473000.00 Development Cost 0.00  1,00,00,000 1 Crore+ Ernakulam district Movattupuzha Taluk Thirumarady Village Sy No.526/4A/3,Sy No. 353/5A,Sy No.353/8A/2,Sy No 353/8/B  Total Area 2.97.5 Acres Built Up Area Whether Inherited Y Purchase Date 0000-00-00 Purchase Cost 0.00 Development Cost 0.00  80,00,000 80 Lacs+ Ernakulam District Movattupuzha Taluk Thirumarady village Sy.No.341/6A/1,sy.No.341/6B  Total Area 2.98acres Built Up Area Whether Inherited Y Purchase Date 0000-00-00 Purchase Cost 0.00 Development Cost 0.00  75,00,000 75 Lacs+ Ernakulam district kanayoor Taluk Edakattuvayal Village Sy no.216/17  Total Area 97.71 cent Built Up Area Whether Inherited Y Purchase Date 0000-00-00 Purchase Cost 0.00 Development Cost 0.00  60,00,000 60 Lacs+",Nil,"Ernakulam district Muvattupuzha Taluk Thirumarady Village Sy No 353/6-3,353/5A-2  Total Area 92 cent Built Up Area Whether Inherited N Purchase Date 0000-00-00 Purchase Cost 1100000.00 Development Cost 0.00  45,00,000 45 Lacs+",Nil,Nil,"Rs 8,63,00,000 8 Crore+"
2,ii,Non Agricultural Land,"Ernakulam district Kanayanoor Taluk kurikode Village Sy No 74/3(Resurvey No 226/10) Total Area 6.50 cents Built Up Area Whether Inherited N Purchase Date 0000-00-00 Purchase Cost 0.00 Development Cost 0.00  15,00,000 15 Lacs+ Ernakulam District movattupuzha Taluk Thirumarady village Sy No 133/4 Total Area 2.50 Cents Built Up Area Whether Inherited N Purchase Date 1998-05-13 Purchase Cost 56000.00 Development Cost 0.00  3,25,000 3 Lacs+ Ernakulam District kanayanoor taluk Vazhakkala village Sy No 14/11,Block No 8(Resurvey No 193/2) Total Area 7.187 cents Built Up Area Whether Inherited N Purchase Date 2008-06-09 Purchase Cost 810000.00 Development Cost 0.00  50,00,000 50 Lacs+","Trivandrum district Trivandrum Taluk Sasthamangalam Village Sy no.95 Total Area 20 Cents Built Up Area Whether Inherited N Purchase Date 0000-00-00 Purchase Cost 0.00 Development Cost 0.00  55,00,000 55 Lacs+ Ernakulam district Kanayannur taluk Kureekkad Village Sy No 221 Total Area 25 Cents Built Up Area Whether Inherited N Purchase Date 2016-07-16 Purchase Cost 3400000.00 Development Cost 0.00  75,00,000 75 Lacs+",Nil,Nil,Nil,Nil,"Rs 1,98,25,000 1 Crore+"
3,iii,Commercial Buildings,Nil,"Trivandrum District Trivandrum taluk Vanchiyoor Village Sy No 1206/4 Total Area 7.951 cent Built Up Area Whether Inherited N Purchase Date 0000-00-00 Purchase Cost 0.00 Development Cost 0.00  1,60,00,000 1 Crore+",Nil,Nil,Nil,Nil,"Rs 1,60,00,000 1 Crore+"
4,iv,Residential Buildings,"Ernakulam District Movattupuzha Taluk Thirumarady Village Sy No.353/6  Total Area 123 cent Built Up Area Whether Inherited Y Purchase Date 0000-00-00 Purchase Cost 0.00 Development Cost 0.00  75,00,000 75 Lacs+ Trivandrum District Trivandrum Taluk Kowdiar Village CC 11/350,1350(1)  Total Area 15 cent Built Up Area Whether Inherited Y Purchase Date 0000-00-00 Purchase Cost 0.00 Development Cost 0.00  2,00,00,000 2 Crore+","Poonithura village Kanayanoor taluk Ernakulam District Sy no.931/1 Door No 29/987-A  Total Area 9.270 cent Built Up Area Whether Inherited N Purchase Date 2003-09-20 Purchase Cost 1765000.00 Development Cost 0.00  1,50,00,000 1 Crore+",Nil,Nil,Nil,Nil,"Rs 4,25,00,000 4 Crore+"
5,v,Others,Nil,Nil,Nil,Nil,Nil,Nil,Nil
6,Total Current Market Value of (i) to (v) (as per Affidavit),Total Current Market Value of (i) to (v) (as per Affidavit),"9,21,25,000 9 Crore+","7,55,00,000 7 Crore+",Nil,"45,00,000 45 Lacs+",Nil,Nil,"Rs 17,21,25,000 17 Crore+"
7,Totals Calculated,Totals Calculated,"Rs 8,46,25,000 8 Crore+","Rs 7,55,00,000 7 Crore+",Nil,"Rs 45,00,000 45 Lacs+",Nil,Nil,"Rs 16,46,25,000 16 Crore+"
