,0,1,2,3,4,5,6,7,8
0,Sr No,Description,self,spouse,huf,dependent1,dependent2,dependent3,
1,i,Agricultural Land,Nil,"Mauza Saharkol, Jamabandi No54  Total Area 6 Acre Built Up Area Whether Inherited Y Purchase Date 0000-00-00 Purchase Cost 0.00 Development Cost 0.00  10,00,000 10 Lacs+",Nil,Nil,Nil,Nil,"Rs 10,00,000 10 Lacs+"
2,ii,Non Agricultural Land,Nil,"Mesra,Ranchi Khata No-104, Plot No-1417  Total Area 7481sq.ft Built Up Area Whether Inherited N Purchase Date 2007-08-09 Purchase Cost 44000.00 Development Cost 0.00  7,00,000 7 Lacs+",Nil,Nil,Nil,Nil,"Rs 7,00,000 7 Lacs+"
3,iii,Commercial Buildings,"1. New Babupara, Mauz a-Dumka Town, Halka- 11,Khata no- 13/5, Plot No- 589, 2. Napitpara Mauza-Dumka Town, Halka- 11,Khata No- 4/1,Plot No- 1500, Date 04.06.2015, 03.01.2018  Total Area 26185 Sq.Ft. Built Up Area 2380 Sq.Ft. Whether Inherited N Purchase Date 2015-06-04 Purchase Cost 6264380.00 Development Cost 8243743.00  1,45,05,743 1 Crore+",Nil,Nil,Nil,Nil,Nil,"Rs 1,45,05,743 1 Crore+"
4,iv,Residential Buildings,"1.vill- r pusaro Fasiadangal, Near Bridge, Dumka, . Radhe Krishna garden, Bariatu ,Ranchi. Date 16.09.2002, 15.01.2021  Total Area 19104 Sq.Ft. Built Up Area 6278 Sq.Ft. Whether Inherited N Purchase Date 0000-00-00 Purchase Cost 11033900.00 Development Cost 3000000.00  1,40,33,900 1 Crore+","Gokulpur, Pakur JB No. 43, Dag nO. 990  Total Area 2025 Sq.Ft. Built Up Area 2000 Sq.Ft. Whether Inherited Y Purchase Date 0000-00-00 Purchase Cost 0.00 Development Cost 1400000.00  16,00,000 16 Lacs+",Nil,Nil,Nil,Nil,"Rs 1,56,33,900 1 Crore+"
5,v,Others,Nil,Nil,Nil,Nil,Nil,Nil,Nil
6,Total Current Market Value of (i) to (v) (as per Affidavit),Total Current Market Value of (i) to (v) (as per Affidavit),"2,85,39,643 2 Crore+","33,00,000 33 Lacs+",Nil,Nil,Nil,Nil,"Rs 3,18,39,643 3 Crore+"
7,Totals Calculated,Totals Calculated,"Rs 2,85,39,643 2 Crore+","Rs 33,00,000 33 Lacs+",Nil,Nil,Nil,Nil,"Rs 3,18,39,643 3 Crore+"
