,0,1,2,3,4,5,6,7,8
0,Sr No,Description,self,spouse,huf,dependent1,dependent2,dependent3,
1,i,Agricultural Land,"1. Mouza-Pilkrapur Plot No-1291 2.Mouza Jayper Plot No-8/761 3.Mouza Jaypur Plot No-5/817 4.Mouza Dadhibabanpur Plot No-4 2.Mouza Panchupalli Plot No-631,632 6.Mouza Sahaspur Plot No-273 7.Mouza Sunderpada Plot No-1658,305,2953,1720,1721 8.Mouza Asraypur Plot No-138 Area-0.256,0.048,0.330,0.0337,0.451,0.165,0.484,0.656,0.325 Date-2018-02-28,2023-09-01,2023-01-29,2022-09-17,2023-01-25,2006-07-10,2010-05-02,2016-10-8,2022-01-01 COP-2000000,384000,2640000,506250,1127500,161205,1000000,2800000,812500  Total Area Built Up Area Whether Inherited N Purchase Date 0000-00-00 Purchase Cost 0.00 Development Cost 0.00  3,31,79,680 3 Crore+","Mouza Sahaspur Plot No-1716 2. Mouza Sahaspur Plot No-1465/3116 Area-0.80 Dec,0.31 Dec Date-2007-01-01,2007-01-01 COP-78160,30287 Total Area Built Up Area Whether Inherited N Purchase Date 0000-00-00 Purchase Cost 0.00 Development Cost 0.00  19,42,500 19 Lacs+",Nil,Nil,Nil,Nil,"Rs 3,51,22,180 3 Crore+"
2,ii,Non Agricultural Land,"A.Mouza Satyabhampur Plot No-516/781/947 B.Mouza Satyabhampur Plot No-516/781/853 3.Mouza Satyabhampur Plot No-516/985 D.Mouza Satyabhamapur Plot No-516/781/1338 E.Mouza Satyabhampur Plot No-516/984 F.Mouza Satyabhamapu Plot No-516/781/549 G.Mouza Satyabhamapau Plot No-516/781/850 H.Mouza Satyabhamapur Plot No-516/781/954 I.Mouza Satyabhampur Plot No-516/781/955 J.Mouza Satyabhampur Plot No-509/1219 K.-Mouza Satyabhampur Plot No-514 L.Mouza Gotalgram Plot No-138/985 M.Plot Gotalgram Plot No-218 Road N.Mouza Lekundi Plot No-36,37/298 O..Mouza Lekundi Plot No-39 .Mouza Lekundi Plot No-34 Q-.Mouza Lekundi Plot No-35 R..Mouza Lekundi Plot No-34/250 S-.Mouza Lekundi Plot No-85/364 T..Mouza Lekundi Plot No-82/393 U..Mouza Lekundi Plot No-54 V-.Mouza Lekundi Plot No-306/554 W..Mouza Balabhadarpur Plot No- X-Mouza Balabhadarpur Plot No-304305/749 Y.Mouza Balabhadarpur Plot No-304Mouza Balabhadarpur Plot No-20 Z-Mouza Balabhadarpur Plot No-23 AA.Mouza Jaypour Plot No-14 AB.Mouza Jaypour Plot No-3 AC-Mouza Kapilprasad Plot No-895,896,923,896,2699 AD.Mouza Kapilprasad Plot No-898 AE-Mouza Lekundi Plot No-27,25 Area-1437,2570,1568,1350,1045,392,1136,1611,1437,6011,7361,784,2787,8624,1698,1785,1611,4486,23958, 7884,4051,6882,4356,8385,10018,15246,11979,16596,1742,2470,8164 DOP-2015-04-11,2015-12-28,2011-04-06,2015-04-29,2015-12-22,2011-03-15,2019-09-23,2015-11-03,2023-01-24,2011-12-09, 2011-05-13,2011-05-13,2011-05-11,2011-05-132012-05-07,2012-09-17,2018-12-07,2021-04-19,2015-07-13,2020-01-18,2016-10-03,2022-04-08,2019-08-06,2018-03-06,2017-11-01,2021-08-09,2017-11-01,2021-08-09-2017-03-10,2017-03-16,2013-09-06 ,COP-341550/609615/31025/356820/20315/104221/271538/30150/27965/1171698/ 1749150/326592/626826/465300/87750/94300/83250/231750/1452000/959300/209250/790000/402000/2531375/1610000/ 1960000/1842500/525600/1612000/2762000/280500 Total Area Built Up Area Whether Inherited N Purchase Date 0000-00-00 Purchase Cost 0.00 Development Cost 0.00  4,85,15,929 4 Crore+",Nil,Nil,Nil,Nil,Nil,"Rs 4,85,15,929 4 Crore+"
3,iii,Commercial Buildings,"Mouza Laxmisagar Plot No-2395 B.BDA Kiosk Bearing Number-3 Kalyani Market Bhubaneshwar Area-1200 Sqft,100 Sqft Builtup Area-3300 Sqft Date-2013-10-21/1999-01-13 COP-1620000/66124 Total Area Built Up Area Whether Inherited N Purchase Date 0000-00-00 Purchase Cost 0.00 Development Cost 0.00  95,00,000 95 Lacs+",Nil,Nil,Nil,Nil,Nil,"Rs 95,00,000 95 Lacs+"
4,iv,Residential Buildings,Nil,"Mouza Chandrasekharpur Plot No-S/5-159  Total Area 600 Sqft Built Up Area 600 Sqft Whether Inherited N Purchase Date 1999-10-04 Purchase Cost 15019.00 Development Cost 500000.00  45,00,000 45 Lacs+",Nil,Nil,Nil,Nil,"Rs 45,00,000 45 Lacs+"
5,v,Others,"Mouza Kapilprasad Plot No-892 Total Area 1200 Sqft Built Up Area 2400 Sqft Whether Inherited N Purchase Date 0000-00-00 Purchase Cost 0.00 Development Cost 0.00  65,00,000 65 Lacs+",Nil,Nil,Nil,Nil,Nil,"Rs 65,00,000 65 Lacs+"
6,Total Current Market Value of (i) to (v) (as per Affidavit),Total Current Market Value of (i) to (v) (as per Affidavit),"9,76,95,609 9 Crore+","64,42,500 64 Lacs+",Nil,Nil,Nil,Nil,"Rs 10,41,38,109 10 Crore+"
7,Totals Calculated,Totals Calculated,"Rs 9,76,95,609 9 Crore+","Rs 64,42,500 64 Lacs+",Nil,Nil,Nil,Nil,"Rs 10,41,38,109 10 Crore+"
