,0,1,2,3,4,5,6,7,8
0,Sr No,Description,self,spouse,huf,dependent1,dependent2,dependent3,
1,i,Agricultural Land,Nil,Nil,Nil,"(1) Arapur, Tal Gangapur, Gat No. 42, Area- 10R, DOP-18/08/1998, COP Rs. 23000. (2) Harsul Tal Gangapur, Gat No. 42, Area- 1 Acre, DOP- 21/09/2007, COP- Rs. 225000. (3) Anantpur, tal Gangapur, Gat No. 58, Area- 55 R, DOP- 13/07/2023, COP Rs. 950000. Total Area Built Up Area Whether Inherited N Purchase Date 0000-00-00 Purchase Cost 0.00 Development Cost 0.00  46,00,000 46 Lacs+",Nil,Nil,"Rs 46,00,000 46 Lacs+"
2,ii,Non Agricultural Land,"(1) Sawangi, Lasur Station, Gat No. 57, Area- 814, 617 sq ft, DOP- 2008/07/26, COP- Rs. 2562500. (2) Sharanapur, Area- 2519 Sq ft, DOP- 1992/11/17, COP- Rs. 7555.  Total Area Built Up Area Whether Inherited N Purchase Date 0000-00-00 Purchase Cost 0.00 Development Cost 0.00  1,50,00,000 1 Crore+",Nil,Nil,"Swarup Nagar, Lasur Station, Plot Rev. No. 1826  Total Area 660 sq ft Built Up Area Whether Inherited N Purchase Date 1995-07-05 Purchase Cost 40000.00 Development Cost 0.00  4,00,000 4 Lacs+","Plot No. 124, Gat No. 3 & 4, Sy. No. 25, Mouje Dharampur, Tal. Dist. Auranagbad  Total Area 2906 sq ft Built Up Area Whether Inherited N Purchase Date 1995-01-17 Purchase Cost 12000.00 Development Cost 0.00  5,00,000 5 Lacs+",Nil,"Rs 1,59,00,000 1 Crore+"
3,iii,Commercial Buildings,Nil,Nil,Nil,"Gala, Old Mondha, Lasur Station, Rev No. 2873/2  Total Area 275 sq ft Built Up Area Whether Inherited N Purchase Date 1999-05-28 Purchase Cost 105000.00 Development Cost 0.00  10,00,000 10 Lacs+",Nil,Nil,"Rs 10,00,000 10 Lacs+"
4,iv,Residential Buildings,Nil,"Flat at Ashtavinayak Enclave, Padampura, Flat No. 1 Building D, Wing A, CTS No. 19159/A-2 & 19159/2  Total Area 772.42 Sq ft Built Up Area 772.47 Sq ft Whether Inherited N Purchase Date 2021-10-26 Purchase Cost 2889000.00 Development Cost 0.00  40,00,000 40 Lacs+",Nil,"(1) Swarup Nagar, Lasur Station, House No. 52, Area- 3360 sq ft, DOP- 1983/10/07, COP- Rs. 20000, Investment Cost Rs. 230000. (2) Flat at Encleve Padampura, Flat No. 4, CTS19159, Area- 781 Sq ft, DOP- 2003/11/14, COP Rs. 600000. (3) Flat at Ashtavinayak Enclave, Padampura, Flat No. 5 & 6, Area- 1545 sq ft, DOP- 2021/09/23, COP- Rs. 5100000.  Total Area Built Up Area 5686 sq ft Whether Inherited N Purchase Date 0000-00-00 Purchase Cost 0.00 Development Cost 0.00  85,00,000 85 Lacs+",Nil,Nil,"Rs 1,25,00,000 1 Crore+"
5,v,Others,Nil,Nil,Nil,Nil,Nil,Nil,Nil
6,Total Current Market Value of (i) to (v) (as per Affidavit),Total Current Market Value of (i) to (v) (as per Affidavit),"1,50,00,000 1 Crore+","40,00,000 40 Lacs+",Nil,"1,45,00,000 1 Crore+","5,00,000 5 Lacs+",Nil,"Rs 3,40,00,000 3 Crore+"
7,Totals Calculated,Totals Calculated,"Rs 1,50,00,000 1 Crore+","Rs 40,00,000 40 Lacs+",Nil,"Rs 1,45,00,000 1 Crore+","Rs 5,00,000 5 Lacs+",Nil,"Rs 3,40,00,000 3 Crore+"
