,0,1,2,3,4,5,6,7,8
0,Sr No,Description,self,spouse,huf,dependent1,dependent2,dependent3,
1,i,Agricultural Land,"Berhna Patna (1) Kh No 879, Plot No 7071 02.29 Decimal, (2) KH NO 27, Plot No 7067, 00.36 D, (3) Kh No 139, Plot No 7068, 00.29 Decimal, (4) Kh no 164, Plot No 6904, 00.45 Decimal, (5) Kh No 669, Plot No 6903, 01.40 Decimal (6) Kh No 1311, Plot No 6901 1.3 Decimal (1/4th Shares)  Total Area Built Up Area Whether Inherited Y Purchase Date 0000-00-00 Purchase Cost 0.00 Development Cost 0.00  15,00,000 15 Lacs+","(1) Bariyarpur Barh Kh No 38 & 2, Plot No 142, 143, 28.125 Decimal, Date of purchase-Year 2009, Cost of Purchase 149500/-, (2) Nadwan, Barh Kh No 133, Plot No 7, Area 125 Decimal, Date of Purchased- Year 2013, Cost of Purchase-415000/-, (3) Goa Barh, Kh No 193, Plot No 1989, 85 Decimal, Date of Purchase- Year 2013, Cost of Purchase-338000/- (4) Samanhua Dumaria, Barh, Kh No 37, 54, 113, 147, 46, 41, 32, Plot No 1989, Area 2831.25 Decimal, Date of Purchase- Year 2018 , Cost of Purchase 16103878/-, (5) Village Badauli Khadar Paragana Dankaur GB Nagar UP, Kh No 247, 248, 249, 0.6690 Hectare, Date of Purchase 05.10.2017- Year , Cost of Purchase 15400000/-  Total Area Built Up Area Whether Inherited N Purchase Date 0000-00-00 Purchase Cost 32406378.00 Development Cost 2056720.00  4,00,00,000 4 Crore+",Nil,Nil,Nil,Nil,"Rs 4,15,00,000 4 Crore+"
2,ii,Non Agricultural Land,"Nadawan PS Barh, Kh No 287, Khesara No 792, 1/4th Shares  Total Area 20 D Built Up Area Whether Inherited Y Purchase Date 0000-00-00 Purchase Cost 0.00 Development Cost 0.00  8,00,000 8 Lacs+","(1) Patliputra Patna, Plot NO 54, (2) Bander Bagicha Patna, Plot NO 161 Holding No 138/139, (3) Berhana Barh(Patna), Plot NO 542004/14,887, Khata No 578 & 353, Plot No 835 & 843, Khata No 168, Plot No 787 (4) Birla Mandir Road Patna (Jointly) With Fufail Ahamad), Plot No 1006 (5) Village Badauli Khadar Paragna Dankaur G.B. Nagar UP, Kh No 247, 248, 249 & Khata No 00009, Khata No 248K (6) Boring Canal Road, Patna Khata No 164, 169, 170, 174, 176, 177, 179, 184 & 186, Plot No 167, 170, 171, 173, 393 & 404 Area- (1) 11 Katha, (2) 5.5 Kattha (3) 5 Dec & 32.1825 Dec, 2.5 Dec, (4)2.6563 Decimal (50%), (5) 0.6690 Hector (6) 4763 Sq.ft., Date of Purchase- (1) 21.05.2010 (2) Feb 2013 (3) Year 1989, 2008, 2009 (4) Year 2012, (5) Year 2017 (6) Year 2018, Cost of Purchase-(1) Rs 18500000/- (2) Rs 1781000/-(3) Rs 756500/-, (4) Rs 1847900/- (5) Rs 25867406/-  Total Area Built Up Area Whether Inherited N Purchase Date 0000-00-00 Purchase Cost 48752806.00 Development Cost 119838.00  18,25,00,000 18 Crore+",Nil,Nil,Nil,Nil,"Rs 18,33,00,000 18 Crore+"
3,iii,Commercial Buildings,"Hasan Manzil Fraser Road Patna, Plot NO 65, Holding 1075, 537, 344  Total Area 15000 Sq.ft. Built Up Area 12000 Sq.ft. Whether Inherited N Purchase Date 2006-12-07 Purchase Cost 0.00 Development Cost 0.00  10,00,00,000 10 Crore+","(1) Patliputra Patna, Society Plot no 54 of Patliputra Cooperative Society Patna, (2) Bander Bagicha Patna, Plot No 161, Holding No 138/139, (3) Berhna, Barh, plot No 2001/14, 887, Khata No 578 & 353, Plot No 835 & 843, Khata No 168, Plot No 787, (4) South Krishnapuri Patna Plot No 14D, Ward No 34, PMC Patna, Cost of purchase- 4000000/-, Area- (1) 37000 Sq.ft. (2) 18900 Sq.ft. (3) 11150 Sq.ft. (4) 3000 Sq.ft., Date of Purchase- (1) Year 2012-13 (2) Year 2003 to 2005 & 2015, (3) Year 1989, 2008, 2009 (4) 24.09.2012,, Any Investment- (1) Rs 24152018/- (2) 17446000/- (3) 2600000/- (4) 3000000//- Total Area Built Up Area Whether Inherited N Purchase Date 0000-00-00 Purchase Cost 0.00 Development Cost 47198018.00  13,90,00,000 13 Crore+",Nil,Nil,Nil,Nil,"Rs 23,90,00,000 23 Crore+"
4,iv,Residential Buildings,"Nadawan PS Barh House No 35  Total Area 5 Decimal Built Up Area 5 Decimal Whether Inherited Y Purchase Date 0000-00-00 Purchase Cost 0.00 Development Cost 0.00  4,50,000 4 Lacs+","(1) Vaishnavi Dayanand Apartment Boring Road Patna, Flat No 36 & 401, Area & Built Up-5700 Sq.ft, Cost of Purchase- 5000000/-, (2) G.K. II-Delhi, S-24 Top Floor, Area & Built Up-2100 Sq.ft. Cost of Purchase- 21710725/-,  Total Area 7800 Sq.ft. Built Up Area 7800 Sq.ft. Whether Inherited N Purchase Date 2008-07-14 Purchase Cost 26710725.00 Development Cost 0.00  3,65,00,000 3 Crore+",Nil,Nil,Nil,Nil,"Rs 3,69,50,000 3 Crore+"
5,v,Others,Nil,Nil,Nil,Nil,Nil,Nil,Nil
6,Total Current Market Value of (i) to (v) (as per Affidavit),Total Current Market Value of (i) to (v) (as per Affidavit),"10,27,50,000 10 Crore+","39,80,00,000 39 Crore+",Nil,Nil,Nil,Nil,"Rs 50,07,50,000 50 Crore+"
7,Totals Calculated,Totals Calculated,"Rs 10,27,50,000 10 Crore+","Rs 39,80,00,000 39 Crore+",Nil,Nil,Nil,Nil,"Rs 50,07,50,000 50 Crore+"
