,0,1,2,3,4,5,6,7,8
0,Sr No,Description,self,spouse,huf,dependent1,dependent2,dependent3,
1,i,Agricultural Land,"Village Gagol No-397  Total Area 0.92 Acre Built Up Area Whether Inherited N Purchase Date 2019-05-21 Purchase Cost 5248160.00 Development Cost 0.00  52,48,160 52 Lacs+ Village Rali Chauhan No-152, Joint Name, Self Share 1/3  Total Area 2.99 Acre Built Up Area Whether Inherited N Purchase Date 2004-04-21 Purchase Cost 1000913.00 Development Cost 0.00  1,88,96,280 1 Crore+ Village Rali Chouhan No-199, Self Share 1/2  Total Area 0.2 Acre Built Up Area Whether Inherited N Purchase Date 2006-01-30 Purchase Cost 86250.00 Development Cost 0.00  9,66,000 9 Lacs+ Village Pipla Sofipur No-60 to 64,72,89,90 to 100, Joint Name Self Share 1/2  Total Area 7.96 Acre Built Up Area Whether Inherited N Purchase Date 2005-12-03 Purchase Cost 6474220.00 Development Cost 225274.00  5,57,40,600 5 Crore+","Village Gagol No-397  Total Area 0.92 Acre Built Up Area Whether Inherited N Purchase Date 2019-05-21 Purchase Cost 5238160.00 Development Cost 0.00  52,38,160 52 Lacs+","Village Pilna Sofipur Khasra No-60 to 64,72,89,90 to 100 Half Share, Arbitration Award Date-24/09/2015, 14/11/2015, 27/09/2016, (Subject to the proceedings pending u/s 34 of Arbitration & Conciliation Act 1996)  Total Area 8.12 Acre Built Up Area Whether Inherited N Purchase Date 0000-00-00 Purchase Cost 0.00 Development Cost 0.00  5,55,33,000 5 Crore+",Nil,Nil,Nil,"Rs 14,16,22,200 14 Crore+"
2,ii,Non Agricultural Land,"Plot Situated Vill.Nurnagar, Khasra No.225  Total Area 7144 Sq Ft Built Up Area Whether Inherited N Purchase Date 2006-07-31 Purchase Cost 281000.00 Development Cost 0.00  43,80,750 43 Lacs+","Vill.Kasba Meerut, Kh.No.2208  Total Area 5543.36 Sq.Ft. Built Up Area Whether Inherited N Purchase Date 2003-10-08 Purchase Cost 138141.00 Development Cost 0.00  43,25,916 43 Lacs+",Nil,Nil,Nil,Nil,"Rs 87,06,666 87 Lacs+"
3,iii,Commercial Buildings,"Khasra No-1291 Jugal Kishore Baghpat Road, Meerut  Total Area 2106.73 Sq Ft Built Up Area 195.72 Sq Mt. Whether Inherited N Purchase Date 2021-12-24 Purchase Cost 10925820.00 Development Cost 0.00  1,09,25,820 1 Crore+",Nil,Nil,Nil,Nil,Nil,"Rs 1,09,25,820 1 Crore+"
4,iv,Residential Buildings,Nil,"Flat No-F-1 First Division Saswati Enclave Shivaji Road Meerut, Share 1/3  Total Area 553 Sq Ft Built Up Area 492 Sq Ft Whether Inherited N Purchase Date 2018-09-10 Purchase Cost 1940556.00 Development Cost 0.00  19,40,556 19 Lacs+","39/16 Shivaji Road Meerut  Total Area 2020 Sq Ft Built Up Area 3700 Sq Ft Whether Inherited N Purchase Date 1990-05-22 Purchase Cost 101932.00 Development Cost 100160.00  96,00,000 96 Lacs+ Plot No-4 Vijay Nagar Meerut  Total Area 4211 Sq Ft Built Up Area 6000 Sq Ft Whether Inherited N Purchase Date 1993-08-24 Purchase Cost 536564.00 Development Cost 640489.00  1,64,00,000 1 Crore+ Pvt. Passage Vijay Nagar, Meerut, Self Share 1/2  Total Area 202.50 Sq.Ft. Built Up Area Whether Inherited N Purchase Date 1996-01-30 Purchase Cost 16197.00 Development Cost 0.00  7,00,000 7 Lacs+ Flat No-S-5 Sarswati Enclave Shivaji Road, Meerut  Total Area 2296 Sq Ft Built Up Area 1314 Sq Ft Whether Inherited N Purchase Date 2006-05-30 Purchase Cost 289864.00 Development Cost 3155316.00  39,75,000 39 Lacs+ Flat No-T-4, 3rd Floor, Sarswati, Enclave Road, Meerut  Total Area 2296.39 Sq.Ft. Built Up Area 1314.71 Sq.Ft. Whether Inherited N Purchase Date 2006-05-30 Purchase Cost 265709.00 Development Cost 1248113.00  22,00,000 22 Lacs+ Garrage Shivaji Road Meerut, Joint Name, Self Share-1/2  Total Area 458.87 Sq Ft Built Up Area 230 Sq Ft Whether Inherited N Purchase Date 1998-02-20 Purchase Cost 63000.00 Development Cost 0.00  15,00,000 15 Lacs+ Tirupati Garden, Hutch Tower Plot, Meerut, Share 1/2, (Arbitration Award Date-24/09/2015, 14/11/2015, 27/09/2016), (Subject to the proceedings pending u/s 34 of Arbitration & Conciliation Act 1996)  Total Area 1453 Sq.Ft., 1487 Sq.Ft. Built Up Area Whether Inherited N Purchase Date 0000-00-00 Purchase Cost 0.00 Development Cost 0.00  31,86,000 31 Lacs+ Garage Shivaji Road, Meertu (Joint Name Self Share 1/2), Arbitration Award Date-24/09/2015,14/11/2015, 27/09/2016, (Subject to the proceedings pending u/s 34 of Arbitration & Conciliation Act 1996)  Total Area 458.87 Sq.Ft. Built Up Area 230 Sq.Ft. Whether Inherited N Purchase Date 0000-00-00 Purchase Cost 0.00 Development Cost 0.00  15,00,000 15 Lacs+ Pvt. Passage Shivaji Marg, Meerut (Joint Name Self Share 1/2), Arbitration Award Date-24/09/2015, 14/11/2015, 27/09/2016, (Subject to the proceedings pending u/s 34 of Arbitration & Conciliation Act 1996)  Total Area 193.54 Sq.Ft. Built Up Area Whether Inherited N Purchase Date 0000-00-00 Purchase Cost 0.00 Development Cost 0.00  7,00,000 7 Lacs+ H.No.39/17, Shivaji Marg, Vijay Nagar, Meerut, Arbitration Award, Date-24/09/2015, 14/11/2015, 27/09/2016, (Subject to the proceedings pending u/s 34 of Arbitration & Conciliation Act 1996)  Total Area 2565 Sq.Ft. Built Up Area 3000 Sq.Ft. Whether Inherited N Purchase Date 0000-00-00 Purchase Cost 0.00 Development Cost 0.00  1,10,00,000 1 Crore+ Resdential House 23, Purva Ahiran Meerut, Self Share 1/3, (Arbitration Award Date-24/09/2015, 14/11/2015, 27/09/2016, (Subject to the proceedings pending u/s 34 of Arbitration & Conciliation Act 1996)  Total Area 1650 Sq.Ft. Built Up Area 2475 Sq.Ft. Whether Inherited N Purchase Date 0000-00-00 Purchase Cost 0.00 Development Cost 0.00  73,33,500 73 Lacs+",Nil,Nil,Nil,"Rs 6,00,35,056 6 Crore+"
5,v,Others,Nil,Nil,"Arbitratoin Award Date-24/09/2015, 14/11/2015, 27/09/2016  Total Area Built Up Area Whether Inherited N Purchase Date 0000-00-00 Purchase Cost 0.00 Development Cost 0.00  0*(Value Not Given)",Nil,Nil,Nil,Rs 0
6,Total Current Market Value of (i) to (v) (as per Affidavit),Total Current Market Value of (i) to (v) (as per Affidavit),"9,61,57,610 9 Crore+","1,15,04,632 1 Crore+","11,36,27,500 11 Crore+",Nil,Nil,Nil,"Rs 22,12,89,742 22 Crore+"
7,Totals Calculated,Totals Calculated,"Rs 9,61,57,610 9 Crore+","Rs 1,15,04,632 1 Crore+","Rs 11,36,27,500 11 Crore+",Nil,Nil,Nil,"Rs 22,12,89,742 22 Crore+"
