,0,1,2,3,4,5,6,7,8
0,Sr No,Description,self,spouse,huf,dependent1,dependent2,dependent3,
1,i,Agricultural Land,Nil,"Long u Yan, Elaka Nartiang, West Jaintia Hills District Meghalaya  Total Area 46 Acres Built Up Area Whether Inherited N Purchase Date 2019-12-03 Purchase Cost 500000.00 Development Cost 0.00  20,00,000 20 Lacs+",Nil,Nil,Nil,Nil,"Rs 20,00,000 20 Lacs+"
2,ii,Non Agricultural Land,"Wahiajer Laitshnong West Jaintia Hills District, Meghalaya  Total Area 1199.25 Sq Mtr Built Up Area Whether Inherited N Purchase Date 2008-06-28 Purchase Cost 484540.00 Development Cost 0.00  10,00,000 10 Lacs+ Baridua *th Mile Raid Marwet, Mylliem Syiemship Meghalaya  Total Area 19593 Sq Ft Built Up Area Whether Inherited N Purchase Date 2019-10-31 Purchase Cost 500000.00 Development Cost 0.00  10,00,000 10 Lacs+ Khlieh Umshangjiar Lumbhahdakha Wahiajer West Jaitia Hills District Meghalaya  Total Area 23000 Sq Ft Built Up Area Whether Inherited N Purchase Date 2019-08-27 Purchase Cost 500000.00 Development Cost 0.00  10,00,000 10 Lacs+","Wahjahring Mawlyngad East Khasi Hills District Meghalaya  Total Area 5 Acres Built Up Area Whether Inherited N Purchase Date 2013-05-20 Purchase Cost 4069000.00 Development Cost 0.00  60,00,000 60 Lacs+ Sangoh Khap Sohsiat Wahlong Sirdarship East Khasi Hills District, Meghalaya  Total Area 399750 Sq Ft Built Up Area Whether Inherited N Purchase Date 2017-03-28 Purchase Cost 7715175.00 Development Cost 0.00  1,00,00,000 1 Crore+ Rum Jingkieng Nongthymmai-14 Mylliem Syiemship Shillong, East Khasi Hills District Meghalaya  Total Area 18516 Sq Ft Built Up Area Whether Inherited N Purchase Date 2021-12-04 Purchase Cost 13000000.00 Development Cost 0.00  3,50,00,000 3 Crore+ Niriang west Jaintia Hills District, Meghalaya  Total Area 7001 Sq Ft Built Up Area Whether Inherited N Purchase Date 2020-01-22 Purchase Cost 200000.00 Development Cost 0.00  3,50,000 3 Lacs+ Mawrie Lumheh Dong Laitkor Kynton-u-mon Mylliemsyiemship, east khasi hills district, Meghalaya  Total Area 10240 Sq ft Built Up Area Whether Inherited N Purchase Date 2020-07-18 Purchase Cost 6000000.00 Development Cost 0.00  70,00,000 70 Lacs+ Tynring Umroh East Khasi Hills District Meghalaya  Total Area 22.201 Acres Built Up Area Whether Inherited N Purchase Date 2021-12-24 Purchase Cost 1000000.00 Development Cost 0.00  15,00,000 15 Lacs+ Seijiong Wah Sanbor, East Khasi Hills District Meghalaya  Total Area 32.453 Acre Built Up Area Whether Inherited N Purchase Date 2019-10-19 Purchase Cost 10100000.00 Development Cost 0.00  3,00,00,000 3 Crore+ Lower Rynjah Shillong-6 East Khasi Hills District Meghalaya  Total Area 14848 Sq Ft Built Up Area Whether Inherited N Purchase Date 2020-08-08 Purchase Cost 12000000.00 Development Cost 0.00  3,00,00,000 3 Crore+ Mawksiang Umroh, East Khasi Hills District Meghalaya  Total Area 41919 Sq Ft Built Up Area Whether Inherited N Purchase Date 2020-11-10 Purchase Cost 1500000.00 Development Cost 0.00  30,00,000 30 Lacs+ Mewbynna Lapalang East Khasi Hills District, Meghalaya Total Area 126193.638 Sq ft Built Up Area Whether Inherited N Purchase Date 2020-08-29 Purchase Cost 4500000.00 Development Cost 0.00  60,00,000 60 Lacs+ Upper New Colony Laitumkhrah Shillong East Khasi Hills District, Meghalaya  Total Area 8000 Sq Ft Built Up Area Whether Inherited N Purchase Date 2021-06-18 Purchase Cost 12000000.00 Development Cost 0.00  3,00,00,000 3 Crore+",Nil,Nil,Nil,Nil,"Rs 16,18,50,000 16 Crore+"
3,iii,Commercial Buildings,"Baridua 9th Mile Raid Marwet, Mylliem Syiemship Meghalaya  Total Area 3420 Sq ft Built Up Area Whether Inherited N Purchase Date 2011-09-28 Purchase Cost 200000.00 Development Cost 0.00  10,00,000 10 Lacs+ Baridua 8th Mile Raid Marwet, Mylliem Syiemship Meghalaya  Total Area 34883.75 Sq Ft Built Up Area Whether Inherited N Purchase Date 2013-05-24 Purchase Cost 2000000.00 Development Cost 4500000.00  2,50,00,000 2 Crore+ Madanrting Wahtipthoh Block F Shillong-21, Shillong East Khasi Hills District Meghalaya  Total Area 3054 Sq Ft Built Up Area Whether Inherited N Purchase Date 2020-12-12 Purchase Cost 1500000.00 Development Cost 0.00  25,00,000 25 Lacs+",Nil,Nil,Nil,Nil,Nil,"Rs 2,85,00,000 2 Crore+"
4,iv,Residential Buildings,"Umkdait Nongmynsong, Shillong, East Khasi Hills District Meghalaya  Total Area 85600 Sq Ft Built Up Area Whether Inherited N Purchase Date 2008-01-10 Purchase Cost 8000000.00 Development Cost 12000000.00  5,00,00,000 5 Crore+","Nongrim Ummlong, west Jaintia Hills District Meghalaya  Total Area 10358.2 Sq Ft Built Up Area Whether Inherited N Purchase Date 2016-07-05 Purchase Cost 1650000.00 Development Cost 0.00  20,00,000 20 Lacs+ Lumtyrho Nartiang, west Jaintia Hills District Meghalaya  Total Area 2796825 Sq mtr Built Up Area Whether Inherited N Purchase Date 2017-06-05 Purchase Cost 650000.00 Development Cost 0.00  20,00,000 20 Lacs+ Luti Jowai Dongmihsngi, Ummulong, west Jaintia Hills District Meghalaya  Total Area 15300 Sq Ft Built Up Area Whether Inherited N Purchase Date 2019-11-02 Purchase Cost 660000.00 Development Cost 0.00  10,00,000 10 Lacs+ KNB Road Lawnusing, Jowai, west Jaintia Hills District, Meghalaya  Total Area 70 Sq mtr Built Up Area 70 Sq mtr Whether Inherited N Purchase Date 2021-04-09 Purchase Cost 300000.00 Development Cost 0.00  5,00,000 5 Lacs+",Nil,Nil,Nil,Nil,"Rs 5,55,00,000 5 Crore+"
5,v,Others,Nil,Nil,Nil,Nil,Nil,Nil,Nil
6,Total Current Market Value of (i) to (v) (as per Affidavit),Total Current Market Value of (i) to (v) (as per Affidavit),"8,15,00,000 8 Crore+","16,63,50,000 16 Crore+",Nil,Nil,Nil,Nil,"Rs 24,78,50,000 24 Crore+"
7,Totals Calculated,Totals Calculated,"Rs 8,15,00,000 8 Crore+","Rs 16,63,50,000 16 Crore+",Nil,Nil,Nil,Nil,"Rs 24,78,50,000 24 Crore+"
