,0,1,2,3,4,5,6,7,8
0,Sr No,Description,self,spouse,huf,dependent1,dependent2,dependent3,
1,i,Agricultural Land,"Madhwapur Gata No. 406, 408, 418, 436, 438, 447, 468, 1221, 421, 894, 768, 824, 903, 904, 903, 863  Total Area 3.58 Acre Built Up Area Whether Inherited Y Purchase Date 0000-00-00 Purchase Cost 0.00 Development Cost 0.00  15,00,000 15 Lacs+","Gata No-1101 Bankeganj, Gata No-618 Rasyoura, Gata No-123 127 127 133 131 132 178 Rathorepur Cost of Purchased 2500000/- 3000000/- 2800000/- 1300000/- 265000/- Date of Purchased 2001 2008-2011 2010  Total Area 8.485 Acre Built Up Area Whether Inherited N Purchase Date 0000-00-00 Purchase Cost 0.00 Development Cost 0.00  25,00,000 25 Lacs+",Nil,Nil,Nil,Nil,"Rs 40,00,000 40 Lacs+"
2,ii,Non Agricultural Land,Nil,"Gata No-396 Madhwapur  Total Area 181314 Sq Ft Built Up Area Whether Inherited N Purchase Date 2008-12-11 Purchase Cost 870000.00 Development Cost 0.00  60,00,000 60 Lacs+",Nil,Nil,Nil,Nil,"Rs 60,00,000 60 Lacs+"
3,iii,Commercial Buildings,Nil,Nil,Nil,Nil,Nil,Nil,Nil
4,iv,Residential Buildings,"H No-4A Ambedkar Nagar Sitapur,  Total Area 1000 Sq Ft Built Up Area 1000 Sq Ft Whether Inherited N Purchase Date 2002-10-12 Purchase Cost 0.00 Development Cost 0.00  20,00,000 20 Lacs+ House at Village Madhwapur Sitapur  Total Area 1500 Sq Ft Built Up Area Whether Inherited Y Purchase Date 0000-00-00 Purchase Cost 0.00 Development Cost 0.00  5,00,000 5 Lacs+","21A Footkar Place Sitapur Share 1/2  Total Area 500 Sq Ft Built Up Area 500 Sq Ft Whether Inherited N Purchase Date 2007-01-04 Purchase Cost 300000.00 Development Cost 0.00  6,00,000 6 Lacs+",Nil,Nil,Nil,Nil,"Rs 31,00,000 31 Lacs+"
5,v,Others,"Plot Vikas Nagar Lucknow  Total Area 2400 Sq Ft Built Up Area Whether Inherited N Purchase Date 0000-00-00 Purchase Cost 0.00 Development Cost 0.00  25,00,000 25 Lacs+",Nil,Nil,Nil,Nil,Nil,"Rs 25,00,000 25 Lacs+"
6,Total Current Market Value of (i) to (v) (as per Affidavit),Total Current Market Value of (i) to (v) (as per Affidavit),"65,00,000 65 Lacs+","91,00,000 91 Lacs+",Nil,Nil,Nil,Nil,"Rs 1,56,00,000 1 Crore+"
7,Totals Calculated,Totals Calculated,"Rs 65,00,000 65 Lacs+","Rs 91,00,000 91 Lacs+",Nil,Nil,Nil,Nil,"Rs 1,56,00,000 1 Crore+"
