,0,1,2,3,4,5,6,7,8
0,Sr No,Description,self,spouse,huf,dependent1,dependent2,dependent3,
1,i,Agricultural Land,"Village Gharkot Almora,Village-Magrukhal Almora,Vill-Bhikiyasev Almora,Vill-Turachora Almora,Vill-Roorkee Almora Area-9 Naali 34 Naali,3 Nali,2 Nali,11 Mudi, Date 2013 2013 2010 2012 2013  Total Area Built Up Area Whether Inherited N Purchase Date 0000-00-00 Purchase Cost 800000.00 Development Cost 0.00  75,00,000 75 Lacs+",Nil,Nil,Nil,Nil,Nil,"Rs 75,00,000 75 Lacs+"
2,ii,Non Agricultural Land,"Vetalghat Nainital  Total Area 221130 Sq Ft Built Up Area Whether Inherited N Purchase Date 2012-00-00 Purchase Cost 2000000.00 Development Cost 0.00  1,00,00,000 1 Crore+",Nil,Nil,Nil,Nil,Nil,"Rs 1,00,00,000 1 Crore+"
3,iii,Commercial Buildings,"Vetalghat Nainital  Total Area 400 Sq Mtr Built Up Area Whether Inherited N Purchase Date 2017-00-00 Purchase Cost 0.00 Development Cost 0.00  20,00,000 20 Lacs+",Nil,Nil,Nil,Nil,Nil,"Rs 20,00,000 20 Lacs+"
4,iv,Residential Buildings,"H No-G-20 Sec-7 Rohini Delhi 85  Total Area 350 Sq Ft Built Up Area Whether Inherited N Purchase Date 1996-00-00 Purchase Cost 700000.00 Development Cost 0.00  1,00,00,000 1 Crore+",Nil,Nil,Nil,Nil,Nil,"Rs 1,00,00,000 1 Crore+"
5,v,Others,Nil,Nil,Nil,Nil,Nil,Nil,Nil
6,Total Current Market Value of (i) to (v) (as per Affidavit),Total Current Market Value of (i) to (v) (as per Affidavit),"2,85,00,000 2 Crore+",Nil,Nil,Nil,Nil,Nil,"Rs 2,85,00,000 2 Crore+"
7,Totals Calculated,Totals Calculated,"Rs 2,95,00,000 2 Crore+",Nil,Nil,Nil,Nil,Nil,"Rs 2,95,00,000 2 Crore+"
