,0,1,2,3,4,5,6,7,8
0,Sr No,Description,self,spouse,huf,dependent1,dependent2,dependent3,
1,i,Agricultural Land,"Village Chothkhera Tehsil Neemuch Sr. No. 561 Rakba 5.230 Hectare Total Area 5.230 Hectare Built Up Area Whether Inherited Y Purchase Date 0000-00-00 Purchase Cost 0.00 Development Cost 0.00  60,00,000 60 Lacs+","Village Aasandariyanath Tehsil Jawad Sr.No. 38/2 Rakba 0.920 Hectare , Sr. No. 39/2 Rakba 0.280 Hectare , Sr. No. 40/2 Rakba 0.210 Hectare , Sr. No. 41/2 Rakba 0.430 Hectare , Sr. No. 42/2 Rakba 0.440 Hectare Sr. No. 43/2 Rakba 0.430 Hectare , Sr. No. 44/2 Rakba 0.300 Hectare Total Area 3.010 Hectare Built Up Area Whether Inherited N Purchase Date 2008-03-31 Purchase Cost 700000.00 Development Cost 3974133.00  98,00,000 98 Lacs+",Nil,Nil,Nil,Nil,"Rs 1,58,00,000 1 Crore+"
2,ii,Non Agricultural Land,"Chilla Sarod Noida U.P. Khasra No. 408/274 Total Rakba 2500 Sq.ft.  Total Area 22500 Sq.ft. Built Up Area Whether Inherited N Purchase Date 0000-00-00 Purchase Cost 50000.00 Development Cost 0.00  5,00,000 5 Lacs+",Nil,Nil,Nil,Nil,Nil,"Rs 5,00,000 5 Lacs+"
3,iii,Commercial Buildings,"Village Athana Tehsil Jawad Commercial Building Total Area 5880 Sq.ft. Built Up Area 1200 Sq.ft. Whether Inherited Y Purchase Date 0000-00-00 Purchase Cost 0.00 Development Cost 4100000.00  76,00,000 76 Lacs+ Parking Space D.C.M Building Connaught Place New Delhi Total Area 500 Sq.ft. Built Up Area 500 Sq.ft. Whether Inherited N Purchase Date 0000-00-00 Purchase Cost 500000.00 Development Cost 0.00  45,00,000 45 Lacs+",Nil,Nil,Nil,Nil,Nil,"Rs 1,21,00,000 1 Crore+"
4,iv,Residential Buildings,Nil,Nil,Nil,Nil,Nil,Nil,Nil
5,v,Others,"Noida Sakhlecha Udyog Farm Total Area Built Up Area Whether Inherited N Purchase Date 0000-00-00 Purchase Cost 0.00 Development Cost 0.00  1,66,40,000 1 Crore+",Nil,Nil,Nil,Nil,Nil,"Rs 1,66,40,000 1 Crore+"
6,Total Current Market Value of (i) to (v) (as per Affidavit),Total Current Market Value of (i) to (v) (as per Affidavit),"3,52,40,000 3 Crore+","98,00,000 98 Lacs+",Nil,Nil,Nil,Nil,"Rs 4,50,40,000 4 Crore+"
7,Totals Calculated,Totals Calculated,"Rs 3,52,40,000 3 Crore+","Rs 98,00,000 98 Lacs+",Nil,Nil,Nil,Nil,"Rs 4,50,40,000 4 Crore+"
