,0,1,2,3,4,5,6,7,8
0,Sr No,Description,self,spouse,huf,dependent1,dependent2,dependent3,
1,i,Agricultural Land,"Shivni Survey No 238, 239 209,272  Total Area 10.80 Acres Built Up Area Whether Inherited N Purchase Date 2023-02-24 Purchase Cost 199800.00 Development Cost 680000.00  14,53,200 14 Lacs+ At Shivani Survey No 288 Date 1999-07-19 Rs 20008 Survey No 213 Date 1999-06-21 Rs 57808 Survey no 269/2 Date 2003-02-24 Rs 37858 Survey No 275 Date 1999-07-17 Rs 37858 Survey no 276,287 Date 1999-09-17 Rs 26993 SURVEY NO 285 Date 1999-07-19 Rs28398  Total Area 14.01 acres Built Up Area Whether Inherited N Purchase Date 2003-02-24 Purchase Cost 199800.00 Development Cost 680000.00  20,95,100 20 Lacs+ At Parasgaov Survey No 41  Total Area 0.64 Acres Built Up Area Whether Inherited N Purchase Date 2004-02-06 Purchase Cost 32360.00 Development Cost 0.00  2,39,760 2 Lacs+ At Govindpur Survey No 218  Total Area 1.71 Acres Built Up Area Whether Inherited N Purchase Date 2001-05-08 Purchase Cost 34178.00 Development Cost 0.00  5,05,245 5 Lacs+ At Wadala Survey No 113  Total Area 2.00 Acres Built Up Area Whether Inherited N Purchase Date 2010-01-30 Purchase Cost 393950.00 Development Cost 0.00  9,81,600 9 Lacs+ At Yerkheda Survey No 5/1  Total Area 4.55 Acres Built Up Area Whether Inherited N Purchase Date 2014-12-16 Purchase Cost 454169.00 Development Cost 0.00  30,60,000 30 Lacs+ At Visapur Survey No 259  Total Area 2.50 Acres Built Up Area Whether Inherited N Purchase Date 2001-09-12 Purchase Cost 300000.00 Development Cost 0.00  25,38,000 25 Lacs+ At Wadala Survey No 114  Total Area 0.59 Acres Built Up Area Whether Inherited N Purchase Date 2010-01-30 Purchase Cost 183970.00 Development Cost 0.00  45,83,080 45 Lacs+ At Rampur Tukum Survey No 90  Total Area 0.64 Acres Built Up Area Whether Inherited N Purchase Date 2004-01-12 Purchase Cost 89130.00 Development Cost 0.00  1,60,434 1 Lacs+ At Rampur Tukum Survey No 90 A  Total Area 0.67 Acres Built Up Area Whether Inherited N Purchase Date 2004-01-12 Purchase Cost 89130.00 Development Cost 0.00  1,60,434 1 Lacs+ At Tumadi Menda Survey No 76  Total Area 2.50 Built Up Area Whether Inherited N Purchase Date 2023-05-04 Purchase Cost 1166520.00 Development Cost 0.00  11,66,520 11 Lacs+ At Bujjivahi Survey No 22/1  Total Area 0.96 Acres Built Up Area Whether Inherited N Purchase Date 2022-11-07 Purchase Cost 111720.00 Development Cost 0.00  1,26,000 1 Lacs+","At Shivani Survey No 268 Date 2005-07-07Rs 42340 Survey No250/B Date 2000-04-24 Survey No 273 Date 273 Date 2001-09-01Rs 31543 Survey No 278 Date Rs 30541 1999-27-09 Rs 43103  Total Area 9.71 Acres Built Up Area Whether Inherited N Purchase Date 0000-00-00 Purchase Cost 0.00 Development Cost 0.00  13,97,160 13 Lacs+ Vyahad khudrd Survey No 329  Total Area 1.98 Acres Built Up Area Whether Inherited N Purchase Date 2013-02-15 Purchase Cost 318420.00 Development Cost 0.00  9,66,000 9 Lacs+ At vichora vyahad Survey No 22/2  Total Area 2.00 Acres Built Up Area Whether Inherited N Purchase Date 2008-11-14 Purchase Cost 113240.00 Development Cost 0.00  18,09,750 18 Lacs+ At Shindevahi Survey No 568 Date 0.125 Acres Rs 648500 Survey No 568 date27/05/2019 Rs 648500  Total Area Built Up Area Whether Inherited N Purchase Date 0000-00-00 Purchase Cost 0.00 Development Cost 0.00  14,40,000 14 Lacs+ Shinde Survey No 246  Total Area 1.48 Built Up Area Whether Inherited N Purchase Date 2010-07-25 Purchase Cost 288570.00 Development Cost 0.00  58,80,000 58 Lacs+ At Nindra marred Survey No 60  Total Area 18.00 Acers Built Up Area Whether Inherited N Purchase Date 2010-04-09 Purchase Cost 1131270.00 Development Cost 0.00  46,41,480 46 Lacs+ At Bhokara Survey No 164/1  Total Area 0.31 Acres Built Up Area Whether Inherited N Purchase Date 2016-05-16 Purchase Cost 3723020.00 Development Cost 0.00  48,36,000 48 Lacs+ At Bhokara Survey No 164  Total Area 0.19 Acers Built Up Area Whether Inherited N Purchase Date 2020-08-14 Purchase Cost 2321040.00 Development Cost 0.00  41,20,000 41 Lacs+ At Nagbhida Survey No 14  Total Area 0.12 Acres Built Up Area Whether Inherited N Purchase Date 2020-05-21 Purchase Cost 529650.00 Development Cost 0.00  6,20,000 6 Lacs+ At Shindevahi Survey No 249/1,249/2,249/3,250/3  Total Area 5.51 Acers Built Up Area Whether Inherited N Purchase Date 2021-12-22 Purchase Cost 6072700.00 Development Cost 0.00  1,15,00,000 1 Crore+ Shindevahi Survey No 515  Total Area 1.35 Acres Built Up Area Whether Inherited N Purchase Date 2022-08-05 Purchase Cost 2675360.00 Development Cost 0.00  28,09,128 28 Lacs+ At Shindevahi Survey No 516  Total Area 1.38 Acres Built Up Area Whether Inherited N Purchase Date 2022-08-05 Purchase Cost 1605440.00 Development Cost 0.00  17,65,984 17 Lacs+ At Kinhi Shindevahi Survey No 422  Total Area 1.09 Acres Built Up Area Whether Inherited N Purchase Date 2022-07-14 Purchase Cost 560360.00 Development Cost 0.00  8,25,846 8 Lacs+ At kinhi Shindevahi Survey No 420  Total Area 0.77 Acres Built Up Area Whether Inherited N Purchase Date 2022-07-14 Purchase Cost 530360.00 Development Cost 0.00  5,83,396 5 Lacs+ At navegaov Gadchiroli Survey No 241/2A  Total Area 2.64 Acers Built Up Area Whether Inherited N Purchase Date 2006-04-24 Purchase Cost 0.00 Development Cost 0.00  70,00,000 70 Lacs+",Nil,Nil,Nil,Nil,"Rs 6,72,64,117 6 Crore+"
2,ii,Non Agricultural Land,"At Gadchiroli Survey No 731  Total Area 6996.53 Sqft Built Up Area Whether Inherited N Purchase Date 2003-02-14 Purchase Cost 248375.00 Development Cost 0.00  40,50,500 40 Lacs+ At Rampur Tukum Survey No 93B,plot No 2  Total Area 4062.83 SqFT Built Up Area Whether Inherited N Purchase Date 2012-08-04 Purchase Cost 484902.00 Development Cost 0.00  11,97,000 11 Lacs+ At Somalvada vrdha rod polt No 1-3-4-5-6  Total Area 8196.81 SQFT Built Up Area Whether Inherited N Purchase Date 2020-02-28 Purchase Cost 32875300.00 Development Cost 0.00  3,61,62,830 3 Crore+ At brahmapuri polt No 449/1/25  Total Area 2037.39 SqFT Built Up Area Whether Inherited N Purchase Date 2022-09-06 Purchase Cost 193200.00 Development Cost 0.00  3,24,000 3 Lacs+ At brahmapuri polt No 449/1/24  Total Area 2022.11 SqFT Built Up Area Whether Inherited N Purchase Date 2022-09-06 Purchase Cost 187850.00 Development Cost 0.00  4,37,000 4 Lacs+ At Brahmapuri polt No 449/1/23  Total Area 2009.30 SqFT Built Up Area Whether Inherited N Purchase Date 2002-09-06 Purchase Cost 193200.00 Development Cost 0.00  3,20,000 3 Lacs+ At brahmapuri polt No 449/1/26  Total Area 2050.20 SQft Built Up Area Whether Inherited N Purchase Date 2022-09-06 Purchase Cost 193200.00 Development Cost 0.00  3,26,000 3 Lacs+ At Brahmapuri polt No 449/1/27  Total Area 2063.01 SQFT Built Up Area Whether Inherited N Purchase Date 2022-09-06 Purchase Cost 193200.00 Development Cost 0.00  3,28,000 3 Lacs+ At brahmapuri polt No 758/31  Total Area 2540 SqFT Built Up Area Whether Inherited N Purchase Date 2021-05-19 Purchase Cost 2675760.00 Development Cost 0.00  27,56,030 27 Lacs+","At Rampur Gadchiroli Survey No 2217V 2211  Total Area 9464.37 sqft Built Up Area Whether Inherited N Purchase Date 2011-07-05 Purchase Cost 2248300.00 Development Cost 0.00  43,92,000 43 Lacs+ At bhishi Survey No 1029/1 Polt No 1Te 21Polt No 23te 38  Total Area 66744 Built Up Area Whether Inherited N Purchase Date 2011-03-11 Purchase Cost 2196160.00 Development Cost 0.00  95,86,200 95 Lacs+ At Brahmapuri Survey No 759/2 Total Area Built Up Area Whether Inherited N Purchase Date 2011-11-21 Purchase Cost 0.00 Development Cost 350660.00  37,40,000 37 Lacs+ At Nagbhida Survey No 15/1/2 polt No 5 Te 6No 759/2 plot No 5 area 4942.72 sqft date 05-04-2011 Plot No 6 area 6006.56Sqft Date 2010-05-29 Rs 394010  Total Area 4942.72 SUFT 6006 SUFT Built Up Area Whether Inherited N Purchase Date 0000-00-00 Purchase Cost 0.00 Development Cost 0.00  22,49,500 22 Lacs+ At Vadala paiku suvey No 116  Total Area 87187.59 SQFT Built Up Area Whether Inherited N Purchase Date 2008-06-27 Purchase Cost 109050.00 Development Cost 2477000.00  44,25,000 44 Lacs+ At Somalvad Vrdha Rod polt No 1-3-4-5-6  Total Area 8196.815 SqFt Built Up Area Whether Inherited N Purchase Date 2020-02-28 Purchase Cost 32875300.00 Development Cost 0.00  3,61,62,830 3 Crore+ At bramapuri Polt No 20 srevy No 449/1/20  Total Area 1699.40 SqfT Built Up Area Whether Inherited N Purchase Date 2022-09-06 Purchase Cost 161100.00 Development Cost 0.00  2,70,000 2 Lacs+ At bramapuri Polt No18 Srevy No 449/1/18  Total Area 1363.46 SqFt Built Up Area Whether Inherited N Purchase Date 2002-09-06 Purchase Cost 129000.00 Development Cost 0.00  2,17,000 2 Lacs+ At bramapuri polt No 17suevay No 449/1/17  Total Area 1459.80 SQFT Built Up Area Whether Inherited N Purchase Date 0022-09-06 Purchase Cost 139780.00 Development Cost 0.00  2,32,000 2 Lacs+ At bramapuri Polt No 16 Survey No 449/1/16  Total Area 1506.95 SQFT Built Up Area Whether Inherited Y Purchase Date 0000-00-00 Purchase Cost 0.00 Development Cost 0.00  2,40,000 2 Lacs+ At brmapuri Polt No 15 surevey No 449/1/15  Total Area 1742.35 SqFt Built Up Area Whether Inherited N Purchase Date 2022-09-06 Purchase Cost 161100.00 Development Cost 0.00  2,77,000 2 Lacs+ At bramapuri Polt No 14 Surevey N0 449/1/14  Total Area 1742.35 SQFT Built Up Area Whether Inherited N Purchase Date 2022-09-06 Purchase Cost 161100.00 Development Cost 0.00  2,77,000 2 Lacs+ At Bramapuri Polt No 13 Surevey No 449/1/13  Total Area 1742.35SQFT Built Up Area Whether Inherited N Purchase Date 2022-09-06 Purchase Cost 161100.00 Development Cost 0.00  2,77,000 2 Lacs+ At somavada Vrdha Rod Polt No 2 Surevey No 604/1  Total Area 2147.528SQFT Built Up Area Whether Inherited N Purchase Date 2022-08-10 Purchase Cost 15035120.00 Development Cost 0.00  1,65,38,632 1 Crore+ At Shirkada Surevey No 153 POLT No 1-23  Total Area 104632.75 Sqft Built Up Area Whether Inherited N Purchase Date 2023-11-07 Purchase Cost 8056200.00 Development Cost 0.00  82,97,886 82 Lacs+ At bramapuri No 639/5 Surevey 10  Total Area 5381.95 sqft Built Up Area Whether Inherited N Purchase Date 2024-05-03 Purchase Cost 4005700.00 Development Cost 0.00  40,05,700 40 Lacs+ At Bramapuri No640/5Surevey No 1  Total Area 20151.78SQFT Built Up Area Whether Inherited N Purchase Date 2024-05-03 Purchase Cost 1378200.00 Development Cost 0.00  13,78,200 13 Lacs+ At Vadala paiku Polt No 10-12 Surevey No 116  Total Area 2448.79SQFT Built Up Area Whether Inherited N Purchase Date 2024-08-14 Purchase Cost 497550.00 Development Cost 0.00  4,97,500 4 Lacs+",Nil,Nil,Nil,Nil,"Rs 13,89,64,808 13 Crore+"
3,iii,Commercial Buildings,"At bramapuri Polt No 71 Surevey No 758/71  Total Area 4161.43 SQFT Built Up Area 4161.43 SQFT Whether Inherited N Purchase Date 2020-10-12 Purchase Cost 4150560.00 Development Cost 0.00  45,65,660 45 Lacs+",Nil,Nil,Nil,Nil,Nil,"Rs 45,65,660 45 Lacs+"
4,iv,Residential Buildings,"At lodra surevey No 183 Polt No 103  Total Area 797.99 SQFT Built Up Area 797.99 SQFT Whether Inherited N Purchase Date 2000-10-24 Purchase Cost 634990.00 Development Cost 0.00  58,68,000 58 Lacs+ At devai govindpur rytvari Surevey NO 107/48K Polt No 16  Total Area 2331.57 SQFT Built Up Area 2331.57 SQFT Whether Inherited N Purchase Date 2022-11-14 Purchase Cost 6464700.00 Development Cost 0.00  67,87,935 67 Lacs+","At brmapuri Delanvadi Surevey No 100/2  Total Area 4876 SQFT Built Up Area 4500 SQFT Whether Inherited N Purchase Date 2012-04-13 Purchase Cost 3180420.00 Development Cost 5958000.00  1,89,60,000 1 Crore+ At parsodi Gopalnagar Polt No 70  Total Area 1200 SQFT Built Up Area 800 SQFT Whether Inherited N Purchase Date 2013-03-15 Purchase Cost 2412600.00 Development Cost 0.00  93,50,000 93 Lacs+ At Gadchirili Surevey No100/1  Total Area 3229.17 SQFT Built Up Area 3229.17 SQFT Whether Inherited N Purchase Date 1996-07-20 Purchase Cost 33103.00 Development Cost 2374800.00  38,74,800 38 Lacs+ At shinde Surevey No 566  Total Area 538 SQFT2 Built Up Area 5382 SQFT Whether Inherited N Purchase Date 2023-01-06 Purchase Cost 2046840.00 Development Cost 0.00  52,51,524 52 Lacs+ At Ramdaspot Polt No 5-6 Surevey 996  Total Area 5101.72 SQFT Built Up Area 6500 SQFT Whether Inherited N Purchase Date 2012-10-29 Purchase Cost 49134980.00 Development Cost 30000000.00  10,20,00,000 10 Crore+ At chimur Polt No 3 Surevey No 116  Total Area 6942.72 SQFT Built Up Area 5000SQFT Whether Inherited N Purchase Date 2008-06-27 Purchase Cost 111630.00 Development Cost 1100000.00  42,00,000 42 Lacs+ At bremapuri Polt No 1-2 Surevey No 412/1/1-412/1/2  Total Area 9877.71 Built Up Area 9877.71 Whether Inherited N Purchase Date 2020-12-09 Purchase Cost 5721200.00 Development Cost 3032000.00  87,53,200 87 Lacs+ At Ledra Polt No 801 Polt No 36 Survey No 998  Total Area 2999.90 SQFT Built Up Area 2999.90 SQFT Whether Inherited N Purchase Date 2008-02-14 Purchase Cost 4932730.00 Development Cost 0.00  2,03,00,000 2 Crore+",Nil,Nil,Nil,Nil,"Rs 18,53,45,459 18 Crore+"
5,v,Others,Nil,Nil,Nil,Nil,Nil,Nil,Nil
6,Total Current Market Value of (i) to (v) (as per Affidavit),Total Current Market Value of (i) to (v) (as per Affidavit),"8,01,92,288 8 Crore+","31,59,07,716 31 Crore+",Nil,Nil,Nil,Nil,"Rs 39,61,00,004 39 Crore+"
7,Totals Calculated,Totals Calculated,"Rs 8,01,92,328 8 Crore+","Rs 31,59,47,716 31 Crore+",Nil,Nil,Nil,Nil,"Rs 39,61,40,044 39 Crore+"
