,0,1,2,3,4,5,6,7,8
0,Sr No,Description,self,spouse,huf,dependent1,dependent2,dependent3,
1,i,Agricultural Land,"Dickling Pakyong East Sikkim K.H No-98 Plot No-831,832  Total Area 0.3600 Built Up Area Whether Inherited Y Purchase Date 0000-00-00 Purchase Cost 0.00 Development Cost 0.00  1,96,85,039 1 Crore+ Chalamthang Dicking Pakyong East Sikkim K.H No-63 plot No-366,367,362,310,311,329,365,382  Total Area 2.558 Built Up Area Whether Inherited Y Purchase Date 0000-00-00 Purchase Cost 0.00 Development Cost 0.00  21,97,21,981 21 Crore+",Nil,Nil,Nil,Nil,Nil,"Rs 23,94,07,020 23 Crore+"
2,ii,Non Agricultural Land,"Chalamthang Dicking Pakyong East Sikkim K.H No-63 Plot No-324  Total Area 0.66 Built Up Area Whether Inherited Y Purchase Date 0000-00-00 Purchase Cost 0.00 Development Cost 1265200.00  56,69,136 56 Lacs+","Samdur Tadong Gangtok East Sikkim K.H No-164/195 Plot No-616/653  Total Area 0.320 Built Up Area Whether Inherited Y Purchase Date 0000-00-00 Purchase Cost 0.00 Development Cost 0.00  1,03,33,354 1 Crore+ Samdur Tadong Gangtok East Sikkim K.H No-1250 Plot No-616/1489  Total Area 0.037 Built Up Area Whether Inherited N Purchase Date 2024-02-20 Purchase Cost 212326.00 Development Cost 0.00  2,12,326 2 Lacs+",Nil,Nil,Nil,Nil,"Rs 1,62,14,816 1 Crore+"
3,iii,Commercial Buildings,Nil,"Sandur Tadong Gangtok East Sikkim K.H No-164/195 Plot No-616/653  Total Area 2022 Sqft Built Up Area 6416 Sqft Whether Inherited Y Purchase Date 0000-00-00 Purchase Cost 0.00 Development Cost 0.00  1,42,82,400 1 Crore+ Sandur Tadong Gangtok East Sikkim K.H No-164/195 Plot No-616/653  Total Area 2197 Sqft Built Up Area 4394 Sqft Whether Inherited Y Purchase Date 0000-00-00 Purchase Cost 0.00 Development Cost 0.00  92,27,400 92 Lacs+",Nil,Nil,Nil,Nil,"Rs 2,35,09,800 2 Crore+"
4,iv,Residential Buildings,"Chalamthang Dicking Pakyong East Sikkim K.H No-63 Plot No-324  Total Area 120 Sqft Built Up Area 1250 Sqft Whether Inherited Y Purchase Date 0000-00-00 Purchase Cost 0.00 Development Cost 0.00  64,89,200 64 Lacs+ Chalamthang Dicking Pakyong East Sikkim K.H No-63 Plot No-324  Total Area 693 Sqft Built Up Area 693 Sqft Whether Inherited Y Purchase Date 0000-00-00 Purchase Cost 0.00 Development Cost 1265200.00  15,24,600 15 Lacs+ Pakyong Bazar Sikkim K.H No-181 plot No-36  Total Area 1720 Sqft Built Up Area 1720 Sqft Whether Inherited Y Purchase Date 0000-00-00 Purchase Cost 0.00 Development Cost 0.00  69,66,000 69 Lacs+",Nil,Nil,Nil,Nil,Nil,"Rs 1,49,79,800 1 Crore+"
5,v,Others,Nil,Nil,Nil,Nil,Nil,Nil,Nil
6,Total Current Market Value of (i) to (v) (as per Affidavit),Total Current Market Value of (i) to (v) (as per Affidavit),"26,00,55,956 26 Crore+","3,40,55,480 3 Crore+",Nil,Nil,Nil,Nil,"Rs 29,41,11,436 29 Crore+"
7,Totals Calculated,Totals Calculated,"Rs 26,00,55,956 26 Crore+","Rs 3,40,55,480 3 Crore+",Nil,Nil,Nil,Nil,"Rs 29,41,11,436 29 Crore+"
