,0,1,2,3,4,5,6,7,8
0,Sr No,Description,self,spouse,huf,dependent1,dependent2,dependent3,
1,i,Agricultural Land,"Mauja Andwa Pargana Jhunshi Teh-Phulpur Prayagraj Khata No-151  Total Area 1.0118 Hec Built Up Area Whether Inherited Y Purchase Date 0000-00-00 Purchase Cost 0.00 Development Cost 0.00  80,95,815 80 Lacs+ Mauja Andwa Pargana Jhunshi Teh-Phulpur Prayagraj Khata No-152  Total Area 5.7805 Acre Built Up Area Whether Inherited Y Purchase Date 0000-00-00 Purchase Cost 0.00 Development Cost 0.00  4,62,47,961 4 Crore+ Mauja Andwa Pargana Jhunshi Teh-Phulpur Prayagraj Khata No-151  Total Area 1.4405 Acre Built Up Area Whether Inherited Y Purchase Date 0000-00-00 Purchase Cost 0.00 Development Cost 0.00  11,52,591 11 Lacs+","Mauja Sarsaul-1 Pargana Narwal Teh-Narwal Dist Kanpur Nagar, Mauja Sarsaul-2 Pargana Narwal Teh-Narwal Dist Kanpur Nagar, Date of Purchased Year 13-01-1999 22-11-2002 Cost of Purchased 100000/- 524000/- 624000/-  Total Area 3.4569 Acre Built Up Area Whether Inherited N Purchase Date 0000-00-00 Purchase Cost 0.00 Development Cost 0.00  1,22,36,000 1 Crore+ Mauja Andwa Pargana Jhunshi Teh-Phulpur Prayagraj Khata No-336  Total Area 0.2687 Acre Built Up Area Whether Inherited N Purchase Date 2015-08-21 Purchase Cost 2152000.00 Development Cost 0.00  40,00,000 40 Lacs+ Teh Bindki Dist Fatehpur (1) Village Gangoli Gata No 9B, 120B, Village Jarauli Gata No-484 Village Nandapur Gata No-862 739 824 Village Chak Kashmiri Gata No-179 25Min 184Min 185 Village Rewari Bujurg Gata No-955 956 957 958 Teh Nardal Dist Kanpur Kanpur Nagar Village Tilsaheri Khurd Gata No-607 Village Karvi Gaon Salempur Gata No-315, Village Sarsaul-1 Gata No-307 Village Sarsaul -2 Gata No-258 Area 6.1484 Acre, 0.4200 Acre, 1.5700 Acre, 0.2569 Acre, 1.0553 Acre, 0.5232 Hec, 0.6283 Acre 0.6671 Acre, 1.1663 Acre  Total Area 13.2051 Acre Built Up Area Whether Inherited Y Purchase Date 0000-00-00 Purchase Cost 0.00 Development Cost 0.00  2,14,00,000 2 Crore+ Teh Narwal Dist Kanpur Nagar, Village Maharajpur Gata No-1688 Village Karvi Gaon Salempue Gata No-315 151 159 & Village Sarsoul-1 Gata No-64 74 369 Village Sarsoul-2 Gata No-392  Total Area 6.1907 Acre Built Up Area Whether Inherited Y Purchase Date 0000-00-00 Purchase Cost 0.00 Development Cost 0.00  1,20,00,000 1 Crore+",Nil,Nil,Nil,Nil,"Rs 10,51,32,367 10 Crore+"
2,ii,Non Agricultural Land,"Village Katka Pargana Jhunshi Teh Phulpur Prayagraj Gata No-106  Total Area 19385 Sq Ft Built Up Area Whether Inherited Y Purchase Date 0000-00-00 Purchase Cost 0.00 Development Cost 0.00  4,50,25,000 4 Crore+ Village Katka Pargana Jhunshi Teh Phulpur Prayagraj Gata No-037  Total Area 3336.84 Sq Ft Built Up Area Whether Inherited Y Purchase Date 0000-00-00 Purchase Cost 0.00 Development Cost 0.00  77,50,000 77 Lacs+ Village Andwa Pargana Jhushi Teh Phulpur Prayagraj Gata No-152  Total Area 9848 Sq Ft Built Up Area Whether Inherited Y Purchase Date 0000-00-00 Purchase Cost 0.00 Development Cost 0.00  15,70,00,000 15 Crore+","Ramadevi Kanpur Nagar, KDA Difence Colony Jajmau Kanpur Colony, Vikas Pradhikaran Ghaziabad, Deheli Sujanpur Kanpur, Rai Bakewar Fatehpur , K1/19 MIG Barra Kanpur Nagar, Plot No-A/847/448/307 Shivkatra Lalbangla Kanpur Nagar, Total Area 15072.97 Sq Ft Built Up Area Whether Inherited Y Purchase Date 0000-00-00 Purchase Cost 0.00 Development Cost 0.00  2,01,00,000 2 Crore+",Nil,Nil,Nil,Nil,"Rs 22,98,75,000 22 Crore+"
3,iii,Commercial Buildings,Nil,"Situated at Rmadevi Kanpur Nagar, Village Village Bakewar Dist Fatehpur Area-1600 Sq Ft, 500 Sq Ft  Built Up Area-1600 Sq Ft 500 Sq Ft  Total Area Built Up Area Whether Inherited Y Purchase Date 0000-00-00 Purchase Cost 0.00 Development Cost 0.00  20,00,000 20 Lacs+",Nil,Nil,Nil,Nil,"Rs 20,00,000 20 Lacs+"
4,iv,Residential Buildings,"H No-285 Village Andwa Teh-Phulpur Prayagraj  Total Area 16000 Sq Ft Built Up Area 8000 Sq Ft Whether Inherited Y Purchase Date 0000-00-00 Purchase Cost 0.00 Development Cost 0.00  17,50,000 17 Lacs+ H No-61/35/FN -402 Vinayak Lata Kunj Dayanand Marg Prayagraj  Total Area 2104.36 Sq Ft Built Up Area 2104.36 Sq Ft Whether Inherited N Purchase Date 2020-07-28 Purchase Cost 6666667.00 Development Cost 0.00  66,66,667 66 Lacs+","H No-61/35/FN -402 Vinayak Lata Kunj Dayanand Marg Prayagraj  Total Area 2104.36 Sq Ft Built Up Area 2104.36 Sq Ft Whether Inherited Y Purchase Date 2020-07-28 Purchase Cost 6666667.00 Development Cost 0.00  66,66,667 66 Lacs+",Nil,Nil,Nil,Nil,"Rs 1,50,83,334 1 Crore+"
5,v,Others,Nil,Nil,Nil,Nil,Nil,Nil,Nil
6,Total Current Market Value of (i) to (v) (as per Affidavit),Total Current Market Value of (i) to (v) (as per Affidavit),"27,36,88,034 27 Crore+","7,84,02,667 7 Crore+",Nil,Nil,Nil,Nil,"Rs 35,20,90,701 35 Crore+"
7,Totals Calculated,Totals Calculated,"Rs 27,36,88,034 27 Crore+","Rs 7,84,02,667 7 Crore+",Nil,Nil,Nil,Nil,"Rs 35,20,90,701 35 Crore+"
