,0,1,2,3,4,5,6,7,8
0,Sr No,Description,self,spouse,huf,dependent1,dependent2,dependent3,
1,i,Agricultural Land,"Village Mashibad Talab Imliya Vandhusra, Amhawa Hasimpara S No-6.50 4.19 4.67 0.26 Acre Total 15.62 Acre  Total Area 15.62 Acre Built Up Area Whether Inherited Y Purchase Date 2019-10-14 Purchase Cost 200000.00 Development Cost 0.00  1,00,30,000 1 Crore+",Nil,Nil,Nil,Nil,Nil,"Rs 1,00,30,000 1 Crore+"
2,ii,Non Agricultural Land,"Village Lalganj Teh Utraula  Total Area 3270 Sq Ft Built Up Area Whether Inherited Y Purchase Date 2019-10-14 Purchase Cost 400000.00 Development Cost 0.00  25,00,000 25 Lacs+",Nil,Nil,Nil,Nil,Nil,"Rs 25,00,000 25 Lacs+"
3,iii,Commercial Buildings,"Utraula Nagar Subhash Nagar 2 Shops  Total Area 400 Sq Ft Built Up Area 400 Sq Ft Whether Inherited Y Purchase Date 0000-00-00 Purchase Cost 0.00 Development Cost 0.00  5,50,000 5 Lacs+",Nil,Nil,Nil,Nil,Nil,"Rs 5,50,000 5 Lacs+"
4,iv,Residential Buildings,"R.O Village Imliya Banghusra Post-Rehramafi Dist Balrampur 1/5shere Total Area 870 Sq Ft Built Up Area 200 Sq Ft Whether Inherited Y Purchase Date 0000-00-00 Purchase Cost 0.00 Development Cost 0.00  2,00,000 2 Lacs+ Utraula Mohalla Ekinagar Share 1/5  Total Area 1500 Sq Ft Built Up Area Whether Inherited Y Purchase Date 0000-00-00 Purchase Cost 0.00 Development Cost 0.00  15,00,000 15 Lacs+",Nil,Nil,Nil,Nil,Nil,"Rs 17,00,000 17 Lacs+"
5,v,Others,"Bricks  Total Area Built Up Area Whether Inherited N Purchase Date 0000-00-00 Purchase Cost 0.00 Development Cost 0.00  35,00,000 35 Lacs+","Bricks  Total Area Built Up Area Whether Inherited N Purchase Date 0000-00-00 Purchase Cost 0.00 Development Cost 0.00  20,00,000 20 Lacs+",Nil,Nil,Nil,Nil,"Rs 55,00,000 55 Lacs+"
6,Total Current Market Value of (i) to (v) (as per Affidavit),Total Current Market Value of (i) to (v) (as per Affidavit),"1,88,80,000 1 Crore+","20,00,000 20 Lacs+",Nil,Nil,Nil,Nil,"Rs 2,08,80,000 2 Crore+"
7,Totals Calculated,Totals Calculated,"Rs 1,82,80,000 1 Crore+","Rs 20,00,000 20 Lacs+",Nil,Nil,Nil,Nil,"Rs 2,02,80,000 2 Crore+"
