,0,1,2,3,4,5,6,7,8
0,Sr No,Description,self,spouse,huf,dependent1,dependent2,dependent3,
1,i,Agricultural Land,"1. Khasra No. 1750, 1747, 1748, Vill. Gadhiya, Pargna Deva, Tah- Nawabganj, Dist. Barabanki, Land- 0.6324 Acre, Amount- 400000. 2. Khasra No. 375, Vill. Maheshpur, Pargana- Nawabganj, Tah- Tarabganj, Dist. Gounda, Land- 0.4000 Acre, Amount- 400000. 3. Khasra No. 141S, 142, 265C, 265KH, 265G, 265GH, 266G, 270C, 270Kh, 270G, 270Gh, Vill. Chandiymau, Pargna - Tah- Dist. Lucknow, Land- 3.9258 Acre, Amount- 8951000 4. Khasra No. 860, 844, 831, Vill. Udaypur, Pargna- Mohanlalganj, Dist. Lucknow, Land- 1.6971 Acre, Amount- 1560000 5. Khasra No. 169, 218, 99, 219, 156, Vill. Lajghata, Pargna- Amodha, Tah- Harriya, Dist. Basti, Land- 1.4081 Acre, Amount- 2223000 6. Khasra No. 85, 88, 486, Vill. Pakheri, Pargna- Amodha, Tah- Harriya, Dis. Basti, Land- 1.2912 Acre, Amount- 4652030 7. Khasra No. 236, Vill. Alanikhurd, Pargna- Amodha, Tah- Harriya, Dist. Basti, Land- 0.9795 Acre, Amount- 949680, 8. Khasra No. 30, Vill. Ramahtiya, Pargna- Amodha, Tah- Harriya, Dist. Basti, Land- 0.1835 Acre, Amount- 178320, 9. Khasra No. 16Mi, 155C, 109, 83, 122Mi, 68, 319, Vill. Ajandih, Pargna- Amodha, Tah- Harriya, Dist. Basti, Land- 0.4846 Acre, Amount- 588600 10. Khasra No. 834, Vill. Thana Khas, Pargna- Amodha, Tah- Harriya, Dist. Basti, Land- 0.0804 Acre, Amount- 717000. Date of Purchase- 03/10/2009, 13/08/2015, 06/03/2014, 04/10/2012, 11/04/2014, 12/01/2011, 11/08/2014, 05/02/2015, 17/06/2010  Total Area 11.0824 Acre Built Up Area Whether Inherited N Purchase Date 0000-00-00 Purchase Cost 20619630.00 Development Cost 0.00  2,26,81,593 2 Crore+","1. Khasra No. 2054, 2057, 2120, 2105, 2082, 2088, 2092, 2093, 2040, 2041 Ect. Vill. Mati, Pargna- Bijnouri, Tah- Sarojininagar, Dist. Lucknow, Land- 1.4659 Acre, Amount- 5935000. 2. Khasra No. 245Mi, 491. Vill. Khesuaa, Pargna- Amodha, Tah- Harriya, Dist. Basti, Land- 0.4989 Acre, Amount- 210000. 3. Khasra No. 1756, 1750, 1747, 1748, 1742, Vill. Gadiya, Pargna- Deva, Tah- Nawabganj, Dist. Barabaki, Land- 1.0548, Amount- 500000 4. KHasra No. 383, 374, Vill. Lajghata, Aprgna- Amodha, Tah- Harriya, Dist. Basti. Land- 0.8473 Acre, Amount- 336000. Date of Purchase- 10/09/2009, 24/10/2019, 15/04/2009, 29/06/2005, 18/02/2006  Total Area 3.8669 Acre Built Up Area Whether Inherited N Purchase Date 0000-00-00 Purchase Cost 6981000.00 Development Cost 0.00  76,79,100 76 Lacs+",Nil,"Khasra No. 399, Vill. Maheshpur, Pargna- Nawabganj, Tah- Tarbganj, Dist. Gonda, Total Area 2.290 Acre Built Up Area Whether Inherited N Purchase Date 2015-08-13 Purchase Cost 500000.00 Development Cost 0.00  18,00,000 18 Lacs+",Nil,Nil,"Rs 3,21,60,693 3 Crore+"
2,ii,Non Agricultural Land,"1. Plot No. H-148, Area- 1056.88 Sq Mtr- 1/2 Part, Sushant Golf City Lucknow. 2. Plot No. A/5/18, Area- 450 sq mtr- 1/2 Part, Gomati Green Lucknow. 3. Plot C-B/B/23, Area- 200 SQ mtr, Gomati Green Lucknow. 4. Khasra No. 647, Area- 418.214 sq mtr, Madiyav. Lucknow 5. C.P.-19 Area- 2406 Sq tr- 1/3 Part, Sushant Golf City Lucknow Date of Purchase- 11/11/2019, 20/10/2019, 25/11/2013, 08/10/2021  Total Area 2173.64 sq mtr Built Up Area Whether Inherited N Purchase Date 0000-00-00 Purchase Cost 0.00 Development Cost 0.00  4,20,01,827 4 Crore+","1. Plot No. H-148, Area- 1056.86 sq mtr-1/2 Part, Sushant Golf City, Lucknow, DOP- 11/11/2019. 2. Plot No. A/%/18, Area0 450 SQ mtr-1/2 Part, Gomati Green Lucknow, DOP- 22/10/2019.  Total Area 753.43 SQ mtr Built Up Area Whether Inherited N Purchase Date 0000-00-00 Purchase Cost 15966770.00 Development Cost 0.00  1,75,63,447 1 Crore+",Nil,Nil,Nil,Nil,"Rs 5,95,65,274 5 Crore+"
3,iii,Commercial Buildings,"1. F.F-301, Are- 17.359 Sq Mtr-1/2 Part, Vikas Khand, Lucknow. 2. F.F. 302, Area- 16.80 Sq Mtr, Vikas Khand, Lucknow. 3. TCV- 56C, Area- 398 Sq mtr 1/4 Part, Gomati Nagar Lucknow 4. Khasra No. 647, Area- 209.107 Sq mtr, Adiyaw Lucknow 5. Khasra No. 647, Area- 209.107 Sq mtr, Madiyaw Lucknow. Date of Purchase- 20/01/2007, 19/10/2012, 19/03/2019, 22/06/2013  Total Area 543.19 sq mtr Built Up Area 950.58 sq mtr Whether Inherited N Purchase Date 0000-00-00 Purchase Cost 10903500.00 Development Cost 0.00  1,19,93,850 1 Crore+","1. UGF-A-226, Area- 20.399 Sq mtr-1/2 Part, Vikas Khand Lucknow 2. B-110, Area- 183.60 sq mtr-1/3 Part, Vibhuti Khand, Gomati Nagar Lucknow. Date of Purchase- 16/06/2006, 15/05/2013  Total Area 71.39 sq mtr Built Up Area 35.69 sq mtr Whether Inherited N Purchase Date 0000-00-00 Purchase Cost 2450000.00 Development Cost 0.00  30,62,500 30 Lacs+",Nil,Nil,Nil,Nil,"Rs 1,50,56,350 1 Crore+"
4,iv,Residential Buildings,"1. 10/74, Area- 170, 074 sq mtr-1/3 Part, Sahara State Madiyaw Lucknow. 2. D/2/209, Area- sq mtr, Sushant Golf City Lucknow. Date of Purchase- 08/11/2007, 01/08/2016  Total Area 392.69 sq mtr Built Up Area 687.20 sq mtr Whether Inherited N Purchase Date 0000-00-00 Purchase Cost 15114520.00 Development Cost 0.00  1,88,93,150 1 Crore+","10/74, Sahara State Madiyaw Lucknow  Total Area 56.69 sq mtr Built Up Area 99.20 sq mtr Whether Inherited N Purchase Date 2007-11-08 Purchase Cost 4000000.00 Development Cost 0.00  50,00,000 50 Lacs+",Nil,Nil,Nil,Nil,"Rs 2,38,93,150 2 Crore+"
5,v,Others,Nil,Nil,Nil,Nil,Nil,Nil,Nil
6,Total Current Market Value of (i) to (v) (as per Affidavit),Total Current Market Value of (i) to (v) (as per Affidavit),"9,55,70,420 9 Crore+","3,33,05,047 3 Crore+",Nil,"18,00,000 18 Lacs+",Nil,Nil,"Rs 13,06,75,467 13 Crore+"
7,Totals Calculated,Totals Calculated,"Rs 9,55,70,420 9 Crore+","Rs 3,33,05,047 3 Crore+",Nil,"Rs 18,00,000 18 Lacs+",Nil,Nil,"Rs 13,06,75,467 13 Crore+"
