,0,1,2,3,4,5,6,7,8
0,Sr No,Description,self,spouse,huf,dependent1,dependent2,dependent3,
1,i,Agricultural Land,"Honnavar tq village sy.no.381A/131  Total Area 0.5.8 gts Built Up Area Whether Inherited N Purchase Date 0000-00-00 Purchase Cost 0.00 Development Cost 0.00  5,50,000 5 Lacs+ Bailur village sy.no.214/4  Total Area 1.4.0 gts Built Up Area Whether Inherited N Purchase Date 0000-00-00 Purchase Cost 0.00 Development Cost 0.00  40,25,000 40 Lacs+ Bailur village sy.no.156/1  Total Area 00.28 gts Built Up Area Whether Inherited N Purchase Date 0000-00-00 Purchase Cost 0.00 Development Cost 0.00  28,00,000 28 Lacs+ Bailur village sy.no.156/8  Total Area 00.3.00gts Built Up Area Whether Inherited N Purchase Date 0000-00-00 Purchase Cost 0.00 Development Cost 0.00  3,00,000 3 Lacs+ Bailur village sy.no.157/14  Total Area 00.06.00 gts Built Up Area Whether Inherited N Purchase Date 0000-00-00 Purchase Cost 0.00 Development Cost 0.00  6,00,000 6 Lacs+ Bailur village sy.no.158A/1  Total Area 00.11.00 gts Built Up Area Whether Inherited N Purchase Date 0000-00-00 Purchase Cost 0.00 Development Cost 0.00  11,00,000 11 Lacs+ Bailur village sy.no.578A/1  Total Area 00.03.00 gts Built Up Area Whether Inherited N Purchase Date 0000-00-00 Purchase Cost 100000.00 Development Cost 0.00  6,00,000 6 Lacs+ Bailur village sy.no.577A  Total Area 00-07-08gts Built Up Area Whether Inherited N Purchase Date 0000-00-00 Purchase Cost 120000.00 Development Cost 0.00  15,00,000 15 Lacs+ Bengre village sy.no.365/2K3A  Total Area 00.18.00gts Built Up Area Whether Inherited N Purchase Date 0000-00-00 Purchase Cost 90000.00 Development Cost 0.00  18,00,000 18 Lacs+ Kaikini village sy.no.62A/9  Total Area 00.02.00gts Built Up Area Whether Inherited N Purchase Date 0000-00-00 Purchase Cost 36400.00 Development Cost 0.00  4,00,000 4 Lacs+","Bailur village sy.no.577/*/7  Total Area 00.07.00 gts Built Up Area Whether Inherited N Purchase Date 0000-00-00 Purchase Cost 275000.00 Development Cost 0.00  14,00,000 14 Lacs+ Bailur village sy.no.577/*/2B  Total Area 00.14.04gts Built Up Area Whether Inherited N Purchase Date 0000-00-00 Purchase Cost 223000.00 Development Cost 0.00  28,00,000 28 Lacs+ Mavali Village sy.no.356/*/19  Total Area 00.02.04 gts Built Up Area Whether Inherited N Purchase Date 0000-00-00 Purchase Cost 182500.00 Development Cost 0.00  4,50,000 4 Lacs+ Bengre Village sy.no.408/*/7  Total Area 1.29.00 gts Built Up Area Whether Inherited N Purchase Date 0000-00-00 Purchase Cost 935000.00 Development Cost 0.00  69,00,000 69 Lacs+ Kaikini village sy.no.21/*/7  Total Area 00.06.00 gts Built Up Area Whether Inherited N Purchase Date 0000-00-00 Purchase Cost 80000.00 Development Cost 0.00  6,00,000 6 Lacs+",Nil,"Bengre village sy.no.446/*/1  Total Area 00.20.00 gts Built Up Area Whether Inherited N Purchase Date 0000-00-00 Purchase Cost 69000.00 Development Cost 0.00  20,00,000 20 Lacs+ Bailur village sy.no.444/*/2  Total Area Built Up Area Whether Inherited N Purchase Date 0000-00-00 Purchase Cost 140000.00 Development Cost 0.00  28,00,000 28 Lacs+ Bailur village sy.no.444/*/3  Total Area 00.17.00 gts Built Up Area Whether Inherited N Purchase Date 0000-00-00 Purchase Cost 164000.00 Development Cost 0.00  34,00,000 34 Lacs+ Bailur village sy.no.444/*/4  Total Area 00.13.00 gts Built Up Area Whether Inherited N Purchase Date 0000-00-00 Purchase Cost 126000.00 Development Cost 0.00  26,00,000 26 Lacs+ Bailur village sy.no.444/*/5  Total Area 00.14.00 gts Built Up Area Whether Inherited N Purchase Date 0000-00-00 Purchase Cost 135000.00 Development Cost 0.00  28,00,000 28 Lacs+ Bailur village sy.no.605/*/1  Total Area 01.10.00 gts Built Up Area Whether Inherited N Purchase Date 0000-00-00 Purchase Cost 482000.00 Development Cost 0.00  2,00,00,000 2 Crore+ Kaikini village sy.no.62/A/4B  Total Area 00.00.08 gts Built Up Area Whether Inherited N Purchase Date 0000-00-00 Purchase Cost 30000.00 Development Cost 0.00  1,00,000 1 Lacs+ Mavali Village sy.no.190/A/1K  Total Area 00.02.04 gts Built Up Area Whether Inherited N Purchase Date 0000-00-00 Purchase Cost 180000.00 Development Cost 0.00  4,50,000 4 Lacs+",Nil,Nil,"Rs 5,99,75,000 5 Crore+"
2,ii,Non Agricultural Land,"Bailur village sy.no.578/4  Total Area 00.01.00 gts Built Up Area Whether Inherited N Purchase Date 0000-00-00 Purchase Cost 20000.00 Development Cost 0.00  1,50,000 1 Lacs+ Bailur village sy.no.578/D  Total Area 00.22.00 gts Built Up Area Whether Inherited N Purchase Date 0000-00-00 Purchase Cost 440000.00 Development Cost 0.00  44,00,000 44 Lacs+ Bailur village sy.no.578/B  Total Area 00.24.13gts Built Up Area Whether Inherited N Purchase Date 0000-00-00 Purchase Cost 650000.00 Development Cost 0.00  56,60,000 56 Lacs+ Bailur village sy.no.434/3D  Total Area 00.32.08 gts Built Up Area Whether Inherited N Purchase Date 0000-00-00 Purchase Cost 150000.00 Development Cost 0.00  65,00,000 65 Lacs+ Shiralli village sy.no.434/3  Total Area 00.22.08 Built Up Area Whether Inherited N Purchase Date 0000-00-00 Purchase Cost 100000.00 Development Cost 0.00  45,00,000 45 Lacs+ Shiralli village sy.no.434/3  Total Area 2.15.00 gts Built Up Area Whether Inherited N Purchase Date 0000-00-00 Purchase Cost 350000.00 Development Cost 0.00  1,90,00,000 1 Crore+ Shiralli village sy.no.434/3  Total Area 00.22.00 gts Built Up Area Whether Inherited N Purchase Date 0000-00-00 Purchase Cost 100000.00 Development Cost 0.00  44,00,000 44 Lacs+ Kaikini Village sy.no.62/7  Total Area 00.11.00 gts Built Up Area Whether Inherited N Purchase Date 0000-00-00 Purchase Cost 100000.00 Development Cost 0.00  44,00,000 44 Lacs+ Kaikini village sy.no.62/6  Total Area 00.10.00 gts Built Up Area Whether Inherited N Purchase Date 0000-00-00 Purchase Cost 100000.00 Development Cost 0.00  40,00,000 40 Lacs+ Bailur village sy.no.578/K  Total Area 00.05.00 gts Built Up Area Whether Inherited N Purchase Date 0000-00-00 Purchase Cost 88000.00 Development Cost 0.00  10,00,000 10 Lacs+","Kaikini village sy.no.20/*/4  Total Area 00.01.14 gts Built Up Area Whether Inherited N Purchase Date 0000-00-00 Purchase Cost 190000.00 Development Cost 0.00  35,40,000 35 Lacs+ Bailur village sy.no.577/*/6  Total Area 00.10.04 gts Built Up Area Whether Inherited N Purchase Date 0000-00-00 Purchase Cost 1038000.00 Development Cost 0.00  30,75,000 30 Lacs+ Mavali village sy.no.356/*/7  Total Area 00.06.04 gts Built Up Area Whether Inherited N Purchase Date 0000-00-00 Purchase Cost 1280000.00 Development Cost 0.00  18,75,000 18 Lacs+ Tiptur tq sy.no.24/4  Total Area 9.14*14.24 mtrs Built Up Area Whether Inherited N Purchase Date 0000-00-00 Purchase Cost 400000.00 Development Cost 0.00  5,00,000 5 Lacs+",Nil,Nil,Nil,Nil,"Rs 6,30,00,000 6 Crore+"
3,iii,Commercial Buildings,"Mavali village sy.no.661A5/A  Total Area 00-4-00 gts Built Up Area Whether Inherited N Purchase Date 0000-00-00 Purchase Cost 261000.00 Development Cost 0.00  20,00,000 20 Lacs+ Bailur village sy.no.577/B  Total Area 1-15-00 gts Built Up Area Whether Inherited N Purchase Date 0000-00-00 Purchase Cost 1064000.00 Development Cost 0.00  1,65,00,000 1 Crore+ Kaikini village sy.no.62/B1  Total Area 00-5-08 sft Built Up Area Whether Inherited N Purchase Date 0000-00-00 Purchase Cost 100000.00 Development Cost 0.00  15,00,000 15 Lacs+",Nil,"Bina boarding lodging Total Area 2640 sft Built Up Area Whether Inherited N Purchase Date 0000-00-00 Purchase Cost 0.00 Development Cost 0.00  1,50,00,000 1 Crore+ Bina vaidya international school  Total Area 28579sft Built Up Area Whether Inherited N Purchase Date 0000-00-00 Purchase Cost 0.00 Development Cost 0.00  24,50,00,000 24 Crore+ Karavali Ice plant , bluilding machinery Total Area 1309 sft Built Up Area Whether Inherited N Purchase Date 0000-00-00 Purchase Cost 0.00 Development Cost 0.00  20,00,000 20 Lacs+","Kaikini gramada sy.no.62B/2  Total Area 5445 sft Built Up Area 1642.5 sft Whether Inherited N Purchase Date 0000-00-00 Purchase Cost 2200000.00 Development Cost 2500000.00  40,00,000 40 Lacs+",Nil,Nil,"Rs 28,60,00,000 28 Crore+"
4,iv,Residential Buildings,"Kaikini village sy.no.62/5  Total Area 1647 sft Built Up Area Whether Inherited N Purchase Date 0000-00-00 Purchase Cost 55000.00 Development Cost 5000000.00  83,00,000 83 Lacs+ Kaikini village sy.no.62  Total Area 1365sft Built Up Area Whether Inherited N Purchase Date 0000-00-00 Purchase Cost 40000.00 Development Cost 4000000.00  64,00,000 64 Lacs+ Bailur village sy.no.578/2  Total Area 360sft Built Up Area Whether Inherited N Purchase Date 0000-00-00 Purchase Cost 245000.00 Development Cost 500000.00  27,00,000 27 Lacs+ Bengre village sy.no.365/2  Total Area 888 sft Built Up Area Whether Inherited N Purchase Date 0000-00-00 Purchase Cost 90000.00 Development Cost 300000.00  28,00,000 28 Lacs+","Kaikini village sy.no.20/A/4  Total Area 2450sft Built Up Area 1804 sft Whether Inherited N Purchase Date 0000-00-00 Purchase Cost 3000000.00 Development Cost 0.00  30,00,000 30 Lacs+",Nil,"Mavali village sy.no.190B/*  Total Area 9801sft Built Up Area 28.5sft Whether Inherited N Purchase Date 0000-00-00 Purchase Cost 2600000.00 Development Cost 2500000.00  60,00,000 60 Lacs+",Nil,Nil,"Rs 2,92,00,000 2 Crore+"
5,v,Others,Nil,Nil,Nil,Nil,Nil,Nil,Nil
6,Total Current Market Value of (i) to (v) (as per Affidavit),Total Current Market Value of (i) to (v) (as per Affidavit),"10,78,85,000 10 Crore+","2,41,40,000 2 Crore+","26,20,00,000 26 Crore+","4,41,50,000 4 Crore+",Nil,Nil,"Rs 43,81,75,000 43 Crore+"
7,Totals Calculated,Totals Calculated,"Rs 10,78,85,000 10 Crore+","Rs 2,41,40,000 2 Crore+","Rs 26,20,00,000 26 Crore+","Rs 4,41,50,000 4 Crore+",Nil,Nil,"Rs 43,81,75,000 43 Crore+"
