,0,1,2,3,4,5,6,7,8
0,Sr No,Description,self,spouse,huf,dependent1,dependent2,dependent3,
1,i,Agricultural Land,"Mauje, Undera, Survey No. 588,601, 602/1  Total Area 0.41 Acres Built Up Area Whether Inherited N Purchase Date 2008-02-18 Purchase Cost 205000.00 Development Cost 0.00  13,50,000 13 Lacs+ Mauje, Pavalepur, Survey No. 35-A, Juna Survey No. 70  Total Area 0.4 Acres Built Up Area Whether Inherited N Purchase Date 2010-09-14 Purchase Cost 630000.00 Development Cost 0.00  18,60,000 18 Lacs+ Mauje Tatarpur, Survey no. 189, Block No. 146  Total Area 2.64 Acres Built Up Area Whether Inherited N Purchase Date 2018-04-09 Purchase Cost 1775000.00 Development Cost 0.00  17,75,000 17 Lacs+",Nil,Nil,Nil,Nil,Nil,"Rs 49,85,000 49 Lacs+"
2,ii,Non Agricultural Land,Nil,Nil,"Keyur Narayandas Rokdiya, HUF, Mauje Humad, Survey No. 1228 And Block no. 853/1  Total Area 10846 Sq.ft Built Up Area Whether Inherited N Purchase Date 2019-06-04 Purchase Cost 3766409.00 Development Cost 0.00  67,00,000 67 Lacs+",Nil,Nil,Nil,"Rs 67,00,000 67 Lacs+"
3,iii,Commercial Buildings,"First Floor, Rajgadh Complex, Dandiya bazar, Tika No. 13/1 Survey No. 24/A  Total Area 365 Sq.ft Built Up Area 365 Sq.ft Whether Inherited N Purchase Date 1998-03-09 Purchase Cost 175000.00 Development Cost 0.00  13,00,000 13 Lacs+",Nil,Nil,Nil,Nil,Nil,"Rs 13,00,000 13 Lacs+"
4,iv,Residential Buildings,"18, Anupam Society, Jetalpur Road, Vadodara, Survey no. 104, (Joint Property) (50%)  Total Area 4000 .00 Sq.ft Built Up Area 4000 Sq.ft Whether Inherited N Purchase Date 2000-05-14 Purchase Cost 1800000.00 Development Cost 4500000.00  75,97,000 75 Lacs+ Flat No. 202, Shivam Avenue, Shrinagar Society, Akota, Cense No. 06-07-111-001-005-020  Total Area 800.00 Sq.ft Built Up Area 1258 Sq.ft Whether Inherited N Purchase Date 1998-08-14 Purchase Cost 369000.00 Development Cost 0.00  23,55,000 23 Lacs+ Doshiwaga, Savali, Tila No./ Survey no. 6/2, (Joint Property) 50%  Total Area 1050 Sq.Ft Built Up Area 1050 Sq.ft Whether Inherited Y Purchase Date 0000-00-00 Purchase Cost 0.00 Development Cost 0.00  13,67,000 13 Lacs+ 20, Dattakrupa Society, Opp. Panigate Petrolpump, Vadodara, Cense No. 09-09-120-000-000-101  Total Area 1700 Sq.ft Built Up Area 1700 Sq.ft Whether Inherited Y Purchase Date 0000-00-00 Purchase Cost 0.00 Development Cost 0.00  5,80,000 5 Lacs+",Nil,Nil,Nil,Nil,Nil,"Rs 1,18,99,000 1 Crore+"
5,v,Others,Nil,Nil,Nil,Nil,Nil,Nil,Nil
6,Total Current Market Value of (i) to (v) (as per Affidavit),Total Current Market Value of (i) to (v) (as per Affidavit),"1,81,84,000 1 Crore+",Nil,"67,00,000 67 Lacs+",Nil,Nil,Nil,"Rs 2,48,84,000 2 Crore+"
7,Totals Calculated,Totals Calculated,"Rs 1,81,84,000 1 Crore+",Nil,"Rs 67,00,000 67 Lacs+",Nil,Nil,Nil,"Rs 2,48,84,000 2 Crore+"
