,0,1,2,3,4,5,6,7,8
0,Sr No,Description,self,spouse,huf,dependent1,dependent2,dependent3,
1,i,Agricultural Land,Nil,"Village Bezkuchi, Upper Barbhag Dag No-348 Patta No-123  Total Area 10B-2K-19L Built Up Area Whether Inherited N Purchase Date 1995-04-14 Purchase Cost 250000.00 Development Cost 0.00  20,00,000 20 Lacs+ Bezkuchi, Upper Barbhag Dag No-229 Patta No-156  Total Area 0B-2K-6L Built Up Area Whether Inherited N Purchase Date 2019-03-18 Purchase Cost 46000.00 Development Cost 0.00  50,000 50 Thou+ Bezkuchi, Upper Barbhag Dag No-228 Patta No-44 Total Area 0B-2K-12L Built Up Area Whether Inherited N Purchase Date 2019-01-24 Purchase Cost 52000.00 Development Cost 0.00  60,000 60 Thou+",Nil,Nil,Nil,Nil,"Rs 21,10,000 21 Lacs+"
2,ii,Non Agricultural Land,"No-3 Bortola, Barkhetri Moua Mukulam Total Area 8640 sq feet Built Up Area Whether Inherited N Purchase Date 2010-10-07 Purchase Cost 30000.00 Development Cost 0.00  3,00,000 3 Lacs+ Azara Mouza-Ramcharani, Kamrup Dag No-449 Patta No-6  Total Area 14400 sq feet Built Up Area Whether Inherited N Purchase Date 2012-03-03 Purchase Cost 630000.00 Development Cost 0.00  10,00,000 10 Lacs+ Agchia, Boko Dag No-239 Patta No-133  Total Area 21312 sq feet Built Up Area Whether Inherited N Purchase Date 2018-01-24 Purchase Cost 1000000.00 Development Cost 0.00  20,00,000 20 Lacs+","Land At Tetelia Mouza Jalukbari Dag No-40 Patta No-16  Total Area 69125 sq feet Built Up Area Whether Inherited N Purchase Date 1991-09-05 Purchase Cost 120000.00 Development Cost 0.00  50,00,000 50 Lacs+",Nil,Nil,Nil,Nil,"Rs 83,00,000 83 Lacs+"
3,iii,Commercial Buildings,"RCC Building At Tetelia Jalukbari Dag No-40 Patta No-16  Total Area 2454 sq feet Built Up Area 2454 sq feet Whether Inherited N Purchase Date 0000-00-00 Purchase Cost 0.00 Development Cost 3750000.00  50,00,000 50 Lacs+","RCC Building Tetelia Jalukbari Dag No-40 Patta No-16  Total Area 3069 sq feet Built Up Area 3069 sq feet Whether Inherited N Purchase Date 0000-00-00 Purchase Cost 0.00 Development Cost 4850000.00  60,00,000 60 Lacs+",Nil,Nil,Nil,Nil,"Rs 1,10,00,000 1 Crore+"
4,iv,Residential Buildings,"At House At Tetelia Jalukbari Jointly With Husband Dag No-40 Patta No-16  Total Area 1200 sq feet Built Up Area 1200 sq feet Whether Inherited N Purchase Date 0000-00-00 Purchase Cost 0.00 Development Cost 85000.00  2,00,000 2 Lacs+ No-3 Bortola Barkhetri Mouza Mukalmua Dag No-259 Patta No-62  Total Area 1000 sq feet Built Up Area 1000 sq feet Whether Inherited N Purchase Date 0000-00-00 Purchase Cost 0.00 Development Cost 250000.00  5,50,000 5 Lacs+ Agchia Boko Kamrup Dag No-239 Patta No-133  Total Area 3000 sq feet Built Up Area 3000 sq feet Whether Inherited N Purchase Date 0000-00-00 Purchase Cost 0.00 Development Cost 1400000.00  25,00,000 25 Lacs+","At House Tetelia Jalubari Jointly With Wife Dag No-40 Patta No-16  Total Area 1200 sq feet Built Up Area 1200 sq feet Whether Inherited N Purchase Date 0000-00-00 Purchase Cost 0.00 Development Cost 795000.00  10,95,000 10 Lacs+",Nil,Nil,Nil,Nil,"Rs 43,45,000 43 Lacs+"
5,v,Others,Nil,Nil,Nil,Nil,Nil,Nil,Nil
6,Total Current Market Value of (i) to (v) (as per Affidavit),Total Current Market Value of (i) to (v) (as per Affidavit),"1,15,50,000 1 Crore+","1,42,05,000 1 Crore+",Nil,Nil,Nil,Nil,"Rs 2,57,55,000 2 Crore+"
7,Totals Calculated,Totals Calculated,"Rs 1,15,50,000 1 Crore+","Rs 1,42,05,000 1 Crore+",Nil,Nil,Nil,Nil,"Rs 2,57,55,000 2 Crore+"
