,0,1,2,3,4,5,6,7,8
0,Sr No,Description,self,spouse,huf,dependent1,dependent2,dependent3,
1,i,Agricultural Land,"Mauza Muktapasi PS-Dhenkanal Sadar, Khata No. 17/7 Plot No. 1/221, 1/204, 3/183, 3, 2, 2/200, 5 & 4 Mauza Muktapasi PS-Dhenkanal Sadar, Khata No. 17/5, Plot No. 6, 7, 9, 10, 11, 12, 13, 34, 35 Khata No. 15, Plot No. 1, 33, 36 Mauza Sarakia PS-Dhenkanal Sadar, Khata No. 190/124, Plot No. 290/1482 Mauza Sarakia PS-Dhenkanal Sadar, Khata No. 108, Plot No. 290 Mauza Sarakia PS-Dhenkanal Sadar, Khata No. 115, Plot No. 291/1245 Mauza Jatan Nagar PS-Dhenkanal Sadar, Khata No. 50/77, Plot No. 230, 274/511, 275, 276/512 Mauza Jatan Nagar PS-Dhenkanal Sadar, Khata No. 51 Plot No. 141, 142, 148 Date of Purchase 2005 2008/07/25 2013/03/26 2013/06/28 2013/07/22 2009/08/26 2009/09/10  Total Area Ac. 45.785.5 dec Built Up Area Whether Inherited N Purchase Date 0000-00-00 Purchase Cost 1999600.00 Development Cost 0.00  50,00,000 50 Lacs+","Mauza Jatan Nagar PS-Dhenkanal Sadar, Khata No. 51, Plot No. 211, 278, 40/403, 231/405, 231/406, 93/461, 128/471, 308, 310, 274 & 276  Total Area Ac. 55.93 dec Built Up Area Whether Inherited N Purchase Date 2009-09-10 Purchase Cost 2334805.00 Development Cost 0.00  60,00,000 60 Lacs+","Mauza Jatan Nagar PS-Dhenkanal Sadar, Khata No. 50/57, Plot No. 184, 94 & 95 Mauza Jatan Nagar PS-Dhenkanal Sadar, Khata No. 50/198, Plot No. 95/459 & 147 Mauza Jatan Nagar PS-Dhenkanal Sadar, Khata No. 50/457, Plot No. 169/474 & 229/477 Mauza Bibhutipada PS-Dhenkanal Sadar, Khata No. 34 Plot No. 114, 116, 148, 51/424, 51/425, 149, 141, 147, 115 Mauza Bibhutipada PS-Dhenkanal Sadar, Khata No. 90/22 Plot No. 348/409, 348/410, 352/379, 352/380, 352/442 Mauza Bibhutipada PS-Dhenkanal Sadar, Khata No. 90/24, Plot No. 313, 322, 347, 237  Total Area Ac. 10.715 dec Built Up Area Whether Inherited Y Purchase Date 0000-00-00 Purchase Cost 0.00 Development Cost 0.00  25,00,000 25 Lacs+",Nil,Nil,Nil,"Rs 1,35,00,000 1 Crore+"
2,ii,Non Agricultural Land,Nil,Nil,"Mauza Jatan Nagar PS-Dhenkanal Sadar, Khata No. 50/47, Plot No. 191/501  Total Area 3920 sq.ft Built Up Area Whether Inherited Y Purchase Date 0000-00-00 Purchase Cost 580000.00 Development Cost 8800000.00  1,60,00,000 1 Crore+",Nil,Nil,Nil,"Rs 1,60,00,000 1 Crore+"
3,iii,Commercial Buildings,Nil,Nil,"Mauza Dhenkanal Town PS-Dhenkanal, Khata No. 3470/1067, Plot No. 1911, 1912 & 1912/7999 Mauza Dhenkanal Town PS-Dhenkanal, Khata No. 3470/936, Plot No. 1911/10484  Total Area 4530 sq.ft Built Up Area 4530 sq.ft Whether Inherited N Purchase Date 0000-00-00 Purchase Cost 0.00 Development Cost 5000000.00  2,50,00,000 2 Crore+",Nil,Nil,Nil,"Rs 2,50,00,000 2 Crore+"
4,iv,Residential Buildings,Nil,Nil,"Mauza Similia PS Town (old building) Dist. Dhenkanal Khata No. 337/90, Plot No. 641/1435 Mauza Similia PS Town (New building) Dist. Dhenkanal Khata No. 337/98, Plot No. 46/1412 Any investment 800000 8000000  Total Area 13068 sq.ft Built Up Area 13068 sq.ft Whether Inherited N Purchase Date 0000-00-00 Purchase Cost 0.00 Development Cost 0.00  2,00,00,000 2 Crore+",Nil,Nil,Nil,"Rs 2,00,00,000 2 Crore+"
5,v,Others,Nil,Nil,Nil,Nil,Nil,Nil,Nil
6,Total Current Market Value of (i) to (v) (as per Affidavit),Total Current Market Value of (i) to (v) (as per Affidavit),"50,00,000 50 Lacs+","60,00,000 60 Lacs+","6,35,00,000 6 Crore+",Nil,Nil,Nil,"Rs 7,45,00,000 7 Crore+"
7,Totals Calculated,Totals Calculated,"Rs 50,00,000 50 Lacs+","Rs 60,00,000 60 Lacs+","Rs 6,35,00,000 6 Crore+",Nil,Nil,Nil,"Rs 7,45,00,000 7 Crore+"
