,0,1,2,3,4,5,6,7,8
0,Sr No,Description,self,spouse,huf,dependent1,dependent2,dependent3,
1,i,Agricultural Land,"MALAPPURAM DIST. TIRUR TALUK, THIRURANGADI VILLAGE(PADDY FIELD) RS NO. 142  Total Area 1.25 ACRES Built Up Area not mentioned Whether Inherited Y Purchase Date 0000-00-00 Purchase Cost 0.00 Development Cost 0.00  25,00,000 25 Lacs+ MALAPPURAM DIST. TIRUR TALUK, THIRURANGADI VILLAGE(COCONUT GARDEN) RS NO. 279/6  Total Area 0.60 ACRES Built Up Area not mentioned Whether Inherited Y Purchase Date 0000-00-00 Purchase Cost 0.00 Development Cost 0.00  25,00,000 25 Lacs+ MALAPPURAM DIST. TIRUR TALUK, THIRURANGADI VILLAGE(1/7 SHARE ON UNDIVIDED LAND)(PADDY FIELD) SURVEY NO. 203/37  Total Area 0.902 ACRES Built Up Area not mentioned Whether Inherited Y Purchase Date 0000-00-00 Purchase Cost 0.00 Development Cost 0.00  2,50,000 2 Lacs+","MALAPPURAM DIST. PERINTHALMANNA TALUK, NENMIN VILLAGE(1/2 SHARE ON UNDIVIDED LAND)(PADDY FFIELD) SURVEY NO. 3/1, 3/2  Total Area 0.25 ACRE Built Up Area not mentioned Whether Inherited Y Purchase Date 1989-05-18 Purchase Cost 6000.00 Development Cost 0.00  2,50,000 2 Lacs+ MALAPPURAM DIST. PERINTHALMANNA TALUK, NENMIN VILLAGE(PADDY FIELD), SURVEY NO. 3/1,3/2  Total Area 0.32 ACRE Built Up Area not mentioned Whether Inherited Y Purchase Date 0000-00-00 Purchase Cost 0.00 Development Cost 0.00  3,20,000 3 Lacs+ MALAPPURAM DIST. TIRUR TALUK, THIRURANGADI VILLAGE(COCONUT GARDEN) SR NO. 2/3  Total Area 0.675 Built Up Area not mentioned Whether Inherited N Purchase Date 1993-02-27 Purchase Cost 27000.00 Development Cost 0.00  10,00,000 10 Lacs+ MALAPPURAM DIST. PERINTHALMANNA TALUK, NENMIN VILLAGE(COCONUT GARDEN) SR NO. 2/3  Total Area 0.75 ACRES Built Up Area not mentioned Whether Inherited Y Purchase Date 0000-00-00 Purchase Cost 0.00 Development Cost 0.00  12,00,000 12 Lacs+ MALAPPURAM DIST. PERINTHALMANNA TALUK, NENMIN VILLAGE(2/3 SHARE ON UNDIVIDED LAND) SR NO. 3/3,3/4  Total Area 0.68 ACRES Built Up Area not mentioned Whether Inherited N Purchase Date 0000-00-00 Purchase Cost 0.00 Development Cost 0.00  12,00,000 12 Lacs+",Nil,Nil,Nil,Nil,"Rs 92,20,000 92 Lacs+"
2,ii,Non Agricultural Land,"KOZHIKODE TALUK, KATCHERI VILLAGE, KATCHERI AMSOM DESOM, SURVEY NO. 1-31-1156  Total Area 0.1478 ACRES Built Up Area not mentioned Whether Inherited Y Purchase Date 0000-00-00 Purchase Cost 0.00 Development Cost 0.00  30,00,000 30 Lacs+ KOZHIKODE TALUK, KATCHERI VILLAGE, KATCHERI AMSOM DESOM, SURVEY NO. 1 20.815/816(1/5TH SHARE IN THE UNDIVIDED PROPERTY)  Total Area 0.02 ACRES Built Up Area not mentioned Whether Inherited Y Purchase Date 0000-00-00 Purchase Cost 0.00 Development Cost 0.00  4,00,000 4 Lacs+","MALAPPURAM DIST. PERINTHALMANNA TALUK, NENMIN VILLAGE SR NO. 46/4  Total Area 1.52 ACRES Built Up Area not mentioned Whether Inherited Y Purchase Date 0000-00-00 Purchase Cost 0.00 Development Cost 0.00  25,00,000 25 Lacs+ PALAKKAD DIST. MANNARKAD TALUK, ALANALLUR VILLAGE(1/3 SHARE ON UNDIVIDED LAND) SR NO. 174/1-1, 180/182-1, 180/181-2, 180/1A-9  Total Area 2.75 ACRES Built Up Area not mentioned Whether Inherited Y Purchase Date 0000-00-00 Purchase Cost 0.00 Development Cost 0.00  40,00,000 40 Lacs+",Nil,Nil,Nil,Nil,"Rs 99,00,000 99 Lacs+"
3,iii,Commercial Buildings,"KOZHIKODE TALUK, KATCHERI VILLAGE, KATCHERI AMSOM DESOM, BUILDING NO. 68/1222 SURVEY NO. 1 20.815/816(1/5TH SHARE IN THE UNDIVIDED PROPERTY)  Total Area 46.47 SQM Built Up Area 37.17 SQM Whether Inherited Y Purchase Date 0000-00-00 Purchase Cost 0.00 Development Cost 0.00  4,00,000 4 Lacs+",Nil,Nil,Nil,Nil,Nil,"Rs 4,00,000 4 Lacs+"
4,iv,Residential Buildings,"KOZHIKODE TALUK, KATCHERI VILLAGE, KATCHERI AMSOM DESOM, BUILDING NO. 1/3984 A(68/1842)SURVEY NO. 1-31-1156  Total Area 220.01 SQM Built Up Area 162.63 SQM Whether Inherited Y Purchase Date 0000-00-00 Purchase Cost 0.00 Development Cost 2000000.00  40,00,000 40 Lacs+","MALAPPURAM DIST. PERINTHALMANNA TALUK, NENMIN VILLAGE, BUILDING NO. 17/249 SR NO. 46/4  Total Area 134.708 M2 Built Up Area not mentioned Whether Inherited Y Purchase Date 0000-00-00 Purchase Cost 0.00 Development Cost 0.00  3,00,000 3 Lacs+",Nil,Nil,Nil,Nil,"Rs 43,00,000 43 Lacs+"
5,v,Others,Nil,Nil,Nil,Nil,Nil,Nil,Nil
6,Total Current Market Value of (i) to (v) (as per Affidavit),Total Current Market Value of (i) to (v) (as per Affidavit),"1,30,50,000 1 Crore+","1,07,70,000 1 Crore+",Nil,Nil,Nil,Nil,"Rs 2,38,20,000 2 Crore+"
7,Totals Calculated,Totals Calculated,"Rs 1,30,50,000 1 Crore+","Rs 1,07,70,000 1 Crore+",Nil,Nil,Nil,Nil,"Rs 2,38,20,000 2 Crore+"
