,0,1,2,3,4,5,6,7,8
0,Sr No,Description,self,spouse,huf,dependent1,dependent2,dependent3,
1,i,Agricultural Land,"Patwari Halka No-39 Nagar Khujen Pargana Khujner Total Area 7.949 Hectare Built Up Area 6.532 Hectare Whether Inherited N Purchase Date 2011-03-28 Purchase Cost 269965.00 Development Cost 0.00  1,23,00,000 1 Crore+ Shrimati Nathi Bhai Deva Heeralal Bansingh Amar Nath Total Area 0.443 Hectare Built Up Area Whether Inherited N Purchase Date 2013-03-29 Purchase Cost 674010.00 Development Cost 0.00  2,00,000 2 Lacs+ Patwari Halka No-27 Ward No-11 Total Area Built Up Area 0.152 Hectare Whether Inherited N Purchase Date 0000-00-00 Purchase Cost 982800.00 Development Cost 0.00  15,00,000 15 Lacs+ Near Shiv Mandir Bakhed Road Khunjer, 03 Rakba 0.306 Hect  Total Area Built Up Area Whether Inherited N Purchase Date 0000-00-00 Purchase Cost 810720.00 Development Cost 0.00  10,00,000 10 Lacs+","(1) Patwari Halka No-39 Nagar Khujner Parwana Khujner Total Self Kita 3, ((2) Patwari Halka No 42 Village Gopalpura Parna Khunjer Self Name Total kita 2. (3) Patwari Halka NO 19 Village Khairasi Parna Sarangpur Self Kita Total 6, (4) Kalyakhedi P.H. No 20, Pargna Sarangpur Sy No 501/1 (5) Kalyakhedi P.H No 20, Pargna Sarangpur SY NO 504/3 (6) Kalyakhedi P.H No 20, Pargna Sarangpur SY NO 504/4, (7) Kalyakhedi P.H No 20, Pargna Sarangpur SY NO 502, (8) Kalyakhedi P.H No 20, Pargna Sarangpur SY NO 504/5 (9) Kalyakhedi P.H No 20, Pargna Sarangpur SY NO 500/2 (10) Harijan Mohalla Khujner Sy No 821/3 (11) Patwari Halka No 27(84) Nagar Khujner Pargna Khujaner Self Kita Total 02, (12) Patwari Halka No 27(84) Nagar Khujner Pargna Khujaner Self Kita Total 1, Area (1) 0.910 Hect(2) 0.923Hect (3) 4.451 Hect (4) 0.278 Hect (5) 0.365 Hect (6) 0.365 Hect (7) 0.582 Hect (8) 0.365 Hect (9) 0.140 Hect (10) 0.253 Hect (11) 1.632 Hect (12) 0.278 Hect, Date of purchase- (1) 24.10.2007, 27.05.2011, (2) 27.05.2011, (3) 17.05.2005 (4) 10.02.2021 (5)10.02.2021 (6) 10.02.2021 (7) 10.02.2021 (8) 10.02.2021 (9) 10.02.2021 (10) 31.03.2017 (11) 23.11.2007 (12) 04.01.2011, Cost of Purchase (1) 451505/- (2) 234010/- (3) 493000/- (4) 133440/- (5) 175200/- (6) 175200/- (7) 279360/- (8) 175200/- (9) 67200/- (10) 814500/- (11) 400000/- (12) 200000/-  Total Area Built Up Area Whether Inherited N Purchase Date 0000-00-00 Purchase Cost 0.00 Development Cost 0.00  80,00,000 80 Lacs+",Nil,Nil,Nil,Nil,"Rs 2,30,00,000 2 Crore+"
2,ii,Non Agricultural Land,"Khujner Plot No-1025  Total Area 1134 Sq. Ft Built Up Area Whether Inherited N Purchase Date 2013-03-30 Purchase Cost 180180.00 Development Cost 0.00  3,00,000 3 Lacs+ Khujner Plot No-1188  Total Area 8500 Sq. Ft Built Up Area Whether Inherited N Purchase Date 2018-06-05 Purchase Cost 1023000.00 Development Cost 0.00  10,23,000 10 Lacs+ Village Survey No-52/5/2/1/0005 Total Area 1750 Sq. Ft Built Up Area Whether Inherited N Purchase Date 2020-12-30 Purchase Cost 910420.00 Development Cost 0.00  9,10,420 9 Lacs+ Khujner Plot No-796/1  Total Area 238 Sq. Ft Built Up Area Whether Inherited N Purchase Date 2021-02-17 Purchase Cost 75174.00 Development Cost 0.00  75,174 75 Thou+ Khujner Plot No-796  Total Area 736 Sq. Ft Built Up Area Whether Inherited N Purchase Date 2021-02-17 Purchase Cost 232560.00 Development Cost 0.00  2,50,000 2 Lacs+ Khujner Survey No-2424/3  Total Area 8500 Sq, Ft Built Up Area Whether Inherited N Purchase Date 0000-00-00 Purchase Cost 965250.00 Development Cost 0.00  10,00,000 10 Lacs+",Nil,Nil,Nil,Nil,Nil,"Rs 35,58,594 35 Lacs+"
3,iii,Commercial Buildings,Nil,Nil,Nil,Nil,Nil,Nil,Nil
4,iv,Residential Buildings,"Ward No-10 Khujner Bhawan No-745/2 Total Area 450 Sq. Ft Built Up Area 900 Sq. Ft Whether Inherited N Purchase Date 0000-00-00 Purchase Cost 0.00 Development Cost 0.00  24,09,000 24 Lacs+ Ward No-12 Khujner Bhawan No-792/2 Total Area 1750 Sq. Ft Built Up Area 3400 Sq. Ft Whether Inherited Y Purchase Date 0000-00-00 Purchase Cost 0.00 Development Cost 0.00  5,85,000 5 Lacs+ Jeerapur Road Khujner Total Area 2943 Sq. Ft Built Up Area 5800 Sq. Ft Whether Inherited N Purchase Date 2015-08-26 Purchase Cost 1670000.00 Development Cost 0.00  32,00,000 32 Lacs+ Near by Canera Bank Total Area 800 Sq. Ft Built Up Area 1600 Sq. Ft Whether Inherited N Purchase Date 2015-02-16 Purchase Cost 1500000.00 Development Cost 1500000.00  30,00,000 30 Lacs+",Nil,Nil,Nil,Nil,Nil,"Rs 91,94,000 91 Lacs+"
5,v,Others,"M.P. Housing Board Bhopal Kilandevi Apartment D Block G Type Flat No 901 Total Area Built Up Area Whether Inherited N Purchase Date 0000-00-00 Purchase Cost 0.00 Development Cost 0.00  33,60,000 33 Lacs+",Nil,Nil,Nil,Nil,Nil,"Rs 33,60,000 33 Lacs+"
6,Total Current Market Value of (i) to (v) (as per Affidavit),Total Current Market Value of (i) to (v) (as per Affidavit),"3,11,12,594 3 Crore+","80,00,000 80 Lacs+",Nil,Nil,Nil,Nil,"Rs 3,91,12,594 3 Crore+"
7,Totals Calculated,Totals Calculated,"Rs 3,11,12,594 3 Crore+","Rs 80,00,000 80 Lacs+",Nil,Nil,Nil,Nil,"Rs 3,91,12,594 3 Crore+"
