,0,1,2,3,4,5,6,7,8
0,Sr No,Description,self,spouse,huf,dependent1,dependent2,dependent3,
1,i,Agricultural Land,"Semminjeri Village Thiruvidanthai Group, Chengalpet Taluq, Kanchiuram Dist, Tamilnadu And Nos. 84/1 part & 349 part  Total Area ac 0.3306 Built Up Area Whether Inherited N Purchase Date 2006-09-04 Purchase Cost 3139200.00 Development Cost 0.00  3,91,63,000 3 Crore+ Semminjeri Village Thiruvidanthai Group, Chengalpet Taluq, Kanchiuram Dist, Tamilnadu (Sy Nos.84/1 part & 84/1B1A5)  Total Area Ac 0.33 Built Up Area Whether Inherited N Purchase Date 2011-07-05 Purchase Cost 6228060.00 Development Cost 0.00  4,03,67,000 4 Crore+ Yethavakili Village, Mattampalli Mandal, Nalgonda district, Telangana Sy no 16E/2  Total Area ac 1.00 Built Up Area Whether Inherited N Purchase Date 2005-03-07 Purchase Cost 49000.00 Development Cost 0.00  10,89,000 10 Lacs+ Thungapahad Village, Miryalaguda Mandal, Nalgonda district, Telangana And No. 197  Total Area ac 1.00 Built Up Area Whether Inherited N Purchase Date 2000-01-20 Purchase Cost 67000.00 Development Cost 0.00  16,80,000 16 Lacs+ Chintapalli Village, Miryalaguda Mandal, Nalgonda district, Telangana And No. 449  Total Area Ac 2.30 Built Up Area Whether Inherited N Purchase Date 2001-06-28 Purchase Cost 152000.00 Development Cost 0.00  18,56,250 18 Lacs+ Chintapalli Village, Miryalaguda Mandal, Nalgonda district, Telangana And No. 459  Total Area ac 1.00 Built Up Area Whether Inherited N Purchase Date 2003-12-23 Purchase Cost 55000.00 Development Cost 0.00  6,75,000 6 Lacs+","Semminjeri Village Thiruvidanthai Group, Chengalpet Taluq, Kanchiuram Dist, Tamilnadu Sy No.84/1 part & 349 part  Total Area Ac 0.7179 cents Built Up Area Whether Inherited N Purchase Date 2006-01-23 Purchase Cost 7984390.00 Development Cost 0.00  8,77,53,000 8 Crore+ Chintapalli Village, Miryalaguda Mandal, Nalgonda Dist, Telangana And No. 458  Total Area 7 Guntas Built Up Area Whether Inherited N Purchase Date 1999-09-15 Purchase Cost 87136.00 Development Cost 0.00  1,18,125 1 Lacs+ Chintapalli Village, Miryalaguda Mandal, Nalgonda district, Telangana Sy no 451  Total Area 41.5 Gunts Built Up Area Whether Inherited N Purchase Date 2003-01-06 Purchase Cost 516576.00 Development Cost 0.00  7,00,312 7 Lacs+ Chintapalli Village, Miryalaguda Mandal, Nalgonda district, Telangana  Total Area Ac. 1.73 Built Up Area Whether Inherited N Purchase Date 2018-09-19 Purchase Cost 12302000.00 Development Cost 0.00  1,38,05,400 1 Crore+ Chinaoutapalli Village, Gannavaram Mandal, Krishna district, Andhra Pradesh And No. 54-R, 54-3/A-1  Total Area Ac.1.78 Built Up Area Whether Inherited N Purchase Date 2018-09-26 Purchase Cost 12722000.00 Development Cost 0.00  1,42,04,400 1 Crore+ Chinaoutapalli Village, Gannavaram Mandal, Krishna district, Andhra Pradesh And No.51-4-B2RU,51-5AR  Total Area Ac 050 Built Up Area Whether Inherited N Purchase Date 2018-09-27 Purchase Cost 3555000.00 Development Cost 0.00  39,90,000 39 Lacs+ Chinaoutapalli Village, Gannavaram Mandal, Krishna district, A.P And No. 48-6/R, 50-1/C  Total Area ac 1.75 Built Up Area Whether Inherited N Purchase Date 2018-09-19 Purchase Cost 12474000.00 Development Cost 0.00  1,39,65,000 1 Crore+ Chinaoutapalli Village Gannavaram Mandal, Krishna district, Andhra Pradesh And No. 48-3/B  Total Area ac 0.94 Built Up Area Whether Inherited N Purchase Date 2018-09-17 Purchase Cost 6688886.00 Development Cost 0.00  75,01,200 75 Lacs+ Chinaoutapalli Village, Gannavaram Mandal, Krishna district, Andhra Pradesh Sy No.51-3/R, 51-4/A  Total Area ac 0.93 Built Up Area Whether Inherited N Purchase Date 2018-09-17 Purchase Cost 6613000.00 Development Cost 0.00  74,21,400 74 Lacs+ Chinaoutapalli Village, Gannavaram Mandal, Krishna district, Andhra Pradesh And No. 48-2-B, 48-3-A  Total Area ac 0.82 Built Up Area Whether Inherited N Purchase Date 2018-09-11 Purchase Cost 5831000.00 Development Cost 0.00  65,43,600 65 Lacs+ Chinaoutapalli Village, Gannavaram Mandal, Krishna district, Andhra Pradesh Sy. No. 54-3-A/2, 54-3-B/R  Total Area ac 0.82 Built Up Area Whether Inherited N Purchase Date 2018-09-15 Purchase Cost 5831000.00 Development Cost 0.00  65,43,600 65 Lacs+",Nil,Nil,Nil,Nil,"Rs 24,73,76,287 24 Crore+"
2,ii,Non Agricultural Land,"HIG-11, Madhurawada Village. Maruti Nagar, Visakhapatnam And No. 374/1  Total Area 333.33 Sq. yards (2999.97 sq.ft) Built Up Area Whether Inherited Y Purchase Date 1989-07-21 Purchase Cost 15000.00 Development Cost 0.00  1,16,66,000 1 Crore+","Plot No.A72, Manikonda Village, Rajendra Nagar Mandal, RR District, Telangana (Sy no.210/P)  Total Area 1487 sq yds Built Up Area Whether Inherited N Purchase Date 2009-10-01 Purchase Cost 8847650.00 Development Cost 0.00  3,53,90,600 3 Crore+ Plot NO.19/C, Nandi Hills, Raidurgam, Panmaktha Village, Ranga Reddy District, Telangana (Sy No.5/3)  Total Area 1155 Sq. yards Built Up Area Whether Inherited N Purchase Date 0000-00-00 Purchase Cost 2390200.00 Development Cost 0.00  3,73,41,000 3 Crore+ Plot No.D142, Rishikonda Layout, Madhurawada, Visakhapatnam, Andhra Pradesh And No. 333  Total Area 1879.89 sq yrda Built Up Area Whether Inherited N Purchase Date 1998-10-27 Purchase Cost 851000.00 Development Cost 0.00  6,57,96,150 6 Crore+ Qila Fort Mohammad Nagar, Golconda, Hyderabad, Telangana And No. 252/P & 253  Total Area 35259 Sq yards (317331 sq.ft) Built Up Area Whether Inherited N Purchase Date 2011-05-28 Purchase Cost 65722258.00 Development Cost 0.00  43,01,64,680 43 Crore+ Bhimavaram village, West Godavari district, Andhra Pradesh Sy No.5  Total Area Ac. 0.58 (2807.20 Sq yards or 25,265 sq.ft)) Built Up Area Whether Inherited N Purchase Date 2015-04-06 Purchase Cost 4121335.00 Development Cost 0.00  5,05,29,600 5 Crore+ Plot No. 19D, Nandi Hills, Raidurgam, Panmaktha Village, Serilingampally, Hyderabad, Telangana Sy No. 5/3  Total Area 1133 sq yds Built Up Area Whether Inherited N Purchase Date 2015-01-03 Purchase Cost 2391850.00 Development Cost 0.00  3,66,32,600 3 Crore+",Nil,Nil,Nil,Nil,"Rs 66,75,20,630 66 Crore+"
3,iii,Commercial Buildings,"D NO.10-50-15, Plot No.20-B, 3rd Floor, Block No.9, Waltair Ward, Visakhapatnam Sy no 77A  Total Area 100 sq yds Built Up Area 2300 sft Whether Inherited Y Purchase Date 1992-03-31 Purchase Cost 227073.00 Development Cost 0.00  2,21,90,000 2 Crore+","Site No.171, Manyatha Residency, Rachanahalli village, KR Puram, Bangalore, Karnataka sy no 3/1  Total Area 444.44 sq yds Built Up Area 10385 sft Whether Inherited N Purchase Date 2008-05-07 Purchase Cost 34465017.00 Development Cost 0.00  5,60,00,000 5 Crore+ 6th Floor, Sanpras Corporate Capital, Sheraton Towers, Financial District, Nanakramguda, Gachibowli, Hyderabad Telangana And No. 115/1 & 115/29 Total Area 2,250 sq.ft. Built Up Area 24578 sft Whether Inherited N Purchase Date 2016-02-10 Purchase Cost 61403878.00 Development Cost 0.00  14,48,74,800 14 Crore+",Nil,Nil,Nil,Nil,"Rs 22,30,64,800 22 Crore+"
4,iv,Residential Buildings,Nil,"Flat No.S3, Waves Apartments, RK Beach, Visakhapatna Andhra Pradesh Total Area 55.38 Sq yards (490.42 sq.ft) Built Up Area 1950 sq ft Whether Inherited N Purchase Date 1991-05-09 Purchase Cost 58150.00 Development Cost 0.00  1,18,95,000 1 Crore+ Plot No.9 Chamiers Road, Nandanam, Chennai, Tamilnadu  Total Area 447.22 Sq. yards (4025 sft) Built Up Area 7650 sft Whether Inherited N Purchase Date 2006-01-23 Purchase Cost 24708540.00 Development Cost 0.00  11,02,69,000 11 Crore+ D-5/3, 2nd Floor, Vasanth Vihar, New Delhi Total Area 2050 sft Built Up Area 2050 sft Whether Inherited N Purchase Date 2008-03-12 Purchase Cost 13075000.00 Development Cost 0.00  14,74,00,000 14 Crore+ D-5/3, 3rd Floor, Vasanth Vihar, New Delhi  Total Area 2050 sft Built Up Area 2050 sft (190.44 in mts) Whether Inherited N Purchase Date 2008-08-21 Purchase Cost 13052000.00 Development Cost 0.00  14,74,00,000 14 Crore+ Plot No.A 71, villa, Emaar, Manikonda village, Rajendranaga Mandal, Hyderabad, Telangana sy 210 /p  Total Area 1999 Sq yards Built Up Area 5540 sft Whether Inherited N Purchase Date 2009-07-31 Purchase Cost 72641050.00 Development Cost 0.00  7,26,41,050 7 Crore+ China Miram village, West Godavari district, Andhra Pradesh  Total Area 1274 Sq yards (11,466 sq.ft) Built Up Area 354 sq ft Whether Inherited N Purchase Date 2013-12-21 Purchase Cost 5300000.00 Development Cost 0.00  1,57,88,400 1 Crore+ Plot No.RA393, D No.3 (Old No.17) 6th Main Road, Raja Annamalaipuram, Chennai  Total Area 418 sq yards (3762 sq.ft) Built Up Area 4977 sq ft Whether Inherited N Purchase Date 2005-07-18 Purchase Cost 17144907.00 Development Cost 0.00  11,67,35,000 11 Crore+ D.No.5-119, Peda Amaram village, Kalla Mandal, West Godavari district, Andhra Pradesh sy 475/2  Total Area 2420 sq yards (21780 sft) Built Up Area 5878 sq ft Whether Inherited N Purchase Date 2013-12-20 Purchase Cost 25900000.00 Development Cost 0.00  2,88,25,120 2 Crore+ Plot No.A74 villa, Emaar, Manikonda village, Rajenda nagar Mandal, Hyderabad, Telangana sy NO.210/P  Total Area 1870 sq yards (16,830 sq.ft) Built Up Area 16,877.81 sft Whether Inherited N Purchase Date 2020-03-31 Purchase Cost 55235249.00 Development Cost 0.00  8,42,87,597 8 Crore+",Nil,Nil,Nil,Nil,"Rs 73,52,41,167 73 Crore+"
5,v,Others,Nil,Nil,Nil,Nil,Nil,Nil,Nil
6,Total Current Market Value of (i) to (v) (as per Affidavit),Total Current Market Value of (i) to (v) (as per Affidavit),"11,86,86,250 11 Crore+","1,75,45,16,634 175 Crore+",Nil,Nil,Nil,Nil,"Rs 1,87,32,02,884 187 Crore+"
7,Totals Calculated,Totals Calculated,"Rs 11,86,86,250 11 Crore+","Rs 1,75,45,16,634 175 Crore+",Nil,Nil,Nil,Nil,"Rs 1,87,32,02,884 187 Crore+"
