,0,1,2,3,4,5,6,7,8
0,Sr No,Description,self,spouse,huf,dependent1,dependent2,dependent3,
1,i,Agricultural Land,"Tarihala Grama, Hubli Taluk, Dharward Distict Sy.no: 93/2B & 93/3  Total Area 131769sqft Built Up Area Whether Inherited N Purchase Date 2022-03-26 Purchase Cost 8107230.00 Development Cost 0.00  82,00,000 82 Lacs+",Nil,"Kamodolli Village Kundagol, Hobli, Hubli Taluk, Dharward dist Sy.no: 88/1  Total Area 142659sqft Built Up Area Whether Inherited Y Purchase Date 0000-00-00 Purchase Cost 0.00 Development Cost 0.00  50,00,000 50 Lacs+",Nil,Nil,Nil,"Rs 1,32,00,000 1 Crore+"
2,ii,Non Agricultural Land,"Yelahanka Hobli, Bangalore sy.no: 11/1 site no: 12  Total Area 4250sqft Built Up Area Whether Inherited N Purchase Date 1995-03-18 Purchase Cost 102200.00 Development Cost 0.00  3,00,00,000 3 Crore+ Bengeri village hubli, sy.no: 51B/34-37  Total Area 21780sqft Built Up Area Whether Inherited N Purchase Date 2005-08-12 Purchase Cost 1540720.00 Development Cost 0.00  4,44,00,000 4 Crore+",Nil,"Amaragol Village, Hubli tq, Dharward dist- Block no: 172/5 (old block-172/1)  Total Area 25047sqft Built Up Area Whether Inherited Y Purchase Date 2014-10-16 Purchase Cost 0.00 Development Cost 0.00  1,87,85,250 1 Crore+ Amaragol Village, Hubli tq, Dharward dist- Block no: 172/6 (old block-172/4)  Total Area 18513sqft Built Up Area Whether Inherited Y Purchase Date 2014-10-16 Purchase Cost 0.00 Development Cost 0.00  1,38,84,750 1 Crore+ Amaragol Village, Hubli tq, Dharward dist- Block no: 172/3 (Converted to Non agricultural )  Total Area 47916sqft Built Up Area Whether Inherited Y Purchase Date 2014-10-16 Purchase Cost 0.00 Development Cost 0.00  3,59,37,000 3 Crore+ Amaragol Village, Hubli tq, Dharward dist- Block no: 172/3 (Converted to Non agricultural)  Total Area 29403sqft Built Up Area Whether Inherited Y Purchase Date 2014-10-16 Purchase Cost 0.00 Development Cost 0.00  2,20,52,250 2 Crore+",Nil,Nil,Nil,"Rs 16,50,59,250 16 Crore+"
3,iii,Commercial Buildings,"Lakkamanahalli Industrial estate, Dharward-580004 N0: 25/A  Total Area 43055sqft Built Up Area Whether Inherited N Purchase Date 2000-03-31 Purchase Cost 48000000.00 Development Cost 0.00  4,80,00,000 4 Crore+ KSSIDC Indurstrial Estate, Doddballapur No: A-109  Total Area 10645.50sqft Built Up Area Whether Inherited N Purchase Date 2008-04-22 Purchase Cost 12774600.00 Development Cost 0.00  1,27,74,600 1 Crore+ Majali Village, Karwar taluk, uttara kannada survey no: 1744/1  Total Area 26781.87sqft Built Up Area Whether Inherited N Purchase Date 2016-10-22 Purchase Cost 2200000.00 Development Cost 0.00  22,00,000 22 Lacs+",Nil,Nil,Nil,Nil,Nil,"Rs 6,29,74,600 6 Crore+"
4,iv,Residential Buildings,"Shiggoan Taluk, Haveri dist no: 160/2B  Total Area 21780sqft Built Up Area Whether Inherited N Purchase Date 2013-12-28 Purchase Cost 16258170.00 Development Cost 0.00  5,97,11,000 5 Crore+ Casalavelle Apt. no: 3 Lavelle road, Bangalore-01, D-2 flat  Total Area 1350sqft Built Up Area Whether Inherited N Purchase Date 1993-09-29 Purchase Cost 743293.00 Development Cost 0.00  2,43,00,000 2 Crore+",Nil,"No: 52, GF, Adarsh nagar, Hubli  Total Area 5724sqft Built Up Area Whether Inherited Y Purchase Date 2014-10-16 Purchase Cost 0.00 Development Cost 0.00  91,58,400 91 Lacs+ N:4, Matadahalli ext. RT Nagar, Bangalore  Total Area 5724sqft Built Up Area Whether Inherited Y Purchase Date 2014-10-16 Purchase Cost 0.00 Development Cost 0.00  8,72,00,000 8 Crore+",Nil,Nil,Nil,"Rs 18,03,69,400 18 Crore+"
5,v,Others,Nil,Nil,Nil,Nil,Nil,Nil,Nil
6,Total Current Market Value of (i) to (v) (as per Affidavit),Total Current Market Value of (i) to (v) (as per Affidavit),"22,95,85,600 22 Crore+",Nil,"19,20,17,650 19 Crore+",Nil,Nil,Nil,"Rs 42,16,03,250 42 Crore+"
7,Totals Calculated,Totals Calculated,"Rs 22,95,85,600 22 Crore+",Nil,"Rs 19,20,17,650 19 Crore+",Nil,Nil,Nil,"Rs 42,16,03,250 42 Crore+"
