,0,1,2,3,4,5,6,7,8
0,Sr No,Description,self,spouse,huf,dependent1,dependent2,dependent3,
1,i,Agricultural Land,Nil,"Village Madodar, Tal. Vaghodiya, Dist. Vadodara, Survey No. 261/1/A  Total Area 2.02 Acres Built Up Area Whether Inherited N Purchase Date 2008-01-17 Purchase Cost 1459640.00 Development Cost 0.00  1,15,00,000 1 Crore+ Village Guntala, Tal. Vaghodiya, Dist. Vadodara, Survey No. 367  Total Area 8.20 Acres Built Up Area Whether Inherited N Purchase Date 2008-12-16 Purchase Cost 108195.00 Development Cost 0.00  38,52,500 38 Lacs+ Village Lobhoda, Tal. Vaghodiya, Dist. Vadodara, Survey No. 487  Total Area 1.97 Acres Built Up Area Whether Inherited N Purchase Date 2008-07-04 Purchase Cost 1695000.00 Development Cost 0.00  64,40,000 64 Lacs+",Nil,Nil,Nil,Nil,"Rs 2,17,92,500 2 Crore+"
2,ii,Non Agricultural Land,"1)Khodiyar nagar, Survey No. 538/A, Account No. 2818 2)Village Savajipura, Dist. Vadodara Survey No. 530/2, 531, 532, A/c No. 2118 (25% Part)  Total Area 9710 Sq.ft Built Up Area Whether Inherited N Purchase Date 2021-06-11 Purchase Cost 1995250.00 Development Cost 0.00  21,00,000 21 Lacs+","Somabhai Chal, Tal. Dist. Vadodara  Total Area 25000 Sq.ft Built Up Area Whether Inherited N Purchase Date 2008-01-17 Purchase Cost 1500000.00 Development Cost 0.00  1,10,00,000 1 Crore+ village Varanama Jamin, Varanama, Tal.Dist. Vadodara, S.R No. / Block No. 1139 (40% Part)  Total Area 25000 Sq.ft Built Up Area Whether Inherited N Purchase Date 2021-02-04 Purchase Cost 2000300.00 Development Cost 0.00  21,00,000 21 Lacs+ Bapod, Dist, Vadodara, Survey no, 995 (25% Part)  Total Area 83390 Sq.ft Built Up Area Whether Inherited N Purchase Date 2008-06-19 Purchase Cost 3086893.00 Development Cost 0.00  1,00,00,000 1 Crore+ Bapod, Dist, Vadodara, Survey No. 995-538 Paiki  Total Area 13826 Sq.ft Built Up Area Whether Inherited N Purchase Date 2008-06-19 Purchase Cost 674898.00 Development Cost 0.00  1,20,00,000 1 Crore+ Khodiyar Nagar, Jamin Survey no. 538/A. account No. 2818 Survey No. 530/2, 531, 532 Account No. 2118 Village Sayajipura, Tal. Vadodara (25% Part)  Total Area 9710 Sq.ft Built Up Area Whether Inherited N Purchase Date 2021-06-11 Purchase Cost 1995250.00 Development Cost 0.00  21,00,000 21 Lacs+",Nil,Nil,Nil,Nil,"Rs 3,93,00,000 3 Crore+"
3,iii,Commercial Buildings,"New Vidyalay, Vaghodiya Road, Vadodara, Block No. 984  Total Area 15000 Sq.Ft Built Up Area 20000 Sq.Ft Whether Inherited N Purchase Date 2003-03-31 Purchase Cost 285500.00 Development Cost 500000.00  41,00,000 41 Lacs+ Mehta Girls hostel, Vaghodiya Road, Vadodara, Block No. 974/1  Total Area 8000 Sq. Ft Built Up Area 12000 Sq.Ft Whether Inherited N Purchase Date 2003-12-15 Purchase Cost 724303.00 Development Cost 648784.00  1,52,00,000 1 Crore+ Swami Vivekanand School, Pariwar Char Road, Vaghodiya Road, Vadodara  Total Area 12000Sq.ft Built Up Area 16000 Sq.ft Whether Inherited N Purchase Date 2003-12-31 Purchase Cost 79240.00 Development Cost 297471.00  34,00,000 34 Lacs+ Vajra Complex, 07-08 Owner No. Karelibaug, Vadodara, Survey No. 30 (25%Part) Total Area 1313 Sq.Ft Built Up Area 1500 Sq.ft Whether Inherited N Purchase Date 2004-03-31 Purchase Cost 800000.00 Development Cost 0.00  11,50,000 11 Lacs+ Devaki Chembers, Aajava Road, Vadodara, Swad-300  Total Area 1000 Sq.Ft Built Up Area 1100 Sq.ft Whether Inherited N Purchase Date 1999-01-01 Purchase Cost 132373.00 Development Cost 0.00  34,00,000 34 Lacs+ Girishankar Complex, Vaghodiya Road, HUF. Shop No. 1-8,10-12, 14-19, 13-9, Survey No. 78  Total Area 2200 Sq.ft Built Up Area 2700 Sq.ft Whether Inherited N Purchase Date 2007-05-10 Purchase Cost 795102.00 Development Cost 0.00  46,00,000 46 Lacs+ First Floor, Jalashakti Complex, Survey no. 912  Total Area 2000 Sq.ft Built Up Area 2200 Sq.ft Whether Inherited N Purchase Date 1999-01-01 Purchase Cost 188500.00 Development Cost 225843.00  36,50,000 36 Lacs+ Plot No. B/19, Meghduth Society, Vaghodiya Road, Vadodara  Total Area 1180 Sq.ft Built Up Area 1300 Sq.t Whether Inherited N Purchase Date 2015-09-15 Purchase Cost 3706730.00 Development Cost 0.00  70,00,000 70 Lacs+ Shop No. 3, B.P.S School, Kaladarshan Char Road, Vaghodiya Road, Vadodara  Total Area 500 Sq.ft Built Up Area 650 Sq.ft Whether Inherited N Purchase Date 2010-02-15 Purchase Cost 250000.00 Development Cost 1347471.00  17,50,000 17 Lacs+ Mahavir Park Society, Vaghodiya, Vadodara  Total Area 1200 Sq.Ft Built Up Area 1350 Sq.ft Whether Inherited N Purchase Date 2010-01-19 Purchase Cost 895200.00 Development Cost 0.00  37,50,000 37 Lacs+ Ground Floor,Office, Citra Square, Vaghodiya Road, Vadodara  Total Area 2800 Sq.ft Built Up Area 2800 Sq.ft Whether Inherited N Purchase Date 2021-06-10 Purchase Cost 1347940.00 Development Cost 0.00  1,50,00,000 1 Crore+","Shop No. 1 And 8, 10 And 12 Girigadh Complex, Vaghodiya Road, Vadodara  Total Area 1200 Sq.ft Built Up Area 1400 Sq.ft Whether Inherited N Purchase Date 2007-05-10 Purchase Cost 795102.00 Development Cost 0.00  34,50,000 34 Lacs+ Shop, Vrundavan Society, Vaghodiya Road, Vadodara  Total Area 900 Sq.ft Built Up Area 1000 Sq. Ft Whether Inherited N Purchase Date 2008-03-14 Purchase Cost 344043.00 Development Cost 0.00  20,00,000 20 Lacs+ Mankhi Complex, Flat No. A/201156  Total Area 1000 Sq.Ft Built Up Area 1200 Sq.ft Whether Inherited N Purchase Date 2001-04-01 Purchase Cost 685400.00 Development Cost 550230.00  17,00,000 17 Lacs+ Swami Vivekanand School  Total Area 12000 Sq.ft Built Up Area 15000 Sq.ft Whether Inherited N Purchase Date 2003-12-31 Purchase Cost 237640.00 Development Cost 297471.00  48,00,000 48 Lacs+ Second Floor, Kalashakti Complex, Survey No. 912  Total Area 2000 Sq.ft Built Up Area 2200 Sq.ft Whether Inherited N Purchase Date 2000-03-31 Purchase Cost 358500.00 Development Cost 0.00  22,70,000 22 Lacs+","Third Floor, Kalashakti Aparment, Total Area 1000 Sq.ft Built Up Area 1000 Sq.ft Whether Inherited N Purchase Date 2000-06-23 Purchase Cost 176378.00 Development Cost 0.00  10,00,000 10 Lacs+ Second Floor, Kalashakti Aparment  Total Area 2200 Sq.ft Built Up Area 2200 Sq.ft Whether Inherited N Purchase Date 1999-05-12 Purchase Cost 512500.00 Development Cost 0.00  20,00,000 20 Lacs+ Baroda Public School, Village Danteshawar, Survey No. 397/5 (15% Part)  Total Area 19620 Sq.ft Built Up Area 21455 Sq.Ft Whether Inherited N Purchase Date 2021-03-30 Purchase Cost 8352022.00 Development Cost 0.00  1,00,00,000 1 Crore+",Nil,Nil,Nil,"Rs 9,02,20,000 9 Crore+"
4,iv,Residential Buildings,"Kaham Bangaloz, Vaghodiya Road, Vadodara  Total Area 14000 Sq.ft Built Up Area 17000 Sq.ft Whether Inherited N Purchase Date 2011-11-24 Purchase Cost 10000000.00 Development Cost 3763534.00  2,50,00,000 2 Crore+","4, Kailash Society, Vaghodiya Road, Vadodara 911  Total Area 5100 Sq.ft Built Up Area 6200 Sq.ft Whether Inherited N Purchase Date 2013-03-03 Purchase Cost 691047.00 Development Cost 1335553.00  1,25,00,000 1 Crore+",Nil,Nil,Nil,Nil,"Rs 3,75,00,000 3 Crore+"
5,v,Others,Nil,Nil,Nil,Nil,Nil,Nil,Nil
6,Total Current Market Value of (i) to (v) (as per Affidavit),Total Current Market Value of (i) to (v) (as per Affidavit),"9,01,00,000 9 Crore+","8,57,12,500 8 Crore+","1,30,00,000 1 Crore+",Nil,Nil,Nil,"Rs 18,88,12,500 18 Crore+"
7,Totals Calculated,Totals Calculated,"Rs 9,01,00,000 9 Crore+","Rs 8,57,12,500 8 Crore+","Rs 1,30,00,000 1 Crore+",Nil,Nil,Nil,"Rs 18,88,12,500 18 Crore+"
