,0,1,2,3,4,5,6,7,8
0,Sr No,Description,self,spouse,huf,dependent1,dependent2,dependent3,
1,i,Agricultural Land,"Field Sateri Panch Sy No.262/16,262/17,262/18,262/19,262/20,262/21,262/22,262/23,262/24,262/77 at Total Area 0.0017 Acres Built Up Area Whether Inherited N Purchase Date 2019-01-30 Purchase Cost 3592220.00 Development Cost 0.00  45,00,000 45 Lacs+",Nil,Nil,Nil,Nil,Nil,"Rs 45,00,000 45 Lacs+"
2,ii,Non Agricultural Land,"Plot Known AS Segunda Arvalem,Sy No.35/13, Cortalim Village Total Area 6458 Sq Ft Built Up Area Whether Inherited N Purchase Date 2018-07-13 Purchase Cost 6386350.00 Development Cost 0.00  65,00,000 65 Lacs+","Plot No.7 Sy No.252/2 cortalim Village Goa Total Area 10764 Sq Ft Built Up Area Whether Inherited N Purchase Date 0000-00-00 Purchase Cost 100000.00 Development Cost 0.00  10,00,000 10 Lacs+",Nil,Nil,Nil,Nil,"Rs 75,00,000 75 Lacs+"
3,iii,Commercial Buildings,"Survey No.123 Subdivision 0""Plot No.15,Quelossim  Total Area 3300 Sq Ft Built Up Area 2000 Sq Ft Whether Inherited N Purchase Date 2010-02-03 Purchase Cost 5747620.00 Development Cost 6283300.00  1,25,00,000 1 Crore+ Shop No.337/1 in Sy No.255/3 of Cortalim,Village Goa  Total Area 600 Sq Ft Built Up Area 600 Sq Ft Whether Inherited N Purchase Date 1980-01-12 Purchase Cost 80000.00 Development Cost 0.00  10,00,000 10 Lacs+",Nil,Nil,Nil,Nil,Nil,"Rs 1,35,00,000 1 Crore+"
4,iv,Residential Buildings,"Regd H.No.386/1 at Sy No.251/18,at Goa Total Area 1925 Sq Ft Built Up Area 1300 Sq Ft Whether Inherited N Purchase Date 2004-06-22 Purchase Cost 93250.00 Development Cost 650000.00  42,00,000 42 Lacs+","Regd H.No.201 in Bldg Mnas at Goa Total Area 1057 Sq Ft Built Up Area 1057 Sq Ft Whether Inherited N Purchase Date 2021-04-15 Purchase Cost 3648097.00 Development Cost 0.00  40,00,000 40 Lacs+",Nil,Nil,Nil,Nil,"Rs 82,00,000 82 Lacs+"
5,v,Others,Nil,Nil,Nil,Nil,Nil,Nil,Nil
6,Total Current Market Value of (i) to (v) (as per Affidavit),Total Current Market Value of (i) to (v) (as per Affidavit),"2,87,00,000 2 Crore+","50,00,000 50 Lacs+",Nil,Nil,Nil,Nil,"Rs 3,37,00,000 3 Crore+"
7,Totals Calculated,Totals Calculated,"Rs 2,87,00,000 2 Crore+","Rs 50,00,000 50 Lacs+",Nil,Nil,Nil,Nil,"Rs 3,37,00,000 3 Crore+"
