,0,1,2,3,4,5,6,7,8
0,Sr No,Description,self,spouse,huf,dependent1,dependent2,dependent3,
1,i,Agricultural Land,"Vill. Jalalabad Tehsil Khadur Sahib Distt. Tarn Taran Hadbast No.154 and Village Kakka Kandiala Tehsil and Distt. Tarn Taran  Total Area 10 Acres 7 K and 3 M Built Up Area Whether Inherited N Purchase Date 2019-05-27 Purchase Cost 512500.00 Development Cost 0.00  1,25,00,000 1 Crore+","Vill. Jalalabad Tehsil Khadur Sahib Distt. Tarn Taran Hadbast No.154  Total Area 2 Acres Built Up Area Whether Inherited N Purchase Date 1997-09-25 Purchase Cost 72000.00 Development Cost 0.00  25,00,000 25 Lacs+",Nil,Nil,Nil,Nil,"Rs 1,50,00,000 1 Crore+"
2,ii,Non Agricultural Land,"Vill. Kakka Kandiala Tehsil and Distt. Tarn Taran  Total Area 4725 Sqft Built Up Area Whether Inherited N Purchase Date 2001-08-01 Purchase Cost 51500.00 Development Cost 0.00  10,00,000 10 Lacs+",Nil,Nil,Nil,Nil,Nil,"Rs 10,00,000 10 Lacs+"
3,iii,Commercial Buildings,Nil,Nil,Nil,Nil,Nil,Nil,Nil
4,iv,Residential Buildings,"Fatehchak Depp Avanue Tarn Taran  Total Area 4059 Sqft Built Up Area 3300 Sqft Whether Inherited N Purchase Date 1995-08-01 Purchase Cost 108000.00 Development Cost 2000000.00  2,00,00,000 2 Crore+","Fatehchak Depp Avanue Tarn Taran  Total Area 4514 Sqft Built Up Area 500 Sqft Whether Inherited N Purchase Date 2001-12-04 Purchase Cost 250000.00 Development Cost 200000.00  60,00,000 60 Lacs+",Nil,Nil,Nil,Nil,"Rs 2,60,00,000 2 Crore+"
5,v,Others,"Leese Rights over property measuring 5776 sq.ft. through two lease deeds dt. 22-12-2010 At Sri Chander Colony, Tarn Taran City  Total Area Built Up Area Whether Inherited N Purchase Date 0000-00-00 Purchase Cost 0.00 Development Cost 0.00  0",Nil,Nil,Nil,Nil,Nil,Rs 0
6,Total Current Market Value of (i) to (v) (as per Affidavit),Total Current Market Value of (i) to (v) (as per Affidavit),"3,35,00,000 3 Crore+","85,00,000 85 Lacs+",Nil,Nil,Nil,Nil,"Rs 4,20,00,000 4 Crore+"
7,Totals Calculated,Totals Calculated,"Rs 3,35,00,000 3 Crore+","Rs 85,00,000 85 Lacs+",Nil,Nil,Nil,Nil,"Rs 4,20,00,000 4 Crore+"
