,0,1,2,3,4,5,6,7,8
0,Sr No,Description,self,spouse,huf,dependent1,dependent2,dependent3,
1,i,Agricultural Land,"CHumbong Galshing West Sikkim K No. plot 706,708,709,710,711  Total Area 2.6780 Hect Built Up Area Whether Inherited Y Purchase Date 0000-00-00 Purchase Cost 0.00 Development Cost 0.00  2,65,19,692 2 Crore+",Nil,Nil,Nil,Nil,Nil,"Rs 2,65,19,692 2 Crore+"
2,ii,Non Agricultural Land,"Chumbong Galshing West Sikkim K No. 21 Plot no. 707 Total Area 0.9840 Hect Built Up Area Whether Inherited Y Purchase Date 0000-00-00 Purchase Cost 0.00 Development Cost 6556000.00  97,44,353 97 Lacs+",Nil,Nil,Nil,Nil,Nil,"Rs 97,44,353 97 Lacs+"
3,iii,Commercial Buildings,"Chumbong Galshing West Sikkim K No. 21  Total Area 1028 Sq.ft. Built Up Area 2056 Sq.ft. Whether Inherited Y Purchase Date 0000-00-00 Purchase Cost 0.00 Development Cost 6565000.00  1,64,48,000 1 Crore+ Chumbong Galshing West Sikkim Plot No 707  Total Area 1663 Sq.ft. Built Up Area 4910 Sq.ft. Whether Inherited N Purchase Date 0000-00-00 Purchase Cost 0.00 Development Cost 0.00  91,86,400 91 Lacs+",Nil,Nil,Nil,Nil,Nil,"Rs 2,56,34,400 2 Crore+"
4,iv,Residential Buildings,"CHumbong Galshing West Sikkim K No. 21 Plot no. 707 Total Area 1237 Sq.ft. Built Up Area 3712 Sq.ft. Whether Inherited Y Purchase Date 0000-00-00 Purchase Cost 0.00 Development Cost 6556000.00  76,72,500 76 Lacs+",Nil,Nil,Nil,Nil,Nil,"Rs 76,72,500 76 Lacs+"
5,v,Others,Nil,Nil,Nil,Nil,Nil,Nil,Nil
6,Total Current Market Value of (i) to (v) (as per Affidavit),Total Current Market Value of (i) to (v) (as per Affidavit),"6,95,70,945 6 Crore+",Nil,Nil,Nil,Nil,Nil,"Rs 6,95,70,945 6 Crore+"
7,Totals Calculated,Totals Calculated,"Rs 6,95,70,945 6 Crore+",Nil,Nil,Nil,Nil,Nil,"Rs 6,95,70,945 6 Crore+"
