,0,1,2,3,4,5,6,7,8
0,Sr No,Description,self,spouse,huf,dependent1,dependent2,dependent3,
1,i,Agricultural Land,"Village Harkotaseer, Survey No. 2331, 2332, 2336, 2340/2, 2341 to 2344 2) Village Girbai Survey No. 543 3) Village Harkotaseer Area 1) 2 Beegha 7 Biswa. 2)1/3 Part of 0.046 Hector 3) 0.080 Hector  Total Area Built Up Area Whether Inherited Y Purchase Date 0000-00-00 Purchase Cost 0.00 Development Cost 0.00  39,74,641 39 Lacs+",Nil,Nil,Nil,Nil,Nil,"Rs 39,74,641 39 Lacs+"
2,ii,Non Agricultural Land,Nil,"Harkota Seer situated Plot  Total Area 1000 Sq. Ft. Built Up Area Whether Inherited N Purchase Date 2008-12-19 Purchase Cost 205000.00 Development Cost 0.00  7,50,000 7 Lacs+",Nil,Nil,Nil,Nil,"Rs 7,50,000 7 Lacs+"
3,iii,Commercial Buildings,"Shop, Agriculture Upajmandi, Lakshmiganj, Lashkar, Gwalior  Total Area 450 Sq. Ft. Built Up Area 450 Sq. Ft. Whether Inherited N Purchase Date 1990-02-03 Purchase Cost 4500.00 Development Cost 90000.00  8,25,000 8 Lacs+",Nil,Nil,Nil,Nil,Nil,"Rs 8,25,000 8 Lacs+"
4,iv,Residential Buildings,"Situated Building Harkotaseer, District Gwalior  Total Area 3500 Sq. Ft. Built Up Area 3500 Sq. Ft. Whether Inherited Y Purchase Date 0000-00-00 Purchase Cost 0.00 Development Cost 500000.00  20,00,000 20 Lacs+","Flat Shiva Plaza Samadhiya Colony  Total Area 1097 Sq. Ft. Built Up Area 1097 Sq. Ft. Whether Inherited N Purchase Date 2009-10-12 Purchase Cost 490000.00 Development Cost 0.00  16,00,000 16 Lacs+",Nil,Nil,Nil,Nil,"Rs 36,00,000 36 Lacs+"
5,v,Others,"Registration fee for allotment of shop in agricultural produce market Total Area Built Up Area Whether Inherited N Purchase Date 0000-00-00 Purchase Cost 0.00 Development Cost 0.00  10,000 10 Thou+",Nil,Nil,Nil,Nil,Nil,"Rs 10,000 10 Thou+"
6,Total Current Market Value of (i) to (v) (as per Affidavit),Total Current Market Value of (i) to (v) (as per Affidavit),"68,09,641 68 Lacs+","23,50,000 23 Lacs+",Nil,Nil,Nil,Nil,"Rs 91,59,641 91 Lacs+"
7,Totals Calculated,Totals Calculated,"Rs 68,09,641 68 Lacs+","Rs 23,50,000 23 Lacs+",Nil,Nil,Nil,Nil,"Rs 91,59,641 91 Lacs+"
