,0,1,2,3,4,5,6,7,8
0,Sr No,Description,self,spouse,huf,dependent1,dependent2,dependent3,
1,i,Agricultural Land,"Mauza singha, Tola tulsiya 550,551,482,107,108 share 1/2  Total Area 4.40 acre Built Up Area Whether Inherited Y Purchase Date 0000-00-00 Purchase Cost 0.00 Development Cost 0.00  1,38,00,000 1 Crore+",Nil,Nil,Nil,Nil,Nil,"Rs 1,38,00,000 1 Crore+"
2,ii,Non Agricultural Land,Nil,"Mauza Mirganj harkhauli, khata 82,267 khasra no.1980,1981  Total Area 20210 sq.ft. Built Up Area Whether Inherited N Purchase Date 2008-08-20 Purchase Cost 960000.00 Development Cost 0.00  2,08,00,000 2 Crore+",Nil,Nil,Nil,Nil,"Rs 2,08,00,000 2 Crore+"
3,iii,Commercial Buildings,"Raj Petroleum hathua, Residential house khata 78 khasra 733,734 Purchase date 26-07-2007, 26-05-2008  Total Area 35640 sq.ft. Built Up Area 6000 sq.f.t, 15000 sq.ft, 14640 sq.ft. Whether Inherited N Purchase Date 0000-00-00 Purchase Cost 570000.00 Development Cost 0.00  60,70,000 60 Lacs+","Raj Complex Mirganj Gopalganj khata no.427 khesra no.1021  Total Area 2915 sq.ft. Built Up Area 2500 sq.ft. Whether Inherited N Purchase Date 2000-10-11 Purchase Cost 114000.00 Development Cost 0.00  1,00,00,000 1 Crore+",Nil,Nil,Nil,Nil,"Rs 1,60,70,000 1 Crore+"
4,iv,Residential Buildings,"Mauza Singha Tola Tulsia joint house half share khata 550,550,482  Total Area 1000 sq.ft., Built Up Area 1500 sq.ft. Whether Inherited N Purchase Date 0000-00-00 Purchase Cost 2007.00 Development Cost 0.00  10,00,000 10 Lacs+ Madiya Hathua  Total Area 35000 Built Up Area 15000 Whether Inherited N Purchase Date 2008-05-26 Purchase Cost 517000.00 Development Cost 0.00  30,00,000 30 Lacs+",Nil,Nil,Nil,Nil,Nil,"Rs 40,00,000 40 Lacs+"
5,v,Others,Nil,Nil,Nil,Nil,Nil,Nil,Nil
6,Total Current Market Value of (i) to (v) (as per Affidavit),Total Current Market Value of (i) to (v) (as per Affidavit),0,0,Nil,Nil,Nil,Nil,Rs 0
7,Totals Calculated,Totals Calculated,"Rs 2,38,70,000 2 Crore+","Rs 3,08,00,000 3 Crore+",Nil,Nil,Nil,Nil,"Rs 5,46,70,000 5 Crore+"
