,0,1,2,3,4,5,6,7,8
0,Sr No,Description,self,spouse,huf,dependent1,dependent2,dependent3,
1,i,Agricultural Land,"SURVEY Nos. 32/2, Kanaganaplli Village.C.K.Palli, Aa nthapuram District Total Area 14.02 Acres Built Up Area Whether Inherited N Purchase Date 2011-10-17 Purchase Cost 710000.00 Development Cost 0.00  2,10,30,000 2 Crore+ SURVEY Nos. 32/2 Kanaganaplli Village.C.K.Palli, An anthapuram District  Total Area 16.01 Acres Built Up Area Whether Inherited N Purchase Date 2011-07-10 Purchase Cost 800000.00 Development Cost 0.00  2,40,15,000 2 Crore+ SURVEY Nos. 32/2 Kanaganaplli Village.C.K.Palli, An anthapuram District  Total Area 1 Acre Built Up Area Whether Inherited N Purchase Date 2018-10-27 Purchase Cost 350000.00 Development Cost 0.00  35,00,000 35 Lacs+ SY.No. 62-A, 62- B,61-B,61-B/2, Mandal, Ananthapuram District Joint Property- along with spouse 50%  Total Area 9 Acres and 54 Cents Built Up Area Whether Inherited N Purchase Date 2018-07-28 Purchase Cost 954000.00 Development Cost 0.00  2,86,00,000 2 Crore+ SY.No.543 Marur Village Rapthadu Mandal, Dharmavar am RD, Ananthapuram District-AP  Total Area 6.01 Acres Built Up Area Whether Inherited Y Purchase Date 0000-00-00 Purchase Cost 0.00 Development Cost 0.00  90,15,000 90 Lacs+","SY Nos. 664,663- 281,663- 282,663- 282,664,663- 281,664,663- 281,663- 1,663-1, Chunchu Earaagudi Gramaam, Krishnagiri Mandal, Kurnool District.  Total Area 19 Acres 65 cents Built Up Area Whether Inherited N Purchase Date 2023-05-05 Purchase Cost 4913000.00 Development Cost 0.00  75,00,000 75 Lacs+ SY.No. 62-A, 62-8,61-8,61- B/2, &618/3 Karidikonda Village, Gooty Mandal, Ananthpur District  Total Area 9 Acres 54 cents Built Up Area Whether Inherited N Purchase Date 2018-07-28 Purchase Cost 954000.00 Development Cost 0.00  2,86,00,000 2 Crore+ Sy.No 36-1A Thimmapuram Revenue village kudair Mandal Anantapur district DOC No.8586/2021  Total Area 2 acres Built Up Area Whether Inherited N Purchase Date 2021-03-15 Purchase Cost 350000.00 Development Cost 0.00  30,00,000 30 Lacs+ SURVEY Nos. 32/2, Kanaganaplli Village, Chenne na Kothapally Mandal, Anant hapuram District  Total Area 5 Acres Built Up Area Whether Inherited N Purchase Date 2013-03-15 Purchase Cost 0.00 Development Cost 0.00  1,50,00,000 1 Crore+",Nil,"Sy No.539-B at Ungaranigundla Dhone Nandhyala Dist  Total Area 5.72 Acres Built Up Area Whether Inherited N Purchase Date 2023-08-19 Purchase Cost 3348000.00 Development Cost 0.00  45,00,000 45 Lacs+",Nil,Nil,"Rs 14,47,60,000 14 Crore+"
2,ii,Non Agricultural Land,"Sy.Nos 463,464,465,466,467,468, 469,470,471,472 &475 Plot No.870, Green Rich Highlands, Phase- 2,LEMOOR VILLAGE, Kandukur Mandal, Rangareddy District, Telangana  Total Area 609.69 sq yards Built Up Area Whether Inherited N Purchase Date 2024-03-14 Purchase Cost 0.00 Development Cost 0.00  20,00,000 20 Lacs+ Sy.Nos 463,464,465,466,467,468, 469,470,471,472 &475Plot No.844, Green Rich Highlands, Phase- 2,LEMOOR VILLAGE, Kandukur Mandal, Rangareddy District, Telangana  Total Area 609.69 sq yards Built Up Area Whether Inherited N Purchase Date 2024-03-14 Purchase Cost 0.00 Development Cost 0.00  20,00,000 20 Lacs+ In Sy.No.64-2, Uddandarayunipalem Village, Thullur Mandal, Amaravathi, Guntu r District, admeasuring 1.00 Acre, purchased by me, the same land acquired by CRDA, in lieu of one Acre land the CRDA was allotted 1000 Sq.yards Residential Plot and 400 Sq. Yards Commercial Plot Category to me Vide  Total Area 1.0 Acre Built Up Area Whether Inherited N Purchase Date 2015-05-15 Purchase Cost 900000.00 Development Cost 0.00  40,00,000 40 Lacs+","Joint Property-33.33% Sy. Nos 17/1C Plot Nos,27,28,29,30,31,32 &33 Rapthadu Village, R & V Village, Ananthapuram District  Total Area 418.48 sq yards Built Up Area Whether Inherited N Purchase Date 2017-09-27 Purchase Cost 418333.00 Development Cost 0.00  15,00,000 15 Lacs+ Sy.No.163 Residential Plot No. 99 Narayanapuram Revenue Village & Mandal, Ananthapuram  Total Area 193.06 sq yards Built Up Area Whether Inherited N Purchase Date 2020-07-03 Purchase Cost 523000.00 Development Cost 0.00  15,00,000 15 Lacs+ Sy.No.163 Residential Plot No. 97 & 98 Narayanapuram Village & Mandal, Ananthapuram RD & SD  Total Area 384 sq yards Built Up Area Whether Inherited N Purchase Date 2022-09-30 Purchase Cost 1240000.00 Development Cost 0.00  30,00,000 30 Lacs+ SY.No. 105/P & 106/P Plot No.98 Mallampet Village, R.R.District  Total Area 222 sq yards Built Up Area Whether Inherited N Purchase Date 2022-11-14 Purchase Cost 1265400.00 Development Cost 0.00  35,00,000 35 Lacs+",Nil,Nil,Nil,Nil,"Rs 1,75,00,000 1 Crore+"
3,iii,Commercial Buildings,"Patancheru Patancheru Industrial Area Plot Nos.17/C/3/17/B  Total Area 50318 sqft Built Up Area 15000 sqft Whether Inherited N Purchase Date 2017-10-16 Purchase Cost 18125500.00 Development Cost 25000000.00  7,00,00,000 7 Crore+",Nil,Nil,Nil,Nil,Nil,"Rs 7,00,00,000 7 Crore+"
4,iv,Residential Buildings,"Sy.No.141,142145,154,155 ,156,158 H.No. 5-370, Plot No.370, Deepthisri Nagar Colony, Hafeezpet Village, Serilimgampally Mandal  Total Area 300 sq yards Built Up Area Whether Inherited N Purchase Date 2012-09-18 Purchase Cost 4300000.00 Development Cost 9000000.00  3,00,00,000 3 Crore+ SY.No. Nos 401,& 402 Flat No.302,3rd Floor, Everest Block, MID VALLEY CITY, Atmakur Village, Mangalagiri Mandal, Guntur Distrct  Total Area 2037 sq ft Built Up Area Whether Inherited N Purchase Date 2021-09-02 Purchase Cost 6426550.00 Development Cost 0.00  90,00,000 90 Lacs+ Sy.No.157 Flat No.107,1 Floor, A Block, ATLANTIC CITY, Deepthisri Nagar Colony, Hafezpet Village, Serilingampally Mandal, Rangareddy District, Telangana Hyderabad  Total Area 1001 sq ft Built Up Area Whether Inherited N Purchase Date 2006-10-10 Purchase Cost 605000.00 Development Cost 500000.00  40,00,000 40 Lacs+ Sy.No.209 Residential house M.Bandameeda Palli Village & Grampanchayat, Anananth apuram RD & SD,  Total Area 3515.75 sq yards Built Up Area Whether Inherited N Purchase Date 2014-11-13 Purchase Cost 879000.00 Development Cost 3000000.00  50,00,000 50 Lacs+ Flat No.G1 Siri Brindavan AKakipalli Village Anahtapurampartment Total Area 1275 sqft 31.18 sq yards Built Up Area Whether Inherited N Purchase Date 2014-08-02 Purchase Cost 1706000.00 Development Cost 0.00  60,00,000 60 Lacs+","Sy.Nos 217 to 225 of Narsingi V and 263 to 270 of Puppalguda Residential Flat No.1505, Block No.01 Narsingi Village & Mandal, R.R.District, Telan MY HOME AVATHAR Puppalguda Village, Gandipet Revenue gana  Total Area 1314 sq ft Built Up Area Whether Inherited N Purchase Date 2019-10-24 Purchase Cost 5796870.00 Development Cost 0.00  1,00,00,000 1 Crore+ Sy.No.104/p1,104/2,104/ 3,104/4 & 104/5A and 80/5 Flat No.1004, Tower C,Celest Apartment Chinagantyada Village, Gajuwaka Mandal, Visakhapatnam District  Total Area 1039 sq ft Built Up Area Whether Inherited N Purchase Date 2021-08-12 Purchase Cost 5461788.00 Development Cost 0.00  80,00,000 80 Lacs+ Sy.No. 140/2A Residential House bearing D.No.6-5-265- 5,Plot No. Kakkalapalli Village & Panchayat, Sri Nagar Colony, Ananthapuram Mandal, Ananthapuram District  Total Area 324.41 sq yards Built Up Area Whether Inherited N Purchase Date 2023-10-21 Purchase Cost 14534000.00 Development Cost 0.00  2,00,00,000 2 Crore+",Nil,Nil,Nil,Nil,"Rs 9,20,00,000 9 Crore+"
5,v,Others,"Share in JDA Agreement 3flats Admeasuring 1267 sqft  Total Area 1267 sqft Built Up Area Whether Inherited N Purchase Date 0000-00-00 Purchase Cost 0.00 Development Cost 0.00  1,33,00,000 1 Crore+",Nil,Nil,Nil,Nil,Nil,"Rs 1,33,00,000 1 Crore+"
6,Total Current Market Value of (i) to (v) (as per Affidavit),Total Current Market Value of (i) to (v) (as per Affidavit),"23,14,60,000 23 Crore+","10,16,00,000 10 Crore+",Nil,"45,00,000 45 Lacs+",Nil,Nil,"Rs 33,75,60,000 33 Crore+"
7,Totals Calculated,Totals Calculated,"Rs 23,14,60,000 23 Crore+","Rs 10,16,00,000 10 Crore+",Nil,"Rs 45,00,000 45 Lacs+",Nil,Nil,"Rs 33,75,60,000 33 Crore+"
