,0,1,2,3,4,5,6,7,8
0,Sr No,Description,self,spouse,huf,dependent1,dependent2,dependent3,
1,i,Agricultural Land,"(1)Bajaura Dobhi, Gaya, (2)Akauli, Dobhi, (3)Dirama, Cherki, Gaya  Total Area 15.11 Acre Built Up Area Whether Inherited N Purchase Date 1984-01-01 Purchase Cost 3866168.00 Development Cost 0.00  55,23,400 55 Lacs+","(1)Bajaura Dobhi, Gaya, (2)Amwan Bodhgaya, Gaya  Total Area 12.50 Acre Built Up Area Whether Inherited N Purchase Date 1984-01-01 Purchase Cost 2198275.00 Development Cost 0.00  52,50,000 52 Lacs+",Nil,Nil,Nil,Nil,"Rs 1,07,73,400 1 Crore+"
2,ii,Non Agricultural Land,"(1)Shastri Nagar, Gaya, (2)Salempur, Dumra, Patna (3)Harigaon Bela, (4)Dumuhan, Bodhgaya, Gaya, (5)Machali, Talab Bajaura, Gaya  Total Area 512.03 Dec Built Up Area Whether Inherited N Purchase Date 1994-01-01 Purchase Cost 3708703.00 Development Cost 100000.00  59,95,000 59 Lacs+","(1)Rampur Gaya, (2)Phulwari, Patna  Total Area 20.82 Dec. Built Up Area Whether Inherited N Purchase Date 1989-01-01 Purchase Cost 3321549.00 Development Cost 3221050.00  95,00,000 95 Lacs+",Nil,Nil,Nil,Nil,"Rs 1,54,95,000 1 Crore+"
3,iii,Commercial Buildings,"A.P. Colony Gaya  Total Area 8160 Sq.Ft. Built Up Area 5000 Sq.Ft. Whether Inherited N Purchase Date 2015-01-01 Purchase Cost 1930000.00 Development Cost 1524850.00  60,24,850 60 Lacs+","Rampur Jail Road, Chiraiya Har, Gaya  Total Area 32 Dec. Built Up Area 30 Dec. Whether Inherited N Purchase Date 1993-01-01 Purchase Cost 970150.00 Development Cost 3860000.00  38,60,000 38 Lacs+",Nil,Nil,Nil,Nil,"Rs 98,84,850 98 Lacs+"
4,iv,Residential Buildings,"(1)Rampur, Jail Road, Gaya, Area-7500 Sq.Ft., Built Up Area-6871 Sq.Ft., (2)Malviya Nagar, Delhi, Area-150 Sq.Yd., Built Up Area-150 Sq.Yd.  Total Area Built Up Area Whether Inherited N Purchase Date 2006-01-01 Purchase Cost 844200.00 Development Cost 14482800.00  2,60,00,000 2 Crore+",Nil,Nil,Nil,Nil,Nil,"Rs 2,60,00,000 2 Crore+"
5,v,Others,Nil,Nil,Nil,Nil,Nil,Nil,Nil
6,Total Current Market Value of (i) to (v) (as per Affidavit),Total Current Market Value of (i) to (v) (as per Affidavit),"4,35,43,250 4 Crore+","2,13,50,550 2 Crore+",Nil,Nil,Nil,Nil,"Rs 6,48,93,800 6 Crore+"
7,Totals Calculated,Totals Calculated,"Rs 4,35,43,250 4 Crore+","Rs 1,86,10,000 1 Crore+",Nil,Nil,Nil,Nil,"Rs 6,21,53,250 6 Crore+"
