,0,1,2,3,4,5,6,7,8
0,Sr No,Description,self,spouse,huf,dependent1,dependent2,dependent3,
1,i,Agricultural Land,"Santhavellore Village Sriperumbudur Taluk, Kancheepuram District. S.No.102 / 13B, 102/14, 102/11, 102/12, 102/16, 102 / 10B, 105/1, 102 / 10A, 102/15, 104/1, 105/2, 105 / 3, 105/4, 104/2, 104 / 5A, 103/2, 103/4 Part, 103 / 5A , 104/6, 104/13, 106 / 3A, 106 / 3B, 104/3. Total Area 14.87 Acres Built Up Area Whether Inherited N Purchase Date 2006-01-02 Purchase Cost 1815834.00 Development Cost 0.00  5,97,77,400 5 Crore+ Santhavellore Village Sriperumbudur Taluk, Kancheepuram District. S. No: 113/8  Total Area 1.90 Acres Built Up Area Whether Inherited N Purchase Date 2006-01-18 Purchase Cost 256030.00 Development Cost 0.00  76,38,000 76 Lacs+ Santhavellore Village Sriperumbudur Taluk, Kancheepuram District. S. No: 113/1A, 113/1B, 113/7, 113/5, 113/6  Total Area 6.67 Acres Built Up Area Whether Inherited N Purchase Date 2006-01-18 Purchase Cost 870054.00 Development Cost 0.00  6,70,33,500 6 Crore+ Santhavellore Village Sriperumbudur Taluk, Kancheepuram District. 105/4, 104/2, 104 / 5A, 103/2,  Total Area 3.10 Acre Built Up Area Whether Inherited N Purchase Date 2006-01-18 Purchase Cost 1831600.00 Development Cost 0.00  6,23,10,000 6 Crore+ Palanjur Vill., Sriperumbudur Taluk, Kancheepuram District. S. No: 417/5A1  Total Area 0.50 Acres Built Up Area Whether Inherited N Purchase Date 2013-02-19 Purchase Cost 1089000.00 Development Cost 0.00  26,80,000 26 Lacs+ Family 1/4th Share Pukkathurai Vill Maduranthakam Taluk, Kancheepuram Dist., S. No: 226/2, 227/2A, 227/3  Total Area 1/4th Share in 1.01 Acre Built Up Area Whether Inherited N Purchase Date 0000-00-00 Purchase Cost 0.00 Development Cost 0.00  1,69,175 1 Lacs+ Family 1/4th Share Pukkathurai Vill Maduranthakam Taluk, Kancheepuram Dist., S. No 235/1, 235/2, 236, 244/1, 245, 233, 234, 222, 225/2, 226/1  Total Area 1/4th Share in 17.30 Acres Built Up Area Whether Inherited Y Purchase Date 2010-09-09 Purchase Cost 86500.00 Development Cost 0.00  28,97,750 28 Lacs+ Family 1/4th Share Pukkathurai Vill Maduranthakam Taluk, Kancheepuram Dist., S. No: 235/1, 235/2, 236, 244/1, 245, 233, 234, 222, 225/2, 226/1, 226/2, 227/2A, 227/3  Total Area 1/4th Share in 7.27 Acres Built Up Area Whether Inherited Y Purchase Date 0000-00-00 Purchase Cost 0.00 Development Cost 0.00  1,09,59,525 1 Crore+ Family 1/4th Share Pukkathurai Vill Maduranthakam Taluk, Kancheepuram Dist., S. No: 97/4B & 98/2B  Total Area 0.6 Acre Built Up Area Whether Inherited Y Purchase Date 0000-00-00 Purchase Cost 0.00 Development Cost 0.00  12,00,000 12 Lacs+",Nil,Nil,Nil,Nil,Nil,"Rs 21,46,65,350 21 Crore+"
2,ii,Non Agricultural Land,"Family 1/4th Share Palanjur Vill., Sriperumbadur Taluk, Kancheepuram Dist., S. No: 102/14, 102/11, 102/12, 102/16, 102 / 10B, 105/1, 102 / 10A, 102/15, 104/1, 105/2, 105 / 3, 105/4, 104/2, 104 / 5A, 103/2, 103/4 Part, 103 / 5A , 104/6, 104/13, 106 / 3A, 106 / 3B, 104/3.  Total Area 23.32 Acre share 1/4th Built Up Area Whether Inherited Y Purchase Date 0000-00-00 Purchase Cost 0.00 Development Cost 0.00  12,96,45,000 12 Crore+ Thygarasanapalli Vill., Hosur Taluk, Krishnagiri Dist., S. No: 247/2A Part  Total Area 1.32 Acres Built Up Area Whether Inherited N Purchase Date 2011-12-19 Purchase Cost 257740.00 Development Cost 0.00  2,87,430 2 Lacs+ Family 1/4th Share Mevaloorkuppam & Chettipedu Vill., Sriperumbudur Taluk, Kancheepuram Dist., S. No: 325/1  Total Area 1/4th Share in 1.77 Acres Built Up Area Whether Inherited Y Purchase Date 0000-00-00 Purchase Cost 0.00 Development Cost 0.00  1,34,00,000 1 Crore+ Family 1/4th Share Kuthambakkam Vill., Poonamalle Taluk, Tiruvallur Dist., S. No: 507/1A, 1B1, 1B2, 1B3, 507/3B  Total Area 1/4th Share in 1.90 Acres Built Up Area Whether Inherited Y Purchase Date 0000-00-00 Purchase Cost 0.00 Development Cost 0.00  59,37,500 59 Lacs+ Family 1/4th Share 1) A.P.M.S. Nagar, Mevalurkuppam Vill., Sriperumbudur Tk., Kanchepuram Dist S. No: 72/1B Part Area: 1/4th Share in 2775 Sq. ft 2) Dharmathupatti Vill., Thirumanagalam Tk., Madurai Dist., S. No: 13/4B, 13/5C, 15/1, 15/1A, 13/2 & 13/5B Area: 1/4th Share in 2.29 Acres  Total Area Built Up Area Whether Inherited Y Purchase Date 2010-09-09 Purchase Cost 313500.00 Development Cost 0.00  29,14,431 29 Lacs+ Family 1/20th Share Maranthalai Vill., Thiruchenduur Taluk, Thoothukudi dist., S. No: 339/1 Vill., Site  Total Area 1/20th of 6261 sq. ft i.e 313 sq. ft Built Up Area Whether Inherited Y Purchase Date 0000-00-00 Purchase Cost 0.00 Development Cost 0.00  35,000 35 Thou+ Family 1/4th Share Arcot Road, Porur, Chennai S. No: 126, 127, 134  Total Area 1/4th Share in 14195 Sq. ft Built Up Area Whether Inherited Y Purchase Date 0000-00-00 Purchase Cost 0.00 Development Cost 0.00  1,06,99,481 1 Crore+","Thygarasanapalli Vill., Hosur Taluk, Krishnagiri Dist. S. No: 247/2A part Total Area 1.00 Acre Built Up Area Whether Inherited N Purchase Date 2015-03-03 Purchase Cost 0.00 Development Cost 0.00  2,17,750 2 Lacs+",Nil,Nil,Nil,Nil,"Rs 16,31,36,592 16 Crore+"
3,iii,Commercial Buildings,"Family 1/4th Share No: 2/146 Mount Poonamallee High Rd., Kattupakkam Ch-56. S. No: 216/1part, 219/2  Total Area 1/4th Share in 0.16 Acres Built Up Area 5700 sq. ft Whether Inherited Y Purchase Date 0000-00-00 Purchase Cost 0.00 Development Cost 0.00  29,21,200 29 Lacs+ Family 1/4th Share No: 2/146 Mount Poonamallee Road, Iyyappanthangal Vill., Chennai 56 S. No: 310/6, 312, 313, 318  Total Area 1/4th Share in 0.5746Acres Built Up Area 9800 sq. ft Whether Inherited Y Purchase Date 0000-00-00 Purchase Cost 0.00 Development Cost 0.00  1,17,53,652 1 Crore+ Family 1/4th Share No: No. 14/41 Azeez Nagar, IInd Dtrt., Kodambakkam Chennai-24 S. No: 17  Total Area 1/4th Share in 4815 sq. ft Built Up Area 4404 sq. ft Whether Inherited Y Purchase Date 0000-00-00 Purchase Cost 0.00 Development Cost 0.00  91,45,575 91 Lacs+ Family 1/4th Share No: No. 14/41 Azeez Nagar, IInd Dtrt., Kodambakkam Chennai-24 S. No: 28/4  Total Area 1/4th Share in 427 sq. ft Built Up Area 1200 sq. ft Whether Inherited Y Purchase Date 0000-00-00 Purchase Cost 0.00 Development Cost 0.00  9,63,875 9 Lacs+",Nil,Nil,Nil,Nil,Nil,"Rs 2,47,84,302 2 Crore+"
4,iv,Residential Buildings,"Family 1/20th Share No: 3/147 Maranthai Vill., Thiruchnedur Taluk, Thoothukudi Dist., S. No: 339/1 Vill., Total Area 1/20th Share of 3000 sq. ft i 150 sq. ft Built Up Area 800 sq. ft Whether Inherited Y Purchase Date 0000-00-00 Purchase Cost 0.00 Development Cost 0.00  37,500 37 Thou+ Family 1/20th Share No: 3/147 Maranthai Vill., Thiruchnedur Taluk, T Nagar Dist., T. S. No: 6376 Vill., Total Area 1/4th Share in 7021 sq. ft Built Up Area 4500 sq. ft Whether Inherited Y Purchase Date 0000-00-00 Purchase Cost 0.00 Development Cost 0.00  2,41,68,250 2 Crore+ Joint Purchase 1/2 Share, Jagadeeswaran Str., T.Nagar Chennai T.S.No: 6331/2  Total Area 2872 Sq. ft Built Up Area 3935 sq. ft Whether Inherited N Purchase Date 2017-10-09 Purchase Cost 41193900.00 Development Cost 0.00  1,39,59,080 1 Crore+ Door No: 5T/1, 5T1A, Plot no: 126, Palayamkottai Road, Ganesh Ngar, Tuticorin T.S No: 27, 26  Total Area 8850 sq. ft Built Up Area 2094 sq. ft Whether Inherited N Purchase Date 2020-09-16 Purchase Cost 18350000.00 Development Cost 0.00  1,83,50,000 1 Crore+",Nil,Nil,Nil,Nil,Nil,"Rs 5,65,14,830 5 Crore+"
5,v,Others,Nil,Nil,Nil,Nil,Nil,Nil,Nil
6,Total Current Market Value of (i) to (v) (as per Affidavit),Total Current Market Value of (i) to (v) (as per Affidavit),"45,88,83,324 45 Crore+","2,17,750 2 Lacs+",Nil,Nil,Nil,Nil,"Rs 45,91,01,074 45 Crore+"
7,Totals Calculated,Totals Calculated,"Rs 45,88,83,324 45 Crore+","Rs 2,17,750 2 Lacs+",Nil,Nil,Nil,Nil,"Rs 45,91,01,074 45 Crore+"
