,0,1,2,3,4,5,6,7,8
0,Sr No,Description,self,spouse,huf,dependent1,dependent2,dependent3,
1,i,Agricultural Land,"1) Mauja Gopalpura Tehasil Pratapgarh R.No. 54 Area 0.53 he Date of Purchase YYYY-MM-DD 2015-04-20 Cost of Purchase 490000.00 2) Mauja Gopalpura Tehasil Pratapgarh R.No. 334/926 Total Area 0.63 he Purchase Date 2014-04-30 Purchase Cost 5,90,000 3) Mauja Gopalpura Tehasil Pratapgarh R.G. No. 469 Total Area 0.27 he Purchase Date 2007-08-07 Purchase Cost 2,45,000 4) Mauja Gopalpura Tehasil Pratapgarh RG No. 625 Total Area 0.31 he Purchase Date 2015-07-27 Purchase Cost 2,90,000 5) Mauja Gopalpura Tehasil Pratapgarh R.G. No. 472, 515/916, 524/912 Total Kita 3 Date of purchase 20/07/17 and 21/07/17 Total Area 0.76 he Purchase Cost 7,15,000 6) Mauja Gopalpura Tehasil Pratapgarh RG.No. 329 5/12 share Date of purchase 18-06-15 and 30-5-17 Cost of purchase 75000 and 151000 and DLC amt 390000 Total Area 1.00 he Purchase Cost 3,90,000 7) Mauja Gopalpura Tehasil Pratapgarh Rg. No. 693, 696 Total Kita 2 Total Area 0.20 he Purchase Date 2021-11-10 Purchase Cost 1,71,000 8) Mauja Gopalpura Tehasil Pratapgarh Rg. No. 704 Total Area 0.44 he Purchase Date 2022-03-22 Purchase Cost 3,75,000 9) Mauja Gopalpura Tehasil Pratapgarh R.No. 639/905 1/2 share Total Area 0.80 he Purchase Cost 3,70,000 10) Mauja Gopalpura Patwar Halka Sidhpua Account No. 201 Rg. No. 109, 117, 473, 474, 475, 15/871, 516, 517, 518, 519, 610, 616, 626 Total Kita 13 1/2 share Sumitra Parental area 1.95 he Total Area 3.90 he Total Area 6.59 he Built Up Area Whether Inherited N Purchase Date 0000-00-00 Purchase Cost 0.00 Development Cost 0.00  65,00,000 65 Lacs+ Mauja Bamotar Tehasil Pratapgarh RG. No. 403/1050, 403  Total Area 0.89 he Built Up Area Whether Inherited N Purchase Date 2011-05-25 Purchase Cost 495000.00 Development Cost 0.00  23,50,000 23 Lacs+ Mauja Bagvas Rg. No. 496/979, 497/928, 498/1035, 498/980, 520/843, 521/844 Total Kita 06 Total Rakaba 2.41 he 1/2 Share Mother Sumitra Parental D.L.C  Total Area Built Up Area Whether Inherited N Purchase Date 0000-00-00 Purchase Cost 1130000.00 Development Cost 0.00  55,00,000 55 Lacs+ Mauja Chotibambori Tehasil Pratapgarh Rg. No. 875/536  Total Area 0.02 he Built Up Area Whether Inherited N Purchase Date 2021-03-21 Purchase Cost 0.00 Development Cost 0.00  2,85,000 2 Lacs+ Mauja Shriramnagar Patwar Mandal Ganeshapura Tehasil Sahada Rg. No. 1000, 1002, 1003, 1008, 100, 1010, 993, 994, 995, 996, 997, 998, 999 Total Kita 13 Total Rakaba 2.45 he. 35/48 Share and Rg.No. 1004 area 0.27 he. 11/27 share Total Area Built Up Area Whether Inherited N Purchase Date 2022-11-25 Purchase Cost 0.00 Development Cost 0.00  4,90,000 4 Lacs+","Sarika Meena 1) Mauja Gopalpur Tehasil Pratapgarh Rg. No. 639/905 Rakaba 0.80 he 1/2 share 2) Mauja Gopalpura Tehasil Pratapgarh RG. No. 33, 59, 65, 57, 68, 69, 539 Total Kita 7 Total Area 4.41 he. Year 1.4.08 Rs. 300000 3) Mauja Gopalpura Tehasil. Pratapgarh Rg. No. 564, 565 Total area 2 Kita Total Area: 0.99 he Date 15-9-2007 Rs. 140000 4) Mauja Gopalpura Tehasil Pratapgarh Rg. No. 634, 635 Total Kita 2 Total area Rakba 2 Total Rakaba 0.49 he Year 2013 Rs. 53000 Sangeeta Meena 1) Mauja Gopalpura Tehasil Pratapgarh KRG No. 538/919 Rakaba 1.00 He Year 05-11-2011 Total 200000  Total Area 7.38 he Built Up Area Whether Inherited N Purchase Date 0000-00-00 Purchase Cost 693000.00 Development Cost 0.00  80,00,000 80 Lacs+",Nil,Nil,Nil,Nil,"Rs 2,31,25,000 2 Crore+"
2,ii,Non Agricultural Land,"Aabadi Aaodyogik Converted Land Mauja Gopalpur Rg. No. 690 area 0.54 he 0.25 he and RG No. 693, 696, 704 Total 3 Kita total area 0.64 he Aabadi Aaodyogik Converted Land Aabadi converted Land 0.89 he Year 2000 and date 10-11-2021 and 22-03-2022 Cost of purchase Total Area 95764 sq.ft. Built Up Area Whether Inherited N Purchase Date 0000-00-00 Purchase Cost 0.00 Development Cost 0.00  55,00,000 55 Lacs+",Nil,Nil,Nil,Nil,Nil,"Rs 55,00,000 55 Lacs+"
3,iii,Commercial Buildings,Nil,"Shrimati Sarika Meena Aabadi converted land Mauja Gopalpur RG No. 636 area 0.18 he Year 2013  Total Area 19368 sq.ft. Built Up Area Whether Inherited N Purchase Date 2013-01-01 Purchase Cost 72000.00 Development Cost 0.00  40,00,000 40 Lacs+",Nil,Nil,Nil,Nil,"Rs 40,00,000 40 Lacs+"
4,iv,Residential Buildings,"Residential Home J-61 Sharma Colony, 22 Godam Jaipur 1/2 share (Inherited from mother Mrs. Sumitra ji)  Total Area 605 sq. gaj Built Up Area 3000 sq. ft. Whether Inherited Y Purchase Date 0000-00-00 Purchase Cost 0.00 Development Cost 0.00  20,00,000 20 Lacs+",Nil,Nil,Nil,Nil,Nil,"Rs 20,00,000 20 Lacs+"
5,v,Others,"Bara Bor Gun Total Area Built Up Area Whether Inherited N Purchase Date 0000-00-00 Purchase Cost 0.00 Development Cost 0.00  42,000 42 Thou+",Nil,Nil,Nil,Nil,Nil,"Rs 42,000 42 Thou+"
6,Total Current Market Value of (i) to (v) (as per Affidavit),Total Current Market Value of (i) to (v) (as per Affidavit),"2,18,92,000 2 Crore+","1,20,00,000 1 Crore+",Nil,Nil,Nil,Nil,"Rs 3,38,92,000 3 Crore+"
7,Totals Calculated,Totals Calculated,"Rs 2,26,67,000 2 Crore+","Rs 1,20,00,000 1 Crore+",Nil,Nil,Nil,Nil,"Rs 3,46,67,000 3 Crore+"
