,0,1,2,3,4,5,6,7,8
0,Sr No,Description,self,spouse,huf,dependent1,dependent2,dependent3,
1,i,Agricultural Land,"Fatehgarh S.Y No-601/3/9  Total Area 0.096 hec Built Up Area Whether Inherited N Purchase Date 2022-02-03 Purchase Cost 175000.00 Development Cost 0.00  2,50,000 2 Lacs+","Dalauda Sy No0138/1/1 Rakba Total Area 0.066 hec Built Up Area Whether Inherited N Purchase Date 2022-02-03 Purchase Cost 1383000.00 Development Cost 0.00  15,25,000 15 Lacs+ Dalauda Sy no-136/2 Rakba  Total Area 0.038 hec Built Up Area Whether Inherited N Purchase Date 2023-08-14 Purchase Cost 1357000.00 Development Cost 0.00  14,50,000 14 Lacs+ Lakhmakheri Sy No-2101/1/ Rakba  Total Area 0.07 hec Built Up Area Whether Inherited N Purchase Date 2019-01-01 Purchase Cost 196000.00 Development Cost 0.00  2,66,000 2 Lacs+ Lakhmakhedi Sy no-211/1/1 Rakba 0.17 hec, sy no-222/1/1 rakba 0.09 hec Total Rakba-0.60 hec  Total Area 0.60 hec Built Up Area Whether Inherited N Purchase Date 2018-01-01 Purchase Cost 1080000.00 Development Cost 0.00  14,60,000 14 Lacs+ Lakhmakheri Sy no-211/1/3 Rakba-0.11 hec Sy no-211/2/3 Rakba 0.51 hec Sy no-222/1/4 rakba 0.31 hec Total Area 0.93 hec Built Up Area Whether Inherited N Purchase Date 2018-12-01 Purchase Cost 1350000.00 Development Cost 0.00  16,35,000 16 Lacs+",Nil,Nil,Nil,Nil,"Rs 65,86,000 65 Lacs+"
2,ii,Non Agricultural Land,Nil,"Banikhedi Patmini Vihar Land-11-15  Total Area 1250 sq.ft Built Up Area Whether Inherited N Purchase Date 2013-03-24 Purchase Cost 187500.00 Development Cost 0.00  3,37,000 3 Lacs+",Nil,Nil,Nil,Nil,"Rs 3,37,000 3 Lacs+"
3,iii,Commercial Buildings,"Dalauda Bhandari Colony Market 1 Floor Sy no-124 share Area-2310 sq.ft  Total Area 2310 sq.ft Built Up Area Whether Inherited N Purchase Date 2003-11-21 Purchase Cost 700000.00 Development Cost 1000000.00  25,00,000 25 Lacs+ Dalauda-3 Floor Sy no-1723/4/1, 12600 sq.ft Rakba-0.117 hec  Total Area 12600 sq.ft Built Up Area Whether Inherited N Purchase Date 2010-05-13 Purchase Cost 71000.00 Development Cost 1525000.00  52,00,000 52 Lacs+",Nil,Nil,Nil,Nil,Nil,"Rs 77,00,000 77 Lacs+"
4,iv,Residential Buildings,"Mandsour Shashtri Colony 1+2 Floor  Total Area 637.79 sq.ft Built Up Area 1900 sq.ft Whether Inherited N Purchase Date 2020-09-02 Purchase Cost 1273000.00 Development Cost 1500000.00  35,65,000 35 Lacs+","Mandsour Padmini Vihar Colony 2 Floor Sy no-304/1 Land No-16 share  Total Area 728 sq.ft Built Up Area 1450 sq.ft Whether Inherited N Purchase Date 2018-01-24 Purchase Cost 1054000.00 Development Cost 0.00  15,72,000 15 Lacs+",Nil,Nil,Nil,Nil,"Rs 51,37,000 51 Lacs+"
5,v,Others,Nil,Nil,Nil,Nil,Nil,Nil,Nil
6,Total Current Market Value of (i) to (v) (as per Affidavit),Total Current Market Value of (i) to (v) (as per Affidavit),"1,15,15,000 1 Crore+","82,45,000 82 Lacs+",Nil,Nil,Nil,Nil,"Rs 1,97,60,000 1 Crore+"
7,Totals Calculated,Totals Calculated,"Rs 1,15,15,000 1 Crore+","Rs 82,45,000 82 Lacs+",Nil,Nil,Nil,Nil,"Rs 1,97,60,000 1 Crore+"
